Job_title,Company,State,City,Min_Salary,Max_Salary,unitText,SalaryCurrency,Job_Desc,Industry,Rating,Date_Posted,Valid_until,Job_Type
INGENIERO DE MOLDEO SR.,P.R. Professional Recruiting,Baja California,Tijuana,-1,-1,,MXN,"Descripción y detalle de las actividadesEsta a cargo de la validación de los procesos de moldes nuevos, transferidos y/o modificados basado en moldeo científico. Analiza el desempeño de los procesos y propone mejoras para hacer los procesos más robustos. Responsabilidades:  * Es lider en la validación de procesos para nuevos moldes, moldes transferidos y moldes modificados o reparados.  * Optimización de procesos de moldeo a través del uso de herramientas estadísticas para reducir el scrap e incrementar la eficiencia  * En conjunto con el Ingeniero de Tooling, evalúa y proporciona medidas para corregir moldes con OEE debajo de 80%  * Participa en proyectos de mejora continua y de reducción costos mediante el uso de técnicas de Lean Manufacturing y 6 Sigma  * Aplica y promueve la metodología de 6S en el área de moldeo y su área de trabajo.  * Mantiene actualizada base de datos en Monitor.  * Crea y actualiza lo base de datos de Mold Books, así como las copias físicas.  * Apoya a los BDM proporcionando tiempos de ciclo y tonelaje para la cotización de nuevos productos. De igual forma, define la mejor opción molde – máquina  * Supervisa la eficiencia del mantenimiento preventivo y correctivo de los moldes  * Proporciona mejoras a los diseños de nuevos moldes durante las sesiones de DFMEA  * Realiza análisis de inversión para la adquisición de equipo nuevo (p. ej. Periférico y robots)  * Mantener de acuerdo a su función los requerimientos del Sistema de Gestión de Calidad aplicando las herramientas de Mejora Continua correspondiente.Experiencia y requisitos8 años de experiencia como Ingeniero en moldeo por inyección de plástico Validación mediante moldeo científico Resolución de problemas de procesos de moldeo por inyección de plástico Diseño de experimentos (deseable)Inglés 90%Certificación Master Mold ( DESEABLE )Tipo de puesto: Tiempo completoSalario: $20,000.00 - $25,000.00 a la semanaHorario:Turno de 10 horasEducación:Licenciatura terminada (Obligatorio)Experiencia:Ingeniero de Moldeo: 5 años (Obligatorio)Idioma:Ingles 80% (Obligatorio)Licencia/Certificación:Master Mold (Deseable)",,,2022-08-24T00:00:00,2022-10-16,FULL_TIME
Administrador de Base de Datos SR SQL,Trejo & Asociados,,,660000,840000,MONTH,MXN,"Empresa Financiera solicita: Administrador de Base de Datos Sr.OBJETIVO· Garantizar y optimizar la seguridad, integridad y estabilidad de las bases de datos, que administran la información de las operaciones del negocio, para que siempre estén disponibles, según las necesidades de las diferentes áreas de la compañía.· El objetivo de este perfil consiste en asegurar la disponibilidad de los datos, proponiendo acciones que ayuden a obtener datos con tiempos de respuestas óptimos para la organización.· Estos datos deben estar seguros, y se deben establecer caminos para recuperarlos en caso de algún incidente.· En términos de tecnologías se debe: Asegurar la continuidad operacional.·PRINCIPALES RESPONSABILIDADES· Es el responsable por la Administración de las Bases de Datos.· Administra las tecnologías de la información y la comunicación, siendo responsable de los aspectos técnicos, tecnológicos, científicos, inteligencia de negocios y legales de bases de datos.· Instalar, configurar y gestionar bases de datos· Dar soporte al equipo de desarrollo· Diseñar la distribución de los datos y las soluciones de almacenamiento· Garantizar la alta disponibilidad de la base de datos· Formato de Descripción de Puestos· Dirección de Recursos Humanos· Garantizar la seguridad de las bases de datos, incluyendo respaldos y recuperación de desastres· Implementar planes de mantenimiento de la base de datos· Desarrollar tareas de tuneo de base de datos, tanto en las consultas SQL como en la configuración del· servidor.· Diseñar la distribución de los datos y las soluciones de almacenamiento· Manejo de Cluster (Windows y LInux)· Desarrollar tareas de Replicación.· Mantenimiento a las bases de datos.·CONOCIMIENTOS: SQL SERVER, MYSQL, SQL CLOUD, AZURE, AWSSUELDO Y PRESTACIONES · Sueldo· PL· 10 días de vacaciones· SGMM· SV· Clases de Ingles· Servicio de comedor y medicoInteresados enviar mensaje al Lic. Christian Trejo para solicitar email al WhatsApp 5549410595Tipo de puesto: Tiempo completo, Por tiempo indeterminadoSalario: $55,000.00 - $70,000.00 al mesHorario:Turno de 8 horasPrestaciones:Seguro de gastos médicos mayoresSeguro de vidaServicio de comedorVacaciones adicionales o permisos con goce de sueldoPregunta(s) de postulación:Que herramienta utilizas, Azure, Asw, Cloud sqlExperiencia:Administrador de base de datos: 6 años (Deseable)SQL: 6 años (Deseable)Microsoft SQL Server: 5 años (Deseable)FINANCIERAS, BANCO, FINTECH: 5 años (Deseable)NUBE: 5 años (Deseable)",,,2022-08-29T00:00:00,2022-10-16,FULL_TIME
Supply Chain Order Sr Specialist,Siemens Healthineers,,,-1,-1,,MXN,"¿Queres ayudar a crear el futuro del cuidado de la salud? Siemens Healthineers es un lugar para las personas que dedican su energía y pasión a esta importante causa. Reflejamos nuestro espíritu pionero combinado con nuestra larga historia de ingeniería en la industria de la salud, que se encuentra en constante evolución. Innovamos en avances para la salud. Para todos. En todas partes.
Te ofrecemos un ambiente flexible y dinámico en donde tendrás tu espacio para crecer personal y profesionalmente. ¿Suena interesante?
¡Entonces únete a nuestro equipo como Supply Chain Order Sr Specialist!
Tu misión y responsabilidades:
Atención y satisfacción de clientes, recepción y procesamiento de pedidos desde la captura hasta su facturación y entrega garantizando condiciones y compromisos comercialesSeguimiento de ordenes en proceso y retroalimentación continua de estatus a clientesSeguimiento de tendencias de volúmenes de operación y definición de acciones que resulten en mejorar la
experiencia del cliente y los resultados de la organización.
Tus cualidades y experiencias:
Experiencia mínima de 5 años en roles de Supply Chain como especialista, Analista u otros roles similaresGestión de clientesSAPExcel avanzadoPower BI deseableAutomatización y digitalización de procesosInglés Intermedio-Avanzado
Tus atributos y habilidades:
Capacidad de análisis y síntesis de informaciónComunicación asertivaProactividadEmpatía y actitud de servicioTrabajo bajo presión

Nuestro equipo global:
Somos un equipo de 66.000 empleados altamente dedicados en más de 70 países que empujan apasionadamente los límites de lo que es posible en el cuidado de la salud para ayudar a mejorar la vida de las personas en todo el mundo. Como líder en la industria, aspiramos a crear mejores resultados y experiencias para los pacientes sin importar dónde vivan o los problemas de salud que enfrenten. Nuestra cartera, que abarca desde el diagnóstico in vitro e in vivo hasta la terapia guiada por imágenes y la atención innovadora del cáncer, es crucial para la toma de decisiones clínicas y las vías de tratamiento.
Nuestra cultura:
Somos parte de una increíble comunidad de científicos, médicos, desarrolladores, investigadores, profesionales y especialistas capacitados que superan los límites de lo que es posible para mejorar la vida de las personas en todo el mundo. Adoptamos una cultura de inclusión en la que se puede liberar el poder y el potencial de cada individuo. Provocamos ideas que generan un impacto positivo y un éxito continuo.
Todas nuestras ofertas laborales incentivan la inclusión de Personas con Discapacidad al mundo laboral.

En caso de que requieras algún ajuste para participar del proceso de reclutamiento y selección, avísanos para facilitar tu participación en igualdad de condiciones.
Visita nuestro sitio de Carrera en www.healthcare.siemens.de/careers .
Nos preocupamos por la privacidad de sus datos y nos tomamos en serio el cumplimiento de la legislación de protección de datos de GDPR, así como otras leyes de protección de datos. Por esta razón, le pedimos que no nos envíe su currículum vitae por correo electrónico. En su lugar, le pedimos que cree un perfil en nuestra comunidad de talentos donde pueda subir su CV. La creación de un perfil nos informa de que está interesado en oportunidades profesionales con nosotros y nos facilita el envío de una alerta cuando se abren puestos relevantes.
A todas las agencias de contratación: Siemens Healthineers no acepta currículos de agencias. No envíe currículums a nuestros alias de trabajo, empleados o cualquier otra ubicación de la empresa. Siemens Healthineers no es responsable de ninguna tarifa relacionada con currículos no solicitados.
Organization: Siemens Healthineers
Company: Siemens Healthcare Diagnostics, S. de R.L. de C.V.
Experience Level: Experienced Professional
Full / Part time: Full-time",Salud,,2022-09-05T00:00:00,2022-10-16,FULL_TIME
