Job_title,Company,State,City,Min_Salary,Max_Salary,unitText,SalaryCurrency,Job_Desc,Industry,Rating,Date_Posted,Valid_until,Job_Type
Senior Business Analyst,Decision Point,México,Ciudad de México,360000,720000,MONTH,MXN,"JOB DESCRIPTIONJOB TITLE SENIOR BUSINESS ANALYSTLOCATION GurgaonEXPERIENCE 2-4 YEARSAbout the CompanyWith a decade of experience and a truly global experience delivering A.I & advanced analytics solutions, we have served over 50+ clients, across North America, Latin America, Europe, Africa and Asia in CPG,Retail, Electronics and Healthcare sector.We are one global team of data scientists, business consultants and tech savvy engineers who are passionate about extracting every ounce of value from data. We’ve built a firm equipped to solve business problems using cutting edge A.I technologies.We care for our client’s business as our own and help them make significant and lasting improvements to their performance by institutionalizing analytics in their decision-making process. We cross boundaries and churn the sum-total of siloed information assets to uncover breakthrough insights which our clients act on.Role and ResponsibilityThe incumbent for the position is expected to deliver but not limited to on following responsibilities:Set up processes for data management, templatized analytical modules/deliverables.Continuously improve processes with focus on automation and partner with different teams to develop system capabilityUnderstand business briefs clearly and execute new/ad-hoc projects and ensure timely deliveryKeep managers informed about progress on projects and proactively flag gaps on data availability, hiccups on analysisDevelop conceptually and enhance statistical model with best in class modelling techniquesManaging the project in Gannt Chart, and ensuring timely delivery and timely escalation of impedimentsDeliver on informative and well-organized deliverablesProactively seek opportunities to help team members by sharing knowledge and expanding skillsAbility to communicate difficult/sensitive information tactfully with ClientJOB DESCRIPTIONAn ideal candidate will be/have: Excellent analytical skills and is a problem solverWork experience in Analytics preferably either in retail or marketingSound knowledge of tools (such as R/SAS etc.) and proficient in MS Excel & Power PointA team player and can deliver under pressureAn eye for detail, quick learner and can think out of the boxSelf-motivated, disciplined with ‘can do’ attitudeInfect peers with enthusiasm and facilitate healthy team interactionKey reasons to Join Decision PointDevelopment as a Subject Matter Expert in FMCG sales & marketing analytics domain, working directly with one of the top 5 global FMCG brandsWork extensively with clients/ direct client interaction - There will be direct client interaction which will fasten your learning process and will enable you to master traits of strategy consulting i.e. from understanding business objective to analyzing data in a methodical way culminating with final output to be delivered to clientLeave the lasting Impact on Business: You will also get to witness the impact of implementing of your recommendations/strategies as you will be working very closely with clients on day-today basis FastTrack Career Growth: *DP provides you to choose your own career path; We haveFast-track career path for people who love challenges, are ambitious and wants to push their limits. This means high reward, challenging role where candidate can get promoted every year with handsome raises Young and dynamic culture: *the average age here is about 25 years. There is a lot of energy flowing all the time. We work hard and party harder. Our work environment is very flexible, and we understand your work life balance. We take off to mountains or beaches to recoup at least once a year and ensure we get together at the end of each quarter.Tipo de puesto: Tiempo completoSalario: $30,000.00 - $60,000.00 al mesHorario:Turno de 8 horasTipos de compensaciones:Bono de productividadIdioma:Inglés (Obligatorio)Disponibilidad para viajar:75 % (Deseable)",,,2022-09-15T00:00:00,2022-10-16,FULL_TIME
Business Operations Sr. Analyst (remote),Iron Mountain,,,-1,-1,,MXN,"At Iron Mountain we protect what our customers value most, from the everyday to the extraordinary. We build customer value around the world with a passion for preserving the physical, transforming the digital, and respecting the environmental. We pioneered the industry for global records and information management and have established some of the best customer relationships in the industry with 95% of the Fortune 1000 companies among our 225,000 loyal customers. Here, you’ll bring your expertise and creativity to a workplace that thrives on continuous improvement. Here, you’ll be part of a global workforce that embraces the differences among us. And here, we’ll encourage you to Climb Higher for the benefit of our customers and each other. There is so much more, but enough about us. We can’t wait to hear about YOU.
ABOUT THE OPPORTUNITY
As Business Operations Senior Analyst at Iron Mountain, you will work hand in hand with business leaders and operational areas in different Iron Mountain sites, to provide structured information, recommendations and in-depth analysis focused on improving our processes and achieving better operational efficiency.
KEY RESPONSIBILITIES
Maintain/update business operational models based upon financial changes, new products and other factors.Work with global sites and leadership to develop, launch and roadmap operational management platform technology with SCRUM/Engineering partners.
Collaborate around the organization to anticipate & solve operational needs.
Review current operating procedures, developing changes to enhance efficiency and working with business leaders and operative teams to implement new policies and procedures as needed.
Document findings, prepare reports and make recommendations by leveraging our systems and platforms.
YOUR QUALIFICATIONS
Bachelor’s Degree in Finance, Business Administration or equivalent field.
Proven experience in a business management, operations or finance related field (5+ years).
Strong skills with Google Office suite (Google Sheets, Slides, Docs, etc.), Data Studio and Salesforce
Solid understanding of financial analysis including time value of money, depreciation, fixed cost, allocation and ROI.
Excellent communication skills, both verbal and written, in Spanish & Portuguese, English is highly desirable.
Category: gja\_Sales Operations Group
Iron Mountain is committed to a policy of equal employment opportunity. We recruit and hire applicants without regard to race, color, religion, sex (including pregnancy), national origin, disability, age, sexual orientation, veteran status, genetic information, gender identity, gender expression, or any other factor prohibited by law.
To view the Equal Employment Opportunity is the Law posters and the supplement, as well as the Pay Transparency Policy Statement, CLICK HERE
Requisition: J0049892",Tecnologías de la información,,2022-09-12T00:00:00,2022-10-16,OTHER
IT Business Sr Analyst,Citi,México,Ciudad de México,-1,-1,,MXN,"The IT Business Senior Analyst is an intermediate-level position responsible for liaising between business users and technologists to exchange information in a concise, logical and understandable way in coordination with the Technology team. The overall objective of this role is to contribute to continuous iterative exploration and investigation of business performance and other measures to gain insight and drive business planning.

Responsibilities:
Formulate and define systems scope and objectives for complex projects and foster communication between business leaders and IT
Consult with users and clients to solve complex system issues/problems through in-depth evaluation of business processes, systems and industry standards and recommends solutions
Support system change processes from requirements through implementation and provide input based on analysis of information
Consult with business clients to determine system functional specifications and provides user and operational support
Identify and communicate risks and impacts, considering business implications of the application of technology to the current business environment
Act as advisor or coach to new or lower level analysts and work as a team to achieve business objectives, performing other duties and functions as assigned
Has the ability to operate with a limited level of direct supervision.
Can exercise independence of judgement and autonomy.
Acts as SME to senior stakeholders and /or other team members.
Appropriately assess risk when business decisions are made, demonstrating particular consideration for the firm's reputation and safeguarding Citigroup, its clients and assets, by driving compliance with applicable laws, rules and regulations, adhering to Policy, applying sound ethical judgment regarding personal behavior, conduct and business practices, and escalating, managing and reporting control issues with transparency.
Qualifications:
3-5 years of relevant experience
Experience in data analysis with intermediate/advanced Microsoft Office Suite skills
Proven interpersonal, data analysis, diplomatic, management and prioritization skills
Consistently demonstrate clear and concise written and verbal communication
Proven ability to manage multiple activities and build/develop working relationships
Proven self-motivation to take initiative and master new tasks quickly
Demonstrated ability to work under pressure to meet tight deadlines and approach work methodically with attention to detail
Education:
Bachelor's degree/University degree or equivalent experienceIntermediate english level required
Desired Knowledge in:JiraSCRUM
-
Job Family Group:
Technology
-
Job Family:
Business Analysis / Client Services
-
Time Type:
Full time
-
Citi is an equal opportunity and affirmative action employer.
Qualified applicants will receive consideration without regard to their race, color, religion, sex, sexual orientation, gender identity, national origin, disability, or status as a protected veteran.
Citigroup Inc. and its subsidiaries (""Citi”) invite all qualified interested applicants to apply for career opportunities. If you are a person with a disability and need a reasonable accommodation to use our search tools and/or apply for a career opportunity review Accessibility at Citi.
View the ""EEO is the Law"" poster. View the EEO is the Law Supplement.
View the EEO Policy Statement.
View the Pay Transparency Posting",Finanzas,,2022-09-14T00:00:00,2022-10-16,FULL_TIME
Rates and Currencies Product Control Vice President Latam,Citi,,,-1,-1,,MXN,"The Prod Ctrl Lead Analyst participates is a senior level position responsible for leading efforts that ensure the completeness, accuracy and integrity of the bank's books and records in coordination with the Finance team. The overall objective of this role is to drive efforts to control and support data integrity and general ledger reconciliation, profit attribution and new activity analysis, valuation control and product P&L and balance sheet reporting.

Responsibilities:
Develop and maintain in-depth knowledge of Finance industry trends
Contribute to the directional strategy of the Finance function, anticipating the impact to daily work and the business
Evaluate and resolve complex issues and select the best action by weighing various alternatives and balancing potentially conflicting needs
Appropriately assess risk when business decisions are made, demonstrating particular consideration for the firm's reputation and safeguarding Citigroup, its clients and assets, by driving compliance with applicable laws, rules and regulations, adhering to Policy, applying sound ethical judgment regarding personal behavior, conduct and business practices, and escalating, managing and reporting control issues with transparency.
Qualifications:
6-10 years of relevant experience
Consistently demonstrates clear and concise written and verbal communication
Education:
Bachelor’s degree/University degree or equivalent experience
Master’s degree preferred
Responsibilities Include:
Oversight of daily revenue production, validation and reporting of the LATAM Rates, Markets Treasury & Currencies businesses, specifically focused on secured financing transactions, interest rate swaps, options, as well as borrowings and placements;
Oversight of daily and month-end sub-ledger / ledger validation;
Review and assess sizable balance sheet and supporting regulatory reporting, month-end closing process and quarterly / annual disclosure reporting, including providing qualitative and quantitative analyses of the aforementioned;
Understand the Profit Attribution Analysis (PAA) of the portfolio. Communicate daily and monthly results and/or issues to the trading desk and senior management, particularly around residuals. Drive to resolve them in partnership with the Front Office, Market Risk, Technology and Market Quantitative Analytics;
Partner with the Valuation Control Group (VCG) in the review and supervision of inventory valuation testing and results;
Engagement in New Products Approval Committee (NPAC) reviews and validation, including documentation of Product Control reviews;
Oversight of daily risk / position validation;
Daily interaction with other managers throughout the organization, including, but not limited to Senior Managers within Finance (i.e. Treasury, Tax, Accounting Policy, Planning, etc.), trading desks, transactors, middle office, risk management, business unit management teams and operations will be necessary to resolve issues and drive change;
Management Control Self-Assessment responsibility for the respective areas under supervision;
Ad hoc projects / assignments including system development, redesigning and streamlining daily and monthly processes, not just for team, but also for the larger department;
Providing and reviewing analytics / control metrics for the management team;
Coordinate and manage internal and external audit reviews;
Responsible for integrating the team, including but not limited to leading standardization of the control framework across the larger the product lines and enabling best practices;
Manage performance reviews and career development opportunities of staff members
Qualifications:
Bachelor’s degree required, Finance and / or Accounting degree preferred;
Advanced degree, CPA, CFA and/or other equivalent degrees / certifications are big pluses;
Minimum 7 years related business experience required; experience supporting fixed income secured financing and derivatives trading desks; prior management experience also preferred;
Must have strong knowledge in accounting fundamentals, transfer pricing, transformation management, financial modeling, portfolio management and understanding of cash flows and asset valuation preferred, particularly with rates-related products;
Excellent interpersonal and communication skills, both verbal and written required. This includes the ability to effectively communicate across multiple teams situated in various geographies in order to lead;
Strong MS Office Excel skills a must, Access, PowerPoint and other financial systems are pluses;
Must have a good eye for detail, but also be able to step back and see the larger strategic picture;
Must manage multiple tasks in a fast paced environment while meeting deadlines and working under pressure;
Able to influence others without authority and interact across all levels of the organization required;
Goals and solutions oriented as well as self- driven
-
Job Family Group:
Finance
-
Job Family:
Product Control
-
Time Type:
Full time
-
Citi is an equal opportunity and affirmative action employer.
Qualified applicants will receive consideration without regard to their race, color, religion, sex, sexual orientation, gender identity, national origin, disability, or status as a protected veteran.
Citigroup Inc. and its subsidiaries (""Citi”) invite all qualified interested applicants to apply for career opportunities. If you are a person with a disability and need a reasonable accommodation to use our search tools and/or apply for a career opportunity review Accessibility at Citi.
View the ""EEO is the Law"" poster. View the EEO is the Law Supplement.
View the EEO Policy Statement.
View the Pay Transparency Posting",Finanzas,,2022-09-06T00:00:00,2022-10-16,FULL_TIME
Sustainability Analyst (German Speaker),EcoVadis,México,Ciudad de México,-1,-1,,MXN,"Company Description
Work smart, have fun and make an impact
EcoVadis is the leading provider of business sustainability ratings. Our solutions are backed by an international team of experts and powerful technology. We analyze data and build sustainability scorecards that give companies actionable insights into their environmental, social and ethical risks.
Why apply to EcoVadis? Be a part of the global sustainability change in business. Grow your career. Work with extraordinary people. Feel valued for your contribution.
Learn more about our team and culture on EcoVadis careers page. If you have questions about the company or open roles you can chat with an insider.

Job Description
As a Sustainability Analyst you will be assessing and reporting on the quality and robustness of their sustainability management systems. Data analysis will be primarily qualitative, centered around the analysis of a company’s management system documentation. You will become an expert in applying the EcoVadis methodology, built on the most rigorous international CSR standards and frameworks (e.g. GRI, ISO 26000), already 13 years in evolution! In a state of virtuous advancement, the methodology continues to be driven forward by strong market forces, societal expectations and emerging regulation. It goes without saying that being flexible and adaptable to change is a must! In your role, you will also have the opportunity to contribute to advancing our world class methodology and bring your unique skills to add value to our approach. Quality is a non-negotiable part of our work, all our analysts follow a set of analysis guidelines to ensure we're working in cohesion. You will be a key stakeholder in the rating process, so having an eye for detail and an ability to learn quickly is key to your success. We are a team of sustainability changemakers rallying together to drive positive impact to business practices across the world, and can’t wait to have you join us!
A day in the life
Understanding of sustainability management system documentation provided by rated companies, extraction and synthesis of material sustainability data related to environmental, social, ethics and supply chain
Identification of the main characteristics of a rated company e.g. company size, operational category, presence in risk countries.
Confirm the implementation of a rated company’s sustainability management system components using the EcoVadis methodology guidelines.
Follow up with rated companies, where needed, to clarify specific issues related to their assessment.
Contribution to the development and the improvement of the assessment methodology is encouraged.
Additional responsibilities related to the function may be required.

Qualifications

Bachelor's degree, preferable with a specialty in Sustainable Development or CSR.
Minimum 6 months of previous working experience in a related field
Combination of analytical and interpersonal skills
Experience in Sustainability/Sustainable Development is a plus
Proficiency in G-Suite application
Autonomy and ability to take initiative
Aptitude to evolve in an international environment.
Must haves
Fluency in English and German is a must.
Demonstrated analytical skills, detail-oriented
Confidence to work independently and autonomously, self-driven
Strong communication skills, both written and oral
Thrives in international environments
Capacity to work in a fast growth environment, adaptability
Communicates with honesty and kindness
Collaborative, builds trusting relationships
Uses fun as a way of being and working
Demonstrated ability to pick up new skills proactively.
Additional Information
How you will grow
When you start with the company you will be welcomed into a robust 1+ month training program designed to master the topics of sustainability and the EcoVadis methodology, and assess a company’s sustainability management system with confidence. You will have training coordinators dedicated to your professional growth in the first month, supported by senior analysts providing feedback and suggestions on your work. Once your training is completed, you will begin working on a greater diversity of companies, increasingly complex with a variety of unique contexts. In addition you will also have the opportunity to gradually pivot some of your time to work on methodology development projects to grow other aspects of your career. These projects are often made-up of an international team of analysts, from our offices in Tokyo all the way to New York City. As you grow in the company, there will be more opportunities for development both on the technical side of the role, and well as in development as a subject matter expert, for example.
Full time position
Are you interested? Please apply directly online by clicking on the link below and attaching your CV and Cover letter in PDF format.
For more information about EcoVadis please visit our site: www.ecovadis.com
Don’t fit all the criteria but still think you’d be a good candidate? Please apply anyway to give our hiring team the opportunity to assess your skills and to learn more about what you could bring to EcoVadis. We’re interested in hiring capable people, regardless of professional and educational background.
Can the hiring process be adjusted to suit my needs? Yes. We want everyone going through the hiring process with EcoVadis to feel confident that you are able to demonstrate your full potential. We welcome applications from disabled people, people with long-term health conditions and neurodiverse candidates. If you need any adjustments, please let the hiring team know.
Our team’s strength comes from everyone’s uniqueness and is founded upon mutual respect. EcoVadis commits to equity and inclusion and does not accept any form of discrimination based on color, national or ethnic origin, ancestry, citizenship, religion, beliefs, age, sex, gender identity, sexual orientation, neurodiversity, disability, parental status, or any other protected characteristic that makes you unique.",Administración y consultoría,,2022-09-14T00:00:00,2022-10-16,FULL_TIME
Senior Intelligence Analyst,Servicios Comerciales Amazon M,México,Cuautitlán Izcalli,-1,-1,,MXN,"
Fluency (written and spoken) in English and Spanish
Expertise in the following geographic areas –Mexico, Central America, and South America
5+ years in Intelligence analysis and/or in the intelligence community, military, law enforcement, or a related global security role in the private sector
5+ years of experience researching, analyzing, writing, editing, and publishing finished intelligence.
Experience with data analytics, Open source (OSINT) tools, and/or geographic information systems.
Experience briefing large audiences and executive leaders from various backgrounds

Bachelor's degree or higher

Job summary
Amazon’ Global Intelligence Program is looking for a Regional Intelligence Analyst to join a team of analysts providing high-level strategic intelligence products to global stakeholders within Amazon Worldwide Operations. This position will be located in Mexico City, Mexico and support Amazon Operations in Central and South America.

This role is vital to the production of actionable intelligence that informs decision making on a global scale. Ideal candidates will have a proven history of writing influential intelligence products, operating with a high degree of independence, and strong acumen for learning and applying business concepts for private-sector intelligence products. Candidates must be capable of identifying developments, assessing their direct and indirect impacts to Amazon, and clearly communicating intelligence findings to stakeholders up to and including executive leadership.

Key job responsibilities
1. In depth understanding of principal geopolitical risks in Central and South America and the impact to Amazon.
2. Plan, research, and write regular analytical reports delivering actionable insights.
3. Ability to work under pressure, demonstrate leadership when required and collaborate effectively with geographically dispersed teams.
4. Actively monitor regional security incidents to determine potential impact and maintain an awareness of strategic trends throughout the region.
5. Collect, organize, analyze, evaluate, and interpret complex data with a strong understanding and application of analytical techniques.
6. Conduct strategic analysis on large data sets to include metrics, physical security trends, aggregate incidents, crime stats, etc.
7. Identify gaps in current analysis products and develop new solutions, methodologies and products to help improve reporting, especially with regards to data driven analysis.
8. Handling multiple simultaneous tasks and prioritize accordingly


• Experience and/or certifications in risk analysis related to transportation, logistics, or supply chain risk management
Ability to clearly articulate complex ideas in both written and verbal communication
Portuguese

",Tecnologías de la información,,2022-08-17T00:00:00,2022-10-16,FULL_TIME
