Job_title,Company,State,City,Min_Salary,Max_Salary,unitText,SalaryCurrency,Job_Desc,Industry,Rating,Date_Posted,Valid_until,Job_Type
Data/Information Mgt Int Anlst,Citi,México,Ciudad de México,-1,-1,,MXN,"The Data/Information Mgt Int Anlst is a developing professional role. Deals with most problems independently and has some latitude to solve complex problems. Integrates in-depth specialty area knowledge with a solid understanding of industry standards and practices. Good understanding of how the team and area integrate with others in accomplishing the objectives of the sub function/ job family. Applies analytical thinking and knowledge of data analysis tools and methodologies. Requires attention to detail when making judgments and recommendations based on the analysis of factual information. Typically deals with variable issues with potentially broader business impact. Applies professional judgment when interpreting data and results. Breaks down information in a systematic and communicable manner. Developed communication and diplomacy skills are required in order to exchange potentially complex/sensitive information. Moderate but direct impact through close contact with the businesses' core activities. Quality and timeliness of service provided will affect the effectiveness of own team and other closely related teams.

Responsibilities:
This function covers incumbents responsible for various data activities, which include database administration, data analysis, maintenance, data quality, and database management or database architecture / design engineering
Responsible for routine operational or administrative work
Day-to-day actions are focused on administering defined procedures, analyses and report preparation
Individuals will have their work thoroughly reviewed and checked by more senior incumbents and will have limited contact outside their immediate area
Daily deliverable of routine and defined outputs, while at the same time developing knowledge of the broader context in which the work is being performed
Appropriately assess risk when business decisions are made, demonstrating particular consideration for the firm's reputation and safeguarding Citigroup, its clients and assets, by driving compliance with applicable laws, rules and regulations, adhering to Policy, applying sound ethical judgment regarding personal behavior, conduct and business practices, and escalating, managing and reporting control issues with transparency.
Qualifications:
2-5 years relevant experience
Ability to think strategically and the ability to engage resources outside of their direct control to achieve objectives
Proficiency in SQL is required
Know-how on analytic tools is desirable (SAS)
Python / Pyspark is desirable
Good english level (able to mantain technical conversations) is a must
Knowledge of customer data and regulations is desirable
Business Analysis experience is desirable
Experience working with projects/initiatives on several streams at the same time
Education:
Bachelors/University degree or equivalent experience
This job description provides a high-level review of the types of work performed. Other job-related duties may be assigned as required.
Experiencia en:
BA (Business Analyst) deseable
SQL necesario, Python es un plus
Análisis y perfilamiento de datos
Conocimiento de datos de clientes (incluyendo regulaciones relacionadas con datos de clientes y entidades financieras) es un plus
Habilidades de comunicación e interacción con personas técnicas y senior management
Conocimiento de Scrum (Agile)
Manejo de Jira y confluence
Conocimiento de sistemas bancarios es un plus
-
Job Family Group:
Decision Management
-
Job Family:
Data/Information Management
-
Time Type:
Full time
-
Citi is an equal opportunity and affirmative action employer.
Qualified applicants will receive consideration without regard to their race, color, religion, sex, sexual orientation, gender identity, national origin, disability, or status as a protected veteran.
Citigroup Inc. and its subsidiaries (""Citi”) invite all qualified interested applicants to apply for career opportunities. If you are a person with a disability and need a reasonable accommodation to use our search tools and/or apply for a career opportunity review Accessibility at Citi.
View the ""EEO is the Law"" poster. View the EEO is the Law Supplement.
View the EEO Policy Statement.
View the Pay Transparency Posting",Finanzas,,2022-09-03T00:00:00,2022-10-16,FULL_TIME
Senior Tax Technology Analyst,Bosch Group,México,Ciudad de México,-1,-1,,MXN,"Company Description
Bosch was founded in Stuttgart in 1886 by Robert Bosch (1861-1942) and for more than 130 years has been distinguished by a unique corporate culture based on solid values that drive us to improve every day. Our products, present in a wide variety of fields, that contribute to improve the quality of life of millions of people.
Work #LikeABosch

Job Description
We are seeking a Senior Tax Technology Analyst to join our Bosch North America Tax Department.
The collaborative, inquisitive and highly motivated member of our regional- global process, projects and IT team will be responsible for optimizing technology and project management methods to ensure effective and efficient tax operations, tax risk management and tax governance functions.

Qualifications
Bachelor’s degree.5+ years in a regional/global corporate, tax or business systems environment.3+ years configuration / maintenance experience with indirect tax systems (i.e., Vertex O Series); ERP (i.e., SAP) systems; Microsoft Office and SharePoint systems3+ years project or process management experience2+ years of data analytic experience to include desktop automation and data visualization tools (i.e., Alteryx, Power BI).
Additional Information
Major responsibilities include:Key team member of cross-functional, regional, and global tax projects and initiativesFunctional design, development, configuration, testing and documentation of new or upgraded tax systemsMonitor, maintain, improve, and troubleshoot existing tax systems including issue tracking and resolutionResponsible to develop, train, implement and communicate tax systems requirements, process, and proceduresLiaison between Bosch Group North America Tax Department and Information Technology Department
Get to know more about how we work at Bosch and our new open positions on our social networks:
Facebook: Bosch Talento México
Instagram: Bosch Campus México
LinkedIn: Bosch México",Manufactura,,2022-09-15T00:00:00,2022-10-16,FULL_TIME
CTO Analyst,PepsiCo,,,-1,-1,,MXN,"Responsibilities

At PepsiCo, we’re redefining what it means to be a consumer products company with a digital-first mindset, and our Global IT team is leading that charge. Our technology teams unlock digital capabilities, enhance cybersecurity safeguards, deliver data-driven insights, and create unmatched consumer and customer experiences.


Our culture is guided by the PepsiCo Way, which is a set of values that define our mission to win with purpose in the marketplace and act with integrity in everything we do. We’re creating smiles with every sip and every bite while advancing a sustainable, socially impactful agenda that promotes our goal of Winning with Purpose.


The Global IT team supports just that with our mission to create more smiles with every CLICK and every LIKE. Join our global, agile team and help us influence and drive PepsiCo’s digital transformation!

Learn more about our culture and life at PepsiCo: https://stories.pepsicojobs.com/

Analyst,Asset Management

What will you be doing?

We are currently looking for a Global IT Infrastructure & Operations Analyst, this role supports the Global Network Asset Management Team and the main accountabilities are:
Drive and deliver successfully AOP and forecast for Network assets in US and Canada.Renew maintenance and support contracts on time for Networks assets to prevent business disruptions.Partnership with vendors like Cisco, Palo Alto, etc; ensuring the correct contract renewals.Provide analytics and derive insights that drive continuous service improvements.Coordinate and backup the Network ordering and procurement process for US and Canada.Ensure the Network assets lifecycle management and the correct information in CMDB.

Accountabilities

Coordinate the Asset Lifecycle for 66,625 Network assets in partnership with IT Sector Asset Managers and HCL.Coordinate with IT Sector Asset Managers and HCL to mitigate the gaps identified in the Weekly Key Quality Indicators (KQI) for Network assets.Partnership with internal teams to ensure the adoption for Asset Management processes.
Partnership with network vendors:To ensure data accuracy in CMDBEnsure the contracts renewals for assets in North AmericaIdentify the end of life for Network Assets.Validate and process the invoices for maintenance, support and SW licensing on time.Partnership with TBM team to validate the HCL invoices in a monthly basis.Partnership with Global procurement to ensure contracts renewalsPeriodically build and communicate scorecards related to assets management life-cycle to understand asset life-cycle status, process variances, and cost drivers.Ensure all the mandatory information for asset records is in CMDB.Coordinate with vendors to collect and update the End of Support Dates for all network assets.Review network equipment returned and work with Network Operations to determine what should be kept for redeployment and what should be disposed. Then provide directives to the disposal vendor and update assets in CMDB (state and location)
Ensuring we have enough end of support spare APs at CDR

Learn more about our culture and life at PepsiCo https://stories.pepsicojobs.com/

At PepsiCo, we are committed to providing equal development opportunities for all candidates for employment without exception of race, religion, sex, sexual orientation, marital status, age, nationality, origin, or type of disability. We respect and value diversity as a workforce and innovation for the organization.

Thank you so much for thinking about PepsiCo to start or continue your career!

Qualifications

Who are we looking for?

1. University / College Degree in Social Sciences, Business Management, Computer Science, or related field, or related professional experience.
2. 1year+ of experience in Servicenow.
3. 1 year+ on Data Management experience.
4. 1 year+ on Financial Management experience (budget and forecasting).
5. 1 year+ on IT Asset management experience.
1. Asset Management tools (Service now, Calero, Azure, SAP, ect)
2. ITIL certification is preferable
3. Strong Excel/PowerBi skills
4. Data analysis
5. Effective written and verbal English communication skills
6. IT Infrastructure Knowledge preferred (hardware, software, services)
7. DevSecOps
8. Financial Skills
9. Vendor Management
10. Asset Management

What can you expect from us?

Competitive compensation packageA flexible work environment that promotes a healthy balance between personal and professional lifeA dynamic and inclusive cultureA supportive team that will foster your professional growth and developmentOpportunity to work with relevant projects worldwideOpportunity to give back to the community with our volunteer programs
Non Technical Skills
1. Be Analytical candidate will be able to collect and analyze information to improve asset management services extremely oriented in details.

2. Use Critical Thinking candidate will be able to analyze data objectively. As a good critical thinker he can disregard personal feelings, opinions or biases when coming up with the proper solutions problems.

3. Good Communication: candidate must fully understand the situation at hand before they start looking for the solution. It is important to be able to explain the situation to a non-IT workers, in a global environment, with a good way to explain technical subjects with non-IT workers is to be empathetic.


4. Be Innovative candidate, the candidate will need to think out of the box oriented to process improvement, streamline workflows and automation.

5. Multitasking candidate may have multiple tasks to work on all at the same time. He will manage several requests and prioritize it to keep track of the different request and issues that rise.

6. Ability to work without direct supervision.

Advanced analytical skills.Must be extremely organized.Detail oriented with strong analytical and problem-solving skills.Ability to train and coach teams.Good networking skills across internal and external stakeholdersAbility to work with senior IT and Business management Teams.",Manufactura,,2022-09-13T00:00:00,2022-10-16,FULL_TIME
Senior Front Office Analyst,Murex,México,Ciudad de México,-1,-1,,MXN,"Senior Front Office Analyst
Job ID: 36501
Location: MEXICO CITY (MEX)
Who we are:

Murex is a global fintech leader in trading, risk management and processing solutions for capital markets. Operating from our 18 offices, 2400 Murexians from over 60 different nationalities ensure the development, implementation and support of our platform which is used by banks, asset managers, corporations and utilities, across the world. Join Murex and work on the challenges of an industry at the forefront of innovation and thrive in a people-centric environment. You’ll be part of one global team where you can learn fast and stay true to yourself.
Why join us:

Murex is the right place for you if you are looking to work alongside other bright and motivated individuals in an environment where collaboration and ownership are highly valued. We believe in empowering our people to take the reigns in tackling challenging opportunities with support and guidance when needed. We also believe in continuous growth of our team and encourage exploration to keep ahead of the fast-paced changes in capital markets and fintech.

The Front Office team is at the forefront of quantitative finance, providing cutting edge solutions for Capital Markets, including Derivatives Trading and Risk Management. The team delivers personalized support to our clients by providing trading solutions involving quantitative models for pricing, trade processing and risk monitoring.

Responsibilities will include:

Provide proactive and high-quality support to Murex clients related to pricing, structuring, P&L and risk analysis tools, market data management and analytics.
Micro-analysis of financial products and derivatives trading activities.
Research and perform model validation of financial products, including vanilla and exotic derivatives.
Ensure successful follow-up on client cases, from notification to resolution and validation.
Understand the client business and deliver, within project timelines, a high-quality solution using Murex best practices.

Qualifications:

Fluency is English is a MUST
Degree in Mathematics, Financial Engineering, or Computer Engineering is REQUIRED.
Strong communication and interpersonal skills.
Demonstrable interest in financial markets and technology
Strong sense of responsibility
Highly motivated
Attention to detail
Knowledge of SQL and Unix is an advantage, but not essential
Ability to travel",Tecnologías de la información,,2022-09-11T00:00:00,2022-10-16,OTHER
Senior Fraud Analyst,Signifyd,México,Ciudad de México,-1,-1,,MXN,"As the Sr. Fraud Analyst, you will join a team of talented and dedicated fraud experts who play a pivotal role in fighting fraud and helping our customers succeed. Your work will make a big impact in advancing payment risk decisioning to the next level. The right candidate is an experienced fraud fighter with a love for learning, problem solving, and not afraid of a challenge. They enjoy being part of a close knit team and working on multiple projects simultaneously without compromising quality.Primary Responsibilities Include: Perform proactive risk analysis to identify risk factors and trends of potentially fraudulent activity on large datasetsIdentify fraud trends, document and communicate findings, and lead in the development and implementation of new fraud prevention strategiesSupport Risk Operations with process and tool improvementsAssist our sales team by leading fraud and tool insights conversations with potential merchantsGather and format data into regular and ad-hoc reports and presentations as well as dashboards for metrics and trend reportingAssist in special projects and ad-hoc assignments, upon requestDevelop and maintain strong relationships with internal teams and external business partnersRequired Skills/Traits: Bilingual with business proficiency in English5+ years experience in e-commerce, payments or risk-related industry with either traditional and non-traditional payment methods.Strong understanding of ecommerce payments landscape in LATAMStrong analytical skills and an understanding of how to utilize data to target improvements and solve problemsExperience with database language (e.g., SQL) as well as BI and reporting tools (Looker, Tableau, Splunk, etc.)Strong critical thinking skills with advanced judgment capabilityAbility to manage multiple assignments while working independentlyStrong communication skills with internal and external stakeholdersFlexibility to work weekends and holidaysDesirable Skills: Experience in large scale data analysis, tools, and processes. (e.g. Python, R)Experience with translating fraud trends into rule logic and/or feature suggestionsPLEASE SUBMIT YOUR RESUME IN ENGLISHJob Type: Full-time",Tecnologías de la información,,2022-09-07T00:00:00,2022-10-16,FULL_TIME
HR Business Analyst,Citi,México,Ciudad de México,-1,-1,,MXN,"The Ops Sup Intermed Analyst is an intermediate level position responsible for providing operations support services, including but not limited to; record/documentation maintenance, storage & retrieval of records, account maintenance, imaging and the opening of accounts in coordination with the Operations - Core Team. Additionally, the Ops Sup Intermed Analyst serves as the liaison between operations staff, relationship managers, project managers, custodians and clients. The overall objective of this role is to provide day-to-day operations support in alignment with Citi operations support infrastructure and processes.

Responsibilities:
Perform financial, statistical, and operational studies using analytical skills and knowledge of data analysis tools and methodologies
Interpret data and results based on the analysis of information and application of professional judgement
Apply project management to assist operational projects as assigned
Perform feasibility analysis for significant process changes and partner with business teams to develop process improvements and solutions that help to streamline the operational workflow
Resolve varied and complex issues using professional judgment, discretion, and business expertise
Provide informal guidance and training to new and lower level team members, as needed
Has the ability to operate with a limited level of direct supervision.
Can exercise independence of judgement and autonomy.
Acts as SME to senior stakeholders and /or other team members.
Appropriately assess risk when business decisions are made, demonstrating particular consideration for the firm's reputation and safeguarding Citigroup, its clients and assets, by driving compliance with applicable laws, rules and regulations, adhering to Policy, applying sound ethical judgment regarding personal behavior, conduct and business practices, and escalating, managing and reporting control issues with transparency.
Qualifications:
2-5 years of relevant experience
Proficient in Microsoft Office
High level knowledge of related to industry standards and practices
Ability to work unsupervised and adjust priorities quickly as circumstances dictate
Consistently demonstrates clear and concise written and verbal communication skills
Self-motivated and detail oriented
Proven organization and time management skills
Demonstrated problem-solving and decision-making skills
Education:
Bachelor’s degree/University degree or equivalent experience
This job description provides a high-level review of the types of work performed. Other job-related duties may be assigned as required.
Proficiency in English
Mapping & reengineering of processes experience under multiple regulations adherence
Change Management experience
Project management experience
Experience in process improvement within HR
Ability to understand how different systems correlate within specific processes in order to propose solutions accordingly
Disposition for working with teams from different time zones
Efficient communication with people from multiple backgrounds
Demonstrated problem-solving and decision-making skills
Works proactively, with empowerment, ownership and accountability
Understands complex organizations and work under uncertainty
Get commitment from others and negotiation skills
Experience in the use of HR systems, ERPs, CRM, ATS, such as Workday, Service Now, Avature is a plus
-
Job Family Group:
Operations - Core
-
Job Family:
Operations Support
-
Time Type:
Full time
-
Citi is an equal opportunity and affirmative action employer.
Qualified applicants will receive consideration without regard to their race, color, religion, sex, sexual orientation, gender identity, national origin, disability, or status as a protected veteran.
Citigroup Inc. and its subsidiaries (""Citi”) invite all qualified interested applicants to apply for career opportunities. If you are a person with a disability and need a reasonable accommodation to use our search tools and/or apply for a career opportunity review Accessibility at Citi.
View the ""EEO is the Law"" poster. View the EEO is the Law Supplement.
View the EEO Policy Statement.
View the Pay Transparency Posting",Finanzas,,2022-09-15T00:00:00,2022-10-16,FULL_TIME
