Job_title,Company,State,City,Min_Salary,Max_Salary,unitText,SalaryCurrency,Job_Desc,Industry,Rating,Date_Posted,Valid_until,Job_Type
"Senior Tax Analyst, Mexico",Apple,México,Ciudad de México,-1,-1,,MXN,"Summary
Posted: Sep 12, 2022
Weekly Hours: 40
Role Number:200393408
Do you have a passion for invention and self-challenge? Do you thrive on pushing the limits of what’s considered feasible? The people here at Apple don’t just build products — they build the kind of wonder that’s revolutionized entire industries. It’s the diversity of those people and their ideas that encourages the innovation that runs through everything we do, from amazing technology to industry-leading environmental efforts. Join Apple, and help us leave the world better than we found it! At Apple, new ideas have a way of becoming extraordinary products, services, and customer experiences very quickly. Bring passion and dedication to your job and there's no telling what you could accomplish. Finance is about “fueling innovation”. We do this by hiring quality individuals with integrity and personal accountability, and who value collaboration, work product excellence, and dedicated thinking. If you share these values and want to join something big, apply today! We are searching for a Senior Tax analyst based in Mexico city with a distinctive analytic mind to join the Latin America Tax team. You will play an integral part to manage the local direct and indirect tax compliance for the region, drive global consistency in systems & processes as well as identifying standardization and simplification opportunities. You will drive process and efficiency improvements through innovation. You will also be working with the team to establish and implement consistent and effective processes across the LATAM entities, mostly Mexico.
Key Qualifications
Experience in tax compliance is required, at least 2 years in Mexico.
High degree of proficiency in Excel required.
Experience with Tableau and SAP is a plus.
Proactive problem solving.
Proficiency in English and Spanish, both written and spoken.
Solid analytical skills with a process focus.
The ability to recognize issues within processes and organizations.
Ability to lead across multiple geographies and cultures.
Mature, responsible, customer focused with excellent interpersonal and communication skills.
Flexible in working with tight deadlines.
Description
In addition to the standard local tax compliance and reporting for Latin America, this position will provide strategic solutions and operational improvements on a day-to-day basis. The ideal candidate will develop subject matter expertise in local tax compliance, specific job duties are: - Develop and innovate processes to standardize income tax and VAT calculations for Mexico and Colombia regions. - Engage with our main partners on Tax project implementations. - Support during local tax audit processes. - Able to manage large volume of information, summarize and reconcile with multiple sources. - Calculate and remit income tax & VAT payments to the Colombian and Mexican tax authorities. - Build standard and scalable reports for tax audit purposes using Tableau and Excel. - Prepare documentation for audit support, including generating and reconciling reports, analyzing the data for exposure and overpayments. - Reconcile large volume of information for accuracy on local tax reporting. - Liaise with external advisors & auditors, including information requests preparation and review, deadline tracking and timely responses. - Drive the resolution of any key control; build the relationship with key agents to ensure tax compliance. - Prepare and/or review quarterly VAT summaries, including Tax account analysis and reconciliations.
Education & Experience
Bachelor’s Degree in Accounting, Finance or business. MBA, MA, and CPA are a plus.
Additional Requirements",Tecnologías de la información,,2022-08-23T00:00:00,2022-10-16,OTHER
R2R JR Analyst,Ingenico,Jalisco,Guadalajara,-1,-1,,MXN,"Job Position:
Record to Report Process PLENO Analyst
Location:
Mexico City, Mexico
Countries to Serve:
Americas Region
Job Purpose:
The Record to Report Process Pleno Analyst is responsible to support the continuous improvement of the Record to Report (R2R) function, support to Senior analyst to review and implementing policies, improving processes and workflow.
The Pleno Analyst must to be the backup of the senior analyst, she or he has to have the ability of take decisions for the team if the Senior analyst is absent.
The ideal candidate is an experienced professional with in-depth knowledge of the R2R function, proactive, self-starter that is inquisitive, takes ownership, and wants to grow their personal and professional skills in a hyper-accelerated environment.
Key Responsibilities:
Meets deadlines and demonstrates high quality when processing core activities and strengthening compliance with internal controls over accounting.
Build strong collaborative networks with LOCAL BUSINESS and ensure good/adequate communication
Reconciles sub-ledger vs. general ledger and prepare roll-forward, performs various analyses (depreciation reasonableness, mid-month review, fluctuation analysis), provides audit (internal/external) support, and assists in various clean-up efforts.
Actively contributes with daily activities, pre-close and month end closing processes. Acts as reviewer of Journal entries and account reconciliations in daily and close processes of other Junior analyst.
Prepares and reviews daily and ad-hoc reporting within agreed SLAs.
Coaches Junior analyst on identifying and managing process improvement projects.
Complies and ensures the operation is aligned with company’s policies and procedures.
Performs general accounting activities, including the preparation, maintenance and reconciliation of ledger accounts and financial statements such as balance sheets, profit-and-loss statements and capital expenditure schedules.
Analyzes and prepares statutory accounts, financial statements and reports.
Reports to Senior Analyst
Competencies/
Skill Requirements:
Excellent understanding of R2R processes, using SAP and their associated risks and mitigating internal controls.
Proficient in Excel (Intermediate to Advanced, VLookups, Pivot Tables, etc.) and other MS Office applications.
Proficiency with R2R processes and procedures on an international level will be favorably considered (specifically experience with Americas Region).
Key Success Factors:
Strong ethical attitude, leading by example and able to set the tone around inclusion and employee well-being.
Ability to go beyond the initial scope of services, be creative, and conflict resolution.
Passion for data integrity, process definition, and organizational alignment.
Demonstrates coaching, supervision and motivation skills while maintaining an open and approachable style
Ability to work collaboratively with multi-cultural business local business and work effectively within cross-functional teams.
Ability to work under pressure to provide service quality and response levels required.
Education Qualifications:
Bachelor’s degree required preferably with concentration in Finance or Accounting.
CPA (Certified Public Accountant) / CFA (Chartered Financial Analyst) / CMA (Certified Management Accountant), Six Sigma, lean accounting, project management, and / or process improvement certifications are a valuable plus.
Experience Requirements:
More than 4 years of experience , consolidation, analysis and reporting for manufacturing capitalization and depreciation forecasts, budgets and business plans and strengthening compliance with internal controls over asset accounting.
Languages:
Excellent communication and interpersonal skills using fluent English and Spanish. (English intermediated is requested)",Finanzas,,2022-08-16T00:00:00,2022-10-16,OTHER
Business Analytics Manager,Citi,México,Ciudad de México,-1,-1,,MXN,"Function Overview:
Decision Science is an area where we analyze large volumes of data from different sources, with innovative analysis techniques, combined with new technologic platforms, and last generation models, providing solutions and/or identifying areas of opportunity to the business.
We design and implement new strategies, to provide a better service to our customers, developing strategies for several products; we propose and understand KPIs to present synthesized results to senior management.
Key Responsibilities:
Work together with other areas of the Bank (Product, Segment, Risk, Behavioral Economics, etc.) in order to design and implement new strategies within GCB.
Identify high impact opportunities and propose strategies that will translate into portfolio growth and incremental revenues, through statistical techniques and models.
Create synergies with D&A CoEs (Centers of Expertise - Testing, Modeling, Pricing), in order to develop high impact use cases / projects.
Lead a group of analysts and manage use cases through an agile approach.
Summarize key findings and present to top management.
Structure, do and validate analysis from various sources/categories (demographic, financial, Credit Bureau, transactional, social media, etc.).
Develop analytical tools, which will help us to have a better understanding of our customers, the bank and the market.
Valuation and tracking of key initiatives.
Requirements/Qualifications:
Bachelor in Actuarial Science, Mathematics, Engineering, Economics or related.
4+ years of experience and skills managing and/or roles as leader.
Team management experience – desirable.
MBA, Master in Finance, Data Science or related – desirable.
English level: Advanced
Skills/Competencies:
Strong analytical skills
Ability to translate numbers into actionable strategies
Skills and interest in programming and statistical analysis (experience with SAS, SQL, R or Python required)
Experience in predictive modeling and machine learning – desirable
Negotiation, leadership and communication (storytelling and data visualization) skills
Project management; Agile and Scrum knowledge – desirable
Advanced skills in Excel and Power Point
Knowledge of consumer banking products - desirable
Self-organized, collaborative, proactive and creative
Interpersonal skills; ability to create synergies with other teams
-
Job Family Group:
Decision Management
-
Job Family:
Business Analysis
-
Time Type:
Full time
-
Citi is an equal opportunity and affirmative action employer.
Qualified applicants will receive consideration without regard to their race, color, religion, sex, sexual orientation, gender identity, national origin, disability, or status as a protected veteran.
Citigroup Inc. and its subsidiaries (""Citi”) invite all qualified interested applicants to apply for career opportunities. If you are a person with a disability and need a reasonable accommodation to use our search tools and/or apply for a career opportunity review Accessibility at Citi.
View the ""EEO is the Law"" poster. View the EEO is the Law Supplement.
View the EEO Policy Statement.
View the Pay Transparency Posting",Finanzas,,2022-09-13T00:00:00,2022-10-16,FULL_TIME
Accounting / Finance Manager (Controller),Bosque de Talentos,Jalisco,Guadalajara,420000,444000,MONTH,MXN,"Accounting/Finance Manager (Controller) Descripción del empleoWithout the strength of our accounting team, we wouldn’t be able to offer the industry-leading service we’re known for. We’re seeking an experienced accountant to oversee this team in the role of controller. The ideal candidate will have proven industry experience as an accountant, preferably in a senior role. As a strong communicator and skilled financial analyst, you will make it your mission to streamline our budgeting, payroll, and financial reporting processes. You will produce thorough financial-status reports for senior management to help improve our operational efficiency and aid in our continued growth.How you will contribute:Provide comprehensive financial updates to senior management by evaluating, analyzing, and reporting appropriate data pointsGuide financial decisions by applying company policies and procedures to the current economic landscapeDevelop, implement, and maintain financial controls and guidelinesAchieve budgeting goals with proper scheduling, analysis, and corrective actionHelp develop and support short and long-term operational strategiesMaintain internal control safeguards for the receipt of revenue, costs, and both team and organizational budgets and actual expendituresIn conjunction with the CEO, establish financial and operating benchmarks, budgets, program monitoring, and reporting standards on a bi-weekly, monthly, and annual basis.Implement consistent accounting policies, practices, and procedures across all programs, upholding federal, state, and local legal standards by remaining knowledgeable about existing, new, and future legislationDevelop and enforce internal controls to maximize the protection of company assets, policies, procedures, and workflowOversee and support the accounting team with dynamic leadership that creates an environment of trust and productivitySkills you’ll bring:5+ years of proven accounting experienceStrong understanding of economic and banking processes2+ years experience as a senior-level accounting or finance managerStrong working knowledge of detailed financial data analysisExemplary history of financial project managementCRM experience preferredJob Types: Full-time, PermanentTipo de puesto: Tiempo completoSalario: $35,000.00 - $37,000.00 al mesHorario:Turno de 8 horasExperiencia:Accounting: 5 años (Obligatorio)Financial Data Analysis: 2 años (Obligatorio)Fecha de inicio prevista: 29/08/2022",,,2022-09-02T00:00:00,2022-10-16,FULL_TIME
Sr. North America Strategy Analyst,Ingredion,Jalisco,Guadalajara,-1,-1,,MXN,"The Senior Analyst, North America Strategy will work with other members of the North America Strategy team, as well as senior members of other functions, to help drive robust and detailed strategies for the growth and profitability of our business in addition to supporting the execution of organic and inorganic strategic projects.
 Core Responsibilities:
Coordinate the NA Digital Transformation COE, whose key objectives are:
Build and refine the pipeline of Digital Use Cases for implementation in the NA Region in the next 2-3 years
Prioritize the most attractive Digital Use Cases
Obtain executive approval and funding of the prioritized Digital Use Cases
Ensure the successful implementation of the selected Digital Use Cases in the NA organization
Highlight NA regional needs for further development in Digital and IT capabilities
Work closely within the North America Strategy team on organic and inorganic strategic projects. Assist with data analysis and presentation preparation to support the development of business strategies including, but not limited to:
Business case preparation
Market sizing
Financial modeling/valuation
Competitive insight
Assume leadership on specific assignments and projects to support the North American Strategy, as requested by the management
Engage and communicate effectively at all levels
Presentations to leadership: Support the research and development of presentations for the North America Senior Management as required
Work with the rest of the team - as well as the business - in identifying new business opportunities
Qualified candidates will have:
Bachelor’s degree in technical or business related field. MBA is a plus.
3-5 years of experience in consulting, finance or strategic business development. Involvement in strategy projects for a North American business is desired.
Experience with financial modeling and/or strategy assessment as well as project management (i.e., M&A models, structuring organic growth projects, PMO)
Strategic mindset with excellent analytical skills and solid financial acumen (i.e. accounting and financial modeling skills)
Sound judgment and a willingness to resolve issues and problems in a timely manner.
Excellent communication skills. Fluent in English.
Skilled with Excel and Power Point
Experience in a B2B environment is preferred and knowledge in Food & Beverage and/or Food Ingredients industry is a plus
Fast learner, willing to take initiative and full ownership of the work
We are an equal opportunity employer and value diversity at our company. We do not discriminate on the basis of race, religion, color, national origin, gender, sexual orientation, age, marital status, veteran status, or disability status.
Ingredion provides accommodations to job applicants with disabilities throughout the hiring process. If a job applicant requires an accommodation during the application process or through the selection process, we will work with the applicant to meet the job applicant's accommodation needs.
Relocation Available:
No",Manufactura,,2022-08-26T00:00:00,2022-10-16,FULL_TIME
Business Analytics Specialist,Ericsson,México,Ciudad de México,-1,-1,,MXN,"About this opportunity
We are now looking for a Business Analyst to provide insight and advice based on detailed and methodical investigation, analysis, and presentation of data. The Business Analyst applies their business knowledge and analytics skills on data, to point to statistically secured conclusions on business performance. They work as an advisor to decision makers, to outline both causes and remedies to business problems. Provides functional process and data expertise, qualifies Analytics IT requirements and manages the Analytics Solution portfolio within their area of responsibility.
What you will do
Manage analytics stakeholders
Drive Business Analysis assignment
Perform data analysis and visualization
Manage Analytics Solutions Portfolio
You will bring
Project Management Skills
Business Understanding
Negotiation Skills
Knowledge sharing and collaboration skills
Delivering result & meet customer expectation
Analyzing
Persuading & Influencing
Presenting & Communicating Info
Deciding and initiating actions
Relating & Networking
Shown ability in effective communication with senior and executive management.
Good to excellent knowledge in statistics
Why join Ericsson?
Here at Ericsson, our culture is built on over a century of courageous decisions. With us, you will no longer be dreaming of what the future holds – you will be redefining it. You won’t develop for the status quo but will build what replaces it. Joining us is a way to move your career in any direction you want; with hundreds of career opportunities in locations all over the world, in a place where co-creation and collaboration are embedded into the walls. You will find yourself in a speak-up environment where insight and humanness serve as cornerstones for how we work, and where work-life balance is a priority. Welcome to an inclusive, global company where your chance to create an impact is endless.
What happens once you apply?
To prepare yourself for next steps, please explore here: https://www.ericsson.com/en/careers/job-opportunities/hiring-process",Telecomunicaciones,,2022-09-02T00:00:00,2022-10-16,OTHER
Data Architecture Lead Analyst,Citi,México,Ciudad de México,-1,-1,,MXN,"The Data Architecture Lead Analyst is a strategic professional who stays abreast of developments within own field and contributes to directional strategy by considering their application in own job and the business. Recognized technical authority for an area within the business. Requires basic commercial awareness. There are typically multiple people within the business that provide the same level of subject matter expertise. Developed communication and diplomacy skills are required in order to guide, influence and convince others, in particular colleagues in other areas and occasional external customers. Significant impact on the area through complex deliverables. Provides advice and counsel related to the technology or operations of the business. Work impacts an entire area, which eventually affects the overall performance and effectiveness of the sub-function/job family.

Responsibilities:
Lead the definition and ongoing management of target data architecture for risk information.
Leverage internal and external leading practices and liaising with other Citi risk organizations to determine and maintain appropriate alignment, specifically with Citi Data Standards.
Work in conjunction with information owners and technology partners to define and implement the roadmap.
Establish a governance process to oversee implementation activities and ensure ongoing alignment to the defined architecture.
Prepare materials for Monthly Operating Reviews (MORs), Portfolio Reviews, Horizontal meetings, Town Halls and Staff Meetings.
Perform analysis of data quality issues and deliver metrics reporting.
Support Managers with status reports and presentation content. Guide data analysis and reporting processes that include collection from multiple sources, validation of data and assembly and presentation of required data.
Analyze current risk processes and systems.
Review current state risk management processes and supporting platforms to understand the information collected and taxonomies used to identify / manage risk.
Define and maintain the inventory of data attributes across risk management platforms.
Define and maintain common data definitions and taxonomies.
Define a set of common information categories that encompass risk activities, and identify the data attributes that support them.
Review and validate information categories and data attributes with risk discipline owners to ensure completeness and define overall data architecture.
Maintain data architecture and its ongoing alignment with Citi's Data Standards.
Identify variance / gaps in the current data and the approach to achieve alignment.
Define and implement risk data roadmap.
Review and validate the roadmap with Risk Discipline owners.
Define a data alignment plan in cooperation with technology partners.
Manage the implementation of the data alignment plan and overall migration to the target state architecture.
Define and operate data governance process that oversees data architecture.
Prioritizing data convergence activities and overseeing the completion of alignment activities.
Review proposed changes or additions to the defined data architecture.
Appropriately assess risk when business decisions are made, demonstrating particular consideration for the firm's reputation and safeguarding Citigroup, its clients and assets, by driving compliance with applicable laws, rules and regulations, adhering to Policy, applying sound ethical judgment regarding personal behavior, conduct and business practices, and escalating, managing and reporting control issues with transparency.
Qualifications:
6-10 years experience in analyzing and defining risk management data structures and architecture
Demonstrated influencing, facilitation and partnering skills
Track record of interfacing with and presenting results to senior management
Analytical, flexible, team-oriented and have good interpersonal/communication skills
Proficient in MS Word, Excel
Education:
MBA or Advanced Degree
This job description provides a high-level review of the types of work performed. Other job-related duties may be assigned as required.
-
Job Family Group:
Technology
-
Job Family:
Data Architecture
-
Time Type:
Full time
-
Citi is an equal opportunity and affirmative action employer.
Qualified applicants will receive consideration without regard to their race, color, religion, sex, sexual orientation, gender identity, national origin, disability, or status as a protected veteran.
Citigroup Inc. and its subsidiaries (""Citi”) invite all qualified interested applicants to apply for career opportunities. If you are a person with a disability and need a reasonable accommodation to use our search tools and/or apply for a career opportunity review Accessibility at Citi.
View the ""EEO is the Law"" poster. View the EEO is the Law Supplement.
View the EEO Policy Statement.
View the Pay Transparency Posting",Finanzas,,2022-08-30T00:00:00,2022-10-16,FULL_TIME
