Job_title,Company,State,City,Min_Salary,Max_Salary,unitText,SalaryCurrency,Job_Desc,Industry,Rating,Date_Posted,Valid_until,Job_Type
"Senior Product Specialist Collateral Management, Capital Markets",Adenza,México,Ciudad de México,-1,-1,,MXN,"Division Overview
Product & Engineering works toward delivering a powerful yet flexible technology platform keeping the needs of the end customer in mind. Our development teams ensure that all the codes are delivered with the highest quality. Product managers are home to technical experts who work together to design and build our software and product roadmap, whereas our QA team is constantly aimed at enhancing the quality of our platform delivery through test methodologies for implementations, upgrades, and migrations.

Team and Role Overview
Adenza is seeking a Product Specialist to work within the Product Management team specifically focusing on Collateral Management Financing. Adenza is currently investing significant resources in developing its Collateral Management solution. The successful candidate will be able to have a significant impact on this development. We are looking for an experienced Business Analyst with strong market knowledge in the Collateral Management area. The successful candidate will be dynamic and self-starting with excellent communications skills and be able to thrive in a challenging and high-pressure environment. This is an exciting opportunity to help shape the future direction of the Calypso Collateral Management solution. This role-based in Mexico City but offers the opportunity for travel due to the Global nature of Adenza and its client base.
Responsibilities
Detailed Functional Analysis of Client and Market Requirements
Working closely with clients to agree on Business Requirements Documents
Writing detailed Functional Requirement Specification Documents
Working very closely with the Calypso Engineers to design the correct solutions
Working closely with the Calypso Quality Assurance team to develop test cases
Carrying out functional testing of developed solutions
Presenting and demonstrating solutions to Clients
Carrying out Internal documentation and training
Skills And Requirements
Comprehensive practical experience in Collateral Management – probably having been gained working for an Investment Bank or Asset Manager
Proven Business Analysis experience/skills
Excellent written and verbal communications skills
Must be a fast learner, self-motivated, team player, and collaborator
More About Us

Our Office:
We’re located in a luxurious building Regus place at Napoles on the 7th floor. Located at Insurgentes Avenue, the locale offers a wide variety of facilities and services, as well as the best transportation system in the entire city. Exclusive restaurants and shops of the best brands are within a few minutes walk. Adenza has 2 offices all furnished and equipped, the floor has bathrooms, meeting rooms, and a coffee area optimizing and facilitating the day-to-day of the business.

Why Apply:
Adenza’s mission to pioneer innovative technology offering efficient, accessible, and transparent, fully integrated solutions is only achievable due to our outstanding workforce. The fusion of deep technical knowledge with the element of human passion, understanding, and energy is what makes Adenza’s employees exceptional. At Adenza, we offer great opportunities to collaborate on challenging and relevant issues in financial services and technology. As we continue our exciting growth trajectory, we recognize how important investing in the best talent across the globe is. Are you self-driven, innovative, execution-focused, and customer-centric? If yes, we want to invest in you.

Adenza is an equal opportunity employer (EOE). We are dedicated to building and supporting a culture of diverse perspectives and talents as well as inclusivity to support individual growth and superior business results.
#LI-RB1
About Adenza
Adenza provides customers with end-to-end trading, treasury, risk management, and regulatory compliance platforms which can be delivered on-premise or on-cloud. We enable the world’s largest financial institutions to consolidate and streamline their operations with front-to-back solutions integrated with data management and reporting. We give them a single source of truth across the business.

With headquarters in London and New York, Adenza has more than 60,000 users across global, central, and regional banks, broker-dealers, insurers, asset managers, pension funds, hedge funds, stock exchanges and clearing houses, securities services providers, and corporates.

Department
Product Management
Employment Type
Permanent - Full Time
Location
Mexico City
Workplace type
Onsite",,,2022-09-08T00:00:00,2022-10-16,FULL_TIME
"VP-Senior Analyst, Corporate Finance Group",Moody's,,,-1,-1,,MXN,"Our Corporate Finance Group (CFG) in México is hiring a Vice President, Senior Analyst who will manage a portfolio of diverse, investment and speculative-grade companies across a range of industries. This is a high-profile opportunity for someone who is passionate about using their credit and analytic skills, while engaging with C-suite executives, finance and credit specialists, internally and externally.
What you will do in this role
You will articulate well-formed credit views to the company and the broader marketplace. Your research, along with targeted outreach, will enhance Moody’s relevance and expand our brand and reputation as a trusted source. You will also promote and embody the highest ethical and performance standards in your research.
Analytics/Monitoring
Conduct quantitative assessment of financial statements and economic/market data, as well as intensive analysis of bond indentures, liquidity agreements, official statements and other legal documents.
Conduct initial and ongoing credit analysis on a dedicated portfolio of companies.
Actively monitor portfolio and make recommendations for rating transitions in a timely fashion.
Formulate a cogent rating rationale and present this rationale in a persuasive fashion at rating committee while leading the committee discussion.
Demonstrate rating judgment as evidenced by the ability to distinguish among different entities at different ratings levels
Research
Produce timely and relevant research on specific issuers, general credit trends, or sector related issues that is in-depth, high quality, insightful and focused.
Issuer/Investor Relations
Build and maintain high profile relationships with investors and issuers, interacting frequently based upon industry and topical research written.
Develop Moody's franchise through intermediary marketing and visibility initiatives (e.g. conference participation).
Lead issuer meetings, including communicating key rating factors effectively and asking probing questions that result in substantive dialog about key rating issues
Communications
Present credits effectively and accurately in rating committees and other internal analytical meetings.
Mentor and develop junior analysts and support associates.
Academic Qualifications
Graduate or rost-graduate degree Economics, Business Administration, Engineering, Finance, or a finance-related discipline
MBA or CFA preferred
Work experience/background
7+ years of experience in credit/risk assessment experience gained from a financial institution, asset management, or proven equivalent
Previous experience at managing workflows, processes, and deadlines
Well-developed analytical skills
Experience in relationship management with issuers
Strong written and oral communication capabilities
Ability to manage multiple competing priorities within deadlines.
Language Skills
Advanced written and oral command of English and Spanish required
Knowledge of Portuguese will be advantageous
#LI-RA
Corporate Finance Group - Regional MX
Moody’s is an equal opportunity employer. All qualified applicants will receive consideration for employment without regard to race, color, religion, sex, national origin, disability, protected veteran status, sexual orientation, gender expression, gender identity or any other characteristic protected by law.
Moody's (NYSE: MCO) is a global integrated risk assessment firm that empowers organizations to make better decisions. Our data, analytical solutions and insights help decision-makers identify opportunities and manage the risks of doing business with others. We believe that greater transparency, more informed decisions, and fair access to information open the door to shared progress. Moody's combines international presence with local expertise and over a century of experience in financial markets. Learn more at moodys.com.

At Moody’s, we’re taking action. We’re hiring diverse talent and providing underrepresented groups with equitable opportunities in their careers. We’re educating, empowering and elevating our people, and creating a workplace where each person can be their true selves, reach their full potential and thrive on every level. Learn more about our DE&I initiatives, employee development programs and view our annual DE&I Report at moodys.com/diversity
Moody’s Investors Service is among the world’s most respected and widely utilized sources for credit ratings and research. Our opinions and analysis on a broad range of credit obligors and obligations are valued around the world for their insight and rigor.
At MIS, our workplace culture supports our mission to be the Agency of Choice for our customers, employees and future employees. Our Culture focuses on Excellence and embodies behavioral qualities such as Integrity, Responsiveness, Collaboration, Respect and Passion. Our people are our core asset and we look beyond outcomes to ensure that behaviors and interactions matter.",Administración y consultoría,,2022-09-09T00:00:00,2022-10-16,FULL_TIME
Social Media Senior Analyst,Univision communications inc,México,Ciudad de México,-1,-1,,MXN,"TelvisaUnivision Digital is looking for a Lifestyle Social Media Senior Analyst to join our team to build and grow a new Lifestyle vertical through social media platforms.
Our mission is to create the most engaging content in Hispanic media and develop the most powerful entertainment content for Hispanic Women in the United States with a high level of storytelling around beauty, fashion, food, wellness, empowerment, and more, as we are inclusive and creative.
ABOUT YOU:
The Social Media Senior Analyst understands the importance of social media Senior analytics to make better content decisions. The successful candidate will have a background in analyzing data and transforming it into a story. You will be responsible for tracking daily content performance of Lifestyle channels across Facebook, YouTube, TikTok, Instagram, Twitter, and other platforms. The analyst is expected to provide meaningful insights and recommendations that inform strategic optimizations and content production decisions based on key performance metrics. You will manage paid social media campaigns to boost organic growth and build a community in the US. You will also manage research tools to keep track of key competitors, identify trends, and turn data into actionable recommendations.
YOUR DAY-DAY:
Aggregate, and analyze social media data to provide meaningful insights and recommendations to content creators and Lifestyle editors
Generate weekly reports to key stakeholders tracking key performance metrics and providing actionable recommendations
Work with internal stakeholders to define business requirements, enhance analytic processes and develop new capabilities to increase real-time reporting via digital dashboards
Help in the development of KPIs for the Lifestyle team
Plan and activate social media campaigns across Univision properties, using ad platforms on Facebook, Instagram, YouTube, TikTok and Twitter
Stay up to date on platform trends and identify new opportunities and ways to improve our content
Leverage research tools like Tubular to understand best performing content from other media and creators across platforms
YOU HAVE:
Minimum of 5+ years of experience in social media
Experience in telling a story using data
Bi-lingual (English and Spanish) required.
Knowledge of Latino and Hispanic culture in the US
Univision es un empleador que ofrece equidad e igualdad de oportunidades. Todos los solicitantes calificados recibirán consideración para el empleo sin distinción de sexo, identidad de género, orientación sexual, raza, color, religión, origen nacional, discapacidad, estado de veterano protegido, edad o cualquier otra característica protegida por la ley.",Audiovisual y medios de comunicación,,2022-08-24T00:00:00,2022-10-16,FULL_TIME
Python developer / Data analyst,Luxoft,,,-1,-1,,MXN,"Project Description
Large US based investment fund is looking for a support engineer having strong Unix administration skills and development experience.
The successful candidate will be working with global teams operating and developing a financial data platform.
Responsibilities
Understand the market and other data that supplies the data pipeline.Understand and support the schemas and other machine consumable documentation describing our data.Research, develop and support end user questions about our data.Troubleshoot the data normalization and enrichment systems.Troubleshoot the system for generating statistics from realtime market data.Work with researchers and portfolio managers to solve problems related to their data needs.
Skills
Must have
Ability to conduct independent research and investigation.Smart and quick learner.A great support attitudeData science expertiseProven development experience with the Python programming languageExperience with market data and financial services
Nice to have
-
Languages
English: B2 Upper Intermediate
Seniority
Senior
Relocation package
If needed, we can help you with relocation process.
Vacancy Specialization
Python
Ref Number
VR-75234",Tecnologías de la información,,2022-09-02T00:00:00,2022-10-16,OTHER
"Finance Manager Retail, Mexico Finance Team",Servicios Comerciales Amazon M,México,Ciudad de México,-1,-1,,MXN,"A Finance Degree or certificate of completion of studies is required
+10 years of experience in a similar role and or finance experience from Retail, FMCG or technology companies within an international environment.

5+ years of experience managing a team of top performing analysts.
Advanced Excel

Job summary
Amazon Mexico is recruiting for a Retail Finance Manager to join its fast growing Retail business. Working within the Retail Finance team, you will have full ownership of the P&L Account of the divisions you will be supporting. You will partner closely with the retail team, finance and other business groups, to support and monitor the consumer business’ strategic, financial and operational plans.

This will be a highly visible and varied role, in which the job holder will have the ability to bring new ideas to the business, interact with senior leaders and help influence the direction and decision making of the Retail business.

Key job responsibilities

Lead support for Mexico Categories including financial analysis and reporting.
Lead a team of financial analysts owning their development and performance.
Coordinating with central FP&A and local teams to support overall performance.
Analyzing and explaining current and historic performance, providing effective commercial business challenge to ensure key operational, commercial and financial targets are achieved or beaten.
Delivering consistent accuracy in predicting performance.
Finance controllership of the business unit area you will be supporting and continuous development of efficient reporting tools to support decision-making.
Providing analytical support such as the evaluation of business proposals, and driving ad-hoc cross-functional projects.

You will:

MBA is preferred.
Robust analytical & modelling skills required.
The ability to simplify and improve inefficient or unnecessarily complex processes.
The ability to prioritize and work to tight deadlines.
The ability to build positive business relationships and work collaboratively.
Ability to lead and develop a team
Eye for detail and passion for data
Be able to prioritize and work to tight deadlines.
Have strong business judgment and good instincts.
Be able to build positive business relationships and work collaboratively.
Have proven ability to simplify and improve inefficient or unnecessarily complex processes.
Have strong verbal & written communication skills.
Be able to operate at all levels, by staying connected to the details as well as being able to step back and see the bigger picture.
Prior knowledge of SQL/ETL would be beneficial.",Tecnologías de la información,,2022-09-14T00:00:00,2022-10-16,FULL_TIME
PMO Jr,Citi,México,Ciudad de México,-1,-1,,MXN,"The Project Intermediate Analyst is a developing professional role. Deals with most problems independently and has some latitude to solve complex problems. Integrates in-depth specialty area knowledge with a solid understanding of industry standards and practices. Good understanding of how the team and area integrate with others in accomplishing the objectives of the subfunction/ job family. Applies analytical thinking and knowledge of data analysis tools and methodologies. Requires attention to detail when making judgments and recommendations based on the analysis of factual information. Typically deals with variable issues with potentially broader business impact. Applies professional judgment when interpreting data and results. Breaks down information in a systematic and communicable manner. Developed communication and diplomacy skills are required in order to exchange potentially complex/sensitive information. Moderate but direct impact through close contact with the businesses' core activities. Quality and timeliness of service provided will affect the effectiveness of own team and other closely related teams.

Responsibilities:
Contributes to work flow or process change and redesign, and to forms a strong basic understanding of the specific product or process associated with a project under management.
Collects, measures, and analyzes project performance data.
Identifies, tracks, and closes project issues.
Ensures creation of project scope management plan.
Creates project schedule management plan.
Ensures corrective action is taken when project schedule variances occur create project cost estimates.
Tracks actual project costs, identify variances, and reforecast project costs as needed.
Creates the project quality management plan.
Identifies quality standards and metrics relevant to the project and how to meet them.
Identifies project risks, perform probability and impact analysis, determine responses to risks, track risks, and execute responses as needed.
Accountable for regular reporting or process administration as owner.
May direct day-to-day work of junior level employees, but will not typically have formal management role.
Exhibits strong basic executional and increasing project ownership capabilities.
Appropriately assess risk when business decisions are made, demonstrating particular consideration for the firm's reputation and safeguarding Citigroup, its clients and assets, by driving compliance with applicable laws, rules and regulations, adhering to Policy, applying sound ethical judgment regarding personal behavior, conduct and business practices, and escalating, managing and reporting control issues with transparency.
Qualifications:
2-5 years of relevant experience
Education:
Bachelor’s/University degree or equivalent experience
Responsibilities:
Ability to interface professionally with all levels of management, and the ability to work with multiple personality types to facilitate cooperation both within the Department and outside.
Assist Senior Project Manager as requested as well as support activities with the Project Management Office.
Coordinate external vendors, personnel from multiple Program areas, and information technology resources.
Create a collaborative consultative work environment, with matrix teams, and workgroups crossdepartmentally and cross-functionally.
Demonstrate professional communication skills
Ensures established budget is adhered to base upon project requirements.
Ensures quality and timeliness of project results.
Establishes and monitors project requirements, priorities, and deadlines from inception to completion.
Explore and implement a variety of best practices and standardized processes to ensure operational efficiency and scalability.
Facilitate the development and implementation of detailed reports to keep key stakeholders up to date on progress, issues, and outcomes.
Lead, manage, and facilitate concurrent projects, while remaining flexible with changing priorities, timeframes, and scope of services.
Manages activities of assigned project team.
May also lead sub-teams for larger projects/programs.
Oversee and provide hands-on project management of small to medium business unit and/or enterprise wide projects including all phases of project life cycle and/or software development life cycle (SDLC), under limited direction.
Responsible for work-streams to develop new services and programs to meet customer specific needs.
Strategically and tactfully determine resolutions to issues as they arise without direction.
Resolves and/or escalates issues in a timely fashion.
Manages risks and mitigations accordingly.
Qualifications:
Meet minimum qualifications as discussed in job classification specifications. Required
2-5 years managing enterprise projects. Required
2 years or more handling concurrent projects. Required
2 years as a member of a PMO or experience implementing a PMO. Desirable
Advance level of Microsoft Excel, Power Point and Project. Required
Advanced English (to be tested during the interview). Required
Project Portfolio Management software: Jira and PTS. Desirable
Education:
Bachelor’s/University degree. Required
Certificate in Project Management or Scrum certification. Required
-
Job Family Group:
Project and Program Management
-
Job Family:
Project Management
-
Time Type:
Full time
-
Citi is an equal opportunity and affirmative action employer.
Qualified applicants will receive consideration without regard to their race, color, religion, sex, sexual orientation, gender identity, national origin, disability, or status as a protected veteran.
Citigroup Inc. and its subsidiaries (""Citi”) invite all qualified interested applicants to apply for career opportunities. If you are a person with a disability and need a reasonable accommodation to use our search tools and/or apply for a career opportunity review Accessibility at Citi.
View the ""EEO is the Law"" poster. View the EEO is the Law Supplement.
View the EEO Policy Statement.
View the Pay Transparency Posting",Finanzas,,2022-08-29T00:00:00,2022-10-16,FULL_TIME
