Job_title,Company,State,City,Min_Salary,Max_Salary,unitText,SalaryCurrency,Job_Desc,Industry,Rating,Date_Posted,Valid_until,Job_Type
Analista de Producto Senior,"HR Remarkable Talent, LLC",Puerto Rico,San Juan,-1,-1,,USD,"Resumen de Posición: Gestiona la planificación y desarrolla la gama de productos de la marca y apoya a la gerencia en la creación de la estrategia de precio a concesionarios, el consumidor, flota corporativa y renta diaria para el mercado de Puerto Rico e Islas Vírgenes Norteamericanas. Es custodio de la información de producto y es responsable de comunicar la misma a todas las áreas del negocio que así lo necesiten. En adición, es la fuente principal de conocimiento de los productos para la gestión de ventas y gestiona las acciones de capacitación a la fuerza de venta de los concesionarios y a la empleomanía de la marca y al resto de la empresa.Requisitos Mínimos: Mínimo Bachillerato en administración de empresas, mercadeo o estadísticas.Mínimo 3 años de experiencia en posiciones de carácter analítico y de interpretación de datos estadísticos e investigación de mercado. Haber trabajado en el desarrollo de estrategias de precios y competencia. Destrezas de presentación frente a públicoDominio en los programas de Microsoft Office (Excel nivel avanzado, Power Point, Word, Outlook). Uso de la herramienta de precios y datos JATO.Destrezas de comunicación verbal y escrita en español e inglésHaga clic en el botón aplicar en la parte superior de la oferta de empleo. Asegúrese de adjuntar su resume actualizado con su información de contacto junto a la solicitud.Patrono con Igualdad de Oportunidades de EmpleoTenga en cuenta que esta descripción de trabajo no está diseñada para cubrir o contener una lista completa de actividades, deberes o responsabilidades que se requieren del empleado para este trabajo. Las declaraciones anteriores tienen la intención de describir en general la naturaleza y el nivel de trabajo que se realiza.HR Remarkable Talent es una firma de consultoría y Reclutamiento de Recursos Humanos para todo tipo de empresas. Ayudamos a las empresas a alcanzar el éxito a largo plazo a través del crecimiento y a encontrar candidatos adecuados para posiciones vacantes, todo dentro de costos razonables y accesibles, ajustados al presupuesto de todo tipo de empresas.Job Type: Full-timeSalary: $38,000.00 - $40,000.00 per yearAbility to commute/relocate:San Juan, PR: Reliably commute or planning to relocate before starting work (Required)Education:Bachelor's (Preferred)Experience:Financial concepts: 1 year (Preferred)Language:English (Required)Fluent Spanish (Required)Shift availability:Day Shift (Required)Night Shift (Preferred)Work Location: One location",,,2022-09-12T00:00:00,2022-10-16,FULL_TIME
Analista Financiero Sr,Kimberly-Clark,West Virginia,Costa,-1,-1,,USD,"Analista Financiero Sr
Job Description
Misión del puesto:
Apoyo en materia contable y financiera a los clústeres de negocio, a través de desempeño proactivo, capacidad analítica, alta capacidad de comunicación y resolución de problemas y compromiso con los resultados.
Responsabilidades:
Analizar y consolidar datos (presupuestos, teniendo en cuenta los objetivos y la posición financiera de la empresa), para obtener análisis operativos perspicaces y relevantes para el negocio.
Aplicar controles financieros y operativos en cumplimiento de CFIs, Código de Conducta, el marco ético y procedimientos internos.
Resolver los requerimientos de los equipos financieros locales, brindando un servicio de valor agregado de alta calidad para el negocio.
Liderar reuniones financieras periódicas para proporcionar visibilidad sobre la variación de gastos de tendencia de SMGA (Selling, Marketing, General, Administrative).
Controlar la razonabilidad del balance a través de la revisión de variaciones, la aclaración de cuentas no naturales y proporcionar explicación-justificación a la oficina del contralor.
Colaborar con el equipo de nómina para garantizar la precisión e integridad de los datos, proporcionando ajustes según sea necesario e identificando oportunidades en el proceso.
Analizar la tendencia de las cuentas de nómina para garantizar que las variaciones se expliquen correctamente y hacer un seguimiento de los temas o explicaciones pendientes.
Revisar los documentos fiscales asegurando la precisión y el cumplimiento de las leyes y regulaciones relevantes.
Revisar los estados financieros y otros informes financieros para evaluar la exactitud, integridad y conformidad con los requisitos locales.
Requerimientos:
Bachiller en Contabilidad, Administración de Empresas o Finanzas.
5 años de experiencia en puestos similares (análisis de negocios, informes financieros y contabilidad)
Nivel avanzado de español y portugués
Conocimientos avanzados de SAP y Excel
Excelentes habilidades analíticas y de resolución de problemas
Fuertes habilidades de comunicación verbal y escrita, con la capacidad de dialogar, resolver problemas, influir e interactuar de manera efectiva en todos los niveles
Sólida comprensión de la contabilidad y el marco de controles relevantes.
Deseables:
Nivel intermedio de inglés
CRC activo
Global VISA and Relocation Specifications:
Primary Location
Brazil -Sao Paulo
Additional Locations
Costa Rica -Prindisa
Worker Type
Employee
Worker Sub-Type
Regular
Time Type
Full time",Manufactura,,2022-09-01T00:00:00,2022-10-16,FULL_TIME
BIZOps,Laika Mascotas,District of Columbia,Washington,-1,-1,,USD,"Descripción empresa:
Laika es la tienda online más completa para mascotas creada por pet lovers para pet lovers! Somos la tienda en línea de mascotas con mayor variedad de productos y servicios a domicilio en Colombia, contamos con más de 4.000 productos (alimentos, dietas naturales, snacks, medicinas, higiene y accesorios) y más de 17 servicios como (medicina veterinaria prepagada, veterinario a domicilio, vacunación, baños, funeraria, entrenador, gaticuidadores, información de colegios, fundaciones, entre otros.
Para Laika, la salud y bienestar de tu mascota es lo más importante. Nos esforzamos día a día por dar la mejor experiencia y servicio a los pet lovers y para que a tus peluditos no les falte nada para su cuidado y salud. Es por esto que también contamos con una línea veterinaria gratuita en donde cualquier persona puede llamar para resolver dudas al 3009108496.

Misión del cargo:
Liderar el desarrollo de proyectos especiales dentro de la empresa, proyectos de alto impacto e importancia para la organización.

Funciones del cargo:
Garantizar el desarrollo, la planeación y ejecución de los proyectos especiales que se presenten al interior de la empresa.
Identificar los puntos clave a mejorar dentro de la organización con el fin de generar soluciones para cerrar estas brechas.
Ejecutar los planes de acción derivados de los hallazgo que encuentre de sus investigaciones.
Generar insights a partir del constante análisis de datos para la toma de decisiones.
Poner en marcha los planes de alto impacto y garantizar que se cumplan en tiempo y con la cobertura esperada.

Requisitos:
Experiencia en Consultoría Startups áreas de estrategia
Administrador, ingeniero y afines
1 - a años como consultor y/o analista sr de estrategia

Condiciones Oferta:Beneficios:

Mascotas bienvenidas
Día de cumpleaños
Descuentos en productos

Descripción Proceso de Selección:
El proceso de selección se realiza a través de Aira - plataforma de reclutamiento diseñado para mejorar tu experiencia de postulación.

Para postular solo necesitas:
1. Postular a la oferta
2. Revisar tu email
3. Ingresar a Aira y contestar las preguntas y/o pruebas solicitadas

Luego, si vemos que tu perfil se ajusta a lo que estamos buscando, te contactaremos por email (a través de Aira) para seguir a la etapa presencial.",,,2022-08-21T00:00:00,2022-10-16,FULL_TIME
Valuation & Financial Analysis Manager,BHE Renewables,Iowa,Des Moines,-1,-1,,USD,"Primary Job Duties and Responsibilities (Essential Job Function)

The Valuation & Financial Analysis Manager is responsible for coordinating and performing research, analysis, financial modeling, valuation, and initial due diligence related to potential merger, acquisition and business development opportunities as well as special projects as requested by company leadership. This position develops, maintains and validates detailed financial modeling and assessment reports using available data in support of investment activity. Expectations are to perform and work with other business analysts and tools to identify impacts and risks to the business strategy. Mentoring experienced and entry-level project analysts in standard financial evaluation and problem-solving methodologies is expected. This role acts as a subject matter expert and is expected to temporarily substitute for the Sr Director, Finance when required. Ensures timely and accurate preparation of in-depth initial analysis and periodic updates of potential target companies and other internal and external business opportunities. In addition to managing transactional deal flow, responsible for researching and developing business case(s) for emerging market opportunities or technologies. Responsible for assisting management with the development and maintenance of the renewable project pipeline, including the planning, scheduling and completion of internal and contracted work tasks needed to meet project deadlines. Additionally, this role will be expected to build expertise in tax equity investment accounting, tax treatment and modeling as well as assist in tax equity planning, budgeting, forecasting and valuations as requested.

Typical Duties
Perform and effectively coordinate timely and accurate analysis of potential target companies/projects and other internal and external business opportunities. (40%)
Develops memorandum and presentations that clearly communicate evaluation results, assumptions, and recommendations. (10-15%)
Participates as team member on acquisition and investment due diligence initiatives, assists BHE Renewables Executive and Senior Management team in lending direct renewable commercial and technical experience to the full evaluation of investment opportunities. Responsible for development of risk management and mitigation strategies for such investments. (10%)
Monitor external news sources and investor communications for material events impacting potential target companies, update financial models and related analyses as appropriate and communicate impacts to senior management. (5-10%)
Provides support to BHE Renewables business development as needed and as priorities dictate, including work on domestic and foreign renewable opportunities. (10%)
Provide assistance and oversight to project analysts and answer questions as they arise. (10%)

Provide support to the Sr. Director, Finance and Tax Equity Accounting Manager as necessary for the accounting, budgeting, forecasting and valuations of current and potential tax equity investments (5%-10%)

Performs research and analysis for use in development of business strategies for emerging market and/or technology opportunities. (5%)
Perform additional special projects, assignments and responsibilities as requested. (5%)

Qualifications
Bachelor's degree in business, accounting, finance or related field required. (Typically six years of related, progressive work experience would be needed for candidates applying for this position who do not possess a bachelor's degree.)
CFA and MBA, CPA, or comparable advanced degree strongly preferred.
Seven or more years of related work, educational focus and/or financial market experience associated with business valuation, financial analysis, fixed income and/or equity research and analysis, financial modeling, strategy development, mergers and acquisitions, corporate finance, or similar business evaluation experience; energy or other utility or commodity industry experience strongly preferred.
Four or more years of power industry experience preferred; three of those years relating to wind, solar or other renewable technology project development. Preference will be given to candidates with direct solar and or wind industry or project management experience.
Demonstrated knowledge and understanding of fixed income, equity, corporate finance and other financial markets.
Highly effective analytical, problem-solving and decision-making skills to recognize patterns in data, information or events and to draw logical conclusions and make recommendations.
Highly effective verbal and written communication skills to effectively convey technical information accurately and understandably to senior management.
Demonstrated project management skills and ability to prioritize and handle multiple tasks and projects concurrently.
Advanced software skills to develop and use spreadsheets, documents, presentations and reports using various applications including Microsoft Excel, Word and PowerPoint; Familiarity with Bloomberg, Capital IQ, SNL Financial and other financial applications strongly preferred.
Employees must be able to perform the essential functions of the position, with or without an accommodation.
All qualified applicants will receive consideration for employment without regard to race, color, religion, sex, sexual orientation, gender identity, national origin, disability or veteran status.",,,2022-08-22T00:00:00,2022-10-16,FULL_TIME
