Job_title,Company,State,City,Min_Salary,Max_Salary,unitText,SalaryCurrency,Job_Desc,Industry,Rating,Date_Posted,Valid_until,Job_Type
Financial Planning & Analysis Manager,AECOM,Texas,Austin,-1,-1,,USD,"AECOM has a need for a Financial Planning & Analysis Manager. This position will be a remote/virtual position and can located anywhere in the United States.

At AECOM, we’re delivering a better world.

We believe infrastructure creates opportunity for everyone. Whether it’s improving your commute, keeping the lights on, providing access to clean water or transforming skylines, our work helps people and communities thrive.

Our clients trust us to bring together the best people, ideas, technical expertise and digital solutions to our work in transportation, buildings, water, the environment and new energy. We’re one global team – 47,000 strong – driven by a common purpose to deliver a better world.

Responsibilities and Duties:
+ Provides guidance to employees within the latitude of established policies.

+ Recommends changes to policies and establishes procedures that affect immediate organization.

+ Works on issues of diverse scope where analysis of situation or data requires evaluation of a variety of factors, including understanding of current business trends.

+ Acts as advisor to subordinates to meet schedules and/or resolve technical problems.

+ May have budget responsibilities. Erroneous decision or failure to achieve results adds to costs and may impact short-term goals of organization.

+ Manages the coordination of activities of a group or department with responsibility for results. In some instances, may be responsible for functional area and does not have direct reports or subordinate employees.

+ Oversight of responsibilities and assignments of direct reports while in collaboration with overseas management to ensure accurate and timely deliverables.

+ Monthly analysis and reporting on business development financial performance, including new awards, backlog changes and BD spend efficiency.

+ Weekly and monthly labor performance planning and analysis, ensuring appropriate personnel are charging to budgets.

+ Develops monthly business review packages and notes for executive leadership of the company.

+ Support of the Strategic planning and operating plan processes. This includes, but not limited to, development of functional (support group) budget, as well as collaboration with regions within Americas to help guide growth expectations.

+ Support of ad hoc analysis, integrating both internal and external data sets to develop the analysis.

+ Continually looks for process enhancement/improvement ideas

+ Assists team by providing direction to regional leadership around specific trends and opportunities

About AECOM

We believe infrastructure creates opportunity for everyone. Whether it’s improving your commute, keeping the lights on, providing access to clean water or transforming skylines, our work helps people and communities thrive.

Our clients trust us to bring together the best people, ideas, technical expertise and digital solutions to our work in transportation, buildings, water, the environment and new energy. We’re one global team – 50,000 strong – driven by a common purpose to deliver a better world.

Minimum Requirements

+ BA/BS + 8 years of Financial planning and analysis experience or demonstrated equivalency of experience and/or education.

+ Due to the nature of the role, US citizenship is required.

Preferred Qualifications

+ A Degree in Finance, Accounting, Economics, or a related field preferred.

+ Comfortable with working independently and virtually.

+ Strong organizational skills – the ability to multi-task, prioritize commitments, manage time effectively, manage documentation, and meet deadlines in a fast paced, dynamic, team-oriented environment.

+ Ability to work well as part of a team.

+ Strong working knowledge of word-processing (Word), database, spreadsheet (EXCEL) programs and integrated software applications.

+ Ability to deal with fast past, ever evolving environment.

+ Skilled at dealing with people and the ability to communicate effectively with people who are geographically separated.

Additional Information:
+ This position does not include sponsorship for United States work authorization now or in the future

+ Relocation assistance and/or per diem is not offered for this position

+ Offered rate of compensation (for Colorado locations only) will be based on individual education, qualifications, experience, and work location. The salary range for this position is $130,000 - $171,809.24 USD annually.

+ AECOM is proud to offer a comprehensive benefits program to meet the diverse needs of our employees. Depending on your employment status, AECOM benefits may include medical, dental, vision, life, AD&D and disability benefits, paid time off, leaves of absence, retirement benefits, voluntary benefits, perks, wellness and global well-being, and global EAP, Business Travel and Service Awards programs.

What We Offer

We will give you the flexibility you need to do your best work with hybrid work options. Whether you’re working from an AECOM office, remote location or at a client site, you will be working in a dynamic environment where your integrity, entrepreneurial spirit and pioneering mindset are championed. You will help us foster a culture of equity, diversity and inclusion – a safe and respectful workplace, where we invite everyone to bring their whole selves to work using their unique talents, backgrounds and expertise to create transformational outcomes for our clients. We will encourage you to grow and develop your career with us through our technical and professional development programs and diverse career opportunities. We believe in leadership at all levels. No matter where you sit in the organization you can make a lasting impact on the projects you work on, the teams and committees you join and our business. We offer competitive pay and benefits, well-being programs to support you and your family, and the development resources you need to advance your career. When you join us, you will connect and collaborate with a global network of experts – planners, designers, engineers, scientists, consultants, program and construction managers – leading the change toward a more sustainable and equitable future. Join us and let’s get started. As an Equal Opportunity Employer, we believe in each person’s potential, and we’ll help you reach yours.","Servicios de construcción, reparación y mantenimiento",,2022-09-12T00:00:00,2022-10-16,FULL_TIME
Financial Analysis & Strategy Manager,Zendesk,,,-1,-1,,USD,"Manager, Finances & Strategy
Finance & Strategy (F&S) is a team of trusted strategic advisors, driving growth and scale through innovation and partnership. We are looking for a Finance Manager that wants to make an impact on the G&A and Operations functions. This role will partner closely with IT, Operations, and other G&A functional leaders, providing a wide breadth of exposure to execs and stakeholders. The Finance Manager will be responsible for providing support to the business through deep analytics and modeling, participating in cross-functional workstreams, and collaborating with business partners to manage and forecast operating costs.
The ideal candidate should have a strong foundation of finance experience, excellent communication skills, and be able to prioritize effectively in a fast-paced, high growth environment.
Description:
Collaborate with G&A and Operations business partners as a trusted performance advisor, driving key elements of the budgeting process and proactively communicating financial updates
Play an active role in cross-functional work streams which involve the IT, Operations, and other G&A organizations, advising on financially impacting decisions, monitoring costs, and keeping the Finance organization in the loop on important developments
Use financial modeling and innovative analytics to improve Zendesk’s understanding of it’s G&A organizations, key cost drivers, the value it delivers, and how that value can be increased
Perform core responsibilities around month-end financial close, forecasting, and preparation of management reports related to financial results
Serve as primary F&S point of contact & approver on critical processes such as purchase requisition approvals and hiring requisition submission/approval
Qualifications:
Bachelor's Degree in Economics, Business, Finance, or Accounting
7+ years of relevant FP&A experience
Exceptional MS Excel skills required
Strong attention to detail with the ability to identify and resolve data issues/needs quickly
Strong oral and written communication skills with the ability to synthesize and communicate information across teams; comfortable presenting to executives
Strong EQ, experience partnering across matrixed organizations, and an appreciation for building deep business partnerships
Experience with financial planning systems strongly preferred - Adaptive experience specifically a plus
Strong working knowledge of SQL a plus
Experience with Google Suite (Sheets, Slides) a plus
#LI-MH3
#LI-Remote
About Zendesk - Champions of Customer Service
Zendesk software was built to bring a sense of calm to the chaotic world of customer service. Today we power billions of conversations with brands you know and love. We advocate for digital first customer experiences — and we stick with it in our workplace. Over 6,000 employees worldwide have the flexibility and trust to choose where they work. The fact is, we know great work happens anywhere. Whether you’re collaborating from your home office, a Zendesk workspace, or the kitchen table, you’re part of one team at Zendesk.
Zendesk is an equal opportunity employer, and we’re proud of our ongoing efforts to foster global diversity, equity, & inclusion in the workplace. Individuals seeking employment and employees at Zendesk are considered without regard to race, color, religion, national origin, age, sex, gender, gender identity, gender expression, sexual orientation, marital status, medical condition, ancestry, disability, military or veteran status, or any other characteristic protected by applicable law. We are an AA/EEO/Veterans/Disabled employer. If you are based in the United States and would like more information about your EEO rights under the law, please click here.
For jobs in the US only: If hired, you will be required to provide proof of full vaccination against COVID-19 and will be provided with an opportunity to request an accommodation for reasons recognized by applicable law. This is a requirement of employment for jobs based in the United States.
For jobs in Australia, Brazil, Canada, the Philippines and Singapore: If hired and required to work in office or in person with others as part of your job, you will be required to provide proof of full vaccination against COVID-19. Zendesk will consider exceptions for reasons recognized by applicable law. This is a requirement of employment for jobs based in Australia, Brazil, Canada, the Philippines and Singapore.
Zendesk endeavors to make reasonable accommodations for applicants with disabilities and disabled veterans pursuant to applicable federal and state law. If you are an individual with a disability and require a reasonable accommodation to submit this application, complete any pre-employment testing, or otherwise participate in the employee selection process, please send an e-mail to benefits@zendesk.com with your specific accommodation request.
By submitting your application, you agree that Zendesk may collect your personal data for recruiting, global organization planning, and related purposes. Zendesk's Candidate Privacy Notice explains what personal information Zendesk may process, where Zendesk may process your personal information, its purposes for processing your personal information, and the rights you can exercise over Zendesk’s use of your personal information.",Tecnologías de la información,,2022-09-15T00:00:00,2022-10-16,OTHER
FINANCIAL PLANNING & ANALYSIS MANAGER,"Bridgepointe Technologies, LLC.",,,-1,-1,,USD,"Financial Planning & Analysis ManagerCOMPANY OVERVIEWBased in Silicon Valley, Bridgepointe was founded in 2002 on the principle that businesses need a strategic partner and advocate when procuring, implementing, and maintaining IT services and infrastructure. The Company’s IT Strategists offer business leaders direct access to a large portfolio of vendor-agnostic solutions, employing a six-step model that starts with getting to know a client’s business, challenges, and goals, and culminates in recommendations and support around supplier selection. Bridgepointe’s expert IT Strategists help clients achieve optimal IT results without costly consulting agreements.In January 2022, Bridgepointe announced a strategic growth investment from Charlesbank Capital Partners, raising more than $100 million as part of the transaction to fuel organic growth and fund acquisitions. Following this investment, Bridgepointe is rapidly building upon its fast-paced, entrepreneurial, and highly successful team to enable it to leverage new growth opportunities.The Corporate Financial Planning and Analysis Manager position is a unique opportunity to join a high-growth, nationwide IT Strategy firm that is quickly scaling to become one of the nation’s largest IT channel platforms. Since January, the firm has acquired sixteen other firms and will continue to seek to grow both organically and inorganically.Candidates can choose between working remotely or relocating to San Mateo, CA.This position will report to Todd Pittman, Bridgepointe’s Chief Financial Officer.KEY RESPONSIBILITIESThe ideal candidate will be excited to take responsibility for being an integral part of Bridgepointe’s finance and accounting team and take a leadership role in shaping the Company’s evolution towards becoming a data driven organization. Key responsibilities include:Financial planning, analysis, budgeting, and modelling, including developing and maintaining KPIs, reports, and analysis to provide critical information in support of management with strategic and operating decisions,Assist in the preparation of financial plans to understand the drivers of revenues and costs.Assist in conducting monthly variance analyses and other ad-hoc analysis as requested.Continuously seek new ways to leverage business data to offer fresh insights and aid decision-making.Provide support for internal management requests and reporting, including but not limited to Board of Directors, Executives, and other management.Effectively translate business strategies, initiatives, and projects into financial model.Extensive experience with a variety of modelling tools is prerequisite and a willingness, andEnthusiasm for learning new skills and tools is required as the Company scales its capabilities and seeks to leverage data to support our growth.Given the importance of financial analysis to Bridgepointe’s strategy, the financial team will have day-to-day interaction with the Bridgepointe’s management team, as well as potential acquisition targets, and Bridgepointe’s partner community.QUALIFICATIONS AND PROFICIENCIES The ideal candidate will have the following core experiences along with a positive, open and Growth Mindset:Bachelor’s Degree required.Relentless work ethic and passion to continuously improve and win.6-8 years of experience in a financial planning and analysis role, ideally with a high growth private equity or venture capital backed enterprise.High degree of proficiency in Excel and PowerPoint, with experience performing robust data analysis and presenting synthesized recommendations.Experience with one or more modeling and dashboard tools such as Tableau, PowerBI, Alteryx, Snowflake, etc.Ability to prioritize multiple workstreams in a fast-paced work environment,Experience in data cleansing, normalization.Critical thinking / problem solving capabilities.Ability to prioritize multiple workstreams in a fast-paced, self-directed environment,Experience with KPIs, Scorecards and Business Intelligence preferred.Experience in the Master Agent channel and/or technology background a benefit, but not required.BENEFITSA comprehensive benefits package including health insurance, 401(k), disability, life insurance, and unlimited time off policy available.For more information, please visit bridgepointetechnologies.com to learn more.Job Type: Full-timePay: $130,000.00 per yearBenefits:401(k)401(k) matchingDental insuranceFlexible scheduleHealth insuranceLife insurancePaid time offVision insurance",,,2022-09-12T00:00:00,2022-10-16,FULL_TIME
Finance Manager (Remote Home-Based Worker),Allstate,,,-1,-1,,USD,"The world isn’t standing still, and neither is Allstate. We’re moving quickly, looking across our businesses and brands and taking bold steps to better serve customers’ evolving needs. That’s why now is an exciting time to join our team. You’ll have opportunities to take risks, challenge the status quo and shape the future for the greater good.
You’ll do all this in an environment of excellence and the highest ethical standards – a place where values such as integrity, inclusive diversity and accountability are paramount. We empower every employee to lead, drive change and give back where they work and live. Our people are our greatest strength, and we work as one team in service of our customers and communities.
Everything we do at Allstate is driven by a shared purpose: to protect people from life’s uncertainties so they can realize their hopes and dreams. For more than 89 years we’ve thrived by staying a step ahead of whatever’s coming next – to give customers peace of mind no matter what changes they face. We acted with conviction to advocate for seat belts, air bags and graduated driving laws. We help give survivors of domestic violence a voice through financial empowerment. We’ve been an industry leader in pricing sophistication, telematics, digital photo claims and, more recently, device and identity protection. We are the Good Hands. We don’t follow the trends. We set them.
Job Summary:
The Financial Associate Manager leads and directs daily execution of analysis and communication of financial results, development of compelling storylines and formulation of financial projections for key products, markets and initiatives. This role facilitates achievement of business objectives with guidance, while ensuring financial credibility and reputation of high quality financial measurement, reporting, planning and consulting. The Associate Manager is responsible for building financial team excellence, and developing analysts.
This position is a permanent remote home-based worker. Your home office does not need to be near an Allstate office, but it does need to be in the United States. This position is eligible for a monthly connectivity reimbursement to offset the costs of internet and phone expenses.
Key Responsibilities:
Serve as financial advisor in absence of manager, assisting Business Unit leaders and partners in a consultative manner and identifying needs in the areas of forecasting, planning, strategic planning, measurement, business case development, capital management and internal controls
Build and communicate convincing story lines and forward-thinking insights (with minimum focus/reliance on the numbers) to help leaders understand results, and anticipate/ understand challenges and opportunities for their business
Assist in preparing the strategic and operating plans for the Business Unit and utilize forecast updates to influence management decisions
Participate on multi-discipline project teams as financial advisor
Lead team members to ensure team efficiency and effectiveness (e.g., conflict/problem resolution, process/system improvements, resource procurement, supportive environment)
Supervisory Responsibilities:
This job does have supervisory duties.
Education and Experience:
Bachelor's degree
5 or more years of related experience
1 or more years of leadership experience strongly preferred
Functional Skills:
High-level of knowledge of general corporate finance
Demonstrated depth of financial and analytical expertise
Knowledge of accounting principles and general audit procedures
Experience as a business consultant in a finance related field
Effective communication across multiple levels and mediums
Demonstrated experience in talent and people management skills
BA or BS in Finance, Economics, Accounting, Mathematics or related area of study
Notes:
The preceding description is not designed to be a complete list of all duties and responsibilities. May be required to perform other related duties as assigned. Regular, predictable attendance is an essential function of this job.
Compensation offered for this role is $95,500.00-$110,500.00 per year and is based on experience and qualifications.
The candidate(s) offered this position will be required to submit to a background investigation, which includes a drug screen.
Good Work. Good Life. Good Hands®.
As a Fortune 100 company and industry leader, we provide a competitive salary – but that’s just the beginning. Our Total Rewards package also offers benefits like tuition assistance, medical and dental insurance, as well as a robust pension and 401(k). Plus, you’ll have access to a wide variety of programs to help you balance your work and personal life - including a generous paid time off policy. For a full description of Allstate’s benefits, visit allstate.jobs/benefits/
Learn more about life at Allstate. Connect with us on Twitter, Facebook, Instagram and LinkedIn or watch a video.
Allstate generally does not sponsor individuals for employment-based visas for this position.
Effective July 1, 2014, under Indiana House Enrolled Act (HEA) 1242, it is against public policy of the State of Indiana and a discriminatory practice for an employer to discriminate against a prospective employee on the basis of status as a veteran by refusing to employ an applicant on the basis that they are a veteran of the armed forces of the United States, a member of the Indiana National Guard or a member of a reserve component.
For jobs in San Francisco, please click “here” for information regarding the San Francisco Fair Chance Ordinance.
For jobs in Los Angeles, please click “here” for information regarding the Los Angeles Fair Chance Initiative for Hiring Ordinance.
To view the “EEO is the Law” poster click “here”. This poster provides information concerning the laws and procedures for filing complaints of violations of the laws with the Office of Federal Contract Compliance Programs
To view the FMLA poster, click “here”. This poster summarizing the major provisions of the Family and Medical Leave Act (FMLA) and telling employees how to file a complaint.
It is the Company’s policy to employ the best qualified individuals available for all jobs. Therefore, any discriminatory action taken on account of an employee’s ancestry, age, color, disability, genetic information, gender, gender identity, gender expression, sexual and reproductive health decision, marital status, medical condition, military or veteran status, national origin, race (include traits historically associated with race, including, but not limited to, hair texture and protective hairstyles), religion (including religious dress), sex, or sexual orientation that adversely affects an employee's terms or conditions of employment is prohibited. This policy applies to all aspects of the employment relationship, including, but not limited to, hiring, training, salary administration, promotion, job assignment, benefits, discipline, and separation of employment.",Seguros,,2022-09-13T00:00:00,2022-10-16,OTHER
