Job_title,Company,State,City,Min_Salary,Max_Salary,unitText,SalaryCurrency,Job_Desc,Industry,Rating,Date_Posted,Valid_until,Job_Type
JUNIOR DATA ENGINEER (100% REMOTE AVAILABLE),University of Washington,Washington State,Seattle,-1,-1,,USD,"Notes: As a UW employee, you will enjoy generous benefits and work/life programs. For a complete description of our benefits for this position, please visit our website, click here.


As a UW employee, you have a unique opportunity to change lives on our campuses, in our state and around the world. UW employees offer their boundless energy, creative problem solving skills and dedication to build stronger minds and a healthier world.


UW faculty and staff also enjoy outstanding benefits, professional growth opportunities and unique resources in an environment noted for diversity, intellectual excitement, artistic pursuits and natural beauty.


This position provides opportunities to work in a rewarding environment and empower our diverse community of faculty, staff, fellows, residents, and students to read, use and act on data as the core decision process of our business. As an employee you will receive excellent benefits, have access to work/life programs and get to work alongside amazing coworkers in our Dean of Medicine IT department.


UW Medicine’s mission is to improve the health of the public by advancing medical knowledge, providing outstanding primary and specialty care to the people of the region, and preparing tomorrow’s physicians, scientists and other health professionals. UW Medicine owns or operates Harborview Medical Center (HMC), Northwest Hospital & Medical Center (NWH), Valley Medical Center (VMC), UW Medical Center (UWMC), a network of UW Medicine Neighborhood Clinics (UWNC) that provide primary care, UW Physicians, UW School of Medicine, Airlift Northwest, and other owned, operated or affiliated entities. In addition, UW Medicine shares in the ownership and governance of Children’s University Medical Group and Seattle Cancer Care Alliance a partnership among UW Medicine, Fred Hutchinson Cancer Research, and Seattle Children’s.


Dean of Medicine IT has an outstanding opportunity for a Junior Data Engineer to join their team.


The Junior Data Engineer (payroll title: Senior Computer Specialist) will be responsible for several aspects of data management to include: research issues and implement corrections, operational support, ETL, TSQL development, application data integration support on multiple business domains (Academic, Finance, Faculty, etc.). The Junior Data Engineer will be part of a newer team supporting existing data processes, integrating and migrating to modern technology. The position will advance our data culture by supporting our business customers, learn and explain data opportunities, further develop, and enhance our data.


POSITION COMPLEXITIES

This position will serve a key role, working with Dean of Medicine or School of Medicine units, vendors, UW Information Technology (UW IT), UW Medicine Information Technology (UW Med ITS), internal business and technical staff to recommend strategies, design and maintain data architecture: internal & external stores, master data management, data acquisition & integration, data delivery platforms, data propagation & distribution, data access & providers, analytic environments, predictive modeling environments, database management systems and metadata repository & services.


The successful candidate will be responsible for supporting and enhancing these integrated systems and balance multiple competing priorities, clearly setting expectations while maintaining excellent customer relationships.


DUTIES AND RESPONSIBILITIES

Develop and maintain databases, SQL Jobs, incident resolution, ETL, TSQL development, application data integration support, and assist with business intelligence solutions.

Research, strategize, and write proposals to advance existing systems and manage new requirements.

Provide best practices and guidance on all aspects of data systems to include: future plans, products, security, privacy compliance, technology, training, design, implementation, support, vendor and customer relationships, future cloud options, ETL tools, and research trends.

Provide DBA support as needed for backup/recovery, related tools, upgrades, migrations, connections, access and permissions when applicable.

Foster and maintain excellent relationships with a wide variety of internal, external business and technical partners.

Attend unit-wide meetings; advance technical and professional skills through continuing education, mentoring programs or personal study; and research and maintain knowledge of new technologies for departmental use.


MINIMUM REQUIREMENTS

Bachelor’s degree in Computer Science, Information Management, related field or equivalent experience.

Two years related experience.


Equivalent education/experience will substitute for all minimum qualifications except when there are legal requirements, such as a license/certification/registration.


ADDITIONAL REQUIREMENTS

SQL development experience using Transact SQL.

Experience with an ETL technology (ex. SSIS).

Strong problem-solving skills, investigating and resolving issues.

Demonstrated ability to work with minimum supervision as an individual contributor to projects and daily work.

Strong sense of focus and attention to detail, flexibility, self-motivation, organizational skills, excellent written/oral communication skills, and ability to adapt to a range of technical and non-technical audiences.


DESIRED QUALIFICATIONS

Experience working in higher education, research, or health services organizations.

Experience working in virtual servers, containers, or cloud computing (such as Azure, AWS, or serverless computing) environments.

Experience working with reporting technologies such as Crystal, Business Objects, Tableau, Power BI, or Reporting Services.

Some experience with Java, C#, Python, R script or M query.

An understanding of contemporary IT systems, network infrastructure and their interdependencies.

Experience with data cleansing and/or ensuring data integrity.

Experience working with HIPAA, FERPA and GDPR data.


Application Process:

The application process for UW positions may include completion of a variety of online assessments to obtain additional information that will be used in the evaluation process. These assessments may include Work Authorization, Cover Letter and/or others. Any assessments that you need to complete will appear on your screen as soon as you select “Apply to this position”. Once you begin an assessment, it must be completed at that time; if you do not complete the assessment you will be prompted to do so the next time you access your “My Jobs” page. If you select to take it later, it will appear on your ""My Jobs"" page to take when you are ready. Please note that your application will not be reviewed, and you will not be considered for this position until all required assessments have been completed.


Applicants considered for this position will be required to disclose if they are the subject of any substantiated findings or current investigations related to sexual misconduct at their current employment and past employment. Disclosure is required under Washington state law.

Committed to attracting and retaining a diverse staff, the University of Washington will honor your experiences, perspectives and unique identity. Together, our community strives to create and maintain working and learning environments that are inclusive, equitable and welcoming.
The University of Washington is a leader in environmental stewardship & sustainability, and committed to becoming climate neutral.
The University of Washington is an affirmative action and equal opportunity employer. All qualified applicants will receive consideration for employment without regard to race, color, religion, sex, sexual orientation, gender identity, gender expression, national origin, age, protected veteran or disabled status, or genetic information.
To request disability accommodation in the application process, contact the Disability Services Office at 206-543-6450 or dso@uw.edu.
COVID-19 VACCINATION REQUIREMENT
Governor Inslee's Proclamation 21-14.2 requires employees of higher education and healthcare institutions to be fully vaccinated against COVID-19 unless a medical or religious exemption is approved. Being fully vaccinated means that an individual is at least two weeks past their final dose of an authorized COVID-19 vaccine regimen. As a condition of employment, newly hired employees will be required to provide proof of their COVID-19 vaccination. View the Final candidate guide to COVID-19 vaccination requirement webpage for information about the medical or religious exemption process for final candidates.",Educación,,2022-09-15T00:00:00,2022-10-16,OTHER
Jr. Data Engineer,Confluent,,,-1,-1,,USD,"Confluent is pioneering a fundamentally new category of data infrastructure focused on data in motion. Have you ever found a new favorite series on Netflix, picked up groceries curbside at Walmart, or paid for something using Square? That’s the power of data in motion in action—giving organizations instant access to the massive amounts of data that is constantly flowing throughout their business. At Confluent, we’re building the foundational platform for this new paradigm of data infrastructure. Our cloud-native offering is designed to be the intelligent connective tissue enabling real-time data, from multiple sources, to constantly stream across the organization. With Confluent, organizations can create a central nervous system to innovate and win in a digital-first world.
We’re looking for self-motivated team members who crave a challenge and feel energized to roll up their sleeves and help realize Confluent’s enormous potential. Chart your own path and take healthy risks as we solve big problems together. We value having diverse teams and want you to grow as we grow—whether you’re just starting out in your career or managing a large team, you’ll be amazed at the magnitude of your impact.
This role will be part of the Sales Strategy and Analytics group under Sales Operations. Specifically within the Sales Business Intelligence team, which is brand new and being built out this fiscal year. This team is the engine behind driving a self-serve reporting culture using Tableau for the broader Field Sales Operations organization.

About the Opportunity:
This newly created role will be a key member of the Sales Business Intelligence team and play an active role in accelerating Confluent’s Data Driven and Self-Serve Reporting culture. You will work as part of the team that transforms data into information, which serves as the foundation for analytics and insights. You will utilize your strong technical competencies to develop, establish and maintain datasets that feed our Tableau dashboards and other analytics. This position will report to the Manager of Sales Business Intelligence within the global Sales Strategy & Analytics organization This role will also be supporting our customer success and growth analytics (CSG Analytics) team.
What you will do:
Design, build and launch extremely efficient and reliable data pipelines to move data across a number of platforms including Google BigQuery and real-time systems such as Tableau.
Work with both the Sales Business Intelligence and CSG Analytics teams to develop, establish and maintain datasets to help drive dynamic tools and reporting.
Partner with analytics teams and business partners to produce internal data products (Certified Datasets)
Communicate changes and updates of owned data sources to key stakeholders
Building Data Pipelines - Create new pipelines or rewrite existing pipelines using SQL, Python on Airflow & DBT
Data Modeling - Partner with analytic consumers to improve existing datasets and build new ones
What you will bring:
1 to 3 years of experience in a Data Engineering role, with a focus on data warehouse technologies, data pipelines, and BI tooling.
Bachelor or advanced degree in Computer Science, Mathematics, Statistics, Engineering, or related technical discipline.
Previous experience working with sales data and analytics.
Expert knowledge of SQL and of relational & cloud database systems and concepts.
Experience with BigQuery preferred; experience with any other relational data warehouse
Some knowledge of data architectures, data modeling, and data infrastructure ecosystem.
Experience with Enterprise Go-to-Market (GTM) business systems such as Salesforce, Marketo, Zendesk, Clari, Anaplan, etc.
Experience with project management tools such as Jira, Trello, and Confluence
Experience with ETL pipeline tools like Airflow, and DBT, and with code version control systems like Git.
The ability to communicate cross-functionally, derive requirements, and architect shared datasets.
The ability to thrive in a dynamic environment. That means being flexible and willing to jump in and do whatever it takes to be successful.
What gives you an edge:
Experience with Apache Kafka
Tableau
Knowledge of batch and streaming data architectures
Product mindset to understand business needs, and come up with scalable data engineering solutions
At Confluent, we are committed to providing competitive pay and benefits that are in line with industry standards. We analyze and carefully consider several factors when determining compensation, including your work history, education, and professional experience. This position has an annual estimated salary of $110,000 - , an annual bonus, and a competitive equity package. The actual pay may vary depending on your skills, qualifications, and experience.

In addition, Confluent offers a wide range of employee benefits. To learn more about our benefits click here.
#LI-Remote
#LI-DO2
Come As You Are
At Confluent, equality is a core tenet of our culture. We are committed to building an inclusive global team that represents a variety of backgrounds, perspectives, beliefs, and experiences. The more diverse we are, the richer our community and the broader our impact. Employment decisions are made on the basis of job-related criteria without regard to race, color, religion, sex, sexual orientation, gender identity, national origin, disability, veteran status, or any other classification protected by applicable law.
Confluent requires all employees (in office and remote) in the U.S. to be vaccinated for COVID-19. Consistent with federal, state, and local requirements, Confluent will consider requests for reasonable accommodation based on medical conditions/contraindications or sincerely-held religious beliefs where it is able to do so without undue hardship to the company.
Click here to review our California Candidate Privacy Notice, which describes how and when Confluent, Inc., and its group companies, collects, uses, and shares certain personal information of California job applicants and prospective employees.
#LI-Remote",Tecnologías de la información,,2022-09-08T00:00:00,2022-10-16,FULL_TIME
Junior Data Scientist/Database Engineer - Technology,Arena Investors LP,Florida,Jacksonville,-1,-1,,USD,"Please Note: This job is advertised for our office in Jacksonville Fl, but open to remote in the Southeast Region. (Florida, Georgia, North/South Carolina, Virginia, Alabama, Texas)
Arena Investors, LP (""Arena"") is a global investment management firm that seeks to generate attractive risk adjusted, consistent and uncorrelated returns by employing a fundamentals based, asset-oriented financing and investing strategy across the entire credit spectrum in areas where conventional sources of capital are scarce. Arena specializes in off-the-run, stressed, distressed, illiquid and esoteric special situation transactions through originations and acquisitions of asset-oriented investments across a wide array of asset types (including but not limited to private direct corporate credit, commercial real estate bridge lending, and commercial and consumer assets).
Quaestor Advisors, LLC (“Quaestor”) is an affiliated Special Servicer, which provides mid and back office services, including asset management, to Arena Investors and external clients.
Quaestor is looking to expand the Technology team, through the addition of a junior-to-mid-level database developer/data scientist who has a passion for coding, troubleshooting data and solving problems. The right candidate would be a key contributor to a proprietary financial data warehouse that is crucial to running its business. Responsivities would include analyzing data, troubleshooting logic problems, monitoring data health and developing data transformations/stored procedures while learning to interface with business-side sponsors from asset management, accounting, and operations. Ideal candidates will be organized, analytical, self-motivated, resourceful and able to work/communicate effectively with all internal functional groups.
This is a great opportunity to be a part of a large-scale fintech platform while honing one’s technical skills and learning the private credit business.
Responsibilities
Analyze/Troubleshoot financial data of Arena’s Data warehouse.
Assist with projects/tasks related to data analysis, data visualization, and reporting for our Operations, Finance & Asset Management departments.
Develop stored procedures and data transformations.
Develop PowerBI visualizations.
Requirements
Bachelor’s degree in computer science from a top university.
3-5 years experience in technology – tech pure play, startup, fintech, etc.
Internships/Co-ops experience is a plus.
Strong Relational Database knowledge (MS SQL Server, etc).
Fluency in SQL, T-SQL, Stored Procedures.
Familiarity with PowerBI (or Tableau) for data visualizations.
Familiarity with SSRS for reporting.
Experience with accounting, fund-accounting, trading operations-related data a plus.
Familiarity with web development (HTML5, Javascript, jQuery, CSS, REST, etc) a plus.
Familiarity with OOP and at least one language (C#, Java, etc) a plus.
Comfortable with Agile/Scrum SDLC.
A positive attitude, strong work ethic and a desire to work collaboratively across the organization.
Strong attention to detail.
COVID Vaccinated
Benefits
Health Care Plan (Medical, Dental & Vision)
Retirement Plan (401k, IRA)
Life Insurance (Basic, Voluntary & AD&D)
Paid Time Off (Vacation, Sick & Public Holidays)
Family Leave (Maternity, Paternity)
Short Term & Long Term Disability
Training & Development
Work From Home
Free Food & Snacks
Wellness Resources",Finanzas,,2022-08-19T00:00:00,2022-10-16,FULL_TIME
Data Engineer - USA (Remote),Knoema,,,-1,-1,,USD,"What we do:
Knoema is the most comprehensive source of global decision-making data in the world. Our tools allow individuals and organizations to discover, visualize, model, and present their data and the world’s data to facilitate better decisions and better outcomes. They are used by more than half a million people worldwide every month.

What you'll be doing:
Build and maintain our data architecture to support reporting, analysis, dimensional modeling, and data development
Develop data management features such as master data, reference data, data quality, data catalog, and data publishing
Providing self-service data capabilities to help everyone leverage data and analytics
Helping to define and champion data quality practices and programs for Knoema data systems
Build and maintain data pipelines from internal and external databases
Create and maintain architecture and systems documentation
Write maintainable, performant code
Implement the DataOps philosophy in everything you do
Plan and execute system expansion as needed
Collaborate with Data Analysts to drive efficiencies for their work
Collaborate with other functions to ensure data needs are addressed



Technical Must Haves (Intermediate Level):
2+ years hands-on experience deploying production quality code
Professional experience using Python, Java, or Scala for data processing (Python preferred)
Knowledge of and experience with data-related Python packages
Deep understanding of relational databases, SQL, analytical data warehouses (Snowflake preferred), and query optimization techniques
Demonstrated ability to both diagnose and prevent performance problems
Hands-on experience implementing ETL (or ELT) best practices at scale.
Hands-on experience with data pipeline tools (dbt, AirByte, Airflow, Luigi)
Strong data modeling skills and familiarity with the Kimball methodology.
Constantly improve product quality, security, and performance
Desire to continually keep up with advancements in data engineering practices
Catch bugs and style issues in code reviews
Ship small features independently
Great applicants have:

The thirst to keep current on new industry trends, IT ops, and best practices, and can help guide us on what we should implement and why
A “no task is too small” attitude
Appreciation for the need to communicate the value of technical work to non-technical audiences: explaining ""why”, not just “what”
A recognition of the value of data to evaluate production environments with metrics, monitoring, and dashboards
Knoema Non-Negotiables:

Willing to work on a team that believes:
Everything starts with the customer
Deliver first, optimize soon
Small experiments >>> large releases
Debates are a sign of passion, and are never personal
Ownership is key
Viewing diversity as a core strength, not just a nice feature
Embracing a growth mindset to tackle new, interdisciplinary challenge

We have multiple Data Engineer roles open, of varying experience levels:
Junior:

At Knoema this is the entry level of roles in Engineering as their first job in the tech industry, new graduate, or returning to the workforce.

Intermediate:

Intermediate Data Engineers are expected to meet the requirements and execute the responsibilities above with minimal assistance.
Senior:

Understand and implement data engineering best practices
Improve, manage, and teach standards for code maintainability and performance in code submitted and reviewed
Create smaller merge requests and issues by collaborating with stakeholders to reduce scope and focus on iteration
Ship medium to large features independently
Generate architecture recommendations and the ability to implement them
Great communication: Regularly achieve consensus amongst teams
Perform technical interviews

Staff:

Ship large features and foundational improvements with minimal guidance and support from other team members
Support other data team members with the shipping of new features by setting direction and providing guidance
Solve technical problems of the highest scope and complexity
Exert significant influence on the long-range goals
Define and extend our internal standards for style, maintenance, and best practices for a high-scale data platform
Represent Knoema and its values in public communication around broad initiatives, specific projects, and community contributions
Interact with customers and other external stakeholders as a consultant and spokesperson for the work of your team
Provide mentorship for all on your team to help them grow in their technical responsibilities
Propose ideas to improve the scale, performance, and capabilities of our Data Architecture",Tecnologías de la información,,2022-08-24T00:00:00,2022-10-16,FULL_TIME
