Job_title,Company,State,City,Min_Salary,Max_Salary,unitText,SalaryCurrency,Job_Desc,Industry,Rating,Date_Posted,Valid_until,Job_Type
Junior Data Engineer,N9 IT SOLUTIONS,,,-1,-1,,USD,"Job Title: - Jr. Data EngineerLocation: - 100% RemotePosition: - W2 Employment ( Should work on our W2 )Eligibility: - (Authorized to work anywhere in the USA and for only those who are staying in the USA)Duration: - Long-term contractJob Description: -Bachelor's Degree or Master’s Degree in Computer Science, Mathematics, Statistics.3+years of experience as a DataStage Developer.3+ years of Complex SQL/PL SQL development experience.1+ years of experience in Writing scripts using Unix or Python.Experience working in Agile Framework.2+ years of experience in Migration from the Data Stage to other technologies.Working experience on AWS.Benefits: -Competitive salaryFlexible work schedule & part-time offE-verifiedH1B and GC fillingOn-job technical supportSkill EnhancementGuesthouse facilities are also availableOpportunity to work with Fortune 500 CompaniesThanks, regardsN9 IT SolutionsJob Type: Full-timePay: $40.00 - $50.00 per hourSchedule:8 hour shiftWork Location: Remote",Tecnologías de la información,,2022-08-29T00:00:00,2022-10-16,FULL_TIME
Junior Data Center Engineer,IMC Financial Markets,New York State,New York,-1,-1,,USD,"LIFE AT IMC AS A JUNIOR DATA CENTER ENGINEER
WHO WE ARE AND WHAT WE DO
IMC is a leading global market maker, using algorithmic trading and advanced technology to buy and sell securities on multiple trading venues worldwide. We provide liquidity to the financial markets, driving efficiencies for buyers and sellers.
Founded in 1989, we are an ambitious, innovative company and identified early on the importance technology would play in the fast-paced evolution of trading. This entrepreneurial spirit still drives us today and can be found in all of our offices around the world.
OUR TEAM
We now operate globally from offices in Europe, the US and Asia Pacific. Our employees work closely together in multidisciplinary teams, making our success possible.
Technology - At IMC, technology is not a department, it is at the heart of everything we do. Our technologists push the limits of possibility, and then look beyond. In our fast-paced environment, short feedback loops mean projects worked on in the morning can enter production the next day.
Trading – Although our traders come from many backgrounds they all have one thing in common: they are at their best solving complex problems. Their insight into global events, market shifts and pricing ensure we are trading in the right place, at the right time.
Business Support - Around the world, IMC’s business support teams are essential for sustaining our success. In our dynamic environment, we have many exciting challenges and multidisciplinary opportunities to shape our operations and make a real impact.
OUR CULTURE
Our employees are our greatest asset so we give them lots of responsibility and the support they need to make a difference. Our flat structure fosters a culture of openness and collaboration, encouraging the sharing of ideas and knowledge. It makes no difference if you have been with us for three days or three years, the best idea wins.
While we work hard, we also have a lot of fun; whether solving complex challenges or in team building, leisure and sporting activities. IMC also enables its employees to contribute towards a better society through our foundation.
We are looking for an entry level to experienced individual to join our team as a Junior Data Center Engineer who will play a critical role in system and application administration of our technical environment. This role will be part of highly experienced team and be provided new challenges on a daily basis. The possibility to make a large impact as part of a dedicated, dynamic team at IMC, both locally and globally, is unlike any other. Our flat culture encourages not only knowledge and best practice sharing, but also the opportunity to have your voice heard.
Key Accountabilities:
Using a ticket system to track work.
Coordinate, Install, and Troubleshoot equipment.
Racking, Cabling, and Provision equipment.
Responsible for the organization, documentation, and inventory in IMC’s Data Centers.
Responsible for the Logistics in shipping/receiving.
Proactively suggesting alternatives for improvements in the IMC Data Center processes, configuration, or procedures.
General understanding of a Data Center Environment and proper usage of Data Center best practices.
Project Management of Data Center related tasks.
Requirements:
1-3 years working in a Data Center is preferred but not requried
Experience with installation, testing, and cleaning of Fiber Optic cabling
Strong documentation skills for creating Standard Operating Procedures in the Data Center.
A Valid Driver’s License
Travel to suburbs of Chicago and New Jersey area.
Communication skills between team members and external vendors.
Lift objects 60+ pounds
Experience with Data Center Facilities Management tools for Power and Cooling.
Basic Bash and Python knowledge is preferred.
Success Factors:
Highly motivated and organized self-starter that enjoys technology.
Able to work flexible hours when required including evening and weekends
High analytical and interpersonal skills
Knowledge of Network and Server Operating Systems.
Dependable and able to work independently.
Ability to manage competing job responsibilities.
OUR HIRING PROCESS
To set you up for success, you can find our hiring process including tips on applying and interviewing with us on our website. Now it’s up to you! Apply today to start an amazing journey with IMC.",Finanzas,,2022-09-08T00:00:00,2022-10-16,FULL_TIME
Cyber Security Fusion Center / Data Derived Intelligence - Junior Data Engineer- AVP,Citi,Florida,Tampa,-1,-1,,USD,"About Citi:
Citi, the leading global bank, has approximately 200 million customer accounts and does business in more than 160 countries and jurisdictions. Citi provides consumers, corporations, governments, and institutions with a broad range of financial products and services, including consumer banking and credit, corporate and investment banking, securities brokerage, transaction services, and wealth management.
As a bank with a brain and a soul, Citi creates economic value that is systemically responsible and in our clients’ best interests. As a financial institution that touches every region of the world and every sector that shapes your daily life, our Enterprise Operations & Technology teams are charged with a mission that rivals any large tech company. Our technology solutions are the foundations of everything we do from keeping the bank safe, managing global resources, and providing the technical tools our workers need to be successful to designing our digital architecture and ensuring our platforms provide a first-class customer experience. We reimagine client and partner experiences to deliver excellence through secure, reliable, and efficient services.
Our commitment to diversity includes a workforce that represents the clients we serve from all walks of life, backgrounds, and origins. We foster an environment where the best people want to work. We value and demand respect for others, promote individuals based on merit, and ensure opportunities for personal development are widely available to all. Ideal candidates are innovators with well-rounded backgrounds who bring their authentic selves to work and complement our culture of delivering results with pride. If you are a problem solver who seeks passion in your work, come join us. We’ll enable growth and progress together.
As a bank with a brain and a soul, Citi creates economic value that is systemically responsible and, in our clients’, best interests. As a financial institution that touches every region of the world and every sector that shapes your daily life, our Enterprise Operations & Technology teams are charged with a mission that rivals any large tech company. Our technology solutions are the foundations of everything we do. We keep the bank safe and provide the technical tools our workers need to be successful. We design our digital architecture and ensure our platforms provide a first-class customer experience. Our operations teams manage risk, resources, and program management. We focus on enterprise resiliency and business continuity. We develop, coordinate, and execute strategic operational plans. Essentially, Enterprise Operations & Technology re-engineers’ client and partner processes to deliver excellence through secure, reliable, and controlled services.
Trust is part of our DNA at Citi. As such, we take safeguarding our customer data very seriously. The Chief Information Security Office (CISO) is made up of deeply dedicated and talented colleagues who work together to ensure the safety of Citi’s and our clients’ assets and information. We manage information security as an end-to-end program – one with a clear mandate and accountability. Our mission is to continually execute and enhance a global security program that is fully anchored to modern control and security frameworks, fully aligned with the technology of the firm, threat-focused and data-driven, and deeply integrated across all Citi businesses globally.
Being talent-driven, we are focused on attracting, developing, and retaining diverse and inclusive talent with a high technical skill level. As a member of our team, we will provide you with career development opportunities at all stages of your career. Our employees model a passion for protecting Citi and our clients and believe in treating others with dignity and respect.
A strong enterprise Cyber Security Operations (CSO) organization is necessary to enable Citi businesses to operate safely. This organization is responsible for all cyber security operations, including assessment, monitoring and detection, intelligence, and incident response and recovery.
Our commitment to diversity includes a workforce that represents the clients we serve globally from all walks of life, backgrounds, and origins. We foster an environment where the best people want to work. We value and demand respect for others, promote individuals based on merit, and ensure opportunities for personal development are widely available to all. Ideal candidates are innovators with well-rounded backgrounds who bring their authentic selves to work and complement our culture of delivering results with pride. If you are a problem solver who seeks passion in your work, come join us. We’ll enable growth and progress together.
In support of the Cyber Security Fusion Center (CSFC) mission, the Data Derived Intelligence team is responsible for researching, developing, and deploying cybersecurity related big data solutions. As such, staff members develop data science solutions to support the analysis of cyber security data that is gathered from a variety of heterogeneous sources.
In order to achieve the above results, this position will be responsible for supporting the CSFC data lake (big data) operations. Including but not limited to implementing and managing data pipelines, analyzing data, providing statistical and visual interpretations to support stakeholders in making data driven decisions.
Responsibilities and Skills:
Experience working with Hadoop, Splunk or Cloud (AWS) ecosystems
Experience supporting and troubleshooting data engineering/ETL processes in production environments
Knowledge of data engineering concepts and experience with associated tool sets to support data wrangling from across a wide array of disparate data sources
Experience processing large amount of structured and unstructured data
Strong understanding of data management controls
Proficiency designing and developing data pipelines across multiple ecosystems
Work as individual contributor and collaboratively as part of a team of teams
The ability to effectively use data to visualize and communicate findings to senior leadership
Programming expertise, ideally in Python, Spark, Java, and Shell/Bash scripting but not limited to them
Proficiency in any variant of SQL
An inquisitive nature and a sense of satisfaction from solving complicated problems
Familiarity with Machine Learning models and statistical data mining techniques
Knowledge of the Hadoop ecosystem and Big Data technologies (HDFS, MapReduce, Hive, Pig, Impala, Spark, Kafka, Oozie, Sqoop)
Experience working in Linux environments (bash, zsh, writing cron jobs, use of systemctl for maintenance, setting of environment variables, etc.).
Data analysis skills, including but not limited to use of Excel, MS Access and business intelligence tools (Tableau, Microsoft PowerBI, Microstrategy) to analyze static data sets
Supports data architecture and modeling design by analyzing client operations, applications, and programming
Academic or working experience in the Cyber domain
Qualifications:
1-3 years of relevant experience
Certifications or willingness to earn within 12 months of joining
Consistently demonstrates clear and concise written and verbal communication
Proven influencing and relationship management skills
Proven analytical skills
Education:
Bachelor’s degree/University degree or equivalent experience
This job description provides a high-level review of the types of work performed. Other job-related duties may be assigned as required.
Excellent organizational, interpersonal, and project management skills
Excellent communication skills both written and oral.
Strong customer and quality-focus is a must.
Self-starter and ability to work in a team environment
Persistence and tenacity in chasing down elusive issues across multiple layers of a complex ecosystem
-
Job Family Group:
Technology
-
Job Family:
Information Security
-
Time Type:
Full time
-
Citi is an equal opportunity and affirmative action employer.
Qualified applicants will receive consideration without regard to their race, color, religion, sex, sexual orientation, gender identity, national origin, disability, or status as a protected veteran.
Citigroup Inc. and its subsidiaries (""Citi”) invite all qualified interested applicants to apply for career opportunities. If you are a person with a disability and need a reasonable accommodation to use our search tools and/or apply for a career opportunity review Accessibility at Citi.
View the ""EEO is the Law"" poster. View the EEO is the Law Supplement.
View the EEO Policy Statement.
View the Pay Transparency Posting
-
Effective November 1, 2021, Citi requires that all successful applicants for positions located in the United States or Puerto Rico be fully vaccinated against COVID-19 as a condition of employment and provide proof of such vaccination prior to commencement of employment.",Finanzas,,2022-08-30T00:00:00,2022-10-16,FULL_TIME
Jr. Data Engineer (REMOTE),IntelliBridge LLC,District of Columbia,Washington,-1,-1,,USD,"Title: Jr. Data Engineer
Clearance: Public Trust clearance will be applied for upon acceptance
Location: Remote
Overview:
IntelliBridge is an award-winning national security company looking for a Jr. Data Engineer to support our contract with the U. S. Customs and Immigration Service (USCIS) on the Records DevSecOps program.
As a Jr. Data Engineer at IntelliBridge, you will be part of an integrated project team delivering scalable and secure systems. You will perform the full suite of DevSecOps tasks in AWS cloud environment to support the continuous development, deployment, integration, and monitoring of the server and client-side solutions. As a member of a project delivery team, you will collaborate with project and product managers, user experience designers, and business analysts.
As a direct employee of IntelliBridge, you would receive a benefit package that includes health/dental/vision insurance coverage, 401K with company match, PTO & paid holidays, and annual tuition/training assistance. For more information, please visit our website.
Clearance:
Public Trust clearance requires a background investigation (BI) and entry on duty (EOD) status. This must be applied for upon acceptance of employment offer. Candidates with existing or recently completed Public Trust background investigations are preferred.
Responsibilities/Duties:
Expected to possess proficiency in manipulating financial data for analytical assessments; be proficient with Microsoft tools, specifically Excel; possess experience with programing languages such as Python, java script, and SQL.
 Required Skills and Qualifications:
Bachelor’s degree is preferred.
Minimum of 2 years of analytical experience, or 3 years of experience with a bachelor’s degree.
Minimum of 2 years SQL programming.
Exceptional communication skills with emphasis on effectively communicating detailed analysis and recommendations.
Strong analytical and problem-solving skills.
Experience working in collaborative sessions, while demonstrating strong verbal communication and presentation skills.
Experience producing varied written documentation products.
Ability to recognize problems and opportunities and evaluate strengths and weaknesses of potential solutions to problems.
Shall also have three (3) years of experience in troubleshooting software which may overlap with the experience requirements above.
Shall have experience working in AWS, software containerization and Agile development processes.
Experience and proficiency with Microsoft Office Suite – Excel, Access, Word, and PowerPoint.
About Us:
IntelliBridge delivers IT strategy, cloud, cybersecurity, application, data and analytics, enterprise IT, intelligence analysis, and mission operation support services to accelerate technical performance and efficiency for Defense, Civilian, and National Security & Federal Law Enforcement clients.",Gobierno y administración pública,,2022-08-31T00:00:00,2022-10-16,FULL_TIME
Junior Data Engineer,Calpine Corporation,Texas,Houston,-1,-1,,USD,"Calpine Corporation is America's largest generator of electricity from natural gas and geothermal resources with operations in competitive power markets. Its fleet of 76 power plants in operation and one under construction represents nearly 26,000 megawatts of generation capacity. Through wholesale power operations and its retail businesses, Calpine serves customers in 22 states, Canada and Mexico. Its clean, efficient, modern and flexible fleet uses advanced technologies to generate power in a low-carbon and environmentally responsible manner.
The company was established on the premise that a strong commitment to the environment is inextricably linked to excellence in power generation and corporate responsibility. Since its founding in 1984, Calpine has led the power industry in its unwavering commitment to environmental stewardship. In addition, its renewable geothermal plants use steam generated deep below the earth's surface to produce clean, renewable electricity.
Job Summary (includes but is not limited to the following, other duties may be assigned)
At Calpine IT, we are strategic problem solvers. Our mission is to create world-class technology solutions to support Calpine business, lead in the innovative use of data and emerging technologies to redefine the customer experience, and help ""Calpine's business growth"". To continue building our hard-working IT Team, we are seeking candidates who champion innovation, operate effectively in an agile environment, challenge the status quo, and are empowered to take risks. The Calpine Technology Associates Program is a talent development program sought at recruiting small cohorts of highly skilled early-career professionals.
This Junior Data Engineer is crafted to:
Develop associates in the program to well-rounded technologists.
Infuse our technology teams with fresh, innovative thinking.
Increase collaboration and partnerships across the tech organization.
Involve in suggesting/delivering solutions to solve critical business problems
Job Responsibilities
The Junior Data Engineer will be responsible for creating reports to be consumed by end users using the SSRS and Power BI Platform.
Documentation of all SQL Server objects referenced in code.
Creation of SQL Objects in development environment to allow the job to complete successfully
Apply predefined database security roles to enable jobs to run successfully.
Collaborates with program managers, team members and developers on specific project business objectives to determine database or reporting requirements.
Designs and builds reports and stored procedures in adherence with organizational architectural standards.
Job Requirements
Bachelor’s degree in Computer Science, Information Systems, or related field preferred
0 - 3 years’ experience in a SQL development or Data Analyst Writer role; or a combination of directly related education and experience required.
Proficiency in Microsoft Office Suite, Windows, Microsoft SQL Tools, and SQL Server.
Excellent customer service, problem solving, and communication skills with the ability to effectively identify and translate business user needs, and to convey technical information in a clear and concise manner.
Strong organizational skills with the ability to manage timelines and prioritize workload in a high-pressure, results-oriented environment.
Self-starter with the ability to work independently while supporting a team environment.
Data analysis and mapping skills with strong attention to detail and concern for data accuracy.
Intermediate knowledge of SQL commonly used concepts, practices and procedures related to relational databases.
Additional Calpine Information
Vaccination Information: Calpine requires an individual who is newly hired into this position to be vaccinated for COVID-19 within the first 28 days of employment - if not already vaccinated prior to starting employment. If you have any concerns regarding compliance with this requirement, you will need to discuss your concerns with Calpine’s HR department after a decision has been made about whether or not to make you a conditional offer of employment. Calpine does not require applicants to discuss vaccination status prior to receipt of a conditional offer of employment and complies with all applicable laws requiring reasonable accommodation.
Equal Opportunity Employer of Minorities, Females, Protected Veterans, and Individuals with Disabilities.
Calpine is committed to Equal Employment Opportunity and providing reasonable accommodations to applicants with physical and/or mental disabilities. If you are interested in applying for employment and need special assistance or an accommodation to use our website or to apply for a position, please send an e-mail with your request to hrrecruitment@calpine.com. Determination on requests for reasonable accommodation are made on case-by-case basis.
Please view Equal Employment Opportunity Posters provided by OFCCP here
Equal Opportunity Employer/Protected Veterans/Individuals with Disabilities
The contractor will not discharge or in any other manner discriminate against employees or applicants because they have inquired about, discussed, or disclosed their own pay or the pay of another employee or applicant. However, employees who have access to the compensation information of other employees or applicants as a part of their essential job functions cannot disclose the pay of other employees or applicants to individuals who do not otherwise have access to compensation information, unless the disclosure is (a) in response to a formal complaint or charge, (b) in furtherance of an investigation, proceeding, hearing, or action, including an investigation conducted by the employer, or (c) consistent with the contractor’s legal duty to furnish information. 41 CFR 60-1.35(c)","Energía, minería e infraestructura pública",,2022-08-18T00:00:00,2022-10-16,FULL_TIME
Jr. Data Engineer,MediaAgility,New Jersey,Princeton,-1,-1,,USD,"Jr. Data Engineer
Experience Level

Location
Princeton, NJ, United States Of America Onsite
Skills
python SQL
Qualifications
Bachelors/ Masters degree or equivalent work experience

Job Role
About MediaAgility
MediaAgility is a premier global digital consultancy on a mission to engineer solutions to help innovators succeed. The company is headquartered in Princeton, NJ with a presence in 5 countries. We are committed to -
a. Delivering exceptional services to our clients
b. Building a people-first company
c. Being global, diverse, and inclusive in all our operations
As a premier Google Cloud partner, we take our clients from idea to impact with ‘Strategic Thought Partnership’ and ‘Intelligence Solutions’. We offer a full spectrum of services from Digital Advisory (consulting), Digital Transformation (implementation), and Digital Operations (continuous improvement). We do this through a unique Braintrust engagement model, Agile development, and deep expertise on the latest technologies.
Job Description
Design and Develop end to end streaming and batch data analytics pipelines. From data ingestion, processing, storage, analysis, machine
Understand big-data principles and best practices. Deliver projects in data analytics, machine learning and AI.
Perform code reviews, ensure code quality and encourage a culture of excellence.
Be a front face of the company in front of customers and prospects.
Required Skills
Good SQL Experience
Good in Python OR Java programming.
Should understand Data Analytics and Machine Learning systems.
Experience in Agile Methodologies
Excellent communication skills
Desired Certification:
Google Cloud Certified Professional Data Engineer",Tecnologías de la información,,2022-08-31T00:00:00,2022-10-16,OTHER
