Job_title,Company,State,City,Min_Salary,Max_Salary,unitText,SalaryCurrency,Job_Desc,Industry,Rating,Date_Posted,Valid_until,Job_Type
Junior Data Engineer,New York Public Radio,New York State,New York,-1,-1,,USD,"Junior Data EngineerThe Data team is seeking a Junior Data Engineer to work on various tasks and projects. The members of Data the team uses rigorous analytics to generate insights that inform content, product, marketing, and business decisions across New York Public Radio. In the meantime, we build systems, infrastructure, data products for collecting, storing, and visualizing data to foster data democracy at New York Public Radio. We work in Python, SQL and we work with technologies like AWS Glue, Lambda, S3 and PySpark.The main functions of this role include:1. ETLDesign and build ETL pipelines by using AWS Glue to collect data from different sources to data warehousesBuild pipeline integration with our various data products for long-running processes. This will include CRM data ( Salesforce ), payments processors ( Stripe & Springboard ), email ( Salesforce Marketing Cloud), our own digital platforms ( apps and websites Google Analytics data ) and audio CMS data, which comes in log form.Identify the room for optimizing relational data storage through design, query optimization, indices, replicas, partitioning, etc.2. Automation: *Build scripts or recurring processes to fully/partially automate labor-intensive workflows of other departments (e.g. Content, Marketing, Fundraising, the Newsroom) as well as for running models and analysis on behalf of the Data team.Requirements & Qualifications1-2 years hands-on experience in ETL design, implementation and maintenanceExperience in schema design and data modeling and in writing complex SQL queries to extract data from relational databases (e.g. MySQL, Redshift)Experience in the following tools/technology is desired: Python, PySpark, AWS Glue, Lambda, S3, Redshift and Google Cloud PlatformComfortable with extensive Python coding. pySpark is a plus.Willing to learn any language/tools/frameworks necessaryExcellent skills in communicating technical knowledge to a broad non-technical audienceExcellent organizational skills with the ability to manage several projects concurrently and communicate effectively across multiple divisions and with diverse groups of stakeholdersAdditional InformationThis is a full-time role with a salary range of $80-$85K per year (plus a full benefits package). Salary offer within this range is determined by skills, experience and organizational pay equity. New York Public Radio offers excellent medical, dental, and vision insurance, vacation, personal and sick time as well as parental leave.This role is currently operating in a primarily remote capacity but the selected candidate will have the option to work from the office if fully vaccinated against COVID-19, unless NYPR has approved a specific religious or medical exemption in advance of the first day of work. At this time, NYPR defines being fully vaccinated as having received two Moderna or Pfizer COVID-19 vaccinations or one Johnson and Johnson vaccination.This role, if desired by the selected candidate, could remain remote.Commitment to Diversity, Equity & InclusionNew York Public Radio is committed to diversity, equity, and inclusion. We continuously strive to place our employees at the center of our thinking and elevate inclusive practices to develop and support a more engaged and productive workforce. Our journalism and operations in the service of that journalism benefit from a broad range of perspectives, from all backgrounds, at all levels of the organization. Diversity is essential to honest, authentic, accurate storytelling and reportage; creating an institution in which all voices are encouraged, valued, and heard.Equal OpportunityNew York Public Radio is an equal opportunity employer committed to achieving the goal of equal employment opportunity for all. Applicants and employees are considered and evaluated for positions without regard to mental or physical disability, race, creed, color, religion, gender, national origin, citizenship status, age, genetic information, military or veteran status, sexual orientation, marital status, employment status or any protected federal, state or local status unrelated to the performance of the work involved.#LI-remoteJob Type: Full-timePay: $80,000.00 - $85,000.00 per year",Audiovisual y medios de comunicación,,2022-09-15T00:00:00,2022-10-16,FULL_TIME
Junior Engineer- Data Entry,Zodiac Solutions,Tennessee,Collierville,-1,-1,,USD,"Job Title: Junior Engineer- Data EntryJob Location: Collierville, Tennessee (Second Shift )Duration: Fulltime Job Description: Perform data entry activities using MS office(Word, excel must)Diploma/ Bachelors of Science in Mechanical/industrial engineeringJob Type: Full-timeSchedule:8 hour shiftMonday to FridayAbility to commute/relocate:Collierville, TN: Reliably commute or willing to relocate with an employer-provided relocation package (Required)Experience:Microsoft Excel: 1 year (Preferred)Work Location: One location",Tecnologías de la información,,2022-08-26T00:00:00,2022-10-16,FULL_TIME
Junior Data Engineer - HYBRID,Kearny Bank,New Jersey,Fairfield,-1,-1,,USD,"Overview: You will be hands on assisting in the creation of data assets, pipelines, reports, and queries that will empower Business Users to perform their functions at scale. Data and information have become an invaluable asset for Banks that focus on innovation and a great user experience. Kearny Bank takes this concept to heart and the Data Analytics team is at the center of this initiativeResponsibilities:Assist in the development of data assets, reports, queries, and models that enable Bankers and other stakeholders across the organizationContribute to documentation around critical production data processesAssist in managing Kearny Bank’s reporting systems and data request management systemsRecognize and adopt best practices in developing data reports and analytical insights including data integrity, testing, analysis, validation, and documentation.Assist in design, development, and maintenance of scalable and automated next generation data solutionsQualifications:Working knowledge of database systems, Excel, and Business Intelligence toolsUnderstanding of Data Modeling concepts and toolsExperience in collaborating with individuals and organizationsCRM experience preferredExperience with Microsoft Azure preferredExperience with Microsoft 365 preferredGeneral Banking and Financial experience preferredJob Type: Full-time",Finanzas,,2022-09-06T00:00:00,2022-10-16,FULL_TIME
Junior/Mid-level Software Engineer - Data Engineering,The Trade Desk,California,Irvine,-1,-1,,USD,"The Trade Desk is a global technology company with a mission to create a better, more open internet for everyone through principled, intelligent advertising. Handling over 600 billion queries per day (more than 100 times the query volume of search globally), our platform operates at an unprecedented scale. We have also built something even stronger and more valuable: an award-winning culture based on trust, ownership, empathy, and collaboration. We value the unique experiences and perspectives that each person brings to The Trade Desk, and we are committed to fostering inclusive spaces where everyone can bring their authentic selves to work every day.
Do you have a passion for solving hard problems at scale? Are you eager to join a dynamic, globally-connected team where your contributions will make a meaningful difference in building a better media ecosystem? Come and see why Fortune magazine consistently ranks The Trade Desk among the best small-medium-sized workplaces globally.
About the Role:
Our Data Engineering Software Engineers are end-to-end owners. You will participate actively in all aspects of designing, building, and delivering data products for our clients.
You will work with petabyte-scale data challenges, large-scale distributed systems coordinating thousands of servers in cloud and physical data centers around the world, machine learning, and advanced visualizations – to name a few.
You will work with data processing pipelines, ML pipelines, data processing automation, data governance, data visualization, data quality, data privacy, data warehousing.
Our Software Engineers work with a variety of platforms and technologies, such as Docker, Kubernetes, Gitlab, Bamboo, AWS, Azure, Scala, Spark, SQL Server, and Vertica.
Who We Are Looking For:
You understand engineering and computer science fundamentals. At our scale, many off-the-shelf techniques and existing technologies (open source and enterprise) simply don't work. You are able to work from first principles to evaluate solutions and adapt them to a unique environment.
You are passionate about data engineering. You'll work at petabyte-scale with SQL, ETL, data modeling, and technologies similar to Spark, Scala, C#, Java, etc..
You are a creative thinker, not bound by ""the way things have always been done"". What you know is less important than how well you learn and innovate. We don't need engineers who know all the answers; we need engineers who can invent the answers no one has thought of yet, to the questions yet to be asked.
What We Care About:
What and how you can contribute is what’s important to us. Our consideration is not limited by the kind of education you have or the specific technologies you have experience with. Variety of technical challenge is one of the best things about working at The Trade Desk as an engineer, but we do not expect you to know every technology we use when you start. What we care about is that you can learn quickly and solve complex problems using the best tools for the job.
Our culture runs much deeper than just having fun together (though, we do that well too...) – the people we want on our team are trust-builders, generous givers, scrappy problem solvers, and gritty pursuers of excellence.
Does this sound like you? If so, we welcome your application and the chance to meet you.
#LI-RE1
Our Compensation and Benefits (for Colorado residents only)Base Compensation Range: $95,800 - $191,600
In accordance with Colorado law, the range provided is The Trade Desk’s reasonable estimate of the base compensation for this role. The actual amount may be higher or lower, based on non-discriminatory factors such as experience, knowledge, skills and abilities. The Trade Desk also offers a competitive benefits package. Click here to learn more.
The Trade Desk does not accept unsolicited resumes from search firm recruiters. Fees will not be paid in the event a candidate submitted by a recruiter without an agreement in place is hired; such resumes will be deemed the sole property of The Trade Desk. The Trade Desk is an equal opportunity employer. All aspects of employment will be based on merit, competence, performance, and business needs. We do not discriminate on the basis of race, color, religion, marital status, age, national origin, ancestry, physical or mental disability, medical condition, pregnancy, genetic information, gender, sexual orientation, gender identity or expression, veteran status, or any other status protected under federal, state, or local law.",Tecnologías de la información,,2022-08-26T00:00:00,2022-10-16,FULL_TIME
Jr. Data Analyst/Engineer,Gate3,Illinois,Elk Grove Village,-1,-1,,USD,"Summary: Leads small projects or supports larger initiatives as part of an Agile team and partners with users to understand business requirements. Develops data objects for business analytics using data modeling techniques. Ability to develop and maintains moderately complex automated ETL pipeline architecture using assigned tools and programming languages. Analyzes, develops, and maintains data warehouse and landing zone metadata, data catalog, and user documentation for internal business customers. Ideal candidate would have SQL, data warehousing knowledge, Meltano, and DBT experience.Essential Functions: Develops, tests, and maintains pipeline architecture and infrastructure: Develops and maintains moderately complex automated ETL pipeline architecture using assigned tools and programming languagesDevelops and maintains moderately complex automated ETL monitoring and alarming solutions using assigned languages and servicesImplements and supports reporting and analytics infrastructure for internal business customers using AWS servicesDevelops, tests, and deploys code using internal software development toolsets, including the code for deploying infrastructure and solutions for secure data storage, ETL pipelines, data catalogs and data queriesMaintains legacy data solutions to ensure functionality until replaced with new technologyData analysis: Leads small projects or supports larger initiatives as part of a teamPartners with users to understand business requirementsCollaborates with team on conceptualizing and developing new data solutions to meet the business requirementsResearches, performs analysis and proposes effective solutions related to systems development and enhancementsReviews potential adjustments or modifications for impacts on other programsCollaborates with business areas to develop solutions in the legacy systems to meet business requirementsData modeling: Develops data objects for business analytics using data modeling techniquesDevelops and optimizes data warehouse and landing zone tables using best practices for data definition language (DDL), physical and logical tables, data partitioning, compression and parallelizationEducation & Experience: Bachelor’s degree, preferably in a computer related field or equivalent relevant experienceTwo years of data integration development experience, or related experienceKnowledge, Skills & Abilities: Good SQL knowledge and experience working with relational databasesGood analytic skills to work with unstructured datasetsGood knowledge of applicable programming languages, such as PythonWorking knowledge of AWS cloud services such as S3, Glue, Athena, Cloudwatch and Lambda preferredKnowledge of Snowflake or Redshift preferredKnowledge of DBTpreferredStrong ability to build processes supporting data transformation, data structures, metadata, dependency and workload managementGood ability to manipulate, process and extract value from large disconnected datasetsStrong verbal and written communication skillsStrong attention to detail, organizational and multi-tasking skills required with the ability to adapt to changing prioritiesAbility to maintain confidentialityJob Types: Full-time, Part-time, ContractPay: $60,000.00 - $80,000.00 per yearBenefits:Dental insuranceEmployee assistance programFlexible scheduleHealth insuranceLife insurancePaid time offParental leaveProfessional development assistanceReferral programRetirement planTuition reimbursementVision insuranceSchedule:8 hour shiftCOVID-19 considerations:Our office building follows local guidelines in common areas and our company follows local and federal vaccine mandates.Ability to commute/relocate:Elk Grove Village, IL 60007: Reliably commute or planning to relocate before starting work (Required)Experience:Advanced SQL: 3 years (Required)Data warehouse: 1 year (Required)AWS or Azure: 1 year (Preferred)Python: 2 years (Required)Data visualization: 1 year (Required)R: 1 year (Preferred)Work Location: One location",,,2022-08-31T00:00:00,2022-10-16,FULL_TIME
"Data Engineer Trainee, Junior",Booz Allen Hamilton,Virginia,Norfolk,-1,-1,,USD,"The Challenge:
Are you excited at the prospect of unlocking the secrets held by a data set? Are you fascinated by the possibilities presented by cloud engineering and loosely coupled architectures? In an increasingly connected world, massive amounts of structured and unstructured data open new opportunities. As an aspiring cloud data scientist, you know you can help turn these complex data sets into useful information to solve global challenges. Across private and public sectors — from fraud detection, to cancer research, to national intelligence — you see data scientists turning data into actions and you want to be part of the team.
We have an opportunity for you to develop your analytical skills and establish your career in data science. You’ll join a rigorous training program that combines skills assessments, a comprehensive curriculum, functional mentorship, a capstone analytic challenge, and support to place you on your first data science project. You’ll learn how to write scripts to integrate data, conduct exploratory data analysis to discover hidden trends, apply machine learning in AWS to train predictive models, and use the right combination of tools and frameworks to turn that set of disparate data points into objective answers that inform decisions. Equipped with the foundational data science skills to accelerate your career, you’ll join a team and apply those skills to support our clients’ critical national security missions. Embrace the challenge and join us in driving change through data science. This position is a hybrid role with a combination of working at a Booz Allen office or client site and working remotely.
Empower change with us.
You Have:Experience with querying or analyzing data to answer questions and solve problemsExperience with visualizing data to identify or communicate key insightsKnowledge of basic concepts in mathematics and statisticsKnowledge of Cloud environmentsAbility to obtain a security clearanceBachelor’s degree
Nice If You Have:Experience with systems engineering or systems administrationExperience with Amazon Web ServicesExperience with AzureExperience with Docker, Kubernetes, and AnsibleKnowledge of Python and GitHubAbility to learn a programming languageSecret clearanceBachelor’s degree in Data Science, Mathematics, Engineering, Physics, Statistics, or CS
Clearance:
Applicants selected will be subject to a security investigation and may need to meet eligibility requirements for access to classified information.
Build Your Career:
At Booz Allen, we know the power of analytics and we’re dedicated to helping you grow as a data analysis professional. When you join Booz Allen, you can expect:
access to online and onsite training in data analysis and presentation methodologies, and tools like Hortonworks, Docker, Tableau, and Splunk
a chance to change the world with the Data Science Bowl—the world’s premier data science for social good competition
participation in partnerships with data science leaders, like our partnership with NVIDIA to deliver Deep Learning Institute (DLI) training to the federal government
You’ll have access to a wealth of training resources through our Analytics University, an online learning portal specifically geared towards data science and analytics skills, where you can access more than 5000 functional and technical courses, certifications, and books. Build your technical skills through hands-on training on the latest tools and state-of-the-art tech from our in-house experts. Pursuing certifications? Take advantage of our tuition assistance, on-site boot camps, certification training, academic programs, vendor relationships, and a network of professionals who can give you helpful tips. We’ll help you develop the career you want, as you chart your own course for success.
We’re an equal employment opportunity/affirmative action employer that empowers our people to fearlessly drive change – no matter their race, color, ethnicity, religion, sex (including pregnancy, childbirth, lactation, or related medical conditions), national origin, ancestry, age, marital status, sexual orientation, gender identity and expression, disability, veteran status, military or uniformed service member status, genetic information, or any other status protected by applicable federal, state, local, or international law.",Administración y consultoría,,2022-09-02T00:00:00,2022-10-16,OTHER
Junior Data Engineer,Decision Point Healthcare,Massachusetts,Boston,-1,-1,,USD,"Boston, MA
Full-Time
We need your help.
We’re looking for a self-motivated and detail-oriented data engineer to join our DataOps team. This opportunity will enable you contribute to the operation, support, and enhancement of our mission critical data operations platform and the development of data pipelines. Our data operations platform supports high volume, high velocity data ingestion and curation to support our existing, and rapidly expanding, health plan client base.
What you’ll do:
As a data engineer, you will be responsible for the execution and management of inbound client and internal service-based data pipelines. This encompasses the development, management, and operation of our client data hubs, including data intake, data quality assessment/evaluation, data curation and enrichment processes. Our client data hubs consist of various health related data sources supporting Decision Point services including our AI/ML platform, analytics platform, and OPUS application suite. If this interests you, read on.
The position:
Develop and apply scalable data integration (ETL/ELT) processes (including ingestion, cleansing, curation, unification, etc.)
Support various components of the data pipelines, including ingestion, validation, cleansing and curation
Manage and ensure the success of ongoing data pipeline routines
Collaborate with our implementation team to assist with the identification and reconciliation of data anomalies
Create and maintain documentation on data pipelines
Engage with our software engineering team to ensure precise data points per application specifications
Provide periodic support to our customer success team
Skills & experience:
BS / MS in Computer Science, Engineering, or applicable experience
Expertise with SQL, database design and data manipulation methodologies
Expertise with ETL/ELT and the development of automated validation and data pipelines
Strong data profiling and analytic skills; Ability to discover and highlight unique patterns/trends within data to identify and solve complex problems
Keen understanding of EDW, master data management and other database design principles
Comfortable working with high volume data in a variety of formats
Experience with Pandas/Numpy in a production environment
Experience with CI/CD and version control tools: Git preferred
Experience working within hybrid cloud environment; AWS experience is a plus
Excellent verbal and written communication
Excellent listener and collaborator with senior leaders, peers, and staff
Familiarity with data engineering and workflow management frameworks such as Airflow and dbt
Familiarity with healthcare data is a plus
A little bit about Decision Point:
We are a rapidly growing healthcare technology company changing the fundamentals of patient and provider engagement. For years, health plans have relied on descriptive data and reactive engagement. We empower our clients to understand and predict the whole member journey, enabling sustained improvements in member health outcomes and plan performance. We combine the latest, most practical technologies and a deep understanding of healthcare, bringing innovative, pragmatic solutions to an industry that touches us all.",,,2022-08-17T00:00:00,2022-10-16,FULL_TIME
