Job_title,Company,State,City,Min_Salary,Max_Salary,unitText,SalaryCurrency,Job_Desc,Industry,Rating,Date_Posted,Valid_until,Job_Type
Senior Associate - Data Science,TheMathCompany,British Columbia,Vancouver,-1,-1,,CAD,"Job Description
:
ROLE DESCRIPTION
We are looking for passionate individuals to help our clients solve complex challenges enabling their sustained analytics transformation. As a member of our Client Services team, you have the opportunity to either work as an Individual Contributor or lead a team of Associates who design, execute and implement cutting edge analytical solutions. You are responsible for institutionalizing data driven insights and recommendations to bring analytics findings and customer strategies to life. The ideal candidate is an enthusiastic and entrepreneurial individual who has experience working with large datasets, is comfortable building relationships with a variety of stakeholders and loves solving complex business problems through data and analytics while leading a team and working in a fast-paced environment.
As a Senior Associate, you will:
Collaborate with teams of business stakeholders and lead the design and execution of roadmap to drive business outcomes
Leverage the global delivery model by working with cross-cultural teams
Lead, mentor and coach a team of Associates in our US offices
Solve complex business problems for organizations, leveraging conventional and new age data sources and applying cutting-edge advanced analytics techniques
REQUIRED QUALIFICATIONS
Bachelor’s degree4 to 6 years’ experience managing analytics projects in a fast-paced environmentAbility to structure and lead rigorous analyses of both quantitative and qualitative information2+ years’ experience in working with SQL(any variant)4+ years’ experience in working with R/ SAS2+ years’ experience in working with PythonExcellent written and oral communication skills including ability to lead and facilitate discussionsAbility to organize and present complex information in a clear and concise manner to small and large groupsExperience in or willingness to work with cross-functional and cross-cultural teamsWorking knowledge of a Big Data ecosystem, such as, Hadoop M/R, Pig and HiveHigh level of comfort dealing with ambiguity and change; must be able to translate business gaps into analytics problems defining the analytical approach, delivering actionable insights and operationalizing recommendationsDemonstrated ability to build strong client relationships, often in complex and sensitive environments
PREFERRED QUALIFICATIONS
Bachelor’s degree in a quantitative field
 Master’s in Business Analytics, Data Sciences or equivalent Consulting background a plus
PLEASE NOTE: Candidates must be legally authorized to work in the United States and must not require immigration-related employment benefit now or in the future.

Department
:
Data Science
Open Positions
:
1
Role
:
As a Senior Associate, you will:
Collaborate with teams of business stakeholders and lead the design and execution of roadmap to drive business outcomes
Leverage the global delivery model by working with cross-cultural teams
Lead, mentor and coach a team of Associates in our US offices
Solve complex business problems for organizations, leveraging conventional and new age data sources and applying cutting-edge advanced analytics techniques

Location
:
Vancouver, BC, Canada
Education/Qualification
:
Bachelor of Engg./Tech.
Years Of Exp
:
4 to 6 Years
Posted On
:
25-May-2022
Designation
:
Senior Associate
ROLE DESCRIPTION
We are looking for passionate individuals to help our clients solve complex challenges enabling their sustained analytics transformation. As a member of our Client Services team, you have the opportunity to either work as an Individual Contributor or lead a team of Associates who design, execute and implement cutting edge analytical solutions. You are responsible for institutionalizing data driven insights and recommendations to bring analytics findings and customer strategies to life. The ideal candidate is an enthusiastic and entrepreneurial individual who has experience working with large datasets, is comfortable building relationships with a variety of stakeholders and loves solving complex business problems through data and analytics while leading a team and working in a fast-paced environment.
As a Senior Associate, you will:
Collaborate with teams of business stakeholders and lead the design and execution of roadmap to drive business outcomes
Leverage the global delivery model by working with cross-cultural teams
Lead, mentor and coach a team of Associates in our US offices
Solve complex business problems for organizations, leveraging conventional and new age data sources and applying cutting-edge advanced analytics techniques
REQUIRED QUALIFICATIONS
Bachelor’s degree4 to 6 years’ experience managing analytics projects in a fast-paced environmentAbility to structure and lead rigorous analyses of both quantitative and qualitative information2+ years’ experience in working with SQL(any variant)4+ years’ experience in working with R/ SAS2+ years’ experience in working with PythonExcellent written and oral communication skills including ability to lead and facilitate discussionsAbility to organize and present complex information in a clear and concise manner to small and large groupsExperience in or willingness to work with cross-functional and cross-cultural teamsWorking knowledge of a Big Data ecosystem, such as, Hadoop M/R, Pig and HiveHigh level of comfort dealing with ambiguity and change; must be able to translate business gaps into analytics problems defining the analytical approach, delivering actionable insights and operationalizing recommendationsDemonstrated ability to build strong client relationships, often in complex and sensitive environments
PREFERRED QUALIFICATIONS
Bachelor’s degree in a quantitative field
 Master’s in Business Analytics, Data Sciences or equivalent Consulting background a plus
PLEASE NOTE: Candidates must be legally authorized to work in the United States and must not require immigration-related employment benefit now or in the future.",Administración y consultoría,,2022-09-07T00:00:00,2022-10-16,OTHER
Senior Data Scientist (Canada),Tiger Analytics,,,-1,-1,,CAD,"Tiger Analytics is looking for experienced Data Scientists to join our fast-growing advanced analytics consulting firm. Our employees bring deep expertise in Data Science, Machine Learning and AI. We are the trusted analytics partner for multiple Fortune 500 companies, enabling them to generate business value from data. Our business value and leadership has been recognized by various market research firms, including Forrester and Gartner. We are looking for top-notch talent as we continue to build the best global analytics consulting team in the world.
As a Data Scientist, you will apply strong expertise in AI through the use of machine learning, data mining, and information retrieval to design, prototype, and build next-generation advanced analytics engines and services. You will collaborate with cross-functional teams and business partners to define the technical problem statement and hypotheses to test. You will develop efficient and accurate analytical models which mimic business decisions and incorporate those models into analytical data products and tools. You will have the opportunity to drive current and future strategy by leveraging your analytical skills as you ensure business value and communicate the results.
Key Responsibilities
Collaborate with business partners to develop innovative solutions to meet objectives utilizing cutting edge techniques and tools.
Effectively communicate the analytics approach and how it will meet and address objectives to business partners.
Advocate and educate on the value of data-driven decision making; focus on the “how and why” of solutioning.
Lead analytic approaches; integrate solutions collaboratively into applications and tools with data engineers, business leads, analysts and developers.
Create repeatable, interpretable, dynamic and scalable models that are seamlessly incorporated into analytic data products.
Engineer features by using your business acumen to find new ways to combine disparate internal and external data sources.
Share your passion for Data Science with the broader enterprise community; identify and develop long-term processes, frameworks, tools, methods and standards.
Collaborate, coach, and learn with a growing team of experienced Data Scientists.
Stay connected with external sources of ideas through conferences and community engagements
Requirements
Bachelors Degree in Data Science, Computer Science, or related field
4+ years of Data Science and Machine Learning experience required
Proficiency in Python or R. Ability to write complex SQL queries
Proficiency with Machine Learning concepts and modeling techniques to solve problems such as clustering, classification, regression, anomaly detection, simulation and optimization problems on large scale data sets.
Ability to implement ML best practices for the entire Data Science lifecycle
Ability to apply various analytical models to business use cases (NLP, Supervised, Un-Supervised, Neural Nets, etc.)
Exceptional communication and collaboration skills to understand business partner needs and deliver solutions
Bias for action, with the ability to deliver outstanding results through task prioritization and time management
Experience with data visualization tools — Tableau, Power BI, etc. preferred
Benefits
This position offers an excellent opportunity for significant career development in a fast-growing and challenging entrepreneurial environment with a high degree of individual responsibility.",Administración y consultoría,,2022-08-19T00:00:00,2022-10-16,FULL_TIME
Senior Data Scientist,ARGO,Ontario,Markham,-1,-1,,CAD,"ARGO is a leading provider of software and analytics solutions for both the financial services and healthcare industries. ARGO transforms business processes for financial service providers and healthcare organizations using proven business models and software innovation informed by real customer challenges, breakthrough technology, and rich analytics.
A Senior Data Scientist with mathematician/statistician and computer science knowledge/experience that will lead a team in developing, evaluating and implementing advanced machine learning algorithms for classification, clustering, data reduction, sampling and optimization based on statistical models to power ARGO analytical solutions. This person should also be able to define direction for robust models for automating various aspects of the data analysis process, including getting customer data, running analytics, and building value-add models for delivery to a production environment.

A key to success in this position will be innovation in the data science space while tying project outcomes to the broader goals of the organization and improvement of the product offering.

WHAT ARE WE LOOKING FOR:
5+ years post-academic and/or recent industry experience in model development and statistical analysis of large datasets
Proven ability to balance probability and statistical theory and algorithms science with pragmatic problem solving skills
A track record of developing and applying advanced predictive algorithms and behavioral models to solve real world problems
Experience using statistical computer languages (Python, R, SQL, etc.) and machine learning to manipulate data and draw insights from large data sets
Working Knowledge of:Determination of structure or distribution of dataCommon classification techniquesCommon regression techniquesPredictive modeling
Experience with distributed data/computing tools
Experience visualizing/presenting descriptive statistical data with modern visual tool i.e.: MS Power BI)
Strong communication skills, both verbally and written, and the ability to develop and present proposals, results and business cases to internal and customer executives
Experience with leading a team is a plus
Experience in commercial software development lifecycle (SDLC) methods


WHAT YOU WILL DO:
Lead a team in developing, evaluating, and implementing analytical models
Support the adoption of data science and well improved analytics across the whole organization
Communicates data findings to stakeholders throughout the organization to identify opportunities for leveraging customer data to drive business solutions
Analyze data to produce and improve statistical, mathematical, or machine learning models or algorithms to forecast results for ARGO’s predictive analytics products
Build and maintain a reliable, efficient workflow to ingest, store, and analyze data sets
Mentor and assist engineers in creating and deploying production ready models
Lead the definition and implementation of an SDLC process for the data science workflow implemented at ARGO, including issue management, automated build and model testing, version control, and automated deployment to internal systems
Define and collect metrics for key performance indicators (KPI) to assess the effectiveness and accuracy of models both during analysis and in production
Document and explain models, algorithms, and their KPIs to internal and external stakeholders


EDUCATIONAL REQUIREMENTS:

The candidate will have a Master’s degree at a minimum, preferably a Ph.D. in Statistics, Applied Math, Machine Learning, Physics, Econometrics or a similar quantitative field with focus and depth in mathematical algorithms, probability theory, statistical modeling, and machine learning.
ADDITIONAL REQUIREMENTS:
Applicants for U.S. or Canadian based positions with ARGO must be legally authorized to work in the United States or Canada. Verification of employment eligibility will be required at the time of hire. Visa sponsorship is not available for any ARGO positions.

PHYSICAL DEMANDS:
While performing the duties of this job, the employee is regularly required to stand; walk; sit; use hands to finger, handle, or feel; reach with hands and arms; talk or hear. Specific vision abilities required by this job include close vision, distance vision, color vision, peripheral vision, depth perception, and ability to adjust focus.",Seguros,,2022-08-23T00:00:00,2022-10-16,FULL_TIME
Senior Data Scientist,Cowbell Cyber Inc.,Ontario,Toronto,-1,-1,,CAD,"At Cowbell, our mission is to protect small to medium-sized enterprises by making cyber insurance accessible to all. Join our fast-growing team of diverse and passionate individuals on this mission to reinvent how businesses manage cyber risk and buy cyber insurance.

Cowbell is a fast-growing, next-generation cyber insurance provider, built on cutting-edge technology by a team of seasoned professionals united in their mission to achieve our ambitious goals. We believe in a people-first culture and know that great work isn't done without a phenomenal team, so we make sure to reflect that in our core values, benefits & wellness program.

In support of increasing demand, we are actively looking for ambitious people, who are not afraid of hard-work, ambiguity and a dash of chaos, to join our team and be part of a growing institution where they can hone their skills and develop new ones in a fun, challenging and dynamic environment.

If that sounds like you, we want to hear from you!
Cowbell Cyber is hiring a Senior Data Scientist to join our team.

Responsibilities:

Work with data scientists, engineers, actuaries and cyber security experts to Identify, research, prototype, evaluate and integrate research advances into Cowbell platform
Analyze cyber security data to support your hypothesis and the team
Build models to predict cybersecurity threat, insurance pricing and user enrichment
Design and own A/B testing
Mentor junior data scientists
Be part of the ""continuous underwriting"" process at Cowbell

Basic Qualifications:

Bachelors in Computer Science, Mathematics, Statistics, Physics, Economics or any STEM field
5-8 years in Machine learning and Statistical analysis experience
Ability to write production software in Python and conversant with AWS
Knowledge and experience with SQL
Experience with experimental design
Excellent communicator and team player

Preferred Qualifications:

Masters or PhD with 5+ years of work experience
Expert in Machine learning fundamentals and Statistical analysis
Experience with NLP

Nice to have:

Experience in Cybersecurity or Actuarial Science
Experience with tools such as Airflow, MetaFlow/KubeFlow
Experience with Postgres or other RDMS, Spark

What Cowbell brings to the table:

Winner of Inc. Magazine's Annual List of Best Workplaces for 2022
Nationwide medical, dental and vision coverage plus life insurance, long term disability and flexible spending accounts.
Employee equity plan for all and wealth enablement plan for select customer facing roles.
Comprehensive wellness program including unlimited PTO, monthly company-wide wellness days, wellness app subscriptions, lunch and learn, book club, get-togethers, lunch & communication stipends, happy hours and much more.",Seguros,,2022-09-13T00:00:00,2022-10-16,OTHER
Senior Data Analyst,Deloitte,Ontario,Toronto,-1,-1,,CAD,"Job Type: Permanent
Reference code: 114701
Primary Location: Toronto, Ontario, Canada
All Available Locations: Toronto
Our Purpose
At Deloitte, we are driven to inspire and help our people, organization, communities, and country to thrive. Our Purpose is to build a better future by accelerating and expanding access to knowledge. Purpose defines who we are and gives us reason to exist as an organization.
By living our Purpose, we will make an impact that matters.
Be encouraged to deepen your technical skills…whatever those may be.
Partner with clients to solve their most complex problems
Experience MyFlex and an agile work environment where work is what you do not where you do it
-
Do you have a passion for unlocking the value of data? Keep reading!
What will your typical day look like?
As a Data Analyst in the Shared Technology Solutions Team, you will guide the creation of data-centric deliverables where your work will have a meaningful enterprise-wide impact. You will define integration patterns working with Cloud technologies. Working with internal stakeholders you will capture requirements, data mappings and business processes. You will influence design and enable the creation of solutions. Working with the delivery teams, you will maintain standards, best practices and methodologies and enable maturity of system engineering, quality assurance and analysis. You may produce conceptual and logical data models for enterprise subject areas. You will collaborate with Enterprise Architects as appropriate to ensure solutions fit into a larger picture. You will interact with Infrastructure, Portfolio, Business and IT leadership representatives. You have strong interpersonal skills and have a demonstrated ability to work with nuanced data concepts
About the team
Our Team builds and maintains Enterprise Data Integration solutions required for the firm (Data Lake, MDM solution, RDM solution). Our onshore team is located within Toronto coupled with additional team-members within Hyderabad, India. We are part of the larger Solutions Delivery group within Deloitte’s ITS (National Information Technology Services).
Enough about us, let’s talk about you
You are someone with:
University degree or equivalent work experience
Strong commitment to professional client service excellence
Demonstrated knowledge of agile project development methodology
5+ years' experience performing Data Analysis activity
Experience with producing conceptual and logical data models is an advantage
Excellent interpersonal relations and demonstrated ability to effectively work with multiple stakeholders and lead others in teams
Superior verbal and written communications skills including oral presentation and building business case
Successful delivery utilizing offshore capabilities considered an asset
Our promise to our people: Deloitte is where potential comes to life.
Be yourself, and more.
We are a group of talented people who want to learn, gain experience, and develop skills. Wherever you are in your career, we want you to advance.
You shape how we make impact.
Diverse perspectives and life experiences make us better. Whoever you are and wherever you’re from, we want you to feel like you belong here. We provide flexible working options to support you and how you can contribute. Be the leader you want to be.
Be the leader you want to be
Some guide teams, some change culture, some build essential expertise. We offer opportunities and experiences that support your continuing growth as a leader.
Have as many careers as you want.
We are uniquely able to offer you new challenges and roles – and prepare you for them. We bring together people with unique experiences and talents, and we are the place to develop a lasting network of friends, peers, and mentors. Our TVP is about relationships – between leaders and their people, the firm and its people, peers, and within in our communities.

The next step is yours
At Deloitte, we are all about doing business inclusively – that starts with having diverse colleagues of all abilities. Deloitte encourages applications from all qualified candidates who represent the full diversity of communities across Canada. This includes, but is not limited to, people with disabilities, candidates from Indigenous communities, and candidates from the Black community in support of living our values, creating a culture of Diversity Equity and Inclusion and our commitment to our AccessAbility Action Plan, Reconciliation Action Plan and the BlackNorth Initiative.
We encourage you to connect with us at accessiblecareers@deloitte.ca if you require an accommodation for the recruitment process (including alternate formats of materials, accessible meeting rooms or other accommodations). We’d love to hear from you!
By applying to this job you will be assessed against the Deloitte Global Talent Standards. We’ve designed these standards to provide our clients with a consistent and exceptional Deloitte experience globally.
Deloitte Canada has 30 offices with representation across most of the country. We acknowledge our offices reside on traditional, treaty and unceded territories as part of Turtle Island and is still home to many First Nations, Métis, and Inuit peoples. We are all Treaty people.",Finanzas,,2022-09-05T00:00:00,2022-10-16,FULL_TIME
