Job_title,Company,State,City,Min_Salary,Max_Salary,unitText,SalaryCurrency,Job_Desc,Industry,Rating,Date_Posted,Valid_until,Job_Type
Senior Data Scientist - TELUS Insights,TELUS,Ontario,Toronto,-1,-1,,CAD,"Location:
Toronto, ON, CA Vancouver, British Columbia, CA Edmonton, AB, CA Calgary, AB, CA
Req ID: 28224
Jobs by Category: Operations
Job Function: Data Science
Status: Full Time
Schedule: Regular
Description
The IoT Industry Solutions team is ""start-up"" within TELUS that is focused on building end-to-end customer solutions that combine the strengths of our networks, leading SaaS and platform partnerships, our breadth of customer relationships, and the power of data insights. We own the success of focused vertical and horizontal IoT solutions across Intelligent Mobility, Connected Workers, Smart City, Agriculture, and Health.

We're passionate about building new business areas for TELUS and will succeed by bringing clarity and focus to the challenge.

About the team

This role is part of the Data and Applied Intelligence team within IoT Industry Solutions. We are a provider of data, insights and data science services to commercial and government organizations. Our product solves many business problems across a wide variety of industries. They are currently being used in Tourism, Commercial Real Estate, Transportation and many other industries to help decision makers plan their next course of action or analyze their historical activities. We are a fun group of individuals, who are really passionate about our products and committed to provide quality solutions to our customers.

About the role

Design and build large and complex data sets, from spurious sources while thinking strategically about uses of data and how data use interacts with data design
Design and implement statistical data quality procedures for new data sources
Develop algorithms/software for accessing and handling data appropriately
Implement and hand off data checking and updating procedures to teams
Lead the new product developments for the TELUS Insights portfolio and product enhancements for existing location intelligence products
Scale the current custom consulting projects to a generalized product that could be reused for multiple clients across multiple verticals
Develop and implement ML & AI and Big Data solutions including predictive modeling,forecasting and classification
Visualize and report data findings creatively in a variety of visual formats that appropriately provides insights to the organization
Train others on what data is available and how to use various sources
Communicate findings to business leaders in a way that can influence how an organization approaches a business challenge
Support and evolve the TELUS Insights product roadmap by leveraging customer insights, industry research, best practices, and emerging tools/technology
Identify opportunities for process/model optimization and refine to improve effectiveness/accuracy and enhance ROI
Collaborate with Data Scientists and Data Engineers within TELUS as well as external Data Science communities

Qualifications
You're the missing piece of the puzzle

You have 5+ years of experience working with large temporal geospatial datasets
MSc. or PhD/Research in Computer Science, Statistics, Geospatial etc.
You possess deep expertise in location intelligence/ Geospatial data
Working with structured and unstructured data sets
Excellent skills working with complex SQL and Spark
Experience developing in Python; comfortable using various data science libraries such as Scikit-learn, Pandas, Numpy as well as frameworks like TensorFlow, Pytorch, Keras
Experience building and architecting API endpoints
Experience working with telecom background is a plus
Experience working with cloud environments like GCP
You are recognized for addressing business needs via your application of data mining and analysis, predictive modeling, statistics, and other advanced analytical techniques
You are sought out for your skills in Machine Learning, Classification, Clustering, Segmentation, Time Series Analysis, Demand Forecasting and Optimization
Evaluating and providing input on potential business intelligence solutions.
Comfortable with Jupyter environment and infrastructure, Spyder/PyCharm
Experience with at least one of the major cloud computing platforms - GCP, AWS, Azure
Well versed in software development lifecycle and ML Ops concepts; Developing end-end to models/ projects and automation in production environment.
Knowledgeable about common supervised and unsupervised Machine Learning approaches (eg. feature engineering, classification, regression, clustering, NLP, time series forecasting, etc. ""Tensorflow”, “Deep Learning” and synthetic tabular data generation is a strong asset

Great-to-haves

PhD in a quantitative field such as Math, Statistics, Computer Science, Economics, or Data Science
Data visualization experience: Data Studio, Tableau, PowerBI, Domo
Data environments experience: MS SQL, Oracle
Experience using Google Workspace
Experience with agile methodology and team-based software development workflows (e.g. JIRA)

MBIOT22 #LI-REMOTE",Telecomunicaciones,,2022-09-06T00:00:00,2022-10-16,FULL_TIME
Senior Data Scientist (CAN),Curinos,Ontario,Toronto,-1,-1,,CAD,"Company Description
Curinos is the leading provider of data, technologies and insights that enable financial institutions to make better, and more profitable, data-driven decisions faster. Born out of the combination of two familiar industry powerhouses, Novantas and Informa’s FBX business, Curinos brings to market a new level of industry expertise across deposits, lending and digital experience solutions and technologies.

Job Description
At Curinos, data scientists drive the innovation process of developing digital solutions. From defining the vision and requirements to purposefully designing the model-driven solutions from the ground up. At Curinos, you will draw insights from massive datasets, create intuitive data visualizations, and build scalable machine learning models and products. You will work with experts in data engineering, machine learning and business executives to deliver proactive instead of reactive solutions.
You will influence product strategy and investment decisions with data and help guide new product initiatives. You must be able to turn unclear business goals into clearly defined problems, develop statistically sound solutions and robust machine learning models from large FinTech data sources, and deliver results that meet high standards of data quality, security, and privacy.
What You Will Do:
Collaborate with the concept development team to discover and understand common pain points and ideate potential model driven solutions
Identify real-world value and build the data required to bring the solution to life; Assess the potential risks and consequences associated with the model and solution
Identify and recommend opportunities to automate systems and processes
Formulate and solve new problems while balancing how deep to dive and prefect data vs achieving progress
Use prior commercial experience in using data and machine learning to drive innovation and continual evolution of the development and testing of machine learning solutions
Be proficient with a wide variety of machine learning and data munging libraries and tools
Leverage prior experience working with engineers and dev ops teams to set up appropriate technical resources
Extract value from data in a variety of formats, structured and unstructured, residing in a variety of data systems (relational databases, object storage, etc.)

Qualifications
Bachelor's/Master’s degree in Mathematics, Statistics, a relevant technical field, or equivalent practical experience
A minimum of 4 years of work experience in data science
Heavy experience in writing and optimizing SQL queries in a business environment with large-scale, complex datasets
High coding proficiency in scripting languages (e.g., Python)
Experience applying various machine learning techniques, and understanding the key parameters that affect their performance
Experience using notebook solutions such Jupyter to conduct reproducible data analysis and modeling projects
Familiarity with at least one cloud-based platform (Google Cloud Platform, Amazon Web Services, or Microsoft Azure)
Additional Information
All candidates must possess work authorization which does not (and will not in the future) require work sponsorship by an employer.
We are proud to be an Equal Opportunity Employer. Please visit www.curinos.com for more information.",Administración y consultoría,,2022-09-01T00:00:00,2022-10-16,FULL_TIME
"Senior Data Scientist (SF, LA, CHI, BOS, BC)",Instawork,British Columbia,Vancouver,-1,-1,,CAD,"At Instawork, we’re driven by our vision to create economic opportunity for local businesses and skilled hourly professionals in communities around the world. With a growing number of hub cities across the world in the U.S., Canada, India, and beyond, we’re looking for top talent to help rapidly scale our high-tech and high-touch labor marketplace. Our accomplished and dedicated team is passionate about our mission and committed to crafting revolutionary products, all with the backing of our world-class investors, including Benchmark, Spark Capital, Craft Ventures, Greylock Capital, Y Combinator, and more!
We need an innovative and hands-on Senior Data Scientist to join our team. This will be the founding member of our data science practice so it’s an exciting opportunity for someone looking to establish solid foundations for that team. Our goal is to embed artificial intelligence and machine learning into everything we do in order to create smarter products and enhance the customer experience.
Who You Are
BA/BS in Math, Statistics, Economics, Computer Science, or other quantitative fields.
Advanced degrees preferred but not required, e.g. PhD or Masters Physics, CS, Stats, etc.
7+ years experience doing quantitative analysis
Expert level fluency using statistical computer languages (R, Python, SQL, or similar) to manipulate data and draw insights from large data sets
Advanced statistical techniques and concepts (regression, properties of distributions, statistical tests and proper usage, or similar) and experience with applications
Ability to initiate and drive projects to completion with minimal guidance
Machine learning techniques (clustering, decision tree learning, artificial neural networks, or similar) and their real-world advantages/drawbacks
Experience with BI tools (e.g. Mode, Chartio, or Tableau)
What You'll Do
Apply your expertise in quantitative analysis, data mining, and the presentation of data to see beyond the numbers and understand how our users interact with our products
Impact key company objectives by working closely with product managers to refine our data science roadmap
Inform, influence, support, and execute our product decisions
Build/maintain reports, dashboards, and metrics to monitor the performance of our products
Mine massive amounts of data and extract useful product insights
Manage development of data resources, gather requirements, organize sources, and support product launches
Act as a data evangelist to create a data-driven culture across the company
Instawork Values
Bias for Action - We are a growing team and an evolving product. We want a team of do’ers to drive the company forward, even if it means making decisions with incomplete information or being wrong.
Act Like an Owner - Treat this company as though it is your own. Execute on the fundamentals, and act creatively to drive growth. Your ability to drive impact in any part of our company is only limited by your courage and conviction, not your job title.
Always Be Learning - We are changing an entire industry. We strive to learn from each other and get better each day, week, and month, so that our team’s learnings can compound and we can all improve, together.
Empathy, Trust, Candor - Empathy for our business partners and professionals means we put ourselves in their shoes. Empathy for our colleagues means we are always upfront and honest with each other, which comes from trust.
About Instawork
Founded in 2016, Instawork is the leading flexible work app for local, hourly professionals. Its digital marketplace connects thousands of businesses and more than three million workers, filling a critical role in local economies. Instawork has been featured on CBS News, the Wall Street Journal, The Washington Post, Associated Press, and more. In 2022, Instawork was ranked among the country’s top 10% of fastest-growing companies by Inc. 5000 and was included in the Forbes Next Billion Dollar Startup list. Instawork was also named the 2022 ACE Award recipient for “Best Innovation” and one of the “Best Business Apps” by Business Insider. Instawork helps businesses in the food & beverage, hospitality, and warehouse/logistics industries fill temporary and permanent job opportunities in more than 25 markets across the U.S. and Canada.
For more information visit www.instawork.com
We value diversity on our team and firmly believe Instawork is stronger when we hire people who make their own unique contributions to our culture. We welcome all applicants and encourage candidates from underrepresented backgrounds to apply.
To learn more about our company values, please visit: https://info.instawork.com/about
[#LI-initials1]",Tecnologías de la información,,2022-08-26T00:00:00,2022-10-16,FULL_TIME
"Sr. Data Scientist, Ads Experimentation Analytics",Reddit,Ontario,Toronto,-1,-1,,CAD,"Our mission is to bring community and belonging to everyone in the world. Reddit is a community of communities where people can dive into anything through experiences built around their interests, hobbies, and passions. With more than 50 million people visiting 100,000+ communities daily, it is home to the most open and authentic conversations on the internet. From pets to parenting, skincare to stocks, there's a community for everybody on Reddit. For more information, visit redditinc.com.
We are looking for a senior data scientist to be a part of the Ads Data Science team. You will work closely with product managers, engineers, and data scientists to up-level the experimentation capabilities of the ads organization. You have a strong understanding of experimentation, are not afraid to challenge the status quo, and thrive in a cross-functional environment.

Reddit is continuing to grow our teams with the best talent. We're completely remote friendly and will continue to be after the pandemic.

Responsibilities:

Elevate the experimentation practice for the Ads org by creating the right processes, templates and tools catered for ads use cases.
Lead an experimentation council that can approve/guide experiment designs for various product launches.
Explore new experiment designs/techniques such as small sample enhancements, Bayesian approaches, causal inference methodologies, dosage response studies, staggered experiments etc and apply them successfully for complex experiments on the ads side of the business.
Liaise with the centralized experimentation team in building platform features to accelerate ads experimentation.
Guide various ads product teams in understanding network effects and novelty effects when running experiments.
Track and own the experiment calendar for the ads org. Run biweekly experiment review discussions.
Create frameworks for making metric trade-off decisions, especially when they span multiple organizations (e.g. ads vs consumer metric tradeoffs).

What We Can Expect From You:

Master's or PhD degree in a quantitative major (e.g., mathematics, statistics, economics, finance, computer science).
2 years of experience with experimentation, preferably for a consumer-facing service/app.
5+ years of experience in quantitative/modeling roles.
Proficiency with statistical analysis and programming languages (Python, SQL).
Understanding of experimentation and causal inference analyses.
Experience with digital advertising is preferred, but not required.

Reddit is committed to providing reasonable accommodations for qualified individuals with disabilities and disabled veterans in our job application procedures. If you need assistance or an accommodation due to a disability, please contact us at ApplicationAssistance@Reddit.com.",Tecnologías de la información,,2022-09-15T00:00:00,2022-10-16,OTHER
Senior Data Scientist,Veeva Systems,Ontario,Toronto,-1,-1,,CAD,"Veeva [NYSE: VEEV] is the leader in cloud-based software for the global life sciences industry. Committed to innovation, product excellence, and customer success, our customers range from the world’s largest pharmaceutical companies to emerging biotechs. Veeva’s software helps our customers bring medicines and therapies to patients faster.

We are the first public company to become a Public Benefit Corporation. As a PBC, we are committed to making the industries we serve more productive, and we are committed to creating high-quality employment opportunities.

Veeva is a Work Anywhere company which means that you can choose to work in the environment that works best for you – on any given day. Whether you choose to work remotely from home or in our Toronto office – it’s up to you.
The Role
Veeva is looking for an all-star Senior Data Scientist to join the Vault Outside Life Science (OLS) team. We’re looking for a high-energy, passionate individual with a deep technical background who is eager to drive product advancement and innovation. In this role, you will be responsible for creating game-changing products in the manufacturing industries such as Consumer Packaged Goods, Chemicals, and Cosmetics.

If you have a passion for creating world-class products and enjoy solving complex problems with simple, elegant solutions, you may be a good fit for this position.

What You’ll Do
Be involved in sales discussions, potentially fueling the conversation about what AI can do and bringing clarity to the discussion
Work with customers and implementation teams to build out custom solutions
Build POCs with AWS assistance and consulting PMs on opportunities
Be hands-on. Design, Prototype, Configure – validate solutions rapidly to ensure we solve the right problems, in the right order
Be a storyteller. Author & design high-quality specifications and communicate specific, actionable requirements to your engineering teammates
Be a leader. Look for opportunities to innovate, keep up with the latest software, machine learning, manufacturing industries trends, and distill them into product requirements
Be agile. Design, implement, iterate
Take pride in your work
Requirements
2+ years of software development/architect, product management, or technical consulting role in AI
5+ years of professional work experience in agile software development environments
Demonstrated skills in design, product development, and planning
Ability to work independently in a fast-paced environment, with little direct supervision
Excellent oral and written communication skills with the ability to effectively explain complex problems and advocate technical solutions to Engineering and customers
Degree in computer science or engineering
Experience with AI and Machine Learning Models
Experience with Natural Language Processing
Qualified candidates must be legally authorized to be employed in Canada. Veeva does not provide sponsorship of employment visas for this position.
Nice to Have
Experience working in the following industries: Consumer Packaged Goods, Chemical and Cosmetics
Experience working on SaaS enterprise applications or content management systems
Experience with API and data exchange schemas
Experience with data migration
Experience with Search matching algorithms and heuristics
Experience with Python, SQL, XML, and JSON
Perks & Benefits
Conveniently located in downtown Toronto
Snacks, beverages, and weekly lunches from local restaurants
Team events and rec league sports teams
Allocations for continuous learning & development
Health & wellness programs
Weekly yoga classes
Ping pong and other games
#LI-Remote
#BI-Remote
Veeva’s headquarters is located in the San Francisco Bay Area with offices in more than 15 countries around the world.
Veeva is an equal opportunity employer. All qualified applicants will receive consideration for employment without regard to race, color, sex, sexual orientation, gender identity or expression, religion, national origin or ancestry, age, disability, marital status, pregnancy, protected veteran status, protected genetic information, political affiliation, or any other characteristics protected by local laws, regulations, or ordinances. If you need assistance or accommodation due to a disability or special need when applying for a role or in our recruitment process, please contact us at talent_accommodations@veeva.com.",Tecnologías de la información,,2022-09-05T00:00:00,2022-10-16,OTHER
Senior Data Analyst,Mastercard,British Columbia,Vancouver,-1,-1,,CAD,"Our Purpose
We work to connect and power an inclusive, digital economy that benefits everyone, everywhere by making transactions safe, simple, smart and accessible. Using secure data and networks, partnerships and passion, our innovations and solutions help individuals, financial institutions, governments and businesses realize their greatest potential. Our decency quotient, or DQ, drives our culture and everything we do inside and outside of our company. We cultivate a culture of inclusion for all employees that respects their individual strengths, views, and experiences. We believe that our differences enable us to be a better team – one that makes better decisions, drives innovation and delivers better business results.
Job Title
Senior Data Analyst
Mastercard’s Cyber & Intelligence Solutions organization develops and delivers world-class security products and services for customers across the globe. NuData Security predicts fraudulent transactions by identifying good users from bad, based on their online behavior. By analyzing over 38 billion behaviors annually, NuData harnesses the power of behavioral and biometric analysis to empower its clients to predict fraud and verify the user behind the device. This allows clients to predict fraud before a critical decision, reduce customer insult, and investigate bad actors efficiently.

We are looking for a Data Scientist/Analyst to join our team in our Vancouver or Toronto office.

You are a determined pattern-finder, one that delights in the tough puzzles because nothing satisfies like finally cracking one. Dig into weird, needle-in-a-haystack Internet-based fraud cases. Ferret out suspicious behaviour from the innocuous. Decipher the pattern, find the fraud and then figure out how to catch it in the future. You’ll back up your findings with deep statistical analysis and robust data modeling, which will go on to inform feature design and fraud investigation strategy for NuData product offerings. You'll produce compelling visuals, exciting dashboards and give fantastic presentations to both internal and external stakeholders.

Qualifications:
Exceptional written and verbal communication skills, with an advanced level of experience in presenting to various audiences (both size and type of audience).Intermediate level of data analysis and reporting experience in professional setting;Experience dealing with large data sets;Experience with SQL and the ability to create complex queries and joins;Strong data analysis and data modeling skills;Familiarity with AWS tools and cloud computing;
Candidates without experience in a professional setting will not be considered for this role.

Bonus points:
Experience with machine learning (supervised or unsupervised);Experience with high level programming languages: Python, PHP, or similar;Experience with data tools: R, SPSS, SAS and Tableau;Experience with data manipulation and designing and implementing ETL processes;High level concepts of Web Services, Internet Security and Online Behavioral Analysis.
COVID-19 Considerations
In many locations, we’ve implemented a virtual hiring process and continue to interview candidates by video or phone. In addition, in our NYC offices, as required by law, only individuals who have been fully vaccinated against COVID-19 will be permitted inside Mastercard offices unless a reasonable accommodation has been approved in advance.
Corporate Security Responsibility
All activities involving access to Mastercard assets, information, and networks comes with an inherent risk to the organization and, therefore, it is expected that every person working for, or on behalf of, Mastercard is responsible for information security and must:
Abide by Mastercard’s security policies and practices;
Ensure the confidentiality and integrity of the information being accessed;
Report any suspected information security violation or breach, and
Complete all periodic mandatory security trainings in accordance with Mastercard’s guidelines.",Finanzas,,2022-08-30T00:00:00,2022-10-16,FULL_TIME
