Job_title,Company,State,City,Min_Salary,Max_Salary,unitText,SalaryCurrency,Job_Desc,Industry,Rating,Date_Posted,Valid_until,Job_Type
"Senior Data Analyst, MRM",MRM,Ontario,Toronto,-1,-1,,CAD,"MRM creatively engineers total human experiences. Through purposeful, dynamic intersections between strategy, creative, technology and data sciences, MRM operates in a borderless, integrated way, to allow for greater collaboration and velocity— all to the service of helping businesses grow meaningful relationships with people. MRM has 35-plus offices across North America, Latin America, Europe, the Middle East and Asia Pacific. For more information, please visit www.mrm.com.


About the Role:

The Sr. Data Analyst role will be responsible for executing a wide variety of database focused analyses in support of a client that is looking for help to join disparate data sets and develop more automated reporting solutions. This role will support the Manager in understanding the client’s business and analytic needs, in terms of developing reporting that promotes decision making and insights that drive to recommended actions. This role will work alongside a global team of resources to automate data ingestion, data cleansing and data management. In this role, the senior analyst will have exposure to a wide variety of data analysis and Business Intelligence tools such as Azure Synapse, SQL Server Integration Services (SSIS), Power BI and will be expected to apply these tools on a daily basis.


Responsibilities:
Plan, design, and have ongoing accountability for the creation of cutting-edge visualizations to meet our client’s needs
Assist in building state-of-the-art, multi-cloud capable products by:
Automating build and deployment processes
Creating solutions that include custom-made, open source and 3rd party solutions for solving pertinent business problems
Serve a multitude of functions including but not limited to: investigation of new product features, identifying new opportunities (in technology or to advance our client’s goals), creating internal processes for removing obstacles within the team
Responsible for creating documentation and educational materials that capture best practices for utilizing product, data governance and data management
Be an integral player in verification of enterprise databases to allow for confirmation of data integrity and investigation of any discrepancies
Utilize SQL (preferably MDX) to create new data engineering processes, perform database management, and identify best practices
Develop creative solutions in visualization, data management and automation that help drive our business forward
Continuously look for improvements, monitor quality levels, and manage quality problems
Lead client conversations related to ongoing initiatives where you embody our team’s “we’ll figure it out” mindset

Required Skills
Education and Experience

At least 3+ years of experience in data and analytics
Must demonstrate strong analytical skills
Highly accountable self-starter with the ability to work well within a group, as well as independently
Bachelor’s degree in Computer Science, Mathematics, Engineering, Information Technology preferred
Knowledge and experience with SQL (preferably in SQL Server) and MDX (preferred, not required) coding languages
Experience with ETL and ETL tools (SQL Server Integration Services is preferred, but other tools such as Airflow would work)
Demonstrated experience using Power BI (preferably with DAX experience) – with a keen eye towards industry trends in data visualization
Knowledge and experience within Azure preferred (Databricks or Data Factory to access Data Lakes, SSAS, Synapse and Function)
Certifications in Power BI and other tools listed above is desired
Some working business understanding, to help reclassify business data into usable format
Must have strong communication skills, both verbal and written
Must be able to handle multiple clients and projects simultaneously
Must be proficient in MS Office (Excel and PowerPoint); advanced Excel skills a plus
Demonstrated ability to learn new technologies and evolve as business requirements change.


MRM is an EEO/AA employer and does not discriminate on the basis of race, color, religion, creed, gender, sexual orientation, age, gender identity, marital status, citizenship, disability, genetic information or veteran status or any other basis prohibited by applicable federal, state, or local law. MRM participates in e-Verify.


If you require reasonable accommodation for any part of the application or hiring process, please submit your request through one of the following methods listed below:


a) Dedicated Fax - 917-661-6310
b) Dedicated E-mail – Careers@mwgdetroit.com
c) US Mail – ATTN: Human Resources, 360 W. Maple Birmingham, MI 48009
d) Dedicated Phone – 248-203-8000


NOTE: Disability accommodation requests only.
Required Experience",Audiovisual y medios de comunicación,,2022-09-12T00:00:00,2022-10-16,FULL_TIME
Senior Data Analyst,Roofr,Ontario,Toronto,-1,-1,,CAD,"We're growing quickly, and we're looking for exceptional people to join us on this incredible journey.We are obsessed with building the most trusted roofing platform in the world so our customers can power their growth with intelligence. Roofr is the all-in-one sales toolbox for roofers, including instant customizable aerial roof measurements with a drone, satellite, or blueprints imagery! In addition, our clients have the ability to immediately create visually stunning, robust and automated proposals that help create a great client experience leading to a higher close rate. Our future roadmap is clear and filled with exciting products such as payment processing, consumer financing, workflow automation, and more!Our Mission is to ensure every family has access to protect their home with an affordable roof. We have amazing culture, great founders, and strong financials (profitable unit economics, strong revenue growth and best-in-class company metrics - including CAC payback of a few months!!). This is a great opportunity to be a part of an extraordinary start-up that is already successful, yet early enough to offer its team members significant growth, equity, and an opportunity to make an impact.Building a powerful user experience is what sets Roofr apart from all other roofing platforms. As an Engineer in an early stage and high growth company, you will have a large impact on both technical implementation and help steer our technology roadmap.What You'll Get to Do: Interpret data and analyze results and provide ongoing and expanding reportingImplement, maintain, clean, and transform data sources into well organized data structures for fast, repeatable reporting and analysisCleaning and reorganizing data for analysisIdentify, analyze, and interpret trends or patterns in complex data setsPresenting findings in an easy-to-understand way to inform data-driven decisionsWhat You'll Bring to the Role: 4+ years of proven working experience as a Data Analyst or Business Data AnalystTechnical expertise regarding data models, database design development, data mining and segmentation techniquesStrong knowledge of and experience with reporting packages (Metabase, Tableau, Looker, Business Objects, etc), databases (PostgreSQL, MySQL, SQL etc), programming (Python, Javascript, or ETL frameworks)Strong analytical skills with the ability to collect, organize, analyze, and disseminate significant amounts of information with attention to detail and accuracyWho You Are: A strong communicator with great presentation skillsAnalytical with a demonstrated ability to utilize data to make informed decisionsHighly organized and able to prioritize and juggle multiple projects at onceYou are a critical thinker who doesn't settle for the status quoYou are obsessed with customer experienceWhat we offer: When you join our team, you're not just accepting a job. You're making a career move. Here's how we'll support you in doing some of the most impactful work of your career:Start your journey with Roofr with 1 week of paid vacation1 Friday off per month (we call those our laundry days!)Flextime, recognition, and support for autonomous work: Flexible time off with ample learning and development opportunities to continue growing your careerCompetitive compensation and equityRemote-first culture with home office set-up & internet reimbursementHolistic health benefits from day 1;and wellness benefits: Company-paid medical, dental, and visionMonthly coworking space reimbursementEven if we are remote, we still manage to host 2 killer retreats per year and great team building activities!At Roofr, we celebrate individuality and uniqueness. Roofr is proud to be an equal opportunity employer. We are committed to building an organization that empowers inclusion and diversity. We encourage candidates and employees to be true to themselves and express all aspects of their identities. We believe that the convergence of fresh perspectives and experiences from all walks of life is what makes our product and culture so great. We do not discriminate against employees based on race, color, religion, sex, national origin, gender identity or expression, age, disability, pregnancy (including childbirth, breastfeeding, or related medical condition), genetic information, protected military or veteran status, sexual orientation, or any other characteristic protected by applicable federal, state or local laws.Job Type: Full-time",,,2022-09-03T00:00:00,2022-10-16,FULL_TIME
Senior Data Analyst,Manulife,Ontario,Toronto,-1,-1,,CAD,"Are you looking for a supportive, collaborative workplace with great teams and inspiring leaders? You’ve come to the right place. We’re looking for ambitious people who share our values and want to make every day better for people around the world. If this sounds like you, and the career below sounds exciting, we’d like to hear from you.
Working Arrangement
Hybrid
Job Description
The Opportunity
As a member of the GWAM Data Engineering team within the Global Wealth and Asset Management division, the Senior Data Analyst role is responsible for working with the Data Management and Delivery team, as well as other project teams, to ensure the data components of solutions provide the appropriate value to the business users, and are aligned with the organization’s Information Management Program.

Responsibilities
Deliver flexible, reusable and well-maintained core data repositories
Use accelerated delivery methodologies to ensure data initiatives provide timely business value
Develop and maintain expertise in the Investment domain, as well as expertise in accessing, querying, testing and validating data content to drive quality and consistency within solutions
Partner with the Data Governance group to establish appropriate standards and methodologies, template and tools related to documenting, analyzing and testing data - work with management to implement these standards within the IS and Data Governance organizations
Developing templates and methodologies to ensure data requirements are accurately and completely captured and can be effectively communicated to other data stakeholders, including Business Users, Business Architects, Business Analysts, Solutions Architects, Solutions Developers, Quality Assurance Analysts, Data Governance and Data Management Staff
Ensuring the proposed technical solutions effectively meet the business need
Conducting data profiling to analyze quality of incoming data and advising on any data cleansing rules
Assisting in the creation of business glossaries (data dictionaries)
Collaborating with the QA group to develop methods to test data components
Evaluating existing and proposed data models and how to best access and query them
Evaluating existing and proposed data interfaces and how to clearly document them, including specification of data flow models, data flow timing, source-to-target mapping, and data transformation rules including data validations and controls
Keeping current on evolving Investment business knowledge domains to accurately assess the quality of the data
Providing guidance to project teams via peer reviews

What motivates you?
You obsess about customers, listen, engage and act for their benefit.
You think big, with curiosity to discover ways to use your agile approach and enable business outcomes.
You thrive in teams and enjoy getting things done together.
You take ownership and build solutions, focusing on what matters.
You do what is right, work with integrity and speak up.
You share your humanity, helping us build a diverse and inclusive work environment for everyone.

What we are looking for
5-10 years related experience in working with Investment domain data and Data Management solutions
Experience with data-centric projects delivering the following (within a capital markets or investment banking domain): Master data management, Data integration, Data warehousing and reporting. Big Data environment for analytics
Significant experience in major trading platforms, book of record systems, performance management platforms, such as Bloomberg Polar Lake, SimCorp Dimension, Findur, Apex, Eagle, Charles River, Sylvan, Calypso
Experience delivering data documentation artifacts in organizations of similar size and complexity within project deadlines
Experienced writing complex SQL queries to analyze data and provide results to business users or project team members
Able to communicate clearly, both verbally and in written form at various levels within the project teams
Strong work ethic, results oriented, and accuracy / attention to detail are critical
Demonstrated initiative, able to work both independently and as a team member
Able to clearly communicate complex methodologies and approaches to stakeholders, peers and management
Able to work in agile or scrum delivery environments
Good understanding of techniques and tools pertaining to the planning, analysis, design, development, testing, deployment and maintenance of technology solutions
Some exposure to Azure

What can we offer you?
A competitive salary and benefits packages.
A growth trajectory that extends upward and outward, encouraging you to follow your passions and learn new skills.
A focus on growing your career path with us.
Flexible work policies and strong work-life balance.
Professional development and leadership opportunities.

Our commitment to you
Values-first culture: We lead with our Values every day and bring them to life together.
Boundless opportunity: We create opportunities to learn and grow at every stage of your career.
Continuous innovation : We invite you to help redefine the future of financial services.
Delivering the promise of Diversity, Equity and Inclusion: We foster an inclusive workplace where everyone thrives.
Championing Corporate Citizenship: We build a business that benefits all stakeholders and has a positive social and environmental impact.
Every career at Manulife/John Hancock provides the opportunity to learn new skills and move your career forward. Ready to make an impact somewhere? What are you waiting for? Apply today.
About John Hancock and Manulife
John Hancock is a unit of Manulife Financial Corporation, a leading international financial services group that helps people make their decisions easier and lives better. We operate primarily as John Hancock in the United States, and Manulife globally, including Canada, Asia and Europe. We provide financial advice, insurance and wealth and asset management solutions for individuals, groups and institutions. Assets under management and administration by Manulife and its subsidiaries were CAD$1.3 trillion (US$1.1 trillion) as of June 30, 2021. Manulife Financial Corporation trades as MFC on the TSX, NYSE, and PSE, and under 945 on the SEHK. Manulife can be found at manulife.com .
One of the largest life insurers in the United States, John Hancock supports more than 10 million Americans with a broad range of financial products, including life insurance , annuities , investments , 401(k) plans , and education savings plans . Additional information about John Hancock may be found at johnhancock.com .
Manulife is an Equal Opportunity Employer
At Manulife /John Hancock , we embrace our diversity. We strive to attract, develop and retain a workforce that is as diverse as the customers we serve and to foster an inclusive work environment that embraces the strength of cultures and individuals. We are committed to fair recruitment, retention, advancement and compensation, and we administer all of our practices and programs without discrimination on the basis of race, ancestry, place of origin, colour , ethnic origin, citizenship, religion or religious beliefs, creed, sex (including pregnancy and pregnancy-related conditions), sexual orientation, genetic characteristics, veteran status, gender identity, gender expression, age, marital status, family status, disability, or any other ground protected by applicable law.
It is our priority to remove barriers to provide equal access to employment. A Human Resources representative will work with applicants who request a reasonable accommodation during the application process . All information shared during the accommodation request process will be stored and used in a manner that is consistent with applicable laws and Manulife/John Hancock policies . To request a reasonable accommodation in the application process, contact recruitment@manulife.com .",Finanzas,,2022-09-01T00:00:00,2022-10-16,FULL_TIME
Data & Analytics - Senior Analytics Engineer,Aritzia,British Columbia,Vancouver,-1,-1,,CAD,"THE TEAM
The mission of the Analytics Department is to provide the business with actionable and accurate information to enable data-driven decision-making.
THE OPPORTUNITY
Aritzia is experiencing exponential growth, and the Data & Analytics team is growing with it. This is a unique opportunity to join the Analytics Engineering Department, where you will transform raw data in a modern platform and create models that empower self-serve analysis, reporting, and data science. As the Senior Analytics Engineer, you will support and enable the business, apply data modeling expertise, and become the data domain go-to person. And with the skills you gain in this role the opportunities are endless, from a rewarding career in Data & Analytics to continued growth at Aritzia.
THE ROLE
As the Senior Analytics Engineer, you will lead and be involved in:
Develop complex SQL transformations to create beautifully designed and widely used data models
Embed and enrich business logic to unify the analysis of cross functional teams
Design and recommend data model structure and flow
Review and approve model changes and be the technical owner for specific data sub-domains
Create in Google Cloud Platform and Dataform (Google’s version of DBT)
Contribute to and leverage the best practices and standards of analytics engineering
THE QUALIFICATIONS
The Senior Analytics Engineer has:
Proven skills, education, and/or applicable certifications in:
Excellent SQL skills with the ability to create efficient data models, applied to cloud data warehousing in particular
Strong business modelling skills: going from expressed requirements to an actual data model
Varied design options of reshaping data tables
Modern cloud data platforms such as GCP, MS, AWS
Object-oriented programming (OOP) understanding
SAP HANA data environment is a plus
An enthusiastic approach to taking on new opportunities and challenges
The ability to collaborate fluently with cross-functional partners
A commitment to learn and apply Aritzia's Business and People Leadership principles
THE PERKS
Some of the industry-leading benefits you will receive working at Aritzia:
Flexible Working Model - The option to work Remotely, On-site, or Hybrid in Canada
A-OK Commissary & Café - Our in-office, world-class bistro and café
The SET - Our in-house gym, with state-of-the art equipment and custom classes
Dog Friendly Office - Bring your best friend to work
Product Discount - Our famous product discount, online and in store
ARITZIA
Aritzia is an Equal Employment Opportunity employer. Our goal is to be inclusive, diverse, and representative of the communities where we work while creating an environment where every person can enjoy a successful career. This commitment applies to all candidates and employees regardless of race, ethnicity, citizenship, creed, place of origin, religion, sex, gender identity, gender expression, sexual orientation, family status, marital status, disability, age, and any other protected characteristic.
Requests for accommodation due to a disability or any other protected characteristic can be made at any stage of the recruitment process and during employment by contacting our People & Culture Team.",Ventas al mayoreo y al menudeo,,2022-09-03T00:00:00,2022-10-16,FULL_TIME
