Job_title,Company,State,City,Min_Salary,Max_Salary,unitText,SalaryCurrency,Job_Desc,Industry,Rating,Date_Posted,Valid_until,Job_Type
Senior Data Scientist - Voice Transcription,Global Relay,British Columbia,Vancouver,-1,-1,,CAD,"Who we are:

For over 20 years, Global Relay has set the standard in enterprise information archiving with industry-leading cloud archiving, surveillance, eDiscovery, and analytics solutions. We securely capture and preserve the communications data of the world's most highly regulated firms, giving them greater visibility and control over their information and ensuring compliance with stringent regulations.

Though we offer competitive compensation and benefits and all the other perks one would expect from an established company, we are not your typical technology company. Global Relay is a career-building company. A place for big ideas. New challenges. Groundbreaking innovation. It's a place where you can genuinely make an impact – and be recognized for it.

We believe great businesses thrive on diversity, inclusion, and the contributions of all employees. To that end, we recruit candidates from different backgrounds and foster a work environment that encourages employees to collaborate and learn from each other, completely free of barriers.

We encourage you to apply if your qualifications and experience are a good fit for any of our openings.
Your Role:

As a Senior Data Scientist in the AI group, you will be building machine learning and speech recognition solutions for Global Relay's customers. You will be applying a wide variety of models to very large audio communication archives in order to recognize and transcribe communication content. This is a new and exciting activity for Global Relay's customer business so this is a great time to join.


Your Job:

Working closely with other data scientists and developers in building and deploying various machine learning models for Global Relay's customers
Being a subject matter expert on current speech transcription and speaker identification techniques
Interacting with product managers on enhancements to our core products
Executing all steps in the data science process from understanding business requirements to deploying models
Producing reports detailing model performance

About You:

5+ years of experience with solving machine learning problems
Experience working with very large data sets in an enterprise-wide application environment
Python and Bash experience
Knowledge of common machine learning libraries such as: Scikit-learn, TensorFlow, PyTorch, HTK, Kaldi, Julius, Sphinx and others
Knowledge of signal processing methods for audio processing and time series analysis
An understanding of different neural network architectures as applied to speech recognition such as: Attention-based models, RNNs and CNNs
Strong organizational and communication skills

Nice to Haves:

MSc or PhD in a STEM or Linguistics subject
Data collection and cleaning experience
Data engineering skills
Experience building acoustic or language models for speech recognition
Experience with:
Natural language processing models
Kubernetes and micro services
Working in an agile development environment

What you can expect:

At Global Relay, there's no ceiling to what you can achieve. It's the land of opportunity for the energetic, the intelligent, the driven. You'll receive the mentoring, coaching, and support you need to reach your career goals. You'll be part of a culture that breeds creativity and rewards perseverance and hard work. And you'll be working alongside smart, talented individuals from diverse backgrounds, with complementary knowledge and skills.

Global Relay is an equal-opportunity employer committed to diversity, equity, and inclusion.

We seek to ensure reasonable adjustments, accommodations, and personal time are personalized to meet the unique needs of every individual.

We understand flexible work arrangements are important, and we encourage that in our work culture. Whether it's flexibility around work hours, workstyle, or lifestyle, we want to ensure our employees have a healthy work/life balance. We support and value a hybrid work model that blends collaboration with the team in the office and focus time from the comfort of your home.

To learn more about our business, culture, and community involvement, visit www.globalrelay.com.",Tecnologías de la información,,2022-09-12T00:00:00,2022-10-16,OTHER
Senior Data Scientist,Jerry,,,-1,-1,,CAD,"We’d love to hear from you if you are looking for a tech company with the following:
Huge market ($2T billion market size), we are building the first AI-powered super app to help people owning a car
Innovative product with the combination of cutting edge mobile, AI, and big data technologies
Start-up energy - come join one of LinkedIn’s Top 50 Tech Start-ups
Hypergrowth - 17x revenue growth in the past two years
Best user experience: #1 ranked app in the insurance comparison category
Strong leadership: from Amazon, Microsoft, Facebook, Nvidia, Alibaba, etc. and experienced colleagues
Here at Jerry, we think owning a car should be as easy as taking a drive.
About the Opportunity:
The Data and Analytics (DNA) team owns data at Jerry and drives intelligent business decision making through analytical insights and advanced models. The DNA team is seeking an exemplary data scientist to accelerate the company’s continuous growth and take its customer experience to the next level.
As a data scientist, you bring your expertise in product and user analytics to Jerry. You will lead the design and development of A/B tests and analytical models to understand user experience and drive feature and design decisions. You will join a team of data engineers, data analysts and data scientists. We are passionate about our mission to build a car ownership super app. We work hard and we also like to have fun.
How you will be contributing:
Lead the design and development of A/B tests on app features and user experience
Produce research projects to recommend business strategies
Define data science standards and best practices and drive operational excellence
Partner with product managers to advise product decisions
Partner with and mentor data analysts to build reports and visualization
Partner with other data scientists to evolve, optimize and integrate machine learning models
About you:
Master’s degree in a highly quantitative field (Computer Science, Mathematics, Statistics, Operational Research, Machine Learning, etc.)
3+ years of experience as a data scientist or in a similar role
2+ years of experience with scripting languages (Python, Java, etc.) or statistical packages (R, SAS, Matlab, etc.)
Hands-on experience of SQL
Proven experience in designing and implementing A/B tests and other user researches
Proven ability in effective verbal and written communication to technical peers and leadership teams with various degrees of technical knowledge
A few more specifics about you:
Doctoral degree in a highly quantitative field (Computer Science, Mathematics, Statistics, Operational Research, Machine Learning, etc.)
3+ years of experience as a data scientist with a consumer-facing technology company
2+ years of experience as a data scientist working on user acquisition and retention initiatives
Experience with web and app user experience analysis
2+ years of experience working on machine learning models
Experience in analytical and visualization platforms (Tableau, Qlik, Power BI, etc.)
Experience providing technical leadership and mentorship
About Jerry:
Jerry is building the first Super App to save car owners time and money on all their car expenses. Drivers deserve better. That’s why we’re committed to making shopping for insurance, financing, maintenance, repairs, parking and more just a few clicks, texts, or swipes away.
Jerry is taking processes that haven’t substantively changed in decades and reimagining and redesigning them. Using artificial intelligence, machine learning and bots, Jerry eliminates the need for long forms and phone calls while providing personalized services for all car-owners’ needs.
Today, Jerry is the #1 rated and most downloaded app in its category and the fastest way to compare and buy car insurance. We have more than 2M customers and we are just getting started. Join our team of curious and passionate people who love tackling real-world problems and be a part of building a revolutionary product that’s disrupting a massive market.
Jerry was founded in 2017 by serial entrepreneurs and has raised more than $130 million in financing.",Seguros,,2022-08-17T00:00:00,2022-10-16,FULL_TIME
Senior Data Scientist (BHJOB13022_12395),Ignite Technical Resources.,British Columbia,Richmond,-1,-1,,CAD,"Senior Data Scientist – Contract position in Richmond (Hybrid):

On behalf of our client in Richmond, Ignite Technical Resources is looking for a Senior Data Scientist with our client for a contract opportunity.

Role Description:
The successful candidate will be responsible:
To further the knowledge base of company with exploratory and iterative data science programs.
To solve extraordinarily complex business problems by providing solutions, using advanced data analysis techniques.
To explore and extract value from internal and external data sets in support of prioritized high-value opportunities for our company.
To identify and refine further high value ideas and hypotheses for next iterations of learning, to continuously strengthen data science in the company.

Responsibilities:
Explore and extract maximum value out of company data and its wider internal and external systems, including both existing and potential sources of company. This will span systems relating to customer and financial management, supply chain and production data.
Contribute to knowledge base of company Data and Data Science, Hub-based company’s Target Architecture and other relevant knowledge bases.
Developing and implement appropriate data science models, and controls that are transferrable and usable by other data science team members and are therefore well documented and shared.
Comply with up-to-date data security, privacy (GDPR) and information data governance rules.
Check all models and recommendations against common sense and ethics standards, to avoid inherent bias and discrimination, and flag warnings and caveats as needed.
Time-box exploration of topics to test and learn quickly and move on to next hypothesis if progress is slowed, keep to deadlines and flag challenges early.
Produce regular progress reports, explaining progress in clear, concise, and illustrated manner, ready for internal sharing and reporting.
Provide cleaned data to help create new or help amended processes, tools and data science services.
Engage with up-to-daters to ensure their buy-in of changes that are being proposed and they understand how to use and monitor new tools, reports and processes.
Engage with 3rd parties in a manner that complies with all internal policies, collaborating and driving commercial success of all 3rd party engagements.
Spend an agreed amount of time staying abreast of new data science trends, benchmarking reports, conferences and explore these for the benefit of company’s value generation.
Maintaining the relevant Data Science sections on SharePoint.

Requirements:
Educated to degree in a numerate discipline or equivalent.
Extensive experience in artificial intelligence and machine learning techniques.
Experience in usage of relevant software packages such as Amazon Sage Maker, TensorFlow, Spark, Microsoft Azure and equivalent.
Working knowledge of data science languages such as SQL, PowerShell, R and/or Python.
Ability to use advance analytical techniques in a sensible pragmatic way and understand their limitations and future potential, keeping up to date with current developments.
Ability to develop accurate models from first principles and be able to sense-check outputs (common sense).
Exceptional attention to detail.
Strong oral and written communication skills in MS Office.
Knowledge of processes from an operational department.
In addition to technical and analytical ability, you need to demonstrate capability in dealing with a wide variety of types of people and ad-hoc projects.
You need to act with quality in mind with the drive to push forward projects to completion.
Taking accountability for areas covered by the Data Science team, monitoring performance, clearly communicating issues, developing and recommending changes where appropriate.
Ensuring that strong links are maintained between the company’s matrix teams and Data and Data Science Directorate.
Needs to be assertive, and emotionally intelligent, to deal with any potentially conflicting internal agendas.

Our Values:
Honest – Simple, secure, set of services and solutions that make life simple for everyone.
Energized – Delivered at speed, with empowered, talented people that are not afraid to seek forgiveness.
Achieve – World class digital solutions that generate measurable value for colleagues, customers, and shareholders.
Together – Using our group wide diversity and skills to work together, disrupt and win.
Due to the volume of resumes, only those candidates being considered will be contacted.

Based in Vancouver and proudly Canadian, Ignite Technical Resources has been providing Top Technical Talent to organizations across Canada since 2005.

Ignite. Wired for people.

Follow Ignite on Twitter @ignitetechnical and become a fan on Facebook for up-to-date information about our company including job postings!

About Ignite Technical Resources.:

Founded in 2005 and headquartered in Vancouver BC, Ignite Technical Resources has been the preferred IT Staffing provider for many of Canada’s largest and well-known organizations for over 15 years.By specializing in Information Technology, we ensure that our processes are focused exclusively on providing qualified IT Professionals and our commitment to speed ensures your teams and projects are staffed quickly and efficiently. Our years of experience provide us with one of the most well-developed networks of candidates in the Canadian market. Come see why Ignite Technical is one of Canada’s premier providers of IT Professionals On-Demand.Ignite Technical Resources – Your Source for Top Talent",Recursos humanos,,2022-09-16T00:00:00,2022-10-16,OTHER
"Sr. Data Scientist, International Growth (Market Insights)",Reddit,Ontario,Toronto,-1,-1,,CAD,"Our mission is to bring community and belonging to everyone in the world. Reddit is a community of communities where people can dive into anything through experiences built around their interests, hobbies, and passions. With more than 50 million people visiting 100,000+ communities daily, it is home to the most open and authentic conversations on the internet. From pets to parenting, skincare to stocks, there's a community for everybody on Reddit. For more information, visit redditinc.com.
Our mission is to bring community and belonging to everyone in the world. Reddit is a community of communities where people can dive into anything through experiences built around their interests, hobbies, and passions. With more than 50 million people visiting 100,000+ communities daily, it is home to the most open and authentic conversations on the internet. From pets to parenting, skincare to stocks, there's a community for everybody on Reddit. For more information, visit redditinc.com.

The International Growth team is a tight-knit, true zero-to-one team at Reddit focused on entering markets outside of the US. If delving into different countries and cultures excites you and you're motivated by how they might use the 4th most popular website in the world, then you've found the right place! We have one of the highest user:employee ratios in the industry, giving you a tremendous opportunity for scope and impact.

Reddit is continuing to grow our teams with the best talent. We're completely remote friendly and will continue to be after the pandemic.

How You'll have Impact:

You will partner directly with our local market as well as content curation teams to help surface key first party data points in a country and drive a holistic picture of what is happening in a market. This may include surfacing key user demographics and valuable segments, an overview of the growth and content funnels, visibility on key insights related to the content distribution, supply and demand (topics, language, etc) of a given geography, etc. You'll also work collaboratively with other Data Science and Machine Learning teams such as Marketing Data Science and Content Analytics to evaluate the performance of in-market actions and to leverage their assets (automated content classification, etc). You will be part of key decisions to drive user centricity and accelerate user growth abroad.

What You'll Achieve:

Partner with local market teams to surface key insights and analytical findings that will help accelerate growth in a specific country
Deliver key dashboards for local teams to scale data findings and unlock the ability for key regions to make timely decisions
Work cross functionally with Content Analytics and Marketing Data Science teams to elevate insights that can inform future country-specific marketing strategies (content and community creation, local campaigns, etc.)
Be the expert on country-level metrics around growth metrics and user segmentation
Define team metrics and goals and work with the Data Warehouse team to create ETLs (extract/transform/load) and reporting dashboards

Who You Might Be:

6+ years of experience in quantitative analytical roles, preferably for growing at-scale consumer products outside the US
Experience working with Market Directors, Content Curation, or Marketing teams preferred
Proficiency with relational database (e.g., SQL)
Familiarity with statistical analysis and programming languages (e.g., R / Python)
Results-oriented with a strong customer and business focus
Entrepreneurial and self-directed, demonstrated ability to innovate and bias toward action in fast-paced environments.
Ability to communicate and discuss complex topics with technical and non-technical audiences
Ability to tackle ambiguous and undefined problems

#LI-NH1 #LI-Remote
Reddit is committed to providing reasonable accommodations for qualified individuals with disabilities and disabled veterans in our job application procedures. If you need assistance or an accommodation due to a disability, please contact us at ApplicationAssistance@Reddit.com.",Tecnologías de la información,,2022-09-01T00:00:00,2022-10-16,OTHER
"Senior Data Scientist, Computer Vision",Zesty.ai,,,-1,-1,,CAD,"Events in recent years have made us all too familiar with the havoc that natural disasters can wreak, and the increasing frequency and intensity with which they are occurring. Despite record levels of losses, conventional methods of risk modeling continue to paint at best an incomplete picture of these threats.

Zesty.ai uses novel data gathering and data science methods to produce higher quality information about the risks to property from catastrophes like floods and wildfires. While AI alone may not be able to thwart these disasters, it can help us become more prepared for them, and ultimately that will lead to better outcomes.

As a Senior Data Scientist - Computer Vision, you are comfortable and excited to work closely with the engineering team to build the best AI tech possible. You will scale the development of top-tier models by using diverse data sources to provide strong insights and maximize the impact of our company efforts. You thrive in a collaborative, creative environment that moves fast and are comfortable setting in place structures and processes to help the company scale.

The Opportunity:

Explore data sets and develop new Property Tech and InsurTech models with data science (Machine learning, Deep learning).
Help direct and scope machine learning projects in conjunction with the product team and data science leadership
Coach and provide feedback to other members of the Machine Learning team across the US/Canada
Develop computer vision algorithms that extract insights from aerial imagery, satellite imagery and geospatial data
Research and model aspects of the built environment utilizing aerial imagery, satellite imagery and other datasets
Help develop training and cross-validation data sets for machine learning algorithms
Translate product management, engineering, and business constraints and queries into tractable data science questions

What You Bring to the Zesty.ai Team:

Experience working with deep learning / neural network models (using TensorFlow, PyTorch, Keras, Caffe)
Experience working with computer vision and building and testing computer vision systems
Experience deploying machine learning models in production environments
BA / BS / BEng degree in Math, Physics, Computer Science, Engineering, or Economics. MS degree or Ph.D. is certainly a bonus
Strong organizational and management skills with past experiences implementing best practices and processes
Experience working with large image datasets (great if you've already worked with satellite imagery and related tools OpenCV, Pillow, etc.)
Proficient in SQL
Experience working with cloud platforms (AWS, Google Cloud, etc)
Must be legally eligible to work in Canada

Why Zesty.ai:

Be part of a well-funded growth-stage start-up
Market competitive comp and equity incentives to give you a stake in our future
Comprehensive health care plan
Flexible Time Off
An upbeat and collaborative work culture
Company-sponsored outings and offsites",Tecnologías de la información,,2022-09-15T00:00:00,2022-10-16,OTHER
Senior Data Analysts,Dawn InfoTek Inc.,Ontario,Midtown Toronto,-1,-1,,CAD,"Dawn InfoTek Inc. is a professional IT consulting team that partners with major financial institutions, investment firms and government sectors. We have been dedicated to delivering cutting-edge consulting services and recruiting all levels of IT positions for our clients.We are currently seeking competent individuals to fulfill the role of Sr. Data Analyst to join our dynamic team for our client, one of the major banks.Contract Duration: ASAP until 10/31/2022Extension Opportunity: PossibilityFTE Opportunity: YesResponsibilities: Champion a customer focused culture to deepen client relationships and leverage broader Bank relationships, systems and knowledgeEstablish partnership with the business stakeholders to formulate Business RequirementsDocument and follow an Agile delivery approach (Recurring development cycle)Create Power BI dashboards to share data insights with the business, builds data features used for modeling, reporting and advanced analyticsBuild and maintain proper documentation, data lineage and extract-transform-load (ETL) processes.Use statistical tools to identify, analyze, and interpret patterns and trends in complex data sets that could be helpful for the diagnosis and predictionUnderstand how the Bank’s risk appetite and risk culture should be considered in day-to-day activities and decisionsActively pursues effective and efficient operations of their respective areas in accordance with Scotiabank’s Values, its Code of Conduct and the Global Sales Principles, while ensuring the adequacy, adherence to and effectiveness of day-to-day business controls to meet obligations with respect to operational, compliance, AML/ATF/sanctions and conduct riskCandidate Requirements/Must-Have skills: 1. 5-7+ years of working experience as a Data Analyst, Business Data Analyst, and/or Data visualization analyst2. Hands-on programming experience and advanced knowledge of SQL3. Experience with agile methodologies, implementing and managing visualization tools such as Power BI, or TableauNice to Have Skills: Advanced knowledge of programming languages such as Python or JavaSoft Skills: Strong analytical skills with the ability to collect, organize, analyze, and disseminate significant amounts of information with attention to detail and accuracyAbility to be work independently and able to work on teams cross-functionallyExceptional written and oral communication skillsAbility to present complex information in a simplified way to various audiencesEducation:Advanced University degree in relevant STEM discipline (Computer Sciences, Computer/ Software Engineering, Mathematics, Statistics, Economics)Job Type: Full-timeSalary: $55.00-$75.00 per hourAbility to commute/relocate:GTA, ON: reliably commute or plan to relocate before starting work (required)",Tecnologías de la información,,2022-08-24T00:00:00,2022-10-16,FULL_TIME
