Job_title,Company,State,City,Min_Salary,Max_Salary,unitText,SalaryCurrency,Job_Desc,Industry,Rating,Date_Posted,Valid_until,Job_Type
Senior Machine Learning Engineer,Loblaw Digital,Ontario,Toronto,-1,-1,,CAD,"At Loblaw Digital, we know that our customers expect the best from us. Whether that means building the best, most innovative online shopping experiences, or designing an app that will impact the lives of people across the country, we’re up for the challenge. Loblaw Digital is the team responsible for building and operating the online businesses of Canada’s largest and most successful retailer. Based in downtown Toronto, we are an entrepreneurial, fast-paced, and collaborative team working towards transforming the way Canadians shop by creating leading eCommerce experiences in the online grocery shopping, beauty, pharmacy, loyalty, and apparel spaces, and we’re only just getting started! To achieve these goals, we are looking for talented and passionate individuals who want to collaborate and solve challenging problems and make significant and lasting impact on Canadians.
As a Senior Machine Learning Engineer on our team, you will build data science products that helps us build a better fulfillment platform that
improves our customers’ experience as well as the efficiency of our colleagues working in store operations. Leveraging the wealth of operational data available you’ll focus on delivering solutions that predict, forecast & optimize how we manage our inventory operations and our fulfillment strategy to provide a fulfillment experience that balances a complex trade-off between ensuring millions of Canadians who shop with us get their orders in a timely fashion and ensuring our operational & fulfillment costs stay low.
Your work requires communicating with an array of business stakeholders across Store Operations, Fulfillment Software Engineering Teams, Product Management, and Online Analytics to name a few primary ones. From brainstorming on numerous options to solve a problem, through deploying the completed solution in a production environment, you will partner with colleagues who offer a diverse set of ideas that are all immensely valuable to our purpose and mission.
What You Will Do
Drive solutions for our businesses, providing carefully designed approaches using your technical skills combined with an ability to inspire the more junior members of the team, with a focus on owning pieces of our solution space
Communicate cross-functionally with business teams — Product, Store Operations, Fulfillment Specialist, Store & Area Managers— to source data, establish requirements and define success
Code robust, scalable, high-performance ML solutions based on massive structured and unstructured datasets from various sources
Collaborate with Engineering and Data Platform teams to build and deploy your ML models into production
Design experiments to measure the effectiveness of your product in driving a seamless fulfillment experience through key metrics such as labour rate, pick efficiency, orders ready of time, fill rate etc.
Document and share, findings and results in a structured manner with stakeholders, as well as drive technical discussions with other Data Science teams
What We Need
MS or Ph.D. in a STEM field — especially computer science — or BS plus equivalent work experience in a Data Scientist or a closely related role
A portfolio including work in the domain of data science and ML with a focus on predictive analytics, forecasting, operations research & supply chain optimization
Ability to deal with some uncertainty and take the lead in designing individual components that sit together in the technical solution architecture
Creative, resourceful, and productive problem-solver
Passion for applying data science to dynamic open-ended problems
Able to work independently and collaboratively
Comfortable with advanced SQL querying
Proficient in Python programming
Experience in shell scripting/unix
Experience with big-data tools, e.g. Spark, Beam, Kafka
Experience with Airflow for workflow scheduling
Experience with or working knowledge of a public cloud AWS, GCP, Azure
Experience with or knowledge of software development best practice
How you’ll succeed
At Loblaw Digital, we seek great people to continually strengthen our culture. We believe great people model our values, are authentic, build trust and make connections. We’re able to keep innovating because our colleagues are passionate about their work and excited about the future of eCommerce. You will get to work with some of the best digital minds and will have the support of world class technologies to craft products our customers will love!
Loblaw Digital recognizes Canada's diversity as a source of national pride and strength. We have made it a priority to reflect our nation’s evolving diversity in the products we sell, the people we hire, and the culture we create in our organization. Accommodation is available upon request for applicants with disabilities in the recruitment and assessment process and when hired. In addition, we believe that compliance with laws is about doing the right thing. Upholding the law is part of our Code of Conduct – it reinforces what our customers and stakeholders expect of us.",Tecnologías de la información,,2022-09-13T00:00:00,2022-10-16,FULL_TIME
Junior to Senior Data Geoscientist,SRK Consulting,Ontario,Toronto,-1,-1,,CAD,"Our North American geology group is one of the largest within SRK, with a diverse cross-section of structural geologists, resource geologists, and geostatisticians. As a junior- to senior-level consultant within this team, your general responsibilities will include the completion of data science projects applied to mining-related geoscience. Our work incorporates data processing, data analysis and the implementation of machine learning models applied from early exploration through mining project development (including resource and engineering studies) to operational support.An important aspect of working for SRK will be the development of your consultancy. We encourage all engineers and scientists to grow their consulting skills under the broad SRK umbrella; the successful applicant will therefore be expected to establish and maintain client relationships.A postgraduate degree specializing in the application of advanced statistical analysis and/or machine learning to geoscienceMining / metals exploration experienceProfessional membership of the Association of Professional Geoscientists of Ontario (APGO) or the Professional Engineers of Ontario (PEO), or eligibility to obtain itA strong theoretical background with demonstrated competence in defining applied solutionsProficiency with a scientific coding language and with data-science and/or machine learning packagesProven ability to work independently and as part of a team to generate, implement, and complete projectsStrong written and verbal communication skillsAdditional Beneficial Experience: An undergraduate degree in geologyProficiency with GIS and/or 3D modeling softwareExperience in economic geology, structural geology, geostatistics, geochemistry and/or geophysicsExperience with modern, implicit modelling tools and/or geophysical interpretationPrior consulting experienceIn this position, you will work in multidisciplinary teams on projects around the world and may be required to travel internationally.Job Types: Full-time, Permanent",Administración y consultoría,,2022-09-15T00:00:00,2022-10-16,FULL_TIME
Staff Machine Learning Infrastructure Engineer,Forethought,Ontario,Toronto,-1,-1,,CAD,"Founded by a team of Facebook, Dropbox, and LinkedIn alumni in 2017, Forethought's mission is to ""unlock human potential through AI."" Forethought is a leading AI company providing human-centered AI solutions that transform the customer experience. Our products enable seamless customer experiences by infusing intelligence at each stage of the customer support journey: resolving common cases instantly, predicting and prioritizing cases, and assisting agents with relevant knowledge—all from one AI platform.

Forethought has grown 22x in the past two years and has raised over $92M in VC funding from top investors including STEADFAST Capital Ventures, New Enterprise Associates (NEA), Ashton Kutcher and Guy Oseary's Sound Ventures, Gwyneth Paltrow, NBA Vet Baron Davis, Robert Downey Jr., Sean ""Diddy"" Combs, LL Cool J, and the CEOs of Robinhood, Carta, and Qualtrics. In 2018, Forethought launched and won at TechCrunch Disrupt—the world's most prestigious startup competition—and was featured in Forbes 30 Under 30. More recently, Forethought was listed as one of Forbes' Next Billion-Dollar Startups.
We're looking for world-class Machine Learning Infrastructure Engineers to join our team! We're looking for folks with a growth mindset who love to solve the world's hardest problems and want to have an impact on the world by building next-generation AI solutions for customer support.

As a member of the infrastructure team, you will focus on applying MLOps methodologies with infrastructure that enables machine learning product teams to develop advanced NLP solutions that power state-of-the-art models for our customers. This includes deploying and maintaining a next-generation experimentation platform for our Machine Learning Engineers to experiment with the latest technologies.

What You'll Be Doing (Responsibilities):

Design, build and maintain optimized and scalable ML platforms for machine learning and data science teams.
Design and develop production backend microservices and infrastructure to perform scalable machine learning training and inference and monitoring in the cloud.
Build and manage a next-generation ML experimentation platform for our Machine Learning Engineers and Scientists.
Deploy and manage third-party annotation solutions to empower engineers to collect, sanitize and, anonymize the data needed for training.
Participate in building data pipelines going from our databases into data lakes.

Who You Are (Skill):

5+ years of experience in software engineering
Proficiency in writing production-quality code in Python
Good understanding of large-scale processing frameworks such as Kafka, Spark, sparkSQL, and Airflow
 Familiarity with Ray, Kubeflow, MLFlow, and AWS Sagemaker or GCP AI Platform
Familiarity with containerization, MLOps, and DevOps (Docker, Kubernetes)
Familiarity with Terraform for Infrastructure as Code

What You Get (Benefits):

A chance to be an early member of a hyper-growth startup with equity to match
An opportunity to help us define a new market within AI
Ability to solve challenging problems with a world-class team
A low-ego company culture that is obsessed with feedback and helping each other grow
Hybrid work structure that allows you to choose where you get your best work done
Competitive medical, dental, and vision coverage
Paid maternity, paternity, & adoption leave
Unlimited paid time off",Tecnologías de la información,,2022-09-15T00:00:00,2022-10-16,OTHER
Power BI Developer,White Cap,Ontario,Vaughan,-1,-1,,CAD,"A position at White Cap isn’t your ordinary job. You’ll work in an exciting and diverse environment, meet interesting people, and have a variety of career opportunities.
The White Cap family is committed to Building Trust on Every Job. We do this by being deeply knowledgeable, fully capable, and always dependable, and our associates are the driving force behind this commitment.
Job Summary
The primary responsibility for this role will be to provide data analytics and reporting to the various company functions. This includes implementing solutions for creating new and optimizing existing reports using standard tools such as power BI and SQL. This helps the company to create and monitor new key performance indicators and operational metrics.
Major Tasks, Responsibilities and Key Accountabilities
 Develop new reports and dashboards using Power BI builder
 Troubleshoot, test, and refresh existing solutions and ensure the solutions perform as necessary and document results
 Develop Microsoft SQL server queries to consume, aggregate, and report data from various data sources and actively use necessary data transformation techniques to convert raw data to clean usable data
 Tackle business problems by converting raw data into meaningful and actionable business insights
 Collaborate directly with peers and business leaders to transform ideas into actions
 Ensure all key stakeholders are aware of progress and next steps in timely and accurate manner
Nature and Scope
Demonstrates skill in data analysis techniques by resolving missing/incomplete information and inconsistencies/anomalies in more complex research/data.
Nature of work requires increasing independence; receives guidance only on unusual, complex problems or issues. Work review typically involves periodic review of output by a supervisor and/or direct customers of the process.
May provide general guidance/direction to or train junior level support or professional personnel.
Work Environment
Located in a comfortable indoor area. Any unpleasant conditions would be infrequent and not objectionable.
Most of the time is spent sitting in a comfortable position and there is frequent opportunity to move about. On rare occasions there may be a need to move or lift light articles.
Typically requires overnight travel less than 10% of the time.
Education and Experience
Typically requires BS/BA in a related discipline. Generally 2-5 years of experience in a related field OR MS/MA and generally 2-4 years of experience in a related field. Certification is required in some areas.
Preferred Qualifications
 Bachelor's Degree
 1 Year but Less Than 3 Years
 1 Year experience in business intelligence reporting or analytics
 Skills Preferred in Database modeling and Machine learning (classification and clustering)
If you’re looking to play a role in building America, consider one of our open opportunities. We can’t wait to meet you.
Functional Area Information Technology
Recruiter Saunders, Kimberly
Req ID WCJR-007207
White Cap is an Equal Opportunity Minority/Female/Individuals with Disabilities/Protected Veteran and Affirmative Action Employer. White Cap considers for employment and hires qualified candidates without regard to age, race, religion, color, sex, sexual orientation, gender, gender identity, national origin, ancestry, citizenship, protected veteran or disability status or any factor prohibited by law.","Servicios de construcción, reparación y mantenimiento",,2022-09-12T00:00:00,2022-10-16,OTHER
"Data Scientist, Product Development",Praemo,Ontario,Kitchener,-1,-1,,CAD,"by Praemo | Sep 1, 2022
Praemo is searching for creative technical people to help improve Razor™. We do not require you to have all the qualifications listed in the following job description. A lot of what we do can be learned on the job. If this position sounds interesting to you, we strongly encourage you to apply!

About Praemo

Founded by industry experts, Praemo is focused on the appropriate application of leading-edge analytic technologies within industrial operations. We believe there is a simpler more effective way to harvest insights from the industrial and manufacturing datasets that already exist.

Utilizing an organization’s operational and IoT (Internet of Things) data as-is, where-is, and applying statistical, machine learning, and AI tools, Razor transforms existing and under-utilized data into context-relevant actionable insights. These insights alert industrial operators to any anomalous behavior with the potential to harm performance in time to prevent an incident. Due to the generalized nature of Razor, it can be applied to a wide range of datasets.

Praemo has worked with customer datasets that range from discrete manufacturing to consumer-packaged goods to mining and processing plants.

The Praemo head office is located in downtown Kitchener, Ontario, Canada. We are looking for an energetic applicant with general knowledge of Linux & Python to help us out. If you thrive in an autonomous, empowering, and exciting environment, and have a strong desire to learn and investigate new technologies, we want to hear from you!

About the Tech Team

The Tech Team is divided into two interacting branches: Product Development and Emerging Applications. The Product Development team focuses on the development of Razor and Razor’s model suite while the Emerging Applications team monitors the application of Razor to new customer data and develops new analytical approaches for emerging use cases. Both teams collaborate regularly to drive the product forward.

Successful Tech Team members are:

Adaptable
Hard-working
Motivated and self-starting
Creative
Can think critically about their code as well as the team’s
Can handle ambiguity

Overall, the Tech Team is dynamic with opportunities for everyone to contribute in a variety of ways. We run both Product Development and Emerging Applications Tech Teams as matrix organizations. Each team member is responsible for their own projects, with the entire team available for brainstorming and mentoring. We feel this structure allows you the freedom to create without the burden of micromanagement. We encourage taking ping-pong or coffee breaks and using all paid time off – a rested mind is an efficient mind!

The tech team also has plenty of opportunities to grow in whichever capacity you’re looking for. Want to upskill? Great! We have annual support for continuing education. Want to take on more responsibility and improve those leadership skills? Praemo will support your ambitions. Want to dip your feet in another team’s pool and learn something new? We’ll make it work! Want to see how many donuts you can eat in a day? Same. We’re in this together

About your role

At Praemo, the Tech Team works with data at massive scales and drives the development of our products. We work closely with our sales department and customers to shape the ongoing development of Razor. As a Data Scientist, you will have a direct impact on both our customers’ bottom line and our own.

Through model and utility development for Razor you will help provide actionable insights across all customers’ processes. In addition to your day-to-day tasks, you will also be expected to gain experience with the global system by contributing to other team-members’ projects in the form of code-review and brainstorming.

Responsibilities:

Build statistical or machine learning based solutions (descriptive, diagnostic, predictive, or prescriptive) while maintaining a generalized customer-centric point-of-view
Work closely with and incorporate feedback from internal Data Science and Sales teams
Actively participate in team-wide activities such as code review, brainstorming, and code quality assurance
Mentor Co-op Students and Junior Data Scientists

Skills:
** reminder: we do not require you to check every box. Please apply if you check even a portion!

Comfortable with Python (Pandas, Numpy, Scipy, Matplotlib, Scikit-learn, Tensorflow, Keras)
Familiar with Statistics, Machine Learning, and/or AI technologies
General knowledge of Linux
General command line commands
General database concepts (Queries, State, Throughput)
Basic containerization concepts for model deployment
Great verbal and written communication skills for collaboration with a multi-disciplinary team
Readily offer constructive feedback during code review
Strong focus on documentation and sharing
Real passion for working in a team to develop solutions for complex problems
Thrive in an autonomous, empowering and exciting environment
A strong desire to learn and investigate new technologies

Ideal Qualifications:

2-4 years of data science experience (this may include Graduate Studies)
or College diploma in STEM field
Projects relating to Statistics, Machine Learning, Deep Learning
Experience with Git or other version control software
Previous startup experience nice, but not required
Some mechanical and industrial process knowledge
Some database knowledge
Desire to grow into a leadership role
Perks

At Praemo we offer an environment that encourages personal growth and continuous improvement. We provide family-focused benefits to all our employees.

Life, Medical, Vision, Dental Benefits
Table-Tennis
Flexible Working Hours
Casual Bi-Weekly Tech-Team Hack-a-Thon
Annual Support for Continuing Education
Paid Time Off
Located near LRT station (Borden), Tim Hortons, and Grand River Rocks

Praemo is an equal opportunity employer with a proven commitment to diversity and inclusion. We are proud to have received the Platinum Seal from Diversio for ranking in the top 5% of technology companies when it comes to diversity and inclusion. We prohibit discrimination based on race, color, religion, gender, national origin, age, disability, veteran status, marital status, pregnancy, gender expression or identity, sexual orientation, or any other legally protected status.

We are committed to providing a positive interview experience for every candidate. If accommodations are required due to a disability or medical condition, contact us via email at info@praemo.com.

Check out our website and our social media to get to know us better as you think about your next step at Praemo. We thank all applicants for showing an interest in this position. Only those selected for an interview will be contacted.",,,2022-09-01T00:00:00,2022-10-16,OTHER
