Job_title,Company,State,City,Min_Salary,Max_Salary,unitText,SalaryCurrency,Job_Desc,Industry,Rating,Date_Posted,Valid_until,Job_Type
Data Scientist,Granify,Alberta,Edmonton,-1,-1,,CAD,"Data Scientist
Granify is a rapidly growing technology company at the intersection of e-commerce, machine intelligence, and psychology. We’ve received investment from top investors, built a world-class team and a world-class product, and in the last year alone we generated over $650 million in incremental sales for many of the world's largest retailers!
We’re searching for an experienced Data Scientist who values mastery, authenticity, and positivity to help build and grow our product. As a key member of our Data Science team, you will work with and analyze vast amounts of behaviour and transaction data, and design and implement algorithms which predict e-commerce shopper actions and needs. This includes - but goes well beyond - recommendations. This is an amazing opportunity to design algorithms which will be responsible for helping and influencing real shoppers across the world in real-time! We have access to and act on millions of shopper sessions per day. If you are a highly technical, hands-on, and mission-driven person who has a passion for solving problems in the area of ML/AI and e-commerce optimization, then this is the role for you.

This is a full-time position. We are centrally located in Edmonton, but remote applications will also be considered.
RESPONSIBILITIES

Develop new and improve existing ML models that guide our interactions with shoppers
Help design and create ML/AI based tools to interact with shoppers
Evaluate performance statistics at an extremely detailed level and present insights and recommendations to teammates.
Analyze, interpret and use machine learning and data mining algorithms on the enormous amount of behavioural and transactional data
Recommend new experiments supported by your findings and research
Dissect online stores’ shoppers data to identify opportunities to increase conversion, order value, lifetime value, and customer delight
Write code to implement your experiments
Work closely with our developers and engineers to bring your new experiments to life
Solve a wide variety of complex problems as they arise that will often require significant analysis of our data, research and deep thinking
Participate in brainstorming sessions with your teammates to determine opportunities for improvement and experiments
Research, design and prototype intelligent systems with the aim of enhancing online shopper experience.
Keep up-to-date with the latest papers in artificial intelligence and machine learning to propose solutions for real problems in e-commerce.
Help to build infrastructure to support the evolution of our shopper interaction toolset
Collaborate with other DS team members, mentor junior DS, participate in code reviews, and share knowledge.
Participate in active maintenance and code reviews in a large codebase, suggesting and implementing changes as appropriate.
Troubleshoot, test, and debug to your heart’s content.

ABOUT YOU

BSc (Msc/Phd preferred) in Computer Science, Machine Learning, Artificial Intelligence, Statistics, Mathematics, Engineering, Physics, or a related discipline, with (at minimum) graduate-level courses in machine learning, or equivalent practical experience.
At least 3+ years of real-world experience implementing Machine Learning models
Comfortable jumping into an existing ML modelling code base
Proficient in at least one programming language, preferably Python (focus on ML)
Demonstrated ability to apply statistical or data mining techniques to solve real problems
Ability to organize, interpret, and analyze large amounts of data
Advanced skills and experience in machine learning and data mining
Strong research experience in machine learning, preferably in one or more of the following (in no particular order):
Unsupervised and Supervised Learning
Reinforcement learning
Recommender and/or ranking systems
Deep learning and deep generative models
Computer vision
NLP
Intimately familiarity with the DS workflow:
Data gathering and cleaning
Feature engineering
Model design, coding, hyperparameter tuning and validations

Proficient in deep learning frameworks like Tensorflow, PyTorch, etc. and scientific computing packages like NumPy. Able to implement an algorithm as described in an academic paper using these frameworks in quality code.
Knowledge of various ML and statistical tools and libraries (e.g. TensorFlow, sciPy, R, and similar)
Good intuition for applying ML/AI theory to make business-oriented products with minimal guidance.


BONUS EXPERIENCE

Experienced using shopper data
Worked with ‘Big data’
Hands-on Knowledge of distributed computing frameworks (e.g. Spark, AWS, Flink)
Experience in online advertising/marketing analytics, behavioral targeting or web analytics
Experience with distributed databases


OUR TECH STACK

We are using AWS cloud and the ML stack includes Python, TensorFlow, Spark, DataBricks and Hadoop. We have dedicated Data Engineers and Software Developers who provide support and tools needed for research and help with implementation of research outcomes.
ABOUT GRANIFY

Granify merges machine intelligence and digital psychology to automatically increase sales for retailers. This is the future and it’s an exceptionally interesting world to delve into every day! Our mission is to provide the ultimate experience for every shopper at any given point in time and, in doing so, completely redefine the trillion-dollar e-commerce market. We hope you can help us achieve this ambitious mission!
Granify is backed by early investors in Tesla, Facebook, SpaceX, AirBnB, Pinterest, Palantir, Alibaba, and Yelp and won Top E-Commerce Solution and Top Digital Startup at the DAA Awards!",Tecnologías de la información,,2022-09-06T00:00:00,2022-10-16,FULL_TIME
Jr. Data Scientist,SimpTek Technologies,New Brunswick,Fredericton,-1,-1,,CAD,"SimpTek Technologies - Fredericton, NB:
SimpTek is seeking a Jr. Data Scientist to join our growing team. You will play a crucial role in helping SimpTek make smarter decisions to deliver even better products. Your primary focus will be on applying data mining techniques, doing statistical analysis, and building high-quality prediction systems integrated with our products to improve and extend the features used by our existing platform.

We are looking for someone that thrives on the urgency of startups and can leverage data analytics while being creative and is eager to learn and evolve as the job demands. You will be part of a dynamic team that is passionate about building better ways to provide energy insights for buildings. We’re looking for someone who can take ownership, and if you think you have those qualifications, you might be a good fit to join our team!

Responsibilities:

Selecting features, building and optimizing classifiers using machine learning techniques
Enhancing data collection procedures to include information that is relevant for building analysis
Processing, cleansing, and verifying the integrity of data used for analysis
Doing ad-hoc analysis and presenting results in a clear manner
Integration with 3rd party API’s for data collection and analysis, including weather data, time-series data, and event-based data sets

Skills and Qualifications:

1-2 years experience in similar roles
Excellent understanding of machine learning techniques and algorithms, such as k-NN,
Naive Bayes, SVM, Decision Forests, etc.
Experience with common data science toolkits.
Great verbal and written communication skills
Experience with data visualization tools, such as D3.js, Highcharts.js etc.
Proficiency in using query languages like SQL.
Good applied statistics skills, such as distributions, statistical testing, regression, etc.
Good scripting and programming skills
Data-oriented personality

About SimpTek Technologies:
We are creating a platform that changes the way utilities, building owners and energy service providers collaborate. By using energy data analytics, SimpTek is building a new way of connecting consumers with personalized products and services to drive towards a zero-carbon world, We call this the Gride Edge Economy

We can offer you::

Competitive salary
Benefits
The opportunity to work with passionate and driven individuals
Flexible schedule

Question::
If you were given a set of resumes with the goal to choose the most qualified candidate for the
Data Scientist position at SimpTek, how would you determine the best candidate?",,,2022-08-21T00:00:00,2022-10-16,OTHER
Junior Process Engineer,Hatch,,,-1,-1,,CAD,"Requisition ID: 81584
Job Category: Mining; Engineering; Metals
Location: Mississauga, ON, Canada
Join a company that is passionately committed to the pursuit of a better world through positive change. With more than 65 years of business and technical expertise in mining, energy, and infrastructure, our 10,000 colleagues in 150 countries tirelessly work toward bettering the industries in which we operate. With practical solutions that are safe, innovative and sustainable, we think globally while acting locally. Are you looking for an opportunity to join a diverse group of professionals who are committed to remaining exceptional? We look forward to hearing from you.
If it isn't grown, it's mined. Our mining and metals teams help our clients to safely and sustainably mine the minerals and metals used in our everyday lives. Want to play a part of innovating and optimizing the mining life cycle on greenfield and brownfield facilities? Apply today!
Position Summary:
The Hatch Metals & Mining group is seeking a Pyrometallurgy EIT with interest in Process Engineering. Reporting to the Global Director Pyrometallurgy, you will support projects globally based out of our Mississauga Head Office location. Bachelor, Master and PhD candidates are encouraged to apply for this position.
What Will a Career at Hatch Offer You:
You will:
Be given opportunities to contribute to complex projects around the world in meaningful ways
Work on problems and gain experience in the office and on project sites
Collaborate with diverse teams locally and globally
Work in an exciting environment where you can apply your academic learning on a daily basis
Gain relevant experience and support in obtaining your professional designation
Benefit from formal and informal mentorship from some of the leading minds and authorities in the industry
Participate in local Professional Development Programs, Sustainability Week, Toastmasters, and more to develop your skills
Join in charitable, social, and sports activities with other Hatch employees
We’re entrepreneurs with a technical soul. Our flat organizational structure creates an atmosphere of openness and participation. We build practical solutions that are safe, innovative, and sustainable. Our ultimate goal is to achieve no harm for our people, our clients, and our communities.
Responsibilities:
Applying problem solving skills to complete project work
Work in a multi-disciplinary engineering team environment, with focus on assisting the process team
Assist with wide range of metals projects, including critical metals for battery manufacturing
Assist with metal industry decarbonization projects to apply new technologies and approaches to reduce greenhouse gas emissions
Assist with developing process control, simulation, automation, prediction and operation models, with emphases on big-data and machine learning
Assist with interpretation of simulation and field data as well as developing test work programs
Assist with preparation of engineering documents and calculations, such as mass and energy balances, design criteria, engineering reports, process facility layout, hazard studies, cost estimation, etc.
Assist with project management within the scope, schedule, and budget provided by the process engineers and project managers
Assist with analysis of on-site data and reporting
Education and Experience:
Must be working towards graduating in 2023, or recently graduated, with an undergraduate or graduate Discipline(s) Engineering degree with a Materials Engineering, Metallurgical Engineering or Chemical Engineering specialization.
Strong academic record (top quintile).
Ability to evaluate ferrous and non-ferrous metallurgical processes by applying concepts of high-temperature chemistry, heat and mass transfer, kinetics and thermodynamics to assist in the modeling and design of process plants.
Ability to program in popular languages for data processing and/or to develop numerical models for metallurgical processes.
Ability to effectively utilize written and oral communication skills to describe, depict and explain their work to team members and clients.
Must have proven skills with MS Excel, Word, and PowerPoint.
Competencies (knowledge, skill, attributes):
Good understanding of engineering and business fundamentals as they apply to engineering problems and projects
Ability to learn quickly and to take on new challenges
Collaborative team player with excellent interpersonal skills
Excellent organizational skills and attention to detail
Strong written and verbal communication skills
Shows critical and creative thinking and problem solving, and brings forward solutions for our clients' toughest challenges
Adapts and embraces change
Relevant Courses:
Metallurgical Engineering
Materials Engineering
Chemical Engineering
Mechanical Engineering
Extractive / Process Metallurgy
Thermodynamics and High Temperature Thermochemistry
Popular Programming Languages (e.g., Python, MatLab, C++, VBA)
To be considered, please use your school email address when applying. If you have applied to a role with Hatch in the past, please ensure your school email is your current email in our system.
For more information on our graduate recruiting process visit hatch.com/students. To be considered you must submit a Resume, Transcript (official or unofficial)
Why join us?
Work with great people to make a difference
Collaborate on exciting projects to develop innovative solutions
Top employer
What we offer you?
Flexible work environment
Long term career development
Think globally, work locally
Don't meet every single requirement? You don't need to. At Hatch, we are building a diverse, inclusive workplace that fosters innovation. If you're interested in this role, we encourage you to apply even if your past experiences don't perfectly align with the skills we've listed.
We're committed to fostering a workforce that reflects the diversity of the communities in which we operate and serve. Hatch is an Equal Opportunity Employer that considers applicants without regard to age, race, color, national origin, citizenship, religion, creed, gender, sexual orientation, marital status, disability, or any other protected status. If you have any accommodation requirements, please let us know. We'll do our best to meet your needs in accordance with applicable local legislation.
[[req_postHashtag]]","Energía, minería e infraestructura pública",,2022-09-13T00:00:00,2022-10-16,OTHER
Staff Machine Learning Engineer,PagerDuty,Ontario,Toronto,-1,-1,,CAD,"We are interviewing and onboarding 100% virtually at this time. PagerDuty is focused on inclusion and employee well-being by building a culture that isn't location specific and gives equal opportunity to everyone—regardless of where you are working. Unless your job requirements make it necessary to be in a company office, you may choose to work in-office, remotely, or hybrid.
Why We Need You:


We're looking for a staff-level engineer and a proven technical leader passionate about successfully collaborating with data scientists and engineers to run machine learning models in production. We expect you to understand requirements from the data science and data engineering team and drive alignment with Engineering teams on design patterns and best practices to support the business.


You are expected to anticipate data science & engineering-related bottlenecks, suggest escalation and investment wherever necessary, communicate immediate and long-term technical as well as strategic solutions and trade-offs, and will possess an excellent capacity to manage time. In addition, you will demonstrate emotional intelligence as you navigate stakeholder relationships championing the organization's data science and machine learning initiatives.

How you contribute to our vision: Key Responsibilities
Build and improve the capabilities of the data platform that enable and accelerate the production of machine learning (ML) based solutions
Drive and define standards for data engineering across the organization.
Provide guidance, technical leadership, and mentoring to other members of the team
Proactively recommend improvements and new approaches addressing potential systemic pain points and technical debt
Anticipate technical demands on the data platform based on the organization's roadmap and systematically drive the evolution of the architecture towards those ends
Mentor junior members and participate in scaling up the existing team
Develop a long-term plan for data science investments
Minimum Requirements
You have 8+ years of experience building, designing, and evolving data architecture for large-scale systems
Experience working with Product teams ensuring and driving a timely delivery
Have a deep understanding of the trade-offs to be considered when designing and delivering machine learning solutions to production
Demonstrated experience with data modeling, database design, extract transform load (ETL) processes, working with unstructured data, and cloud-based data infrastructure
Awareness of and experience with ML processes (exploration, training, deployment), technologies (services, packages), and infrastructure (AWS)
Passionate about data/ML engineering and interested in driving discussions with stakeholders and executives
Not sure if you qualify?

Apply anyway! We extend opportunities to a broad array of candidates, including those with diverse workplace experiences and backgrounds. Whether you're new to the corporate world, returning to work after a gap in employment, or simply looking to transition or take the next step in your career path, we are excited to connect with you.

PagerDuty Offers

We are dedicated to providing a culture where our people are happy, enabled and inspired to do their best. One of the ways we do this is by developing a comprehensive total rewards approach that supports employees and their loved ones. As a global organization, our programs are competitive with industry standards and aligned with local laws and regulations.

Your package may include:
Competitive salary and company equity
Comprehensive benefits package from day one
ESPP (Employee Stock Purchase Program)
Retirement or pension plan
Paid parental leave - up to 22 weeks for pregnant parent, up to 12 weeks for non-pregnant parent (some countries have longer leave standards and we comply with local laws)
Generous paid vacation time
Paid holidays and sick leave
Paid employee volunteer time - 20 hours per year
Bi-annual company-wide hack weeks
Mental wellness programs
Dutonian Wellness Days - scheduled company-wide paid days off in addition to PTO and scheduled holidays
HibernationDuty - a week each year when everyone at PagerDuty, with the exception of a small, coverage crew, is asked to take a much needed break to truly disconnect and recharge
About PagerDuty

PagerDuty, Inc. (NYSE:PD) is a global leader in digital operations management, serving over 14,000 customers and 850,000 users worldwide, including 65% of the Fortune 100.

For the teams who build and run digital systems, PagerDuty is the best way to manage the urgent, mission-critical work that is essential to keeping digital services always on. We make it easy to handle any unplanned task, event, or opportunity, right away.

Led by CEO Jennifer Tejada, 50% of our board of directors is comprised of women, 45% of our managers are from underrepresented groups, and we are a proud member of the Pledge 1% Movement, committed to donating 1% Equity, 1% Employee time, and 1% Product to accelerate change in our communities. We are Great Place to Work-certified™ and our product is top rated in its category on TrustRadius.

From how we build our teams to who sits in the boardroom, we hope you can see yourself at PagerDuty.

Learn more: Social Impact; Inclusion, Diversity, & Equity; Culture

Additional Information

PagerDuty is committed to creating a diverse environment and is an equal opportunity employer. PagerDuty does not discriminate on the basis of race, religion, color, national origin, gender, sexual orientation, age, marital status, parental status, veteran status, or disability status.

PagerDuty is committed to providing reasonable accommodations for qualified individuals with disabilities in our job application process. Should you require accommodation, please email accommodation@pagerduty.com and we will work with you to meet your accessibility needs.

PagerDuty verifies work authorization in accordance with the requirements of your local jurisdiction.",Tecnologías de la información,,2022-09-01T00:00:00,2022-10-16,PART_TIME
Junior Data Scientist,HonestDoor,Alberta,Edmonton,-1,-1,,CAD,"HonestDoor is looking for a junior data scientist to support our data team. The ideal candidate has knowledge of Python and is interested in working in a start-up environment. They learn quickly and, when they don't understand something, they ask questions. They are able to follow directions/instructions and are keen on learning the intricacies of the models and how they work.In this role, you will:- Develop new and improve existing ML models- Analyze, interpret and use machine learning and data mining algorithms on the enormous amount of data- Write code to implement your experiments- Perform analysis for a wide range of requests using data from various platforms.- Support business operations in providing advice stemming from data and process analysis taken from internal and external sources.If you are based in Edmonton, this role would be a hybrid remote/in-person, however, we are open to making sure that any work arrangements fit your needs. We guarantee that you'll learn a lot about both machine learning and working in a start-up.Skills & Qualifications: Proficient in Python (preferably with a focus on ML)significant database querying (SQL) data analysis and visualization experience.Comfortable jumping into an existing ML modelling code baseGood intuition for applying ML/AI theory to make business-oriented productsJob Types: Full-time, PermanentSalary: $40,000.00-$60,000.00 per yearSchedule:8 hour shiftMonday to FridayApplication deadline: 2022-09-30",,,2022-09-15T00:00:00,2022-10-16,FULL_TIME
