Job_title,Company,State,City,Min_Salary,Max_Salary,unitText,SalaryCurrency,Job_Desc,Industry,Rating,Date_Posted,Valid_until,Job_Type
Junior Software Engineer - Simulation,Sanctuary AI,British Columbia,Vancouver,-1,-1,,CAD,"Your New Role and TeamOur Robotics Simulation team is looking to hire a Junior Software Engineer. Reporting to the Simulation Team Lead, you'll gain a comprehensive understanding of the design, architecture, and implementation of our simulation platform and machine learning systems that power our general-purpose robots.The ideal applicants for this position enjoy thinking broadly and are eager to learn and develop technical skills while gaining valuable industry experience. Ultimately, you'll be a valued part of the team as you learn and adapt to new, complex development environments, own solutions from design and execution through to deployment and support, as well as innovate best practices that drive continuous improvements in our robotic systems.*Our Success Criteria*Bring hands-on experience working with high-performing teams on academic group projects and/or internshipsGain cutting edge career experience as you develop physics/game engine tools that support our robotics system's cognitive structureAchieve company-wide visibility as you partner with developers to ensure the smooth deployment of these tools, provide technical support to end users, and update/organize/distribute technical documentation*Your Experience*QualificationsBachelor's degree in Computer Science or related fieldsKnowledge of engineering best practices, including coding standards, testing, and operations1-3 Years of engineering experience with Python, Java, C++, or equivalentAbility to design, implement, and test in a fast-paced environment*Skills*Familiarity with distributed design, multithreading, and concurrencyUnderstanding of fundamentals of computer science, compilers and operating systems, data structures, and networking*Traits*Above all else, a consistently positive attitude and a willingness to do whatever it takes to create robust solutions to complex problemsStrong communication and interpersonal skillsSelf-motivated and able to solve problems independentlyObsession with bringing human-like intelligence to machinesWorking at SanctuarySanctuary is an equal opportunity employer; employment with Sanctuary is governed based on skills, competence, and qualifications and will not be influenced in any way by race, color, religion, gender, national origin/ethnicity, veteran status, disability status, age, sexual orientation, gender identity, marital status, mental or physical disability, or any other legally protected status.BenefitsMedical/dental/vision, life insurance, wellness programs, stock options, paid time off (vacation, paid holidays, sick time, and parental leave), scheduling and worksite flexibility by role, and more.*About Sanctuary*Founded in 2018 by Geordie Rose, Suzanne Gildert, Olivia Norton, and Ajay Agrawal, Sanctuary is a Vancouver, Canada-based company. Sanctuary is on a mission to create the world’s first human-like intelligence in general-purpose robots that will help us work more safely, efficiently, and sustainably. And in the not-too-distant future, help us explore, settle, and prosper in outer space.Members of the Sanctuary team founded D-Wave (a pioneer in the quantum computing industry), Kindred (first use of reinforcement learning in a production robot), and the Creative Destruction Lab (pioneered a revolutionary method for the commercialization of science for the betterment of humankind). The team has experience launching market-defining innovations rooted in previously unsolved and deep scientific problems.Job Type: Full-time",Tecnologías de la información,,2022-08-26T00:00:00,2022-10-16,FULL_TIME
Neuroimaging Data Scientist/Programmer Junior,University of British Columbia,British Columbia,Vancouver,-1,-1,,CAD,"Staff - Non Union
Job Category
M&P - AAPS
Job Profile
AAPS Salaried - Information Systems and Technology, Level A
Job Title
Neuroimaging Data Scientist/Programmer Junior
Department
McKeown Laboratory Pacific Parkinson's Research Centre Division of Neurology | Department of Medicine | Faculty of Medicine
Compensation Range
$4,688.67 - $6,754.00 CAD Monthly
Posting End Date
September 20, 2022
Note: Applications will be accepted until 11:59 PM on the day prior to the Posting End Date above.
Job End Date
Sep 30, 2023
This position is located within a health-care facility, therefore, the successful candidate will be required to provide verification of full vaccination against Covid-19 provided prior to the start date, as required by a provincial health mandate.
Job Summary
Pacific Parkinson’s Research Centre at UBC is seeking a data scientist/programmer. This position is an excellent fit for graduating seniors (or recent graduates) with interest in the field of neuroscience and neuroimaging. We conduct projects associating MRI imaging data (structural, functional, diffusion) with behavioral data in patients with Parkinson’s disease and evaluate how non-invasive brain stimulation interventions change symptom-relevant brain circuits.
A qualified candidate will assist and work closely with the PI and senior-level researchers to set up experiments and analysis pipelines for various neuroimaging, behaviour, and clinical data.
Organizational Status
The data scientist/programmer will report to the Research Manager and Principal Investigator of the study, and will work closely with graduate students, fellows and research staff from different departments on campus.

Work Performed
Developing codes (bash shell scripting, Python, MATLAB, R) to run experiments and preprocess MRI and behavioral data
Conducting data-driven and theory-driven analyses using combinations of supervised and unsupervised learning approaches
Managing project databases
Other duties and responsibilities as assigned
Consequence of Error/Judgement
Errors made could influence the ability of the PI to meet critical deadlines, as well as compromise the results of research projects and affect funding applications, thereby impacting the credibility of the Investigator. Poor decisions may be damaging to the reputation of and cause financial loss to the Principal Investigator, The Centre, the Research Institute and the University.

Supervision Received
The data scientist/programmer will work closely with researchers, graduate students and clinical fellows. Direct supervision will be provided by the Research Manager and Principal investigator of the study.

Supervision Given
None

Minimum Qualifications
Undergraduate degree in a relevant discipline. Minimum of one year of related experience, or the equivalent combination of education and experience.

Preferred Qualifications
Experience with neuroimaging tools (FSL, Freesurfer, AFNI, SPM, ANTs) and neuroimaging data preprocessing
Excellent programming knowledge (Python, MATLAB, R, and linux/bash)
A deep understanding of a variety of statistical concepts, machine learning approaches, clustering and classification techniques, and optimization algorithms.
Experience with popular machine learning frameworks and libraries (xgboost/lightGBM, Keras, Tensorflow, Pytorch, pandas, numpy, etc).
Experience with version control using Git and Code Collaboration practices.
Strong analytical and problem-solving skills and attention to details are desirable
Knowledge in basics of digital image processing is a plus",Educación,,2022-09-08T00:00:00,2022-10-16,FULL_TIME
Metallurgist,New Gold Inc.,British Columbia,Kamloops,-1,-1,,CAD,"Make an impact at Canada’s premier mining company.

When you advance your career at New Gold, you are joining a Canadian-focused intermediate gold mining company engaged in the operation, development and exploration of mineral properties. Our mission is be a leading intermediate gold producer, driving responsible and profitable mining in a way that creates sustainable value for our employee, shareholders, the communities in which we live and work and our environment. To learn more about New Gold, visit our website at www.newgold.com. To learn more about our culture and people practices, visit the Career page.

New Gold attracts and hires highly skilled individuals. By joining our team, you can look forward to:

A stimulating values-based work
A culture of collaboration and inclusion
Inspiring colleagues and approachable leaders
Career development opportunities
A deeply rooted commitment to responsible mining, health and safety and community engagement
A competitive total compensation program
A comprehensive benefits package including a retirement savings plan

New Afton Mine

Situated 10 kilometers west of picturesque Kamloops, British Columbia, the New Afton Mine is an underground gold and copper producing site.

Kamloops is a city of 90,000 people, located 350 kilometers east of Vancouver. The area provides the opportunity to live and work in a vibrant community with its own university and within easy reach of world class ski resorts, championship golf courses, mountain biking trails, popular recreational lakes and award-winning vineyards.

About the Role

Schedule: Monday to Friday, 8 hours per day

Position Reports To: Chief Metallurgist

Position Overview: New Afton is looking for one junior level and one mid-level metallurgist. Working within the Metallurgy team, the incumbent will be a process metallurgist with the ability to make safe decisions and work closely with the operational team.

Key Responsibilities

Putting safety first in the planning and execution of all works;
Identifying, evaluating, and coordinating execution of operational and/or capital projects to improve product quality and process efficiency;
Providing timely and accurate metallurgical accounting information;
Assisting with commissioning of new circuits;
Interpreting mineralogical data;
Designing and executing test programs to optimize gravity, grinding, flotation and tailings dewatering circuit performance.

Qualifications

Required:
Degree in Mining, Mineral Processing, Metallurgical or Chemical Engineering
Minimum two years of experience for the junior metallurgist and five years for mid-level metallurgist in a mineral processing or similar environment. Relevant co-op experience may be included
Previous experience in gold and/or base metal processing plant(s)
Experience with interpretation and application of mineralogical data
Strong problem-solving skills and an emphasis on safety
Ability to both lead teams and be a contributing team member
High level of proficiency in MS Excel
Registered or eligible to register with EGBC

Desirable:
Experience with process control, expert systems and/or machine learning
Hands-on experience with laboratory-scale mineral processing equipment
Experience using JK SimMet or similar balancing/simulation software
Involvement in technical/professional associations and conferences
Experience working as part of a mill operations crew

Other Requirements

Candidates will be required to participate in a comprehensive qualification process, including:

Successful completion of pre-placement functional screen
Provide proof of a valid Class 5 driver’s license
Demonstrate eligibility to work in Canada
Provide confirmation of valid educational requirements

Compensation

A competitive salary, performance bonus plan and benefits will be provided. This is not a camp operation and therefore the successful candidate will be required to relocate to the Kamloops area or travel and accommodation will be the responsibility of the successful applicant.

Inclusion, Equal Opportunity, Accessibility

New Gold is an equal opportunity employer committed to diversity and inclusion. We are pleased to consider all qualified applicants for employment without regard to race, color, religion, sex, sexual orientation, gender identity, national origin, age, disability, protected veterans’ status, Indigenous status or any other legally protected factors. Disability-related accommodations during the recruitment process are available upon request.

Additional Information

We thank all applicants for their interest but will only contact candidates selected to advance in the hiring process. New Gold does not accept resumes from employment placement agencies, head-hunters or recruitment suppliers that are not in a forma contractual arrangement with the Company. Any resume or other information received from a supplier not approved by New Gold will be considered unsolicited and will not be considered.

Applicants can submit their resume and cover letter until 11:59pm on September 21, 2022.","Energía, minería e infraestructura pública",,2022-09-08T00:00:00,2022-10-16,OTHER
Machine Learning Scientist (All levels),Deep Genomics,Ontario,Toronto,-1,-1,,CAD,"About Us
Founded in 2015, Deep Genomics is a drug development company that aims to revolutionize medicine by leveraging expertise in artificial intelligence (AI) and genome biology. We have built the world’s first, and by far the most advanced, AI platform that is able to untangle the enormous complexity of RNA biology and find the best targets, mechanisms, and molecules.
The thesis here at Deep Genomics is that everyone, at some point in their life, will face a genetic condition, whether Mendelian or complex, and we aim to be there for them with a genetically precise therapy. We take immense pride in our team of people whose backgrounds span a diverse range of disciplines including those found in a traditional biotechnology company, as well as machine learning, laboratory automation, and software engineering.
Ideal Candidate
We are seeking a creative and experienced machine learning scientist to decipher how mutations and genetic medicines influence the molecular world of the cell. The successful candidate will develop machine learning approaches for modeling complex RNA- and protein-level outcomes based on massively parallel assays. The ideal candidate has a proven track record of publishing at top machine learning conferences (NeurIPS, ICML, ICLR) or has applied deep learning to genomics in a top life sciences journal.
Requirements/Qualifications
MSc (Junior Scientist) or PhD (Senior Scientist) trained in machine learning.
Extensive practical experience at systematically designing, training, debugging, and evaluating neural networks using modern frameworks such as Tensorflow, PyTorch, or Theano.
Excellent scientific writing and presentation skills.
Senior Scientists must demonstrate leadership and ability to introduce new machine learning techniques.
What we offer:
A chance to develop machine learning techniques that will save human lives.
Inspiring, creative, and fast-moving startup work environment in downtown Toronto
Competitive compensation package including stock options
Deep Genomics thanks all applicants, however only those selected for an interview will be contacted.
Deep Genomics welcomes and encourages applications from people with disabilities. Accommodations are available on request for candidates taking part in all aspects of the selection process.",,,2022-08-22T00:00:00,2022-10-16,FULL_TIME
Junior Algorithms Engineer,Kardium,British Columbia,Burnaby,-1,-1,,CAD,"By joining the Kardium team, you can help make a difference in the lives of millions around the world. Kardium is developing a ground breaking medical device for the percutaneous diagnosis and treatment of atrial fibrillation, a heart condition that can cause strokes, heart failure, and other heart-related complications.As our Junior Algorithms Engineer, you will join Kardium’s Cardiac Mapping team in supporting the design, development, and evaluation of algorithms to turn raw data into actionable information for physicians. You will support the development of 3-dimensional maps used by electrophysiologists during cardiac ablation procedures, using a wealth of electrical, anatomical, and spatial information as inputs. In this role you will have the opportunity to bring your creative and innovative ideas to help Kardium achieve its goal of helping improve people’s lives.What you’ll doApply scientific investigation methods to drive product innovations in mapping and navigation algorithmsImplement and evaluate algorithmic approaches to meet clinical needs related to navigation, electrophysiology, and ablationDevelop and maintain internal software tools for large multivariate data sets of electrophysiological, anatomical, spatial, and procedural dataUse data analysis and visualization to characterize existing algorithms and the data they act on to identify algorithmic improvementsSupplement algorithmic analysis with the collection of high quality and reliable bench top testing dataCommunicate experiments, analyses and results to teammates and senior leadershipWhat you bring to the teamOur Kardium team is smart, creative, and passionate about creating cutting-edge medical devices to help improve people’s lives. We work within a collaborative environment based on trust and respect. And we understand that only by working together can we solve the unsolvable. You bring to the team these characteristics, plus:A bachelor’s degree in engineering, physics, or equivalentPrior experience in research or development within a high-technology fieldPrior experience with object-oriented programming, especially for data analysis; emphasis on MATLAB, Python or Java; experience with source control is also an assetA strong motivation to produce correct, clear, and maintainable codeStrong understanding of foundational topics in applied mathematics such as calculus, linear algebra, and statisticsEffective written and verbal communication of technical subject matterIntroductory experience with advanced topics in applied mathematics are greatly desired; these topics could include signal processing, machine learning, vectors and rotation matrices, statistics, or computer vision.Why work at Kardium?We know you are looking for a meaningful career. We can offer you that, and more:Every day you know you are making a difference by helping treat a condition that debilitates millions of people worldwideA great working environment with opportunities to develop your skills and knowledge while working with cutting-edge technologyAn engaged leadership team who believes in mentoring and growing employees’ careersSupportive colleagues and plenty of fun social events to encourage employee interactionsAnd our employees think we are great too – check out Glassdoor to learn more!How to applyApply today by sending your résumé and cover letter to jobs@kardium.com, with the job title “361 Junior Algorithms Engineer” in the subject line. If you completed your undergraduate degree in the last 2 years, please also include an unofficial copy of your transcripts.Thank you in advance for your interest in working at Kardium!Job Type: Full-time",Salud,,2022-08-25T00:00:00,2022-10-16,FULL_TIME
Junior Data Scientist,Lululemon,British Columbia,Vancouver,-1,-1,,CAD,"Who we are

lululemon is a yoga-inspired technical apparel company up to big things. The practice and philosophy of yoga informs our overall purpose to elevate the world through the power of practice. We are proud to be a growing global company with locations all around the world, from Vancouver to London, and places in between. We owe our success to our innovative product, our emphasis on our stores, our commitment to our people, and the incredible connections we get to make in every community we are in.

About this team

We are looking for someone who is passionate about applying machine learning and statistical modeling techniques to support product strategy at lululemon. This individual will be working closely with cross-functional partners to research data science models and oversee end-to-end implementation into production systems. Working with teams of diverse skillsets and backgrounds, the Data Scientist leads research projects to solve the most difficult problems facing our Product organization while mentoring junior team members.

A day in the life:

Work with a senior data scientist to define data science projects from start to finish, identifying opportunities, defining the problem, building a proof of concept, and deploying a data product
Conduct data mining on guest, product, sales, assortment data sources for insights; generate hypotheses to test for opportunities in improving the merchandising and planning process
Apply a wide range of statistical and quantitative analysis in practical and valuable ways
Perform data pre-processing, data integrity, feature selection, model selection analysis
Participate in design workshops and document business requirements and constraints
Program and write maintainable and well-documented scripts/applications for process automation; produce reusable machine learning pipelines while model building
Connect with business partners to understand the go-to-market process, product lifecycle, and product strategy
Collaborate with data engineering teams to improve data quality and availability
Visualize and communicate results to senior leadership in Product
Create rich interactive visualizations through data interpretation and analysis integrating various reporting components from multiple data sources
Learn and work with subject matter experts

Qualifications:

Excellent academics in Comp. Science, Engineering, Math, Statistics, Research, or a related field
Strong problem solving and analytical skills including mining, evaluation, analysis, and visualization;
Must have experience with Python (Jupyter, NumPy, Pandas, PySpark)
Must have experience in at least one of the common data science toolkits, such as scikit learn, Tensorflow, Keras, PyTorch, etc..
Strong SQL or Excel skills with the ability to learn other analytic tools;
Ability to take on responsibilities and work with minimal supervision;
Ability to create and maintain outstanding partner relationships;
Strong technical aptitude;
Excellent written and verbal communication skills including reports and presentations;
A drive to learn and master new technologies and techniques
1+ years of work experience in data science, preferably in the retail or apparel industries, including internships
Demonstrated experience applying machine learning and data mining techniques
Excellent communication skills to both technical and non-technical audiences
Able to turn business problems into analytical solutions

Must haves:

Possesses an entrepreneurial spirit and continuously innovates to achieve great results.
Communicates with honesty and kindness, and creates the space for others to do the same.
Leads with courage, knowing the possibility of greatness is bigger than the fear of failure.
Fosters connection by putting people first and building trusting relationships.
Integrates fun and joy as a way of being and working, aka doesn’t take themselves too seriously.

NOTE: Only those applicants under consideration will be contacted. Please accept our utmost appreciation for your interest. lululemon is an Equal Employment Opportunity employer. Employment decisions are based on merit and business needs, and not on race, color, creed, age, sex, gender, sexual orientation, national origin, religion, marital status, medical condition, physical or mental disability, military service, pregnancy, childbirth and related medical conditions or any other classification protected by federal, state or provincial and local laws and ordinances. Reasonable accommodation is available for qualified individuals with disabilities, upon request. This Equal Employment Opportunity policy applies to all practices relating to recruitment and hiring, compensation, benefits, discipline, transfer, termination and all other terms and conditions of employment. While management is primarily responsible for seeing that lululemon equal employment opportunity policies are implemented, you share in the responsibility for assuring that, by your personal actions, the policies are effective.",Ventas al mayoreo y al menudeo,,2022-08-29T00:00:00,2022-10-16,OTHER
