Job_title,Company,State,City,Min_Salary,Max_Salary,unitText,SalaryCurrency,Job_Desc,Industry,Rating,Date_Posted,Valid_until,Job_Type
Junior Software Engineer - System Integration,Sanctuary AI,British Columbia,Vancouver,-1,-1,,CAD,"Your New Role and TeamOur System Integration team is looking to hire a Junior Software Engineer. Reporting to the System Integration Team Lead, you'll gain a comprehensive understanding of the design, architecture, and implementation of our platform and machine learning systems that power our general-purpose robots.The ideal applicants for this position enjoy thinking broadly and are eager to learn and develop technical skills while gaining valuable industry experience. Ultimately, you'll be a valued part of the team as you learn and adapt to new, complex development environments, own solutions from design and execution through to deployment and support, and innovate best practices that drive continuous improvements in our robotic systems.*Our Success Criteria*Bring hands-on experience working with high-performing teams on academic group projects and/or internshipsGain cutting-edge career experience while automating our workflows/processes, managing, optimizing, and securing on-robot, edge computers, and cloud environmentsExpand your career capabilities as you refine build, deploy, and monitor component subsystems, ensuring that all segments work together as a coherent unitAchieve company-wide visibility as you partner with developers to ensure the smooth deployment of these tools, provide technical support to end users, and structure and keep technical documentation updated*Your Experience*QualificationsBachelor's degree in Computer Science or related fieldsKnowledge of engineering best practices, including coding standards, testing, and operations1-3 Years of engineering experience with Python, Java, C++, or equivalentProven ability to design, implement, and test in a fast-paced environment*Skills*Familiarity with distributed system design and multithreadingUnderstanding of fundamentals of computer science, compilers and operating systems, data structures, and networking*Traits*Above all else, a consistently positive attitude and a willingness to do whatever it takes to create robust solutions to complex problemsStrong communication and interpersonal skillsSelf-motivated and able to solve problems independentlyObsession with bringing human-like intelligence to machinesWorking at SanctuarySanctuary is an equal opportunity employer; employment with Sanctuary is governed based on skills, competence, and qualifications and will not be influenced in any way by race, color, religion, gender, national origin/ethnicity, veteran status, disability status, age, sexual orientation, gender identity, marital status, mental or physical disability, or any other legally protected status.BenefitsMedical/dental/vision, life insurance, wellness programs, stock options, paid time off (vacation, paid holidays, sick time, and parental leave), scheduling and worksite flexibility by role, and more.*About Sanctuary*Founded in 2018 by Geordie Rose, Suzanne Gildert, Olivia Norton, and Ajay Agrawal, Sanctuary is a Vancouver, Canada-based company. Sanctuary is on a mission to create the world’s first human-like intelligence in general-purpose robots that will help us work more safely, efficiently, and sustainably. And in the not-too-distant future, help us explore, settle, and prosper in outer space.Members of the Sanctuary team founded D-Wave (a pioneer in the quantum computing industry), Kindred (first use of reinforcement learning in a production robot), and the Creative Destruction Lab (pioneered a revolutionary method for the commercialization of science for the betterment of humankind). The team has experience launching market-defining innovations rooted in previously unsolved and deep scientific problems.Job Type: Full-time",Tecnologías de la información,,2022-08-26T00:00:00,2022-10-16,FULL_TIME
Senior Machine Learning Engineer (NLP),Global Relay,British Columbia,Vancouver,-1,-1,,CAD,"Who we are:

For over 20 years, Global Relay has set the standard in enterprise information archiving with industry-leading cloud archiving, surveillance, eDiscovery, and analytics solutions. We securely capture and preserve the communications data of the world's most highly regulated firms, giving them greater visibility and control over their information and ensuring compliance with stringent regulations.

Though we offer competitive compensation and benefits and all the other perks one would expect from an established company, we are not your typical technology company. Global Relay is a career-building company. A place for big ideas. New challenges. Groundbreaking innovation. It's a place where you can genuinely make an impact – and be recognized for it.

We believe great businesses thrive on diversity, inclusion, and the contributions of all employees. To that end, we recruit candidates from different backgrounds and foster a work environment that encourages employees to collaborate and learn from each other, completely free of barriers.

We encourage you to apply if your qualifications and experience are a good fit for any of our openings.
Your Role:

As a Senior Software Developer on the AI team you'll be using leading edge technologies to build AI-enabled products that are used by tens of thousands of users globally to enhance business efficiency. Working alongside data scientists and other developers, you will contribute to the building of machine learning (ML) solutions and other infrastructure components that will be used in features ranging from language detection, machine translation, sentiment analysis, business classifiers, and other natural language processing (NLP) related initiatives.

Our AI team remains grounded with focus and purpose from Global Relay's startup days, while benefiting from being a mature, medium-sized company. We are looking for people with strong software engineering skills and experience writing Python code as well as experience working in a machine learning/data science capacity.

Your Job:

Work with data scientists and developers in the research, building and deployment of machine learning models and other infrastructure components for NLP related features
Work as part of an Agile development team to write Python code
Document code and document detail designs
Design, in collaboration with team, the software implementations that satisfy business requirements
Design, in collaboration with the architecture team, the system architectures that satisfy business requirements
Write unit and integration tests for your code
Collaborate with testers in development of test cases
Develop deployment systems for Python based systems
Collaborate with product owners on user story generation and refinement
Participate in knowledge sharing activities with colleagues
Monitor and support operation of production systems

About You:

Minimum 5 years of Python development experience, shipping enterprise grade software in an Agile environment
Experience working with microservices
Experience with web services technology such as REST, JSON, or Thrift
Experience working on machine learning problems such as in natural language processing, speech recognition, and others
Experience with machine learning libraries such as Scikit-learn, TensorFlow PyTorch, NLTK, SpaCy, and others
Experience with multi-threaded programming
Experience with unit testing and Test Driven Development (TDD)
Experience with Continuous Integration/Continuous Delivery (CI/CD)
Experience mentoring Junior developers
Experience with any of the following is considered an asset:
C++, Bash
MLflow, OpenShift, Kubernetes, Docker

What you can expect:

At Global Relay, there's no ceiling to what you can achieve. It's the land of opportunity for the energetic, the intelligent, the driven. You'll receive the mentoring, coaching, and support you need to reach your career goals. You'll be part of a culture that breeds creativity and rewards perseverance and hard work. And you'll be working alongside smart, talented individuals from diverse backgrounds, with complementary knowledge and skills.

Global Relay is an equal-opportunity employer committed to diversity, equity, and inclusion.

We seek to ensure reasonable adjustments, accommodations, and personal time are personalized to meet the unique needs of every individual.

We understand flexible work arrangements are important, and we encourage that in our work culture. Whether it's flexibility around work hours, workstyle, or lifestyle, we want to ensure our employees have a healthy work/life balance. We support and value a hybrid work model that blends collaboration with the team in the office and focus time from the comfort of your home.

To learn more about our business, culture, and community involvement, visit www.globalrelay.com.",Tecnologías de la información,,2022-08-18T00:00:00,2022-10-16,OTHER
"Junior Associate Data Science, Class of 2023",Publicis Sapient,Ontario,Toronto,-1,-1,,CAD,"Company Description
Publicis Sapient is a digital transformation partner helping established organizations get to their future, digitally-enabled state, both in the way they work and the way they serve their customers. We help unlock value through a start-up mindset and modern methods, fusing strategy, consulting and customer experience with agile engineering and problem-solving creativity. United by our core values and our purpose of helping people thrive in the brave pursuit of next, our 20,000+ people in 53 offices around the world combine experience across technology, data sciences, consulting and customer obsession to accelerate our clients’ businesses through designing the products and services their customers truly value.

Job Description
As a Junior Associate in our Data Science practice, you will develop a deep understanding of how customers engage with our client brands and digital experiences. You will leverage data and your analytics/data science skills to make recommendations that will drive incremental revenue, reduce cost and optimize the customer experience.
You will develop new technical data science and machine learning skills as you build models, begin working with digital analytics platforms to collect and analyze customer data. Then you will harness data to deliver personalized experiences to customers and report on their performance. After developing a thorough understanding of the performance of our clients’ business you will develop and testing hypotheses for driving incremental value from personalized marketing initiatives.
Through your exposure to project work, you will familiarize yourself with many areas of our practice, developing expertise and a specialization.
As part of our new graduate program, you will be on-boarded into a variety of digital analytics tools and will be working with clients by month 2. You’ll also receive on-going structured learning during your first three years that is tailored to you, and you will also be supported with your growth & progression.
Your Impact:
You will function as part of a world class Data Science team to support various AI and machine learning initiatives
Contribute to solving complex marketing and business challenges by accessing, integrating, manipulating, mining and modeling a variety of data sources
Use distributed computing systems to ingest, access and integrate various big data sources
Perform exploratory data analysis, data cleansing and imputation, feature generation in preparation to the modeling process
Apply various quantitative techniques to build predictive models and uncover patterns in data
Build scalable data pipelines and models for real-time modeling frameworks
Document and visualize your work and outputs for technical and non-technical audiences
Contribute to the Data Science capability through presenting work, mentoring talent, helping form best practices and point of views on various AI-related topics

Qualifications
We recognize that you might not meet 100% of the requirements listed below and that’s okay! We’d love to hear from you anyways.
Required Qualifications
Experience conducting data analysis through coursework, coop, and/or volunteer organizations
Fluency in a data programming language such as SQL, Python, R, SAS
Ability to integrate multiple methods to accomplish specific objective/project and apply techniques and learnings from past projects to new projects
Great written and verbal communication and the ability to work closely with senior stakeholders
Broad awareness of data science concepts including, linear regression, logistic regression, correlation variance, standard dev, dimensionality reduction, unsupervised learning, parameter tuning, cross-validation, boot strapping, forecasting and imputation
Hands on evaluation experience with understanding of data exploration, visualization, model comparison, model evaluation, insights/interference, and data Interpretation / insight analysis.
Broad understanding of digital landscape and martech principles
Strong presentation and communication skills clearly developing client communications using tools such as PowerPoint, Excel and email
A demonstrated willingness to learn (a successful candidate will be supported through the certification process of relevant tools for their accounts)
BS/BA degree in Business and Mathematics, Economics, Statistics, Physics, Engineering, Bioinformatics, Computer Science, or other areas where analytics and business are applied
Graduating between August 2022 and July 2023
Willingness to travel up to 80-100% of the time
Desired Qualifications
Prior experience in data science
Direct experience working with cloud platforms
Additional Information
As part of our dedication to an inclusive and diverse workforce, Publicis Sapient is committed to Equal Employment Opportunity without regard for race, color, national origin, ethnicity, gender, protected veteran status, disability, sexual orientation, gender identity, or religion. We are also committed to providing reasonable accommodations for qualified individuals with disabilities and disabled veterans in our job application procedures. If you need assistance or an accommodation due to a disability, you may contact us at hiring@publicissapient.com or you may call us at +1-617-621-0200.",Administración y consultoría,,2022-09-14T00:00:00,2022-10-16,FULL_TIME
Software Developer (Golang),Fortinet,British Columbia,Burnaby,-1,-1,,CAD,"The new developer will be primarily working on the Web Content Filter.
Include exists system maintain and new feature develop. The basic requirement is having some Python or Golang programming knowledge. Our ideal candidate will be smart/eager to learn. We are considering junior/new graduates for this role but also open to a strong candidate at the intermediate or senior level.
Must have skills:
 Experience with Python and software development methodology
 Experience Linux, MySQL
 Strong problem solving and analytical skills
Desired skills:
 Experience with Python, Go and software development methodology.
 Experience with operating system interfaces for threads, process control
 Experience with Linux platforms
 Experience MySQL
 Experience Machine Learning
 Experience with scripting languages (PHP, Shell etc) is a plus
 Experience with Java, C is a plus.
Educational qualifications:
 BS or MS degree in Computer Science, Electrical Engineering or related field
#GD
#LI-MIMI",Tecnologías de la información,,2022-08-26T00:00:00,2022-10-16,FULL_TIME
Junior Engineer,Integral Engineering,Alberta,Edmonton,-1,-1,,CAD,"About usIntegral Engineering is an Edmonton-based, engineering consulting and technology company that specializes in using advanced engineering methods to help major oil and gas operators to manage their assets. We’re looking for highly motivated and talented engineers who are passionate about using a diverse set of skills ranging from applying physical models and statistics, and programming to visualizations, presentations and report writing. Our goal is to help our clients to solve their biggest challenges using the best tools we can find, and to communicate our work in an engaging and interactive way.As an engineer on our team, you will…Develop and apply advanced engineering methods in consulting projects for Fortune 500 oil and gas operatorsPresent your analyses to clients to help them make critical decisions about the operation of their assetsBe constantly looking for better ways to solve problems and visualize the results of your workWe’d love to hear from you if you’re someone with any of the following….Experience performing integrity or risk assessmentsExperience with probabilistic methods, reliability methods, or statistical analysisExperience with programming languagesExperience in machine learning or data scienceExperience with GIS data and geospatial analysisAny engineering experience working with oil and gas assets such as production and storage wells, pipelines, or facilitiesGreat interpersonal and communication skillsBachelor’s degree in Mechanical, Civil, Chemical or Electrical EngineeringWhy us….You’ll be a part of a focused and dynamic team that is excited to test and apply cutting edge technologies to engineering problemsGain a wide range of experience working in a growing companyEnjoy a culture that is built on the premise of freedom and responsibilityHave the opportunity to work remotely with flexible hoursJob Type: Full-timeSalary: $60,000.00-$75,000.00 per yearBenefits:Dental careEmployee assistance programExtended health careWork from homeSchedule:Monday to FridayCOVID-19 considerations:Work from home is available for all employees.Education:Bachelor's Degree (required)Application deadline: 2022-03-11",,,2022-08-26T00:00:00,2022-10-16,FULL_TIME
"Senior Scientist, Cell Line Development (CMC Development)",AbCellera,British Columbia,Vancouver,-1,-1,,CAD,"AbCellera is a nimble, energetic, and quickly growing tech company that searches, decodes, and analyzes natural immune systems to find antibodies that its partners can develop into drugs to prevent and treat disease. We are not afraid of challenges and together we tackle tough problems. AbCellera has made significant news as a leader in the development of antibody therapeutics to treat COVID-19. We won't stop with this success though, and continue to partner with industry leaders to identify therapeutics for serious diseases. With over 400 AbCellerites and growing, we're expanding our capabilities to include internal CMC development and GMP manufacturing of antibodies to bring therapies from idea to patients, faster.

The Senior Scientist will join our newly formed CMC Cell Line Development (CLD) group and be responsible for the generation of mammalian cell lines expressing therapeutic antibodies, bispecific antibodies, and other recombinant therapeutic proteins. These cell lines are used for the manufacturing of antibody therapies to support our partners' rapid transitions from target identification to clinical testing across therapeutic areas including oncology, inflammation, cardiovascular disease, pain, neurodegeneration, and more.

The Senior Scientist will work in a high-performing, fast-paced collaborative environment, committed to ensuring the highest quality and compliance with applicable regulatory guidelines. This is a unique and exciting opportunity for the successful candidate to have a direct impact on establishing an industry leading CLD platform leveraging cutting-edge technologies.

We'd love to hear from you if

You are an innovator and ready to help new approaches to the discovery and development of therapeutics
You have a strong desire to support early antibody discovery work by developing ways to improve and speed up the discovery to CMC development to GMP manufacturing paradigm
You are ready to revolutionize therapeutic development and move at lightning speed to create a legacy in our industry
You are an outstanding communicator and teammate
You are highly motivated and excited about the opportunity to work with an inspired team on challenging problems that matter

How you might spend your days:

Contributing to AbCellera's internal platform capabilities and procedures, including the implementation of appropriate high-throughput and automated workflows.
Conducting end-to-end cell line development for generating recombinant CHO cell lines, including vector design and selection of stable clonal cell lines ready for cell banking.
Training and mentoring junior CLD team members.
Conducting lab work in accordance with appropriate quality standards and ensuring all work is fully documented in a timely manner.
Establishing appropriate quality practices and contributing to regulatory filings.
Working cross-functionally with our antibody assessment team and other CMC functions including upstream and downstream development, analytical and formulation teams.
Managing your own work to ensure that agreed targets are met in a timely manner and effectively communicating results, progress, and plans.

Required qualifications and experience:

PhD in Molecular Biology, Biochemical/Chemical Engineering, Bioengineering or related discipline with 5+ years of relevant industry experience. Candidates with an MSc degrees and 8+ years of industry experience or a BSc and 10+ years of industry experience will also be considered.
Strong molecular biology background, including expression plasmid design, cloning, plasmid extraction and purification, PCR etc.
Strong mammalian cell culture skills with industrial suspension CHO cell lines
Experience with single-cell cloning, automation, and high-throughput technologies as applied to industrial CHO cell line development workflows for recombinant protein manufacturing.
Knowledge of international quality and regulatory guidelines related to cell line development.
Experience and knowledge of a range of CMC operations within biopharmaceutical development.
Previous experience in preparation of regulatory submissions.
Experience in writing protocols, SOPs, policies, risk assessments etc.
Strong attention to detail.
Ability to work collaboratively as a member of a cross-functional team with excellent interpersonal and communication skills.
Foster a positive can-do attitude with a willingness to expand skill set and responsibilities.
Ability to work in a fast-paced and dynamic technical environment.

What we offer

A generous compensation package including an equity stake in AbCellera's success. Our headquarters are nestled in the heart of Vancouver, Canada - we'll support you and your family in every way we can to relocate if you haven't had the joy of living in this beautiful area!

About AbCellera

At AbCellera, we find the next generation of therapeutic antibodies. To succeed, we have created innovative solutions at every step - custom antigen preparation and immunizations, microfluidics, high-throughput imaging, genomics, computation, machine learning and laboratory automation - leaving no stone unturned and revolutionizing how scientists can explore natural antibody diversity and the scale at which they can do it. You'll join a diverse and multi-disciplinary team of biologists, biochemists, engineers, bioinformaticians, computer scientists and physicists - all working together to bring better therapies to patients. This is life-changing research and you could be a part of it.

We're a growing company with state-of-the-art discovery tools and the drive to be the best in the industry. This isn't just about having the best technology. We know we need a world-class team of innovators working together to solve the toughest problems. We look for people with drive and energy. Idealists. People we love and people we trust. This may be unconventional, but it is the key to our success. We're looking for someone like you to support and organize our efforts along the way.

#LI-MS

#LI-EM1",,,2022-09-12T00:00:00,2022-10-16,OTHER
