Job_title,Company,State,City,Min_Salary,Max_Salary,unitText,SalaryCurrency,Job_Desc,Industry,Rating,Date_Posted,Valid_until,Job_Type
Associate Data Scientist (Entry Level): Toronto/Calgary,IBM,Ontario,Toronto,-1,-1,,CAD,"Introduction
As a Data Scientist at IBM, you will help transform our clients’ data into tangible business value by analyzing information, communicating outcomes and collaborating on product development. Work with Best in Class open source and visual tools, along with the most flexible and scalable deployment options. Whether it’s investigating patient trends or weather patterns, you will work to solve real world problems for the industries transforming how we live.

Your Role and Responsibilities
ASSOCIATES PROGRAM

We’re looking for passionate, original thinkers who want to drive progress, grow their network, and further their careers. If you see yourself as someone who never stops learning, who believes no problem is too big to solve, and who wants to unleash their potential, the entry level Associates Program is for you.

To learn more about the Associates Program, check out our Applicant Info Package.

You:
Graduated (or will be graduating) between 2021 and September 2023
Have an Associate’s Degree, College Diploma, Bachelor’s Degree, or Master’s Degree (Exception: The Associates Program does not accept MBA or PhD candidates/graduates)
Have maximum 2 years of full-time, professional work experience
Are within commuting distance of Toronto/Calgary, with flexibility to travel 80-100% of the time
Are eligible to work in Canada without current or future need for visa sponsorship

APPLICATION INSTRUCTIONS

At the very top of your resume, indicate which of the following cities you are willing to remain in and/or relocate to. Kindly note that our incoming Associates are responsible for all costs associated with relocation.
Toronto
Calgary

Application Deadline: September 19, 2022 @ 11:59 PM ET

ASSOCIATE DATA SCIENTIST

As an Associate Data Scientist, you’ll use tools to analyze data and predict trends to make meaningful recommendations to clients. Armed with data, modeling expertise, and analytic results, you’ll formulate conclusions and recommendations to client stakeholders, leveraging strong consulting, communication, visualization, and storytelling skills.

Individuals with an interest in specializing in machine learning operations are also highly encouraged to apply.

Communicate with technical and non-technical stakeholders to understand and define business needs and translate them to a data science context
Work in a collaborative environment, partnering with other scientists, engineers, consultants, and database administrators to integrate the latest predictive analytics with enterprise-level application development
Write programs to cleanse and integrate data sources in an efficient and reusable manner, resulting in high-quality, clean datasets
Incorporate a variety of statistical and machine learning techniques on big data, using leading edge tools such as Python (scikit-learn, tensorflow, matplotlib, pandas), R, and combined with AI application suites. Exposure to big data tools such as include pyspark or sparkR.
Implement and validate predictive models with the end user, comfortable with iterative solution development to arrive at the most usable models for the specific use case
Deploy and maintain machine learning models using established best practices, allowing the client to consistently gain high value from advanced analytics projects.
Understanding of model monitoring and tools such as Prometheus, Grafana, Azure Monitor etc.

REQUIRED PROFESSIONAL AND TECHNICAL EXPERTISE
Strong fundamentals in applied Mathematics and Computer Science algorithms
Proficiency in least one or more statistical programming languages (e.g. R, Python, SQL, Scala, SAS, SPSS, MATLAB)
Basic understanding of or experience with predictive/prescriptive modeling
Ability to translate business requirements into technical solutions
Ability to thrive in an ever-changing, technology-based consulting environment, using agile development techniques

Required Technical and Professional Expertise
Please see Job Description

Preferred Technical and Professional Expertise
Exposure to Cloud (e.g. AWS, Azure, Google Cloud, IBM Cloud) is an asset
Knowledge of end-to-end ML application development in hybrid cloud environments (Azure/AWS/GCP/IBM Cloud)
Familiarity with clusters and containers, writing docker files, defining architectures for distributed computing (Kubernetes/ docker).
Exposure to MLOps pipelines and script development for pipeline automation. (e.g. Jenkins, ArgoCD)
About Business Unit
IBM Consulting is IBM’s consulting and global professional services business, with market leading capabilities in business and technology transformation. With deep expertise in many industries, we offer strategy, experience, technology, and operations services to many of the most innovative and valuable companies in the world. Our people are focused on accelerating our clients’ businesses through the power of collaboration. We believe in the power of technology responsibly used to help people, partners and the planet.

Your Life @ IBM
Are you craving to learn more? Prepared to solve some of the world's most unique challenges? And ready to shape the future for millions of people? If so, then it's time to join us, express your individuality, unleash your curiosity and discover new possibilities.

Every IBMer, and potential ones like yourself, has a voice, carves their own path, and uses their expertise to help co-create and add to our story. Together, we have the power to make meaningful change – to alter the fabric of our clients, of society and IBM itself, to create a truly positive impact and make the world work better for everyone.

It's time to define your career.

About IBM
IBM’s greatest invention is the IBMer. We believe that through the application of intelligence, reason and science, we can improve business, society and the human condition, bringing the power of an open hybrid cloud and AI strategy to life for our clients and partners around the world.

Restlessly reinventing since 1911, we are not only one of the largest corporate organizations in the world, we’re also one of the biggest technology and consulting employers, with many of the Fortune 50 companies relying on the IBM Cloud to run their business.


At IBM, we pride ourselves on being an early adopter of artificial intelligence, quantum computing and blockchain. Now it’s time for you to join us on our journey to being a responsible technology innovator and a force for good in the world.

Location Statement
Must have the ability to work in Canada without sponsorship.

This role will involve working with technology that is covered by Export Regulations sanctions. If you are a Foreign National from any of the following US sanctioned countries (Cuba, Iran, North Korea, Syria, and the Crimea, Luhansk and Donetsk regions of Ukraine) on a work permit, you are not eligible for employment in this position.

Being You @ IBM
IBM is committed to creating a diverse environment and is proud to be an equal opportunity employer. All qualified applicants will receive consideration for employment without regard to race, color, religion, gender, gender identity or expression, sexual orientation, national origin, genetics, pregnancy, disability, age, veteran status, or other characteristics. IBM is also committed to compliance with all fair employment practices regarding citizenship and immigration status.",Tecnologías de la información,,2022-08-31T00:00:00,2022-10-16,FULL_TIME
Machine Learning Compiler & Performance,Qcom,Ontario,Markham,-1,-1,,CAD,"Company:
Qualcomm Canada ULC
Job Area:
Engineering Group, Engineering Group > Machine Learning Engineering
General Summary:
Preferred Qualifications:
Master's degree in Computer Science, Engineering, Information Systems, or related field.5+ years of experience with Machine Learning frameworks (e.g., Tensor Flow, Caffe, Caffe 2, Pytorch, Keras).5+ years of experience with low level interactions between operating systems (e.g., Linux, Android, QNX) and Hardware.5+ years of experience in embedded system development and optimization with application to a specific problem domain in ML (e.g., NLP, multi-media).5+ years of experience with one or more programming language suitable for machine learning (e.g., Python, R, C, C++)5+ years of experience using statistics and probability (e.g., conditional probability, Bayes rule).3+ years experience working in a large matrixed organization.2+ years of work experience in a role requiring interaction with senior leadership (e.g., Director and above).1+ years in a technical leadership role with or without direct reports (only applies to positions with direct reports).Developed 1+ novel Machine Learning architecture(s).
Principal Duties and Responsibilities:
Leads technical conversation in design or project reviews and project meetings across multiple domains to monitor the effectiveness of machine learning solutions in meeting customer needs.Plans and manages team activities on complex projects according to timelines and major project milestones to deliver solutions; monitors collaboration with cross-functional teams to accomplish tasks.Coordinates team within a specific domain and oversees the engineering and management of complex or novel machine learning data.Develops, adapts, or prototypes novel machine learning solutions aligned with and motivated by proposals or roadmaps for complex products and system-level features; advises and supervises small groups of less experienced engineers working together on common tasks.Oversees and provides technical expertise to others conducting experiments within a domain to train and evaluate machine learning solutions.Oversees efforts of a small team of less experienced engineers to optimize new or existing machine learning algorithms or models; solves complex system-level features with ambiguous requirements, including kernels and frameworks; creates and documents solutions to novel issues and shares lessons learned within domain.Leads the integration of machine learning architecture into platforms and products for production; provides technical expertise to resolve systems-level issues during implementation.Displays deep knowledge within a machine learning domain; acquires advanced knowledge of industry trends, competitors' products, and advances within domain from publicly available information and research; shares knowledge within the team and across teams working on similar products.Stays abreast of current and future machine learning trends to make suggestions in strategic discussions within a domain about the product/technology roadmap.
Level of Responsibility:
Working independently with little supervision.May provide supervision to direct reports.Making decisions that are moderate in impact; errors may have relatively minor financial impact or affect on projects, operations, or customer relationships; errors may require involvement beyond immediate work group to correct.Using verbal and written communication skills to convey information that may be somewhat complex to others who may have limited knowledge of the subject in question. May require basic negotiation and influence, cooperation, tact, and diplomacy, etc.Some financial accountability (e.g., manages a small budget, has input into P&L).Having a moderate amount of influence over key organizational decisions (e.g., is consulted by senior leadership to provide input on key decisions).Completing tasks that do not have defined steps; simultaneous use of multiple mental abilities is generally required to determine the best approach; mistakes may result in significant rework.Exercising exceptional creativity to innovate new ideas and develop innovative products/processes without established objectives or known parameters.Working on abstract problems in variable situations that typically require complex analysis, interpretation, or evaluation of intangible factors; directing the resolution of complex problems that have impact beyond own area; participating in corporate development of methods, techniques, and evaluation criteria for projects, programs, and people.Participating in the organization's planning process, interpreting business strategies, establishing strategic plans and objectives for multiple areas and functions. Decisions may affect entire organization.
Qualcomm is committed to hiring and supporting individuals with disabilities. Although this role has some expected physical activity, an inability to perform one or more of the listed physical requirements should not deter otherwise qualified applicants from applying. We will work with you throughout the application and onboarding process to provide reasonable accommodations. Examples of expected physical activity include: frequently transporting between offices, buildings, and campuses up to ½ mile; frequently transporting and installing equipment up to 5 lbs.; performing tasks at various heights (e.g., standing or sitting); monitoring and utilizing computers and test equipment for more than 6 hours a day; and continuous communication which includes the comprehension of information with colleagues, customers, and vendors both in person and remotely.
Minimum Qualifications:
Creates advanced machine learning techniques that enable a broad set of technology verticals or designs and extends training or runtime frameworks or model efficiency software tools with new features and optimizations. Models, architects, and develops advanced machine learning hardware (co-designed with machine learning software) for inference or training solutions. These enable the discovery and improvement of state-of-the-art machine learning solutions that has general applicability at functional platform level towards audio, camera, graphics, video, sensors, wireless, and other functionality over various operating systems running on ARM processors and other embedded hardware like DSP/NSP processors, GPU processors that are embedded into mobile, edge, auto, and IOT products, or on data center based systems such as GPUs or dedicated AI hardware. Develops optimized software to enable AI models efficiently deployed on hardware, such as machine learning kernels, compiler tools, or model efficiency tools, to make sure of specific hardware features, and/or working closely with hardware teams for joint design and development. Works with and/or optimize machine learning software frameworks like TensorFlow or PyTorch to efficiently run machine learning algorithms on hardware.
Preferred Qualifications:Master's degree in Computer Science, Engineering, Information Systems, or related field.5+ years of experience with Machine Learning frameworks (e.g., Tensor Flow, Caffe, Caffe 2, Pytorch, Keras).5+ years of experience in embedded system development and optimization with application to a specific problem domain in ML (e.g., NLP, multi-media).5+ years of experience with one or more programming language suitable for machine learning (e.g., Python, R, C, C++)5+ years of experience using statistics and probability (e.g., conditional probability, Bayes rule).2+ years of experience with low level interactions between operating systems (e.g., Linux, Android, QNX) and Hardware.3+ years experience working in a large matrixed organization.1+ years in a technical leadership role with or without direct reports (only applies to positions with direct reports).1+ years of work experience in a role requiring interaction with senior leadership (e.g., Director and above).
Principal Duties and Responsibilities:
Leads technical conversation in design reviews, project reviews, and project meetings within a particular domain to monitor the effectiveness of machine learning solutions in meeting customer needs.Owns work within a specific area and solves complex issues according to project timelines and requirements; manages small teams to accomplish work and provides guidance on specific issues; collaborates with cross-functional teams when needed.Manages project team to complete complex tasks and troubleshoot issues related to the engineering and management of machine learning data.Develops, adapts, or prototypes novel machine learning solutions aligned with and motivated by proposals or roadmaps for complex products and working features; advises team members and less experienced engineers working together on common tasks.Oversees and conducts experiments across several areas to train and evaluate machine learning models and/or software and assists other team members to do the same.Supports team's efforts to optimize new or existing machine learning algorithms models, and owns the design of machine learning kernels and execution frameworks; finds and documents solutions to novel issues and shares lessons learned with team.Executes the integration of machine learning architecture into platforms and products for production; provides technical expertise to resolve moderately complex issues during implementation.Displays deep knowledge in a specific area of machine learning; acquires advanced knowledge of industry trends, competitors' products, and advances within and outside of area of expertise from publicly available information and research; shares knowledge with others on the team and helps less experienced engineers understand and apply advanced concepts.Stays abreast of current and future machine learning trends to make suggestions in strategic discussions within a domain about the product/technology roadmap.
Level of Responsibility:
Working independently with little supervision.Providing some supervision/guidance to others.Making decisions that are moderate in impact; errors may have relatively minor financial impact or affect on projects, operations, or customer relationships; errors may require involvement beyond immediate work group to correct.Using verbal and written communication skills to convey information that may be somewhat complex to others who may have limited knowledge of the subject in question. May require basic negotiation and influence, cooperation, tact, and diplomacy, etc.Having a moderate amount of influence over key organizational decisions (e.g., is consulted by senior leadership to provide input on key decisions).Completing tasks that do not have defined steps; simultaneous use of multiple mental abilities is generally required to determine the best approach; mistakes may result in significant rework.Exercising substantial creativity to innovate new processes, procedures, or work products within guidelines or to achieve established objectives.Using deductive and inductive problem solving; multiple approaches may be taken/necessary to solve the problem; often information is missing or conflicting; advanced data analysis and interpretation skills are required.Occasionally participating in strategic planning within own area affecting immediate operations.
The responsibilities of this role do not include:
Financial accountability (e.g., does not involve budgeting responsibility).
Qualcomm is committed to hiring and supporting individuals with disabilities. Although this role has some expected physical activity, an inability to perform one or more of the listed physical requirements should not deter otherwise qualified applicants from applying. We will work with you throughout the application and onboarding process to provide reasonable accommodations. Examples of expected physical activity include: frequently transporting between offices, buildings, and campuses up to ½ mile; frequently transporting and installing equipment up to 5 lbs.; performing tasks at various heights (e.g., standing or sitting); monitoring and utilizing computers and test equipment for more than 6 hours a day; and continuous communication which includes the comprehension of information with colleagues, customers, and vendors both in person and remotely.
Applicants: If you need an accommodation, during the application/hiring process, you may request an accommodation by sending email to accommodationsupport
Although this role has some expected minor physical activity, this should not deter otherwise qualified applicants from applying. If you are an individual with a physical or mental disability and need an accommodation during the application/hiring process, please call Qualcomm’s toll-free number found here for assistance. Qualcomm will provide reasonable accommodations, upon request, to support individuals with disabilities as part of our ongoing efforts to create an accessible workplace.
Qualcomm is an equal opportunity employer and supports workforce diversity.
To all Staffing and Recruiting Agencies: Our Careers Site is only for individuals seeking a job at Qualcomm. Staffing and recruiting agencies and individuals being represented by an agency are not authorized to use this site or to submit profiles, applications or resumes, and any such submissions will be considered unsolicited. Qualcomm does not accept unsolicited resumes or applications from agencies. Please do not forward resumes to our jobs alias, Qualcomm employees or any other company location. Qualcomm is not responsible for any fees related to unsolicited resumes/applications.
If you would like more information about this role, please contact Qualcomm Careers.",Tecnologías de la información,,2022-09-13T00:00:00,2022-10-16,FULL_TIME
