Job_title,Company,State,City,Min_Salary,Max_Salary,unitText,SalaryCurrency,Job_Desc,Industry,Rating,Date_Posted,Valid_until,Job_Type
"Sr. Machine Learning Engineer, AWS Payments",Amazon Dev Centre Canada ULC,British Columbia,Vancouver,-1,-1,,CAD,"2+ years of experience contributing to the architecture and design (architecture, design patterns, reliability and scaling) of new and current systems
3+ years of programming experience with at least one modern language such as Java, C++, or C# including object-oriented design
4+ years of professional software development experience
2+ years of experience as a mentor, tech lead OR leading an engineering team
5+ years software development experience
Strong background and experience in MLOps, Machine Learning, Data Science and related technologies
Hands on experience with building data or machine learning pipeline
Programming experience with at least one modern language such as Scala, Python, Java.
Experience building high-quality scalable production software.
Experience contributing to the architecture and design (architecture, design patterns, reliability and scaling) of new and current systems.
Bachelor's degree in Computer Science, Computer or Electrical Engineering, Mathematics or a related field.
Strong problem solving, debugging and troubleshooting skills.
Proficiency with Computer Science fundamentals in object-oriented, data structures, algorithm, problem solving, and complexity analysis.
Knowledge of professional software engineering practices & best practices for the full software development life cycle, including coding standards, code reviews, source control management, build processes, testing, and operations.

Job summary
Machine learning, big data; real-time data streaming. If these areas resonate with you, then join us to work on extremely motivating challenges at Amazon Web Services (AWS). Within AWS Payments we build and run Machine Learning models to optimize business processes and improve the customer experience.


If you are a strong software engineer, self-starter and learner who is passionate about working with massive amounts of data to build state-of-art system on top of AWS native services, then this is the right opportunity for you. You will work with a team of highly skilled engineers and scientists, to build the next generation Machine Learning, Data, and Analytics platform at AWS. As part of your job, you will deal with large amounts of training data, rapid prototyping of new models, performance optimizations, offline and online testing, and building fully automated solutions to push Machine Learning models to production, applying MLOps best-practices.

Key job responsibilities
You are fascinated by the power of large scale systems and using machine learning algorithms to optimize decision making. And you're looking for a career where you'll be able to build, to deliver, and to impress. You look at problems holistically, and thrive on the intricate complexity of designing feedback loops and ecosystems. You want to work on projects where you are implementing solutions to real problems that require creative solutions and deep understanding of the problem space. You will partner with research scientists to challenge yourself and others to constantly come up with better solutions. You'll be given an opportunity to own and drive initiatives through the entire software stack - from customer facing features, to algorithmic innovation, all the way down to the datasets that the back-end services consume.

As a software development engineer of this team, you will play a pivotal role in shaping the definition, vision, design, roadmap and development of this set of product features from beginning to end. You will:

Lead the work to define, scope, and plan the engineering workstreams on the team.
Meet regularly with scientists, engineers, and product managers from other teams to brainstorm new ideas, identify opportunities for collaboration, and clarify ambiguous problems. This could result in writing project proposals with our collaborators and designing components that have cross-team components.
Write clear emails and design documents that convey your work to an audience with varying levels of Software and ML knowledge.
Mentor junior engineers through code reviews, design reviews, and tradeoff discussions. Provide valuable feedback.
Actively participate in interviewing for Amazon software engineers.
Help drive business decisions with your technical input.
Design, implement, test, deploy and maintain innovative software solutions, while optimizing service performance, durability, cost, and security.
Use software engineering best practices to ensure a high standard of quality for all of the team deliverables.
Write high quality distributed and scalable systems, to deal with large scale data.
Automate the end-to-end development life-cycle to deploy Machine Learning models from research phase to production.
Work in an agile, startup-like development environment, where you are always working on the most important stuff.
In this role you will contribute to a critical and highly-visible function within the AWS business. You will be given the opportunity to autonomously deliver the technical direction of new projects and features in our roadmap. You will work with extraordinary talent and have the opportunity to hire and shape the team to best execute on the product. If you’re excited to have a large impact on AWS and the cloud computing industry, you’ll find this role to be engaging, challenging, and full of opportunities to learn and grow.

About the team
Our team is dedicated to supporting new members. We have a broad mix of experience levels and tenures, and we’re building an environment that celebrates knowledge sharing and mentorship. Our senior members enjoy one-on-one mentoring and thorough, but kind, code reviews. We care about your career growth and strive to assign projects based on what will help each team member develop into a better-rounded engineer and enable them to take on more complex tasks in the future.

*Inclusive Team Culture*
Here at AWS, we embrace our differences. We are committed to furthering our culture of inclusion. We have ten employee-led affinity groups, reaching 40,000 employees in over 190 chapters globally. We have innovative benefit offerings, and host annual and ongoing learning experiences, including our Conversations on Race and Ethnicity (CORE) and AmazeCon (gender diversity) conferences. Amazon’s culture of inclusion is reinforced within our 14 Leadership Principles, which remind team members to seek diverse perspectives, learn and be curious, and earn trust.

*Work/Life Balance*
Our team puts a high value on work-live balance. It isn’t about how many hours you spend at home or at work; it’s about the flow you establish that brings energy to both parts of your life. We believe striking the right balance between your personal and professional life is critical to life-long happiness and fulfillment. We offer flexibility in working hours and encourage you to find your own balance between your work and personal lives. This position involves on-call responsibilities, typically for one week every two months. We don’t like getting paged in the middle of the night or on the weekend, so we work to ensure that our systems are fault tolerant. When we do get paged, we work together to resolve the root cause so that we don’t get paged for the same issue twice.

*Mentorship & Career Growth*
Our team is dedicated to supporting new members. We have a broad mix of experience levels and tenures, and we’re building an environment that celebrates knowledge sharing and mentorship. Our senior members enjoy one-on-one mentoring and thorough, but kind, code reviews. We care about your career growth and strive to assign projects based on what will help each team member develop into a better-rounded engineer and enable them to take on more complex tasks in the future.
Learn more about Amazon on our Day 1 Blog: https://blog.aboutamazon.com/

2+ years of experience applying machine learning to solve real-world problems.
Experience working with Spark, Hadoop, and AWS (EMR, EC2, S3, SageMaker, etc…)
Experience with building high-performance, highly-available and scalable distributed systems.
Experience working with large volumes of real-world noisy data.
Experience building and operating highly-available online services and fault-tolerant systems.
A willingness to dive deep, experiment rapidly and get things done.
Amazon is committed to a diverse and inclusive workplace. Amazon is an equal opportunity employer and does not discriminate on the basis of race, national origin, gender, gender identity, sexual orientation, disability, age, or other legally protected status. If you would like to request an accommodation, please notify your Recruiter.",Tecnologías de la información,,2022-09-09T00:00:00,2022-10-16,FULL_TIME
Junior Developer / Quality Assurance Engineer,Fortran Traffic Systems,Ontario,Toronto,-1,-1,,CAD,"Job Title:Junior Developer / Quality Assurance EngineerDivision/Department:Reports To:Position:Full TimeBased in Toronto, Fortran Traffic Systems Limited is a leader in the North American traffic industry and at the forefront of innovation in Intelligent Transportation Systems (ITS) and Connected and Automated Vehicles (CAV) support systems. With the arrival of transportation technologies such as CAV and Vehicle-to-Everything (V2X) communication, Fortran is developing advanced solutions to harness the multitude of benefits that these emerging technologies can provide to road operators and traffic management agencies. Fortran offers a challenging environment, rich in R&D, that fosters creativity and rewards excellence.The RoleThe Junior Developer / QA Engineer will be entrusted to both test and assist with the development ofcutting-edge software solutions for the next-generation of ITS designed and produced by Fortran.The successful candidate will be an integral part of a team developing and testing high performance andsustainable V2X and ITS systems.What You’ll DoBe great: Build a great product, provide a great service and be a great team playerContinuously innovate: Search for a better solution. Then top it!As a Developer you will: Utilize quality focused state-of-the-art software development practices to develop full stacksoftware solutionsPerform detailed analysis, design, unit-level code development, software integration and testingAnalyze complex functions, procedures and problems to deliver creative and effective solutionsParticipate in design and code reviewsPreparation of application operational / procedural documentation for users and technical supportstaffAs a QA you will: Develop and document software efficient test plansExecute test plans manually or automated and track software defects/bugsWork with the software development team to resolve bugsTest automation implementationAccurate creation/revision of software release instructions, software update instructions, testreports and related technical documentation.Install software and hardware in preparation for testing‍What You’ll Need To SucceedBachelors in Computer Science or related technical fieldExperience in software QAExperience defining & developing test scripts (Perl, Python or other) for automated test scriptsWeb-based front-end application framework and web-based UI programming such as but notlimited to HTML, CSS, JavasScript/jQuery and NodeJSSQL and NoSQL experience including (PostgresDB/PostGIS and MongoDB)One or more back-end programming languages such as C++ and PythonLinux (or Unix) environment Operating systems principles and communication protocolsTeam player with excellent interpersonal and communication skillsOrganized, focused and persistent with the ability to work to the plan and meet delivery datesExcellent problem solver and quick learnerNice To HaveExperience in Machine Learning, Data Mining or Machine Intelligence (Artificial Intelligence)Real-time software development experienceMobile app development (Android or iOS)What We OfferTechnically Challenging ProjectsCompetitive SalaryWork Remotely (Flexible Work Location)Casual Dress Code and WorkplaceGreat and Friendly EnvironmentFlexible HoursHalf Day Fridays‍FULL TRAINING WILL BE PROVIDEDTO APPLY: Please forward your resume to resumes@fortrantraffic.com and note "" Junior Developer / QualityAssurance Engineer"" on the subject header, showing how you meet the qualifications listed above in onedocument. No cover letter required.‍We thank all applicants for their interest but only those selected for an interview will be contacted.Job Type: Full-time",,,2022-08-24T00:00:00,2022-10-16,FULL_TIME
Senior Software Development Engineer,"AMZN CAN Fulfillment Svcs, ULC",Ontario,Toronto,-1,-1,,CAD,"
4+ years of professional software development experience
3+ years of programming experience with at least one modern language such as Java, C++, or C# including object-oriented design
2+ years of experience contributing to the architecture and design (architecture, design patterns, reliability and scaling) of new and current systems
Bachelor's degree in Computer Science or 8+ years of equivalent professional or military experience
4+ years of professional software development experience
3+ years of programming experience with at least one modern language such as Java, C++, or C# including object-oriented design
2+ years of experience contributing to the architecture and design (architecture, design patterns, reliability and scaling) of new and current systems
5+ years industry experience as a Software Engineer or a Software developer with experience as a Senior Engineer leading teams in an agile environment
Bachelor’s Degree in Computer Science or related field or equivalent experience
Computer Science fundamentals in object-oriented design, data structures and algorithm design, and complexity analysis

Job summary
Join the team that builds the technology that makes the magic of Amazon happen for hundreds of millions of customers around the world. Positions located in: US Remote/Virtual; Seattle, WA; Bellevue, WA; Austin, TX; San Francisco, CA; Palo Alto, CA; Cupertino, CA; Irvine, CA; Boulder, CO; Goodyear, AZ; Nashville, TN; New York, NY; North Reading, MA; Westborough, MA; Tempe, AZ)

Amazon’s Operations Technology teams are the technical engines that support Amazon’s mission of being Earth’s most customer-centric company. We build the software and services that touch every Amazon customer globally and innovate solutions for logistics, supply chain optimization, and transportation.

As a senior member of our engineering team, you will own:

The full stack technology and drive the technical direction

·

You will be solving complex problems, and working on difficult challenges in software engineering as the scale and suite of our services grow

·

You will work with key stake holders in product management and executive teams to define strategy and requirements

·

You will lead cross functional development of new technology from design to deployment

For additional information Operations Technology: https://www.amazon.jobs/en/business_categories/operations-technology

We are seeking Senior/Lead Software Development Engineers to join a variety of teams:

FULFILLMENT and ROBOTICS
We solve complex problems and invent for almost every aspect of fulfillment. We work with ambiguity and large problems, and work in a startup-like environment. Our robotics teams around the world are driving improvements in the safety and autonomy of our worldwide operations. We re-imagine what now looks like.

TRANSPORTATION and DELIVERY
We exceed the expectations of our customers by ensuring that their orders are delivered where and when they need them, as quickly, accurately, and cost effectively as possible. We strive to innovate and provide best-in-class service levels through the introduction of pioneering new designs, products and services. (i.e. Prime Air, Last Mile, Amazon Flex, Delivery Service Partners)

DELIVERY EXPERIENCE
We build and support the technology tools that Amazon businesses use to deliver packages into the hands of our customers. Our technology is used by multiple businesses and product lines within Amazon. We leverage company-wide technology solutions or design them from the ground up. (i.e. Amazon Scout)

INVENTORY MANAGEMENT
We streamline our processes utilizing the latest applications in science, machine learning, and scalable distributed software on the cloud. We optimize inventory and shipments under the ever-changing landscape of demand, pricing and supply.


Completed Master’s degree in Computer Science or equivalent
Experience taking a leading role in building complex software systems that have been successfully delivered to customers
Knowledge of professional software engineering practices & best practices for the full software development life cycle, including coding standards, code reviews, source control management, build processes, testing, and operations
Experience in communicating with users, other technical teams, and senior management to collect requirements, describe software product features, technical designs, and product strategy
Experience mentoring junior software engineers to improve their skills, and make them more effective, product software engineers
Experience influencing software engineers best practices within your team
Hands-on expertise in many disparate technologies, typically ranging from front-end user interfaces through to back-end systems and all points in between
Experience in building high-performance, highly-available and scalable distributed systems
Ability to work in an ambiguous environment and create innovative solutions regularly

The pay range for this position in Colorado is $168,100 - $227,400/yr; however, base pay offered may vary depending on job-related knowledge, skills, and experience. A sign-on bonus and restricted stock units may be provided as part of the compensation package, in addition to a full range of medical, financial, and/or other benefits, dependent on the position offered. This information is provided per the Colorado Equal Pay Act. Base pay information is based on market location. Applicants should apply via Amazon's internal or external careers site.

Amazon is committed to a diverse and inclusive workplace. Amazon is an equal opportunity employer and does not discriminate on the basis of race, national origin, gender, gender identity, sexual orientation, disability, age, or other legally protected status. If you would like to request an accommodation, please notify your Recruiter.",Tecnologías de la información,,2022-08-21T00:00:00,2022-10-16,FULL_TIME
Senior Software Developer - Backend,Hatch,Ontario,Mississauga,-1,-1,,CAD,"Requisition ID: 66641
Job Category: Digital
Location: Mississauga, ON, Canada
With over six decades of business and technical experience in the mining, energy, and infrastructure sectors, we see challenges evolving in every industry. We respond quickly with solutions that are smarter, more efficient, and innovative. We draw upon our 9,000 staff, with experience in over 150 countries, to challenge the status quo and create positive change for our clients, our employees, and the communities we serve.
We're at the forefront of our clients' digital transformation journey, successfully implementing emerging digital services into our clients' projects and operations that unlock a step change in their performance. Join the team to improve project outcomes, leverage the digital twin, deliver systems integration and interoperability, and support decision-making, autonomous execution, and integrated operations and performance centers.
Hatch is seeking a highly motivated Senior Software Developer to join the Digital Products Development team.
Join our diverse team and award-winning culture and be part of our clients’ digital transformation journey. This journey will lead to better outcomes for our clients, people and the planet through innovative new technology-based solutions. Hatch is all about innovation. We challenge our clients with innovative ideas that help them take their business to higher levels. We challenge our employees to act as entrepreneurs in a flat, connected organization to solve our clients’ problems.
This is an excellent career opportunity for a creative individual who strives to deliver superior digital products in an industry of accelerated change and innovation. This role is within our Digital Products group and focuses on identifying, designing, building and productizing Hatch deep subject matter expertise.
A successful Senior Software Developer at Hatch is a passionate person who is confident and has exceptional communication skills; an outcome-oriented person who enjoys setting the direction and mentoring others, but also likes to lead by doing.
A successful candidate would:
Be involved with all technical activities within the team such as estimating, architecting, designing, software development life cycle activities (we use Agile), code reviews, documentation creation.
Level up our software standards by introducing best practices and guiding their adoption.
Drive our team culture by communicating well, mentoring others, and participating in growing out our team.
Love the challenge of engineering and solving challenging problems. Automate away all the boring stuff and design stellar solutions for our customers.
Experience:
5+ years’ experience working on a development team, experience actively mentoring junior team members and helping shape a quality product/solution. Proven capabilities in the following technologies:
Recent knowledge of one of a set of backend technologies (C#/.NET, Java, Go, Node.js, etc.)
Proficient in working with Cloud Providers (Azure, AWS, GCP) AND architecting or implementing your own cloud solutions
Familiarity with Azure DevOps or other equivalent CICD tools
Familiarity with a database solution (e.g., SQL Server, Azure Storage, MongoDB/Cosmos DB, etc.)
Protocol – REST via Web API + JSON
Experience with designing end to end solutions and/or Products
Experience evaluating new development frameworks and technologies and provide adoption recommendations
Experience with Agile and Kanban methodologies and working in teams of mixed disciplines.
A strong appreciation for all skillset needed to build amazing products. Including (but not limited to) Subject matter experts, engineers, designer and user experience.
Experience building consensus across teams
Trust is the foundation of a strong team, must be a self-starter, organized and needs minimal supervision
Bachelor’s degree or equivalent combination of education, training or work experience
Working knowledge in the following areas considered an asset:
Docker or other virtualization tools
Azure Machines Learning services
DevOps, CI/CD best practices and related technologies.
We are open to hiring for this position in either our Mississauga or St. John's office locations.
Why join us?
Work with great people to make a difference
Collaborate on exciting projects to develop innovative solutions
Top employer
What we offer you?
Flexible work environment
Long term career development
Think globally, work locally
We're committed to fostering a workforce that reflects the diversity of the communities in which we operate and serve. Hatch is an Equal Opportunity Employer that considers applicants without regard to age, race, color, national origin, citizenship, religion, creed, gender, sexual orientation, marital status, disability, or any other protected status. If you have any accommodation requirements, please let us know. We'll do our best to meet your needs in accordance with applicable local legislation.","Energía, minería e infraestructura pública",,2022-09-16T00:00:00,2022-10-16,OTHER
