Job_title,Company,State,City,Min_Salary,Max_Salary,unitText,SalaryCurrency,Job_Desc,Industry,Rating,Date_Posted,Valid_until,Job_Type
Machine Learning Engineer,Moonshot Brands,,,-1,-1,,CAD,"About Moonshot Brands
We are Moonshot Brands, a Y-combinator-backed company (W21) with $160M in debt and equity funding from leading Silicon Valley VC firms, including Victory Park Capital, Liquid 2 Ventures (Joe Montana), and Garage Capital. Among our founding team of MIT Sloan and Wharton graduates, we have operated and sold five businesses and have come together as Moonshot Brands to acquire, operate, and grow profitable e-commerce brands.
From our experience, we want to build the acquisition process that we wish we could have had and to provide the post-acquisition resources to grow your business to its fullest potential. As entrepreneurs ourselves, we believe in empowering our founders, giving them a stake in Moonshot’s continued success, and collaborating with an all-star team to change the e-commerce landscape. We connect our portfolio to growth capital, data, and expertise in operations, marketing, supply chain management, and product development to provide owner-operators with infrastructure to grow and compete at scale. Moonshot is building a technology-centric ecosystem to provide our portfolio with cutting-edge tools and data-driven insights to succeed in global marketplaces. From inventory forecasting to performance marketing and automation, we are building the technology that allows brands to achieve peak performance and win in their markets.
If you’d like to be part of this Moonshot which will be a fun fast-paced rocketship that will drive the future of e-commerce brands and you think you add significant value to our mission we’d love to hear from you.
About The Role
Moonshot Brands is seeking a high-performing Machine Learning Engineer to support both our internal and portfolio company operations. In this role you will work to uncover patterns and generate insights by building and deploying predictive machine learning models that assist with our sourcing and optimization of portfolio company sales, marketing and operations. The candidate will have exposure across all of Moonshot’s portfolio companies and create broad top-down strategies as well as brand specific solutions based on analytical rigor. The Data Scientist will also provide perspective on Moonshot’s collection of data that will be analyzed to inform future business decisions. This role requires a high level of autonomy.
As Machine Learning Engineer, you will:
Solution architecture and design for services that use machine learning and AI algorithms to predict and optimize e-commerce outcomes
Development of tools to facilitate data science and AI model research and testing
Work with business owners to gather requirements, and propose solutions
Build data pipeline to integrate data sources in various formats, warehouse them for downstream applications
Additional responsibilities as requested
Who we looking for:
6+ years of experience working as a professional software developer, at least 2 years of which includes experience in data science or AI solution development
Experience with system design
Strong Python with experience using some subset of the Python ML ecosystem (numpy/scipy/pandas, Tensorflow/PyTorch, etc.)
Strong SQL
Experience choosing and writing machine-learning models for deployment at scale.
Desire to work in a collaborative environment focusing on continuous learning; participating in code review and pair programming
Experience in financial modelling, or advertising is a plus
Experience deploying containerized machine learning services
Experience designing workflow automation
Experience with data integration from external data sources
Experience with Google Cloud Platform
Moonshot Brands welcomes all and is proud to be an equal opportunity employer and values diversity at our company. We do not discriminate based on race, color, religion, sex, sexual orientation, gender perception or identity, national origin, age, marital status, protected veteran status, disability status, or other applicable legally protected characteristics.",Ventas al mayoreo y al menudeo,,2022-08-16T00:00:00,2022-10-16,FULL_TIME
Machine Learning Scientist,DarkVision,British Columbia,Ciudad de North Vancouver,-1,-1,,CAD,"DarkVision's ultrasound imaging system collects huge datasets on the order of hundreds of gigabytes that are several kilometers long where a defect may be on the order of a few mm. It is essential that we develop algorithms for automated processing, measuring, classification and visualization of this data since manual processing is both time consuming and inconsistent.

As a Machine Learning Scientist, you will be involved in researching, designing and implementing deep learning architectures that learn efficient generalizable representations for several tasks including classification, regression, segmentation and object detection. You will report to our Director of Machine Learning and be responsible for developing machine learning pipelines for continuous training, evaluation and deployment of deep learning models.

Our management process is light and generally milestone driven, using pseudo-agile sprints derived from our quarterly and yearly goals. All goals are internally generated with plenty of room for feedback.

Responsibilities: (included, but not limited to)

Data Analysis: Work closely with experts of our Data team to explore & organize data, write required preprocessing code.
Research: Research & develop new deep learning architectures and responsible for end-to-end training of our AI models such as CNNs, Autoencoders, and Transformer models etc. targeting object detection, instance segmentation, semantic segmentation and many more.
Development: Develop cloud-based iterative pipelines for image pre-processing, data-augmentation, training, post-processing and inference.
Deploy: Deploy ML algorithms in conjunction with other members of the Software Team for our Data Team to use and implement tools to monitor the performance.
Monitor: Continuously monitor success matrices of the assigned ML project and make continuous improvements for increasing model robustness & efficiency.

Expectations:

Master's degree in computer science, Electrical Engineering or equivalent, PhD preferred.
Strong analytical skills in linear algebra, geometry, and statistics.
Experience developing Image Processing and conventional Computer Vision algorithms (OpenCV).
Experience developing Deep Learning Models for Computer Vision tasks.
Good working knowledge of one or more Machine Learning Frameworks (TensorFlow, Keras, PyTorch etc.)
Experience with Python beyond basic Machine Learning scripting (i.e., Numpy and Pandas).
Strong communication and data presentation skills.

Opportunities to learn:

AWS services like Sagemaker, Batch, Lambda.
Training models with imbalanced datasets.
Training semantic and/or instance segmentation models.
Latest advancements in Computer Vision.
Developing with C++.

What's in it for you?

Competitive salary or higher (Top $ for top talent)
Full benefits package.
Competitive vacation allotment
Flexible work environment.

About DarkVision

DarkVision Technologies Inc. is a BC-based tech company that has been disrupting the industrial imaging market since 2013. We have created the world's most advanced acoustic-based imaging platform and are packaging it into multiple new product lines, revolutionizing how our clients quantify and visualize the integrity of their critical assets.

Backed by Koch Industries, the largest privately held company in North America, DarkVision's team of Mechanical, Skunkworks, Electrical, Software, and Machine Learning Engineers is rapidly expanding to meet the demand for the company's current and upcoming products.

We provide employees the opportunity to work on cutting-edge technologies that blend science with real-world applications and invite you to join our team for the exciting journey ahead as we become the global leader in industrial imaging.

Why DarkVision:

Here are 4 reason's you'll like working at DarkVision:

Well-Funded: We are backed by Koch Industries - North America's largest privately held company and are actively working with top-tier operators across North America.
'A' Players: Our team is made up of talented, intelligent, and hardworking people. If you're an 'A' player, you'll enjoy the intellectually stimulating, challenging and respectfully competitive atmosphere.
Growing Quickly: We are in the process of launching several new product lines and as a result have more than doubled our headcount over the last year.
Lots of Opportunities: We are transitioning into a much larger organization and will soon be expanding into a 52,000 sq ft facility in Vancouver. We have recently opened a larger Calgary office and have expanded into the US with offices in Houston and Midland, TX.","Energía, minería e infraestructura pública",,2022-08-28T00:00:00,2022-10-16,OTHER
Machine Learning Engineer,Motion Metrics International Corp.,British Columbia,Vancouver,-1,-1,,CAD,"Machine Learning Engineer
Vancouver, BC, Canada
 Motion Metrics International is a technology development and commercialization company with the vision to inspire the next generation of safe, sustainable, and intelligent resource mining. Our products leverage machine learning, computer vision, and sensors to address tough mining challenges.
We are looking for a Machine Learning Engineer who is passionate about applying machine learning techniques to solve real-world computer vision and big data problems. The successful candidate will work alongside other data scientists and software developers to research and deploy new algorithms into our products.
 What you will do:
Review the literature for the state-of-the-art computer vision and machine learning methodologies.
Design and implement proprietary machine learning algorithms and optimize them based on runtime system requirements and constraints.
Propose, implement, and monitor validation and performance metrics for the proprietary algorithms.
Conduct code reviews and work closely with the software/hardware teams to transfer the prototyped models to the production environment.
Must have:
Master’s Degree or higher in Computer Science or a related technology/engineering field.
3+ years of hands-on experience in developing and implementing and evaluating machine learning models/algorithms.
Solid understanding of statistical learning algorithms, including (self, semi) supervised, unsupervised and transfer learning and computer vision algorithms.
Proficiency in Python and version control.
Solid Experience with TensorFlow, PyTorch and OpenCV.
Basic familiarity with object- and service-oriented design, API development, containerization, and complexity analysis.
Familiarity with image processing algorithms.
Strong analytical, communication and presentation skills.
Nice to have:
Published papers in top conferences or journals such as CVPR/ICCV/NeurIPS/IEEE Transactions
Experience with cloud architecture design and deployment
Experience with web API design and development
Familiarity with software design patterns
Hands on C++ programming
Motion Metrics offers an excellent, diverse, and knowledge-sharing workplace and a generous performance-based compensation package with extended benefits.",Tecnologías de la información,,2022-08-20T00:00:00,2022-10-16,OTHER
Machine Learning Scientist/Engineer,MetaOptima,British Columbia,Vancouver,-1,-1,,CAD,"What do you envision your next career to look like? Join MetaOptima to make a difference in the lives of millions as we revolutionize the dermatology industry with artificial intelligence-powered software solutions for faster, more effective, and affordable care. MetaOptima is full of passionate, innovative people who thrive on working together as a team to build smart, life-saving technologies for medical professionals and their patients. We have customers all over the world with staff situated to support them from Canada to the US, to Australia and New Zealand, you will have the chance to have an impact on the lives of medical professionals and their patients all around the globe!
Join our fast-growing startup to add your voice to our vision while working with a cool group of people set on making their mark on the world. We take pride in what we’ve accomplished together, and can’t wait to see how you’ll help us grow.
A team who works together, wins together. We’re excited to share some of our accomplishments with you:
A BCIC New Ventures Competition Winner
Plug and Play Startup Showdown Winner
BCIP Innovation Challenge Award Winner
Coast Capital Savings Venture Prize Winner
A Ready To Rocket Winner 2018 & 2019
Winner of ISIC Disease Classification AI Competition 2018
Member of Canada’s Digital Technology Supercluster
Winner of ITAC Ingenious of the Year Awards, 2019
Requirements
Master’s or PhD degree in Computer Science, or equivalent experience
Proficient in Python and visualization libraries (matplotlib, plotly, seaborn)
Experience using a deep learning framework (PyTorch, Keras, Tensorflow, Caffe) and machine learning/scientific computing libraries (scikit-learn, scipy, numpy)
Able to determine the correct evaluation metric for a given problem and evaluate various models against it to determine performance
Able to work in a fast-paced environment
Self-starter and self-motivated worker
Strong communication, documentation and presentation skills
Comfortable looking at medical images
Computer Vision experience is a strong plus
Enjoying reading academic papers is a plus
Responsibilities:
Understanding business problems and brainstorming ideas as a team to come up with AI solutions.
Able to work on all stages of a problem from data cleaning and acquisition all the way to implementation and deployment.
Fast prototyping of research ideas and estimation of the effort required to develop an MVP.
Develop any tools required to clean and label data.
Able to take an MVP and analyse the performance to determine how to scale it up for a full-scale cloud deployment.
Working closely with our Tech team and cloud engineers to deploy systems into production.
Compiling and presenting research efforts in a clear and understandable way for the rest of the team and other non-technical staff members.
Benefits
We offer a competitive salary, vacation, stock options, and a comprehensive benefits package (including extended health, vision, and dental). If you are interested and passionate about doing things that really matter send us your resume and join us on this amazing journey.",Tecnologías de la información,,2022-09-11T00:00:00,2022-10-16,FULL_TIME
"Staff Data Engineer, Machine Learning Systems",Course Hero,British Columbia,Vancouver,-1,-1,,CAD,"Course Hero is scaling! We are looking for a Staff Data Engineer, ML Systems to work alongside our Machine Learning engineers to develop machine learning models and deploy them to production to enhance the Course Hero service. You will build pipelines, scale machine learning training jobs, and enhance the platform used by the Machine Learning team.

Here are some ways you'll make an impact:

Help our Machine Learning team develop, test, and deploy advanced ML models to our high traffic application.
Develop tools that make ML development more efficient, allowing ML Engineers to focus on modeling rather than technology platforms.
Collaborate across teams including Product Management, Machine Learning, Data Analytics and Engineering to plan projects that enhance the Course Hero user experience.

Requirements:

Experienced with Spark on AWS EMR and/or Databricks
Abie to optimize execution of large scale distributed data jobs.
Experienced with typical ML workflows and MLOps
Fluent in Python and SQL

Bonus Points:

Systems design and thinking
Experience with Kubernetes and Docker
Experience with Airflow
Knowledgeable on the various AWS ML services, including Sagemaker and friends.
Operational experience in areas such as permissions, secret management, observability, etc

Benefits & Perks:

Competitive salary, annual bonus, and RSUs
Medical coverage, including full dental and vision
Life and disability benefits
401(k) program (US) / retirement savings plan (Canada) with company match
One month paid sabbatical after 5 years at the company
Education reimbursement
Professional development workshops & industry conferences
Paid parental leave
Flexible work schedule
Social responsibility program (volunteer time off and donation matching)
Annual wellness stipend
Monthly tech stipend
Annual family planning stipend
Monthly snack boxes delivered to your door
Cell phone allowance
Research shows that candidates from underrepresented backgrounds often don't apply for roles if they don't meet all the criteria. We strongly encourage you to apply if you're interested: we'd love to learn how you can amplify our team with your unique experience!

#USCanada #LI-Hybrid
Equal Employment Opportunity Statement (EEO)

We are an equal opportunity employer and value diversity and inclusion within our company. We will consider all qualified applicants without regard to race, religion, color, national origin, sex, gender identity, gender expression, sexual orientation, age, marital status, veteran status, or ability status. We will ensure that individuals who are differently abled are provided reasonable accommodation to participate in the job application or interview process, to perform essential job functions, and to receive other benefits and privileges of employment as provided to other applicants or employees. Please contact us to request accommodation.


About Course Hero:

Course Hero is on a mission to help students graduate, confident and prepared. The online learning platform offers over 60 million course-specific study resources created by and for students and educators, as well as 24/7 tutor help. More than 65,000 verified college educators use Course Hero to collaborate with other faculty and share resources to hone new strategies for instruction. Everyday, students, educators and tutors help more than 20 million students make every study hour count.


We have an awesome team and a truly engaging culture. We are customer-focused, collaborative, responsible, gritty, and we love to learn. Our bold mission is to help students graduate confident and prepared!


We are not the only ones that think we're onto something big. Course Hero has been recognized as one of the 2021 Top 100 Best Places to Work in the Bay Area, Top 50 Best Paying Companies in the Bay Area, Top 100 Most Transparent Companies, and in the Top 50 Most Transformational Companies in Education Technology. Read up on some of our recent news coverage, blog, and learn more about us to see what it is like to work with our team.


Join us on our mission!",Tecnologías de la información,,2022-08-24T00:00:00,2022-10-16,OTHER
Machine Learning Geoscientist,DATACLOUD,British Columbia,Vancouver,-1,-1,,CAD,"The Role
MinePortal from DataCloud is the groundbreaking cloud-based intelligent platform that powers geotechnical knowhow of the rock in the mining industry for operational intelligence. Our mission is to push the envelope in Artificial Intelligence (AI), Geophysical IoT sensors, Machine Learning (ML), Data Management, Signal Processing, and Grade Engineering, in order to provide the best-possible blast outcomes for our customers. We are looking for a Geology, Statistics, and ML Specialist to help build industry-leading modeling technologies that the world’s largest mines will adopt.
Key Responsibilities
Reporting to the VP Software, the Machine Learning Geoscientist role will include following broad responsibilities and any other assigned work from time to time

Apply domain expertise in the development and implementation of machine learning models within the hard rock and coal mining industry

Teach internal and client teams how to integrate machine learning software into existing workflows to optimize blast design, blasthole spacing, and other engineering applications

Study and transform data science prototypes for the geoscience specific data streams

Feature extraction and identification over large data sets to feed automated algorithm development

Apply knowledge in geology, geosciences, applied mathematics, and quantitative analysis to sensor solutions for challenges facing our sponsors.

Explore promising research and maintain/gain the technical edge required for projects. Share and develop new approaches and methods.

Design machine learning systems that can automatically recognize features, extract features, and create volume models out int and sparse data

Research and implement appropriate ML algorithms and tools for mining domain specific applications

Select appropriate datasets and data representation methods

Run machine learning tests and experiments

Perform statistical analysis and fine-tuning using test results

Train and retrain systems when necessary

Extend existing ML libraries and frameworks

Keep abreast of developments in the field

Contribute to analysis of algorithmic computational complexity and memory requirements.

Work with Hardware Engineers to specify and optimize sensor and IoT device design and configuration for multiple sensing use cases.

Interface closely with Application and UX Engineers to develop compelling analytical use cases to utilize ML outputs and insights.
Key Qualifications


Master’s degree in Geosciences, statistics, mathematics, applied physics, or a related field.

Comprehensive expert level knowledge of programming and experience in C, C++, Python, R, Golang, or similar language used in geo-stat, ML, and computer vision sciences.

Proficient verbal and written communication skills necessary to effectively collaborate in a team environment and present and explain technical information.

Experience in working in distributed teams in the research, development, and implementation of machine learning, spatial modeling, and geo-stat algorithms.

Takes initiative, independent worker

Ability to manage multiple concurrent major projects with different tactical and strategic objectives

Can effectively assume an array of roles as appropriate in various kinds of organizations. These may entail different responsibilities, forms of leadership, team work, and project management.

Experience leading in environments that are highly volatile, cross-functional, and cross-organizational

Work Hours & Location


Full time, Flexible working hours, 15 days/year vacation

Work from home office and DataCloud’s office in Vancouver

Some travel to Seattle, Palo Alto, and Client offices world wide
DataCloud is an Equal Opportunity Employer. Qualified applicants will receive consideration for employment without regard to race, color, religion, sex, age, disability, military status, or national origin or any other characteristic protected under applicable local law. The Candidate must be authorized to work in Canada.
About DataCloud
Founded in 2016, DataCloud delivers high-resolution rock mass characterization data to our clients in real-time. Our innovative measurement and analysis platform provides invaluable orebody insights during drill and blast operations. Our technologies help mine planning teams to dramatically improve their extraction efficiencies.
With our unique combination of skills in both mining and technology, DataCloud is helping to solve many of the problems that have challenged the mining industry for decades. Our founders come from institutions such as Stanford, UC-Berkeley and Cambridge, who have expertise in geosciences and cloud architecture.


Our portfolio of products and services span the latest in Geo-Statistics, Geo-Physics, and advanced digital and artificial intelligence technologies, including cloud computing, machine learning, advanced visualization, and new sensor technology enabled by IoT systems.",,,2022-08-18T00:00:00,2022-10-16,FULL_TIME
