Job_title,Company,State,City,Min_Salary,Max_Salary,unitText,SalaryCurrency,Job_Desc,Industry,Rating,Date_Posted,Valid_until,Job_Type
Staff Machine Learning Engineer,PagerDuty,Ontario,Toronto,-1,-1,,CAD,"We are interviewing and onboarding 100% virtually at this time. PagerDuty is focused on inclusion and employee well-being by building a culture that isn't location specific and gives equal opportunity to everyone—regardless of where you are working. Unless your job requirements make it necessary to be in a company office, you may choose to work in-office, remotely, or hybrid.
Why We Need You:


We're looking for a staff-level engineer and a proven technical leader passionate about successfully collaborating with data scientists and engineers to run machine learning models in production. We expect you to understand requirements from the data science and data engineering team and drive alignment with Engineering teams on design patterns and best practices to support the business.


You are expected to anticipate data science & engineering-related bottlenecks, suggest escalation and investment wherever necessary, communicate immediate and long-term technical as well as strategic solutions and trade-offs, and will possess an excellent capacity to manage time. In addition, you will demonstrate emotional intelligence as you navigate stakeholder relationships championing the organization's data science and machine learning initiatives.

How you contribute to our vision: Key Responsibilities
Build and improve the capabilities of the data platform that enable and accelerate the production of machine learning (ML) based solutions
Drive and define standards for data engineering across the organization.
Provide guidance, technical leadership, and mentoring to other members of the team
Proactively recommend improvements and new approaches addressing potential systemic pain points and technical debt
Anticipate technical demands on the data platform based on the organization's roadmap and systematically drive the evolution of the architecture towards those ends
Mentor junior members and participate in scaling up the existing team
Develop a long-term plan for data science investments
Minimum Requirements
You have 8+ years of experience building, designing, and evolving data architecture for large-scale systems
Experience working with Product teams ensuring and driving a timely delivery
Have a deep understanding of the trade-offs to be considered when designing and delivering machine learning solutions to production
Demonstrated experience with data modeling, database design, extract transform load (ETL) processes, working with unstructured data, and cloud-based data infrastructure
Awareness of and experience with ML processes (exploration, training, deployment), technologies (services, packages), and infrastructure (AWS)
Passionate about data/ML engineering and interested in driving discussions with stakeholders and executives
Not sure if you qualify?

Apply anyway! We extend opportunities to a broad array of candidates, including those with diverse workplace experiences and backgrounds. Whether you're new to the corporate world, returning to work after a gap in employment, or simply looking to transition or take the next step in your career path, we are excited to connect with you.

PagerDuty Offers

We are dedicated to providing a culture where our people are happy, enabled and inspired to do their best. One of the ways we do this is by developing a comprehensive total rewards approach that supports employees and their loved ones. As a global organization, our programs are competitive with industry standards and aligned with local laws and regulations.

Your package may include:
Competitive salary and company equity
Comprehensive benefits package from day one
ESPP (Employee Stock Purchase Program)
Retirement or pension plan
Paid parental leave - up to 22 weeks for pregnant parent, up to 12 weeks for non-pregnant parent (some countries have longer leave standards and we comply with local laws)
Generous paid vacation time
Paid holidays and sick leave
Paid employee volunteer time - 20 hours per year
Bi-annual company-wide hack weeks
Mental wellness programs
Dutonian Wellness Days - scheduled company-wide paid days off in addition to PTO and scheduled holidays
HibernationDuty - a week each year when everyone at PagerDuty, with the exception of a small, coverage crew, is asked to take a much needed break to truly disconnect and recharge
About PagerDuty

PagerDuty, Inc. (NYSE:PD) is a global leader in digital operations management, serving over 14,000 customers and 850,000 users worldwide, including 65% of the Fortune 100.

For the teams who build and run digital systems, PagerDuty is the best way to manage the urgent, mission-critical work that is essential to keeping digital services always on. We make it easy to handle any unplanned task, event, or opportunity, right away.

Led by CEO Jennifer Tejada, 50% of our board of directors is comprised of women, 45% of our managers are from underrepresented groups, and we are a proud member of the Pledge 1% Movement, committed to donating 1% Equity, 1% Employee time, and 1% Product to accelerate change in our communities. We are Great Place to Work-certified™ and our product is top rated in its category on TrustRadius.

From how we build our teams to who sits in the boardroom, we hope you can see yourself at PagerDuty.

Learn more: Social Impact; Inclusion, Diversity, & Equity; Culture

Additional Information

PagerDuty is committed to creating a diverse environment and is an equal opportunity employer. PagerDuty does not discriminate on the basis of race, religion, color, national origin, gender, sexual orientation, age, marital status, parental status, veteran status, or disability status.

PagerDuty is committed to providing reasonable accommodations for qualified individuals with disabilities in our job application process. Should you require accommodation, please email accommodation@pagerduty.com and we will work with you to meet your accessibility needs.

PagerDuty verifies work authorization in accordance with the requirements of your local jurisdiction.",Tecnologías de la información,,2022-09-01T00:00:00,2022-10-16,PART_TIME
Junior Technical Architect,LifeWorks,,,-1,-1,,CAD,"Build a meaningful career
At LifeWorks, we offer more than career opportunities; we provide career opportunities to make meaningful contributions to people's lives. The extraordinary expertise of a more than 7,000-strong workforce is harnessed to support the employees and families of the organizations we serve. Our innovative programs have a lasting impact on the health, financial security and productivity of 24,000 workplaces.
The opportunity
LifeWorks is on a mission to respond to the emerging trends impacting mental health and total wellbeing. Mobile devices, remote offices, the immediate and long-lasting effects of the global pandemic, and the need for employees and employers to find rewarding ways to commit to each other are drivers for our next evolution.
Everyone who joins LifeWorks benefits from the professional reward of working in a more agile human-centric framework and the personal reward of knowing the architecture you build, code you write, the product you release, and the service you provide is supporting the mental, physical, social and financial wellbeing of clients and millions of their employees around the world. We empower our people to make a difference and play a direct role in nurturing and growing our mental health-focused portfolio of globally consistent and locally relevant omnichannel solutions.
There are exciting times ahead, and we're looking for team members who share our enthusiasm, our drive, and our passion for improving business and improving lives.
At LifeWorks, we are always moving forward. Move with us.
Who we need
The Enterprise Platform (EPPS) group develops and supports key platforms and products within LifeWorks, from our APIs to Machine Learning and Cognitive apps. Our technology is used across the LifeWorks portfolio of apps, and we follow product-driven agile methodology. As part of our mission to impact 1 billion lives, we're looking for a hands-on technical leader to play a senior role in our architecture modernization initiatives (i.e., cloud-native apps, event-processing).
Reporting to the VP of Enterprise Platform Engineering, we are looking for a Senior Engineer who wants to step onto a path to a Junior Technical Architect; someone who wants to build and design, diving deep technically into our stack (.NET, Azure, Docker, React). You will be partnered with top developers and another architect on a critical integration team, building an event-driven strategy.
This role can be done remotely in Canada by a motivated individual. Individuals based near a LifeWorks office have the option to work out of that office. Optional team events will be held in Markham.
What's in it for you
Purpose, challenges, and influence. At LifeWorks, we're using evergreen tech for good. It's about as value-driven as it gets, and we are passionate about what we do, ensuring what we build is welcoming, resilient and scalable. After all, our goal is to impact 1 billion lives. This is an opportunity to play a critical role in the architecture and coding of a next-generation platform. You will be supported by our domain experts in security, architecture, infrastructure, DevOps, Agile and UX, and be given opportunities to broaden into cognitive APIs or other innovation areas if you are interested. It's a chance to look at integration between applications, between cloud providers, and across services e.g. SaaS and hosted services. As we successfully pilot our new product and continue to scale as a company, so will your career with a direct path to technical or people leadership.
How you will make an impact as our Junior Technical Architect:
Collaborate on the design. You will be part of a team architecting the next-generation platform for our wellbeing products. You will work with the chief architect to set standards and influence the technical roadmap for EPPS and LifeWorks. You will develop frameworks or foundation-level code and communicate the target architecture design and roadmap to the team, prioritizing development tasks based on a deep understanding of the technologies involved and team objectives.
Research and advise. You will contribute to our technology strategy with advanced research and prototyping cutting-edge technologies. You will provide technical inputs to the product management team to ensure successful product delivery and informed decision-making. You will document features and stories for projects aligned with the strategic roadmap.
Coach and be coached. You will grow into the role of a technical lead through the support of the Chief Architect and the product team. In turn, you will mentor junior developers, conducting code reviews and ensuring the knowledge repository is kept up to date. You will promote and follow best practices to ensure clean design, architectural consistency and exemplary development practices.
What you bring:
The passion. You are a lifelong learner and experimenter, inspired to stay current with industry trends and think deeply about how new technologies can deliver business value.
The technical knowledge. You have With 4+ years of hands-on front and backend development experience, you have:
An excellent understanding of computer engineering fundamentals, including OOP, design patterns, REST/web service design, coding best practices, SOLID principles, etc.
Exposure to architectural concepts, including API design and management, event processing, microservices, dockerization.
Open source development and community contribution through GitHub, networking, technical blogging, etc.
The interpersonal skills. You can build trust to influence the team and the decision-makers. You are a great team player who thrives in a collaborative environment, working cross-functionally with Product, DevOps, infrastructure, and Executive leaders. You have effective and flexible communication skills and can comfortably explain complex problems and technical solutions to a range of audiences.
The education. You may have a Bachelor's or advanced degree in Computer Engineering, Computer Science or related technical field, but we know not everyone gains their skills through traditional academic training.
As designers and providers of technology solutions delivering access to the four pillars of wellbeing to global communities, we are committed to nurturing a remote and onsite environment that welcomes, embraces and appreciates the diversity of the people who make up our teams and the people that use our products. We value equal opportunity and nurture an inclusive workplace where our individual differences are not only recognized but valued.
If you feel you have 70% of what we are looking for and share our mission to make the workplace and the world better through wellbeing solutions, express your interest. We promise to take the time to consider the full spectrum of what you offer.
Where permitted by law, LifeWorks employees must be fully immunized to access a LifeWorks office or customer premises.
Persons with disabilities who need accommodation in the application process or those needing job postings in an alternative format may e-mail a request to talentacquisitiononboarding@lifeworks.com
Fulfilling work that matters
LifeWorks is in the business of helping organizations help their people, and in the process, we strive to elevate ours. We're always looking for talented professionals and strategic leaders looking to make a difference in the lives of the people we serve. We appreciate the interest of every applicant; however, we contact only those selected for an interview.
At LifeWorks, we are committed to putting our people first. Our priority is to optimize the health and productivity of our people. In light of COVID-19, our company continues to monitor the global situation and following local guidance in each of our communities to ensure the health and wellbeing of our employees. Safety is our highest priority, and while the goal is to ultimately return to the office, we are currently working remotely and are connecting with candidates through virtual interviews, recruitment events, and information sessions. We are excited to connect with you virtually, and look forward to receiving your application.
Z5JWNAb9cW",Administración y consultoría,,2022-09-12T00:00:00,2022-10-16,FULL_TIME
Staff Backend Software Engineer,Forethought,Ontario,Toronto,-1,-1,,CAD,"Founded by a team of Facebook, Dropbox, and LinkedIn alumni in 2017, Forethought's mission is to ""unlock human potential through AI."" Forethought is a leading AI company providing human-centered AI solutions that transform the customer experience. Our products enable seamless customer experiences by infusing intelligence at each stage of the customer support journey: resolving common cases instantly, predicting and prioritizing cases, and assisting agents with relevant knowledge—all from one AI platform.

Forethought has grown 22x in the past two years and has raised over $92M in VC funding from top investors including STEADFAST Capital Ventures, New Enterprise Associates (NEA), Ashton Kutcher and Guy Oseary's Sound Ventures, Gwyneth Paltrow, NBA Vet Baron Davis, Robert Downey Jr., Sean ""Diddy"" Combs, LL Cool J, and the CEOs of Robinhood, Carta, and Qualtrics. In 2018, Forethought launched and won at TechCrunch Disrupt—the world's most prestigious startup competition—and was featured in Forbes 30 Under 30. More recently, Forethought was listed as one of Forbes' Next Billion-Dollar Startups.
We're looking for a Staff Backend Engineer who can help us continue on our mission to build an industry-defining AI product. If you possess a growth mindset, want to solve the world's hardest problems, and want to have an impact on the world by building next-generation AI solutions for customer support, this role could be perfect for you!

As a member of the engineering team, you will be responsible for designing, building, and deploying the features and underlying systems that power our core answer engine. You will interact with everything from our document indexing pipeline to our natural language query infrastructure written in Python. Our tech stack leverages top modern technologies, including Docker, Kubernetes, Redis, MongoDB, and ElasticSearch.

What You'll Be Doing (Responsibilities):

Develop backend micro services and infrastructure to expand our answer engine to support 1B+ documents and 100K+ QPS
Build new services to meet critical product and business needs
Optimize the performance of our indexing, processing, and query pipelines
Articulate a long term vision for maintaining and scaling our backend systems and the teams running them
Implement state-of-the-art APIs for Question Answering, Machine Reading Comprehension, Text Summarization, in a scalable, production-ready
Build systems to evaluate and tune the performance of a real-world deep learning system, from data collection to processing to model implementation to post-processing and visualization

Who You Are (Skill):

Bachelor's or Master's degree in Computer Science, Statistics, Informatics, Information Systems, or a related field [Preferred]
8+ years of experience in software engineering role [Required]
Proficiency in Python
Experience building large-scale distributed systems
Experience writing high quality, well-tested code to meet the needs of our customers
Familiarity with MongoDB, Redis, and Elasticsearch
Familiarity with asynchronous APIs including FastAPI or Gevent
Familiarity with microservices architecture
Familiarity with containerization, MLOps, and DevOps (Docker, Kubernetes, Jenkins, Spinnaker)
Familiarity with modern Deep Learning and Natural Language Processing / Natural Language Understanding (NLP, NLU), including Neural Networks, RNNs, seq2seq models, and real-world machine learning in TensorFlow (including regularization, cross-validation, dropout)

What You Get (Benefits):

A chance to be an early member of a hyper-growth startup with equity to match
An opportunity to help us define a new market within AI
Ability to solve challenging problems with a world-class team
A low-ego company culture that is obsessed with feedback and helping each other grow
Hybrid work structure that allows you to choose where you get your best work done
Competitive medical, dental, and vision coverage
Paid maternity, paternity, & adoption leave
Unlimited paid time off",Tecnologías de la información,,2022-08-28T00:00:00,2022-10-16,OTHER
Engineer - Compilers,Tenstorrent,Ontario,Toronto,-1,-1,,CAD,"The Tenstorrent team combines technologists from different disciplines who come together with a shared passion for AI and a deep desire to build great products. We value collaboration, curiosity, and a commitment to solving hard problems.
Find out more about our culture (https://tenstorrent.com/careers/).
Responsibilities:
In partnership with the leadership team, create and define the product roadmap and co-design of Tenstorrent's hardware and software stack
Develop machine learning graph compiler
Be the subject matter expert across one or more areas: scheduling, parallelization, memory allocation, data flow optimizations, optimizing kernels
Define the benchmark, analyze, and optimize performance of key machine learning applications across Tenstorrent's hardware and software stack
Develop performance analysis and estimation infrastructure that feeds into Tenstorrent compiler
Integrate the Tenstorrent software into leading machine learning frameworks
Provide technical guidance and direction to junior staff member
Work closely across teams to discover the hardware and software requirements of current and future machine learning applications
Qualifications & experience:
Deep understanding of IR and machine level compiler optimization techniques.
Extensive working experience with one or more: scheduling, parallelization, memory allocation, data flow optimizations, optimizing kernels
7+ years of experience working with algorithms, data structures, and software development
C++, Python
Bachelors in Computer Science or Electrical/Computer Engineering or Engineering Science
Excellent verbal and written communication skills
Ability to work across multiple teams
Asset:

2+ years of experience as a technical lead, developing and mentoring a team
Experience contributing to open-source projects, and demonstrated influence in the open community.
Masters/PhD in Computer Science or Electrical/Computer Engineering or Engineering Science
Software development in Python
Tenstorrent offers a highly competitive compensation package and benefits, and we are an equal opportunity employer.",,,2022-09-12T00:00:00,2022-10-16,FULL_TIME
Software Engineer II,Pariveda Solutions,Ontario,Toronto,-1,-1,,CAD,"Overview:

Pariveda is not your average consulting firm. We’re new to Toronto and looking for people who aren’t afraid of a challenge and want to make an impact to join our team of leaders. At Pariveda, our focus on people is the key to our success and our mission is to grow you towards your highest potential. If you are into programming, working in small teams, and solving complex problems using the latest in Cloud, Mobile, and Web technologies, Pariveda Solutions is the company for you. Our Toronto team is growing and looking for lead software developers who want to design, develop, and deliver enterprise-level applications. This is an opportunity to expand your knowledge of full life cycle development, gain direct client exposure, and grow junior team members.
To learn more about our culture and what you can expect at Pariveda, review our Findamentals – the behaviors that show who we are.
You Can Expect To:
As a lead software engineer, you will build custom solutions using a variety of technologies. You will work in small, collaborative teams, while partnering with clients to implement real-world solutions for their complex problems.
Grow your career with the support and guidance of a dedicated mentor and a clearly defined, individualized career path. You will be eligible for promotion every 12 months
Lead small Pariveda teams and help teammates develop their skills and careers
Diagnose and solve complex problems for Fortune-500 clients in a variety of industries
Execute projects from start to finish and get exposure to all roles throughout the SDLC (manage projects, estimate, gather requirements, architect, develop, test, and deliver)
Explore different technologies and develop applications in languages that might include: Java, .NET, Python, JavaScript, and SQL, Web technologies like React, Redux, Angular, Vue, Mobile technologies including iOS and Android, Cloud technologies like AWS, Azure, Google Cloud, and Data Driven solutions, IoT, Machine Learning, DevOps, and more
Present findings, solutions, and demos to audiences including senior executives and stakeholders
Actively engage in our culture of continuous learning, personal and professional development, and lead community service and social gathering events
Work with smart, humble, and supportive people
We Look For:
3+ years of hands-on software development experience
Experience with technical leadership such as coaching others and/or leading pieces of projects (estimating/assigning tasks, putting together timelines, requirements gathering, design, etc.)
Client facing or consulting experience highly preferred
Skilled problem solvers with the desire and proven ability to create and implement innovative solutions
Adaptable attitude, able to balance multiple responsibilities, and adjust to varied environments
Ability to explain and present concepts to technical and non-technical audiences
Bachelor’s Degree in MIS, Computer Science, Math, Engineering, or comparable experience
Legally authorized to work for any company in Canada without sponsorship
Pariveda Benefits
Transparent and equitable salaries for all levels. The salary for this position is $128,900 annually. Actual salaries may vary based on factors including but not limited to location, experience, and performance.
RRSP 4% match
Plenty of paid time off – 4 weeks of vacation time, 10 holidays, 1 floating holiday
Paid sabbatical after 5 years of service for Principal levels and above
Paid parental leave
Excellent Healthcare and Wellness – Dental, Health Care Spending Account, Lifestyle Spending Account
100% reimbursement for prescriptions and major medical with no deductible
Group Term & Voluntary Supplemental Life Insurance
Short Term and Long Term Disability
Pariveda Solutions aspires that our employee diversity is representative of the markets in which we serve. Employment decisions are based solely on merit and business needs and not on race, color, religion, sex, sexual orientation, gender, gender identity, gender expression, pregnancy, marital status, national origin, citizenship status (if authorized to work in Canada), uniform service member, military or veteran status, ancestry, age (over 40), physical or mental disability including HIV or AIDS, medical condition, genetic information, political affiliation, or any other category protected by applicable federal, provincial, or local law.
#LI-MZ1

#LI-Hybrid",Tecnologías de la información,,2022-08-30T00:00:00,2022-10-16,FULL_TIME
