Job_title,Company,State,City,Min_Salary,Max_Salary,unitText,SalaryCurrency,Job_Desc,Industry,Rating,Date_Posted,Valid_until,Job_Type
Staff Machine Learning Infrastructure Engineer,Forethought,Ontario,Toronto,-1,-1,,CAD,"Founded by a team of Facebook, Dropbox, and LinkedIn alumni in 2017, Forethought's mission is to ""unlock human potential through AI."" Forethought is a leading AI company providing human-centered AI solutions that transform the customer experience. Our products enable seamless customer experiences by infusing intelligence at each stage of the customer support journey: resolving common cases instantly, predicting and prioritizing cases, and assisting agents with relevant knowledge—all from one AI platform.

Forethought has grown 22x in the past two years and has raised over $92M in VC funding from top investors including STEADFAST Capital Ventures, New Enterprise Associates (NEA), Ashton Kutcher and Guy Oseary's Sound Ventures, Gwyneth Paltrow, NBA Vet Baron Davis, Robert Downey Jr., Sean ""Diddy"" Combs, LL Cool J, and the CEOs of Robinhood, Carta, and Qualtrics. In 2018, Forethought launched and won at TechCrunch Disrupt—the world's most prestigious startup competition—and was featured in Forbes 30 Under 30. More recently, Forethought was listed as one of Forbes' Next Billion-Dollar Startups.
We're looking for world-class Machine Learning Infrastructure Engineers to join our team! We're looking for folks with a growth mindset who love to solve the world's hardest problems and want to have an impact on the world by building next-generation AI solutions for customer support.

As a member of the infrastructure team, you will focus on applying MLOps methodologies with infrastructure that enables machine learning product teams to develop advanced NLP solutions that power state-of-the-art models for our customers. This includes deploying and maintaining a next-generation experimentation platform for our Machine Learning Engineers to experiment with the latest technologies.

What You'll Be Doing (Responsibilities):

Design, build and maintain optimized and scalable ML platforms for machine learning and data science teams.
Design and develop production backend microservices and infrastructure to perform scalable machine learning training and inference and monitoring in the cloud.
Build and manage a next-generation ML experimentation platform for our Machine Learning Engineers and Scientists.
Deploy and manage third-party annotation solutions to empower engineers to collect, sanitize and, anonymize the data needed for training.
Participate in building data pipelines going from our databases into data lakes.

Who You Are (Skill):

5+ years of experience in software engineering
Proficiency in writing production-quality code in Python
Good understanding of large-scale processing frameworks such as Kafka, Spark, sparkSQL, and Airflow
 Familiarity with Ray, Kubeflow, MLFlow, and AWS Sagemaker or GCP AI Platform
Familiarity with containerization, MLOps, and DevOps (Docker, Kubernetes)
Familiarity with Terraform for Infrastructure as Code

What You Get (Benefits):

A chance to be an early member of a hyper-growth startup with equity to match
An opportunity to help us define a new market within AI
Ability to solve challenging problems with a world-class team
A low-ego company culture that is obsessed with feedback and helping each other grow
Hybrid work structure that allows you to choose where you get your best work done
Competitive medical, dental, and vision coverage
Paid maternity, paternity, & adoption leave
Unlimited paid time off",Tecnologías de la información,,2022-09-15T00:00:00,2022-10-16,OTHER
Machine Learning Engineer,Citco,Ontario,Toronto,-1,-1,,CAD,"Machine Learning Engineer
Toronto, Canada
About Citco
Citco is a global leader in fund services, corporate governance and related asset services with staff across 80 offices worldwide. With more than $1 trillion in assets under administration, we deliver end-to-end solutions and exceptional service to meet our clients’ needs.
For more information about Citco, please visit www.citco.com
About the Team & Business Line:
Proprietary software solutions and innovation are at the core of what differentiates Citco in the alternative investment space. Through our network of global development centres, Citco invests heavily in technology development, security, and infrastructure to ensure our clients continue to receive award-winning products that underpin our commitment to service excellence.
As a core member of our Innovation IT team, you will work with dedicated professionals to ensure our clients maintain access to their critical information assets while keeping Citco ahead of industry trends.
Your Role:
Design, develop, and implement software solutions to support business requirements
Be involved in concept design, brainstorming, research, etc. required to create new solutions for consideration
Resolve technical issues through debugging, research, and investigation
Participate in performance/load tests, making recommendations to improve performance and scalability
Provide timely and effective solutions to critical production issues
Contribute to continuous integration and continuous deployment automation
Document solutions and keep knowledgebase up-to-date to support efficiencies
About You:
2 years' experience in python
2 years' experience with relationships databases
2 years' experience building Machine Learning models using sklearn and tensorflow
1 year experience in AWS or other cloud
Proficiency in designing and implementing cloud-based applications in AWS preferred
Experience with serverless architecture is a plus
Experience working with Linux shell scripting an asset
Must have strong communication skills and be able present diagnostic, troubleshooting steps and conclusions to a varied audience
Must be able to work with minimal supervision
Demonstrated expertise in supporting large-scale systems
Strong interpersonal and communication skills and ability to deal effectively in a team environment
Our Benefits
Your well-being is of paramount importance to us, and central to our success. We provide a range of benefits, training and education support, and flexible working arrangements to help you achieve success in your career while balancing personal needs. Ask us about specific benefits in your location.
We recognize diversity as a source of organizational pride and strength. We have made it a priority to reflect our nation’s evolving diversity in the people we hire, and the culture we create in our organization.
Citco welcomes and encourages applications from people with disabilities. Accommodations are available upon request for candidates taking part in all aspects of the selection.

#LI-AR1",Finanzas,,2022-08-27T00:00:00,2022-10-16,FULL_TIME
New Grad Software Engineer / Machine Learning Engineer,Aviva,Ontario,Markham,-1,-1,,CAD,"Individually we are people, but together we are Aviva. Individually these are just words, but together they are our Values – Care, Commitment, Community, and Confidence.
What you’ll doDevelop, test, and deploy codeMaintain an existing code databaseTest and debug software and hardware related issuesKeep your eye out for opportunities to improve our products
What you’ll bring
A degree in Computer Science/Engineering or related field.
1+ programming experience in Python with strong grasp of software engineering standard methodologies such as code-reusability, modularity, use of repos, etc.
1+ years of applied experience in ML, NLP, and Deep learning.
Have an understanding of SDLC, machine learning concepts, and NLP tasks such as classification, feature engineering, information extraction, structured prediction, sentiment analysis, and topic modelling.
Knowledge of packages such as Pytorch, Keras, Scikit Learn, Pandas, Tensorflow, and NLTK.
Conceptual understanding in a data-driven software engineering environment and how to leverage data to make business decisions.
A track record in building and maintaining high quality, robust and maintainable code.
Understanding of Data Warehouse concepts, ETL strategies and best practices.
An appetite for problem solving with a creative and resourceful approach to finding the right solution for the job.
Strong communication and collaboration skills
﻿What sets you apart:
You are a self-motivated and outgoing person who can work closely with business and IT stakeholders.
You understand the relationship between data and business outcomes and can focus on long term strategies for data.
Proficiency with PostgreSQL, Teradata, Hadoop and AWS is an asset.
You have experience working as part of an Agile Team.
What you’ll get
Competitive rewards package including base compensation, eligibility for annual bonus, retirement savings, share plan, health benefits, personal wellness, and volunteer opportunities.
Exceptional Career Development opportunities.
We’ll support your professional development education.
Additional Information
Aviva Canada is committed to providing accommodations for people with disabilities during all phases of the hiring process including the application process. If you require an accommodation because of a disability, we will work with you to meet your needs. Applicants need to make their needs known in advance. If you are selected for an interview and require an accommodation, you are encouraged to advise the Talent Acquisition Partner who will consult with you to determine an appropriate accommodation.
We are an equal opportunity employer and value diversity at our company. We do not discriminate on the basis of race, religion, color, national origin, gender, sexual orientation, age, marital status, veteran status, or disability status.","Energía, minería e infraestructura pública",,2022-09-07T00:00:00,2022-10-16,OTHER
Machine Learning Engineer,Fieri Consulting,Ontario,Toronto,-1,-1,,CAD,"TaksoAi is looking to take our team to the next level!Fresh off our first funding round, enjoy the culture, environment, and potential of an early-stage startup, with the peace of mind that fresh funding brings. We believe that TaksoAi will be a revolution in the construction industry.Who are we: TaksoAi is a startup utilizing AI in the mechanical and electrical construction estimating process. We are working with established industry partners to streamline the gathering and manipulation of engineering data using AI.What you would be doing: TaksoAi has created an AI model in conjunction with a well-established university, you will be mainly responsible for converting a YOLOv3 based object detection neural network from Darknet to Pytorch.Job Duties· Convert a YOLOv3 based object detection neural network from Darknet to Pytorch· Work with university and our other programmersExperience and qualification · Self-starter with an entrepreneurial spirit· Expert level skills in C and PythonWork Location· Work from home, anywhere in CanadaHours and Contract Length· Part or full time contract for the duration of the projectOther information: · Job is 100% remote· Full or part timeJob Types: Fixed term contract, FreelanceContract length: 2 weeksSalary: From $35.00 per hourBenefits:Casual dressFlextimeWork from homeFlexible Language Requirement:French not required",,,2022-09-15T00:00:00,2022-10-16,FULL_TIME
Senior Machine Learning Engineer (NLP),Global Relay,British Columbia,Vancouver,-1,-1,,CAD,"Who we are:

For over 20 years, Global Relay has set the standard in enterprise information archiving with industry-leading cloud archiving, surveillance, eDiscovery, and analytics solutions. We securely capture and preserve the communications data of the world's most highly regulated firms, giving them greater visibility and control over their information and ensuring compliance with stringent regulations.

Though we offer competitive compensation and benefits and all the other perks one would expect from an established company, we are not your typical technology company. Global Relay is a career-building company. A place for big ideas. New challenges. Groundbreaking innovation. It's a place where you can genuinely make an impact – and be recognized for it.

We believe great businesses thrive on diversity, inclusion, and the contributions of all employees. To that end, we recruit candidates from different backgrounds and foster a work environment that encourages employees to collaborate and learn from each other, completely free of barriers.

We encourage you to apply if your qualifications and experience are a good fit for any of our openings.
Your Role:

As a Senior Software Developer on the AI team you'll be using leading edge technologies to build AI-enabled products that are used by tens of thousands of users globally to enhance business efficiency. Working alongside data scientists and other developers, you will contribute to the building of machine learning (ML) solutions and other infrastructure components that will be used in features ranging from language detection, machine translation, sentiment analysis, business classifiers, and other natural language processing (NLP) related initiatives.

Our AI team remains grounded with focus and purpose from Global Relay's startup days, while benefiting from being a mature, medium-sized company. We are looking for people with strong software engineering skills and experience writing Python code as well as experience working in a machine learning/data science capacity.

Your Job:

Work with data scientists and developers in the research, building and deployment of machine learning models and other infrastructure components for NLP related features
Work as part of an Agile development team to write Python code
Document code and document detail designs
Design, in collaboration with team, the software implementations that satisfy business requirements
Design, in collaboration with the architecture team, the system architectures that satisfy business requirements
Write unit and integration tests for your code
Collaborate with testers in development of test cases
Develop deployment systems for Python based systems
Collaborate with product owners on user story generation and refinement
Participate in knowledge sharing activities with colleagues
Monitor and support operation of production systems

About You:

Minimum 5 years of Python development experience, shipping enterprise grade software in an Agile environment
Experience working with microservices
Experience with web services technology such as REST, JSON, or Thrift
Experience working on machine learning problems such as in natural language processing, speech recognition, and others
Experience with machine learning libraries such as Scikit-learn, TensorFlow PyTorch, NLTK, SpaCy, and others
Experience with multi-threaded programming
Experience with unit testing and Test Driven Development (TDD)
Experience with Continuous Integration/Continuous Delivery (CI/CD)
Experience mentoring Junior developers
Experience with any of the following is considered an asset:
C++, Bash
MLflow, OpenShift, Kubernetes, Docker

What you can expect:

At Global Relay, there's no ceiling to what you can achieve. It's the land of opportunity for the energetic, the intelligent, the driven. You'll receive the mentoring, coaching, and support you need to reach your career goals. You'll be part of a culture that breeds creativity and rewards perseverance and hard work. And you'll be working alongside smart, talented individuals from diverse backgrounds, with complementary knowledge and skills.

Global Relay is an equal-opportunity employer committed to diversity, equity, and inclusion.

We seek to ensure reasonable adjustments, accommodations, and personal time are personalized to meet the unique needs of every individual.

We understand flexible work arrangements are important, and we encourage that in our work culture. Whether it's flexibility around work hours, workstyle, or lifestyle, we want to ensure our employees have a healthy work/life balance. We support and value a hybrid work model that blends collaboration with the team in the office and focus time from the comfort of your home.

To learn more about our business, culture, and community involvement, visit www.globalrelay.com.",Tecnologías de la información,,2022-08-18T00:00:00,2022-10-16,OTHER
Senior Machine Learning Scientist,GoDaddy,,,-1,-1,,CAD,"Location

At GoDaddy the future of work looks different for each team. Some teams work in the office full-time, others have a hybrid arrangement (they work remotely some days and in the office some days) and some work entirely remotely.

This position may be a hybrid or fully remote position, as decided by your manager. If designated as hybrid, you’ll divide your time between working remotely from your home and an office location, so you should live within commuting distance. If designated as remote, you’ll be working remotely from your home and may occasionally visit a GoDaddy office to meet with your team for events or off-sites. Your hiring manager can share more about this role’s hybrid or remote designation.

This position is not eligible to be performed in Alaska, Mississippi, North Dakota, or the Virgin Islands.

Hybrid-or-Remote: This position may be a hybrid or fully remote position, as decided by your manager. If designated as hybrid, you’ll divide your time between working remotely from your home and an office location, so you should live within commuting distance. If designated as remote, you’ll be working remotely from your home and may occasionally visit a GoDaddy office to meet with your team for designation.

Join Our Team

Our team is a part of the Worldwide Engineering organization within GoDaddy, and we are looking to hire a Senior Machine Learning Scientist/Applied Researcher experienced with NLP/NLU to join our ML/AR team. Our goal is to build and grow a community of ML scientists and engineers to learn, share, and grow. We are committed to understanding all major business units, and we thrive on empowering business results by leveraging state-of-the-art ML algorithms.

This core Machine Learning/Applied Research team utilizes large-scale data to power various business areas, and a primary goal is to enhance the effectiveness of our team of customer care and sales partners with ML solutions like the self-service chatbot, a customer-centered case management system, and a configurable dynamic routing system to connect our customers with the team member who can answer their questions.

Your contributions will affect millions of customers and have a direct impact on our business results. Our team's challenges include deriving value from sparse data, understanding large scale shopping data to extract and retrieve information, and developing best practices to create the best customer experience and highest customer engagement. GoDaddy has deep and rich data sets, many still untapped, and your real passion for the cutting-edge machine learning algorithms has the power to unlock tangible business growth.

What you will get to do…

You can articulate and understand a business problem, identify challenges, formulate the ML/NLP problem and provide/prototype solutions
You will provide technical leadership, identify, and understand key business challenges and opportunities, and develop end-to-end software solutions using ML/NLP.
You will collaborate extensively with internal partners, program & product management, and engineering teams to ensure that solution meets business needs, emits valid inferences, and is functionally feasible
You will collect and process large volumes of data and build new and improved techniques and/or solutions for data collection, management, and usage
You will communicate results in a comprehensible manner to all levels of the company (field teams up to Senior Management)
You will brainstorm and share knowledge with other team members

Your experience should include…

MS in machine learning, computer science, or equivalent quantitative field with at least 2 years of industry experience, or PhD in same fieldsA background in both machine learning/NLP and software development; hands-on Deep Neural Network experience is preferredStrong algorithm design and programming skills in at least one low level language like C++/Java, and scripting languages like Python/R/ScalaExperience with distributed computing (Hadoop/Spark)Passion for solving interesting and meaningful real-world problems using principled techniques and practicesExperience working with live data (data cleaning, data visualization, and modeling)Passion for collaboration and teamworkExperience documenting, synthesizing, and communicating results

 Your experience may include…

Hands-on experience with Google Dialogflow, Live Engage, Kore.ai, or similar chatbot tools
Defining or implementing chatbot and conversation design best practices

About us... GoDaddy is empowering everyday entrepreneurs around the world by providing all of the help and tools to succeed online. GoDaddy is the place people come to name their idea, build a professional website, attract customers, sell their products and services, and manage their work. Our mission is to give our customers the tools, insights and the people to transform their ideas and personal initiative into success. To learn more about the company, visit About Us (https://aboutus.godaddy.net/about-us/overview/default.aspx.)


GoDaddy is proud to be an equal opportunity employer. We will not discriminate against any applicant or employee on the basis of age, race, color, creed, religion, sex, sexual orientation, gender, gender identity or expression, national origin, citizenship, marital status or civil partnership/union status, disability, pregnancy, genetic information or any other basis prohibited by applicable country or local laws.

If you need help completing an application for a position with GoDaddy, please reach out to our Recruiting Team at myrecruiter@godaddy.com.

GoDaddy doesn’t accept unsolicited resumes from recruiters or employment agencies.
Job ID R016523
GoDaddy's compensation is local to where you are and may vary based on an individual's qualifications at the time of the offer. The anticipated annual base salary ranges for select locations are listed below:
Seattle, New York City - $128000.00 to $160000.00
Colorado, Washington State - $113500.00 to $142000.00",Tecnologías de la información,,2022-08-18T00:00:00,2022-10-16,FULL_TIME
AI Machine Learning Engineer (PHD Student wanted),RealTime7 Inc.,Ontario,Toronto,-1,-1,,CAD,"The role is for a PhD student in the AI or Machine Learning field that has deep experience with Tensorflow and TensorflowLite. Knowledge of how to quantize the models, setup training using Google Colab, and the use of NNAPI architecture is desirable.The primary task is to develop a model that works with Python and can be ported to C++ to generate signatures for face recognition in particular, but more generically object recognition where the model can produce unique quantized signatures for vehicles, animals, and objects.The role will work closely with the firmware role to integrate the models into an embedded low power environment for arm64 processor. The models are first proven with Python and tflite, then the tflite model is invoked from C++. The developer may need to assist the C++ firmware engineer with the task.The role is suited for a grad student or PhD student who can work along side their other duties and give at least 20 hours a week. However, other qualified candidates seeking full time or part time roles are also invited to apply.Job Types: Freelance, Apprenticeship, Internship / Co-opSalary: $22.00-$30.00 per hourBenefits:Casual dressFlexible Language Requirement:French not requiredSchedule:8 hour shift",,,2022-09-11T00:00:00,2022-10-16,FULL_TIME
[ACN] Machine Learning Intern - SynapseBio,AlleyCorp Nord,Quebec,Montreal,-1,-1,,CAD,"Opportunity

We are hiring machine learning interns to train and test models that diagnose and predict neuropsychiatric conditions using physiological data. In this role, you will be working on a team with engineers and statisticians to research solutions for healthcare diagnostics and treatment areas, starting with Alzheimer's Disease and Major Depressive Disorder, among others.

Key Responsibilities
Design, train, and implement machine learning models to classify and predict neuropsychiatric conditions;
Collaborate with our interdisciplinary team to develop, test, and rank models that will be selected for product integration;
Collaborate with leading scientific researchers on scientific publications;
Keep up to date with ML and deep learning research literature – implement novel techniques from adjacent research areas (e.g. audio and video engineering, speech recognition, eye movement), to develop the highest performing models for healthcare applications.
Qualifications
Master's or PhD student in machine learning, computer science, neuroscience, or other related fields;
Demonstrable proficiency writing code in Python, in particular with Tensorflow, Scikit-learn, PyTorch, Keras or similar (familiarity with Tensorflow is ideal, but flexibility across toolchains is strongly preferred);
Excellent presentation and communication skills – published work such as papers, code, talks are a plus.",,,2022-09-13T00:00:00,2022-10-16,OTHER
