Job_title,Company,State,City,Min_Salary,Max_Salary,unitText,SalaryCurrency,Job_Desc,Industry,Rating,Date_Posted,Valid_until,Job_Type
"Software Development Engineer, Automated Brand Protection",Amazon Dev Centre Canada ULC,British Columbia,Vancouver,-1,-1,,CAD,"Programming experience with at least one modern language such as Java, C++, or C# including object-oriented design
1+ years of experience contributing to the architecture and design (architecture, design patterns, reliability and scaling) of new and current systems.
2+ years of non-internship professional software development experience

Job summary
Do you enjoy working in an entrepreneurial, fast paced environment, solving complex technical problems and delivering innovative solutions using cutting edge Machine Learning at scale?

The Automated Brand Protection team aims to deliver a trusted and complete Buyer‐facing catalog by helping Brands protect their intellectual property and accurately represent themselves on Amazon. We build large scale, low latency, high throughput, distributed software systems that identify, prevent and act on all forms of product listings abuse on the Amazon catalog. These systems will rely on data from our innovative, next-generation image processing and machine learning solutions.

As a Software Development Engineer on the team you will take ownership over the software design, documentation, development, delivery and continued support of machine learning systems built natively in AWS. In this role you will collaborate with leaders, work backwards from customers, identify problems, propose innovative solutions, relentlessly raise standards, and have a positive impact on hundreds of millions of customers.

Key job responsibilities
You will be responsible for:

Designing and developing highly reliable and scalable distributed systems to deploy cutting edge machine learning models to identify product listing abuse in images.
Working with your team members to investigate and design approaches, prototype new technology and evaluate technical feasibility.
Working in an Agile/Scrum environment to deliver quality software.
Collaborating with Product and Program stakeholders to ensure we are appropriately protecting Intellectual Property and staying on top of emerging threats.
Performing development and maintenance of key system features, and promptly attending to production issues.
Driving software development best practices and engineering excellence within your team.
Mentoring other engineers.
About the team
We are a multi-cultural and inclusive team who value diverse viewpoints and out of the box thinking. We take complete ownership of our systems, ensuring that the systems we design continue to perform optimally in production. We earn the trust of our business partners through transparency and open dialogue and have a say in how we serve brands through technology. We are also a fun loving team, regularly organizing team lunches and other social activities.

Master’s degree or PhD in Computer Science, Computer Engineering or related technical discipline.
3+ years industry experience as a Software Engineer or Software Developer.
Experience communicating with users, software development engineering teams and management to collect requirements, describe software product features and technical design.
Familiarity with professional software engineering & best practices for full software development life cycle, including coding standards, code reviews, source control management, continuous deployments, testing and operations.
Experience developing complex software systems that have successfully been delivered to customers
Experience with Amazon Web Services is a bonus.
Experience and/or a strong interest with machine learning software systems and/or big data software systems.
Demonstrated ability to mentor junior software engineers or software developers in all aspects of their engineering duties.
Amazon is committed to a diverse and inclusive workplace. Amazon is an equal opportunity employer and does not discriminate on the basis of race, national origin, gender, gender identity, sexual orientation, disability, age, or other legally protected status. If you would like to request an accommodation, please notify your Recruiter.",Tecnologías de la información,,2022-08-21T00:00:00,2022-10-16,FULL_TIME
Junior Automation Engineer,Fresh Prep,British Columbia,Vancouver,-1,-1,,CAD,"This internship is funded by the Government of Canada and work terms are under the Digital Skills for Youth (DS4Y) Program. DS4Y, an initiative from Innovation, Science and Economic Development Canada (ISED), provides an opportunity for youth to gain valuable training and work experience needed for today’s digital economy.

Who We Are
Fresh Prep is Vancouver’s homegrown meal kit delivery service. We help people throughout B.C. make world-class dinners with fresh, pre-cut and pre-portioned ingredients along with an extended menu of over 100 add-ons from local suppliers delivered weekly to your door.

From sourcing quality local goods, to delivering in reusable, recyclable and compostable packaging, we believe it’s possible to make convenient eating healthy and sustainable for the community we live in.

In the past few years, we have collected first place awards for The Georgia Straight’s Golden Plates (2019 and 2020) in addition to winning the 23rd and 24th Annual Best of Vancouver award for Best Meal Kit Service as voted by readers (2018 and 2019). Fresh Prep also placed on the Canadian Business and Maclean’s Magazine STARTUP LIST 2020 as a high-growth Canadian startup.
Who You Are

Phenomenal Teammate. You work well with others and enjoy contributing to a fantastic team. Do others enjoy working with you?
Ultra Reliable. Since we work in teams, we need team members who are engaged and seeking to contribute in a positive manner. Are you willing to show up on time and work hard?
Responsible. You have the ability to work independently as needed. Can you be trusted to act without needing strict supervision?
Self Starter. You are comfortable owning a task from start to finish and you take initiative to make continual process improvements. You observe strict deadlines and hold yourself accountable to your deliverables.

What You'll Be Doing

Automate systems through design, analysis, programming, and building components to integrate with production machines
Design, source, and implement new robotic systems (Internal and External) to improve operational efficiency
Test programming and configurations of the new systems built
You will assist the engineering team with setting up equipment for operational expansion and R&D purposes.
You will be responsible for the Project Management and completion of paperwork including, projects, budget, status reports, timesheets, and required engineering documentation
You will follow and complete equipment work instructions for various equipment while testing and ensuring a high quality of work for all documentation released
Perform other duties as assigned.

What We Are Looking For

Technician diploma / Engineering degree (Mechatronics preferred)
Basic skills with Solidworks assemblies and working with sheet metal
Ability to wire, crimp, and solder prototype electronics in a safe and efficient manner
Comfortable working with Excel, Solidworks, and learning new software
Mechanical Aptitude and knowledge of manufacturing processes
Able to work in a fast-paced environment with strict deadlines.
Comfortable occasionally working in a temperature controlled environment. The warehouse is kept at between 0 to 10 degrees Celsius
Familiarity with Automation controls like SCADA to do testing of mechanical systems
Ability to push, pull, squat, bend, and reach above and below shoulders; repetitive use of hands

What You Can Expect

An inclusive, fun workplace filled with fantastic colleagues. We’re a certified B-Corporation and our team is passionate about making a positive difference (and also about food!)
The ability to work from home or from our HQ located in beautiful East Vancouver
Competitive pay and bonuses, as well as the opportunity to participate in our Employee Stock Option Plan.
$1000.00 budget allotted to professional development training
Comprehensive health benefits (including medical, dental, vision and life-insurance) after 90 days of successful employment.
Free food! A Fresh Prep meal plan for 2 meals per week and sample meals from our test kitchen at our HQ!

Research shows that while men apply to jobs when they meet an average of 60% of the criteria, women and other marginalized folks tend to only apply when they check every box. So if you think you have what it takes, but don’t necessarily meet every single point on the job description, please still get in touch. We’d love to have a chat and see if you could be a great fit.

Fresh Prep is an Equal Opportunity Employer (EOE) and prohibit discrimination of any kind. We value diversity at our company and at all job levels our goal is to be diverse, inclusive and representative of the communities we operate in. We endeavour to recruit, develop and retain the best talent from a diverse candidate pool and truly believe that diversity, equity and inclusion among our team members is vital to our success as a company. We trust that in applying for a role with us you value this as well!",Manufactura,,2022-09-09T00:00:00,2022-10-16,FULL_TIME
Intermediate Software Engineer,Bench Accounting,British Columbia,Vancouver,-1,-1,,CAD,"What's Bench? Check us out in Medium, Betakit, Financial Post, our Instagram, and our Life at Bench Blog.

We acknowledge that Bench headquarters is located on the traditional, ancestral, and unceded territory of the Coast Salish Peoples, including the territories of the xʷməθkwəy̓əm (Musqueam), Skwxwú7mesh (Squamish), and Səl̓ílwətaʔ/Selilwitulh (Tsleil-Waututh) Nations.

Businesses need to understand their financial performance, but for many smaller ones, this means a trade-off between managing their books and running their businesses.

Our mission is to make a profound difference in the quality of life of one million people. From creatives to chiropractors, Bench helps thousands of small business owners and entrepreneurs master their financial lives. Because understanding your finances should be three things: simple, effortless, and affordable.

We're growing fast, and we're looking for exceptional people to join us on this incredible journey. Check out our culture guide to learn more about what it's like to work at Bench and read more about our business here!

Dear future Benchmate,

There has never been a more exciting time to join Bench. We're on our way to make a profound difference in the quality of life of one million people.

Finance is inseparable from the human experience. Our personal finances influence our mental and physical wellbeing, where we live, our education, our family structures, and the opportunities we do or do not have. In the mind of a small business owner, there is no distinction between their business finances and their personal finances. Working at a Bench isn't about fintech; it's about making a difference in the quality of life of human beings.

Bench is already the biggest bookkeeper in North America—we currently have over 11,000 clients, and in 2020 alone we processed $21B in transactions—and we're just at the beginning of our technological journey.

We need help improving the internal tools for our developers to have the best experience. Our mission is improving our technology and processes to enhance the speed and quality of our engineering, with a strong focus on the reduction of technical debt. We're looking for intermediate software engineers who align with our mission of using technology to improve the lives of our Benchmates so they can build the tools to help our customers succeed. What we do is immensely creative; it requires us to fall in love with the problems we're tackling, and then challenge ourselves to resolve them with the simplest solutions we can dream up.

Here is an insight into this Intermediate Software Engineer position at Bench:

Do you enjoy debugging complex problems in code you did not write?
Are you comfortable with being on-call once per month for issues that are impacting our clients or Benchmates (we pay extra for this too)?
Do you seek efficiency through automation and tooling?
Does a slow or inefficient CI/CD pipeline frustrate you?
Does finding creative ways to configure and setup efficient and effective local development environments bring you joy?
Are you interested in dabbling in machine learning systems?
Are you someone who enjoys the speed, simplicity, and ease of working in a well architected AWS infrastructure?
Are you the type of person who is frustrated or inspired by technical debt that you want to pay it down and find ways to avoid it building up again?
Does finding or resolving security vulnerabilities in code, systems and services bring you joy and satisfaction?

If this aligns with your passion and career goals, then I look forward to meeting you and discussing how you can grow with us.

Sincerely,

Vee Weller
DXI Engineering Manager

Engineer 3 - Intermediate Engineer

An Engineer 3 tends to have 3-5 yrs of relevant industry experience and is a fully competent individual contributor who can be relied upon to execute with high quality and speed with significant autonomy. Through their practice, they improve the performance, reliability, maintainability, and security of our systems. They are significant contributors to our architecture and project planning. They make their teams stronger through upholding our cultural principles, optimizing processes, and mentoring their peers and Eng 1/2s. They are measured by the quality and speed with which they improve our systems, and by their impact on their team.

You'll need to have:

A resonance with our Bench and Technology principles
A passion for continual growth: What's not working? What's affecting our speed? We are always looking to improve our systems and we need you be excited about improving the quality of our tools
Extensive experience with backend development, with some knowledge of frontend
Demonstrable ability to act as a technical lead on projects
Demonstrable ability to mentor more junior engineers

It could be an even better fit if you have:

Good understanding of CI/CD pipelines: We deploy our code a lot and we want you to help keep those pipelines fast and easy to maintain for all of our engineers
Good understanding of frontend languages and frameworks (NodeJS / TypeScript)
Experience working within Developer experience or tooling ecosystems
Deep knowledge of building quality and testing into everything you code
Experience diagnosing and resolving complex issues
Experience creating/working with IDEs

What you'll get:

The salary range for this role is $108,600k - 135,800k per year, depending on experience
In addition, we offer an extended benefits package that includes paid vacation, unlimited paid flex days, stock options, and full health, dental, and vision
You'll get unlimited access to Inkblot Therapy, our virtual counselling service to support mental wellbeing, and Bravely, our confidential, on-demand, 1:1 professional coaching service
You will have the support of your manager, and the opportunity to learn and develop by working with a team of unconventional & diverse Benchmates, who are all working together to achieve the same mission
We have a number of Affinity Groups - groups of people who have shared identities and experiences! The purpose of these groups is to support underrepresented Benchmates and amplify their voices
Bench is now a fully remote organization and will provide a Home Office Setup Fund, to ensure that you have everything you need to work comfortably from home, from day one
We will be providing alternative solutions to bring teams together for collaboration and connection
We currently focus our hiring efforts in the following provinces: British Columbia, Alberta, Ontario, New Brunswick, and Nova Scotia.

Everyone has their own unique talents. Even if you don't meet 100% of the qualifications outlined above, tell us why you'd be a great fit for this role in your application.

We believe that unchecked biases disproportionately impact the most marginalized people in society—including but not limited to BIPOC, LGBTQ2S+ people, immigrants, and people with disabilities. We strongly encourage applications from people with these identities or other marginalized communities because we believe that without you, we are all less. At Bench, we don't stand for tokenism. We stand for representation.",Finanzas,,2022-08-22T00:00:00,2022-10-16,OTHER
Software Engineer,ResMed,Nova Scotia,Halifax,-1,-1,,CAD,"Digital Health Technology team powers digital experiences and engagement to enhance the lives of millions of people every day through connected care. We build, deliver and manage a portfolio of data management platforms and mobile offerings in support of our core businesses. We thrive on simple and elegant architecture and agility. You’ll be immersed in a dynamic high-growth environment and empowered to excel, take informed risks, and drive ingenuity across the enterprise.
Digital Health Technology team powers digital experiences and engagement to enhance the lives of millions of people every day through connected care. We build, deliver and manage a portfolio of data management platforms and mobile offerings in support of our core businesses. We thrive on simple and elegant architecture and agility. You’ll be immersed in a dynamic high-growth environment and empowered to excel, take informed risks, and drive ingenuity across the enterprise.
Let’s talk about the team and you:
As a Software Engineer, you will be a part of a highly dynamic and innovative scrum team working on the latest technologies in the exciting fast-growing Digital Health space. We’re a team of thinkers and innovators who constantly challenge ourselves to do everything better than the day before so that people around the world can breathe easier.
The Connected Health Platform is a microservices architecture that enables patient-centric workflows focusing on patient use of sleep and respiratory medical devices, and their interactions with healthcare providers. The platform supports device management, access to device data, interoperability with external healthcare systems, and insights through derived data and machine learning algorithms. The platform is developed using AWS technologies such as AWS serverless, managed services, microservices on ECS Fargate, SQS messaging, NoSQL and relational database technologies.
As an Engineer on the team you will get familiar with the technology and the product, and be able to contribute to the on-going development, deployment, monitoring, and support of the solution.
Let’s talk about Responsibilities
Design, develop, implement, and deploy AWS cloud solutions.
Development of high-performance, scalable, and resilient web applications, back-end services, and database solutions.
Provide incident management, change management, application support, monitoring, and Tier 2 support as part of the full cycle team responsibilities.
Mentor junior members of the team.
Perform code reviews and provide feedback, following coding standards and best practices, including secure coding guidelines.
Assist with project estimation, planning, task break down based on user stories, progress and bug tracking.
Write clear, well-commented, and easy to understand code.
All engineers are expected to place a strong emphasis on writing automated tests, including unit tests, integration tests, and end-to-end functional tests.
May be part of an on-call support rotation.
Other tasks and responsibilities as assigned.
Let’s talk about Qualifications and Experience
Strong object oriented design and programming skills.
You enjoy learning and are committed to staying up to date with new and emerging technologies.
Understanding of challenges associated with high availability, 24×7 applications and services.
Experience with Amazon ECS, AWS Elastic Beanstalk, AWS Lambda, or Amazon EC2.
Experience working with and managing container development, deployment and operations on AWS, specifically with ECS on Fargate.
Experience developing serverless applications, using Lambda, Dynamo DB, SNS, SQS, and S3.
Experience with Git, Confluence, and JIRA.
Experience with CI/CD tools (e.g. CodePipeline, TeamCity) and infrastructure as code tools (e.g. Terraform, CloudFormation).
Experience working with, or an understanding of, NoSQL databases and relational databases.
Experience with test-driven development (TDD) is an asset.
An understanding of 12-factor applications and cloud-native principles is an asset.
Experience with various message brokering architectures (pub/sub queues, request/response) and data streaming is an asset.
Experience in Java, Python, or C#, targeting multiple platforms (e.g. Windows, Linux) and application types (e.g. console, web site, REST API).
Experience with front end JavaScript frameworks (e.g. Angular, React) and web servers (e.g. Apache, Nginx, IIS).
Experience with testing frameworks (e.g. Junit, Nunit, Selenium), and testing tools (e.g. JMeter, Postman, Cucumber)
University Degree or College Diploma in Computer Science or Computer Programming or equivalent experience.
3+ years experience in design and development of multi-tiered business applications; equivalent combination of education and experience will be considered.
Fun nice to haves but not needed:
AI, Machine Learning, and Data Engineering experience is an asset.
Experience with mobile application development is an asset.
#LI-NF1
#LI-Remote
Joining us is more than saying “yes” to making the world a healthier place. It’s discovering a career that’s challenging, supportive and inspiring. Where a culture driven by excellence helps you not only meet your goals, but also create new ones. We focus on creating a diverse and inclusive culture, encouraging individual expression in the workplace and thrive on the innovative ideas this generates. If this sounds like the workplace for you, apply now!",Farmacéutica y biotecnología,,2022-09-13T00:00:00,2022-10-16,FULL_TIME
