Job_title,Company,State,City,Min_Salary,Max_Salary,unitText,SalaryCurrency,Job_Desc,Industry,Rating,Date_Posted,Valid_until,Job_Type
Machine Learning Engineer,BPH Online Marketing,Ontario,Hamilton,-1,-1,,CAD,"We are looking for a highly capable machine learning engineer to optimize our machine learning systems. You will be evaluating existing machine learning (ML) processes, performing statistical analysis to resolve data set problems, and enhancing the accuracy of our AI software's predictive automation capabilities.To ensure success as a machine learning engineer, you should demonstrate solid data science knowledge and experience in a related ML role. A first-class machine learning engineer will be someone whose expertise translates into the enhanced performance of predictive automation software.Responsibilities: Consulting with managers to determine and refine machine learning objectives.Designing machine learning systems and self-running artificial intelligence (AI) software to automate predictive models.Transforming data science prototypes and applying appropriate ML algorithms and tools.Ensuring that algorithms generate accurate user recommendations.Turning unstructured data into useful information by auto-tagging images and text-to-speech conversions.Solving complex problems with multi-layered data sets, as well as optimizing existing machine learning libraries and frameworks.Developing ML algorithms to analyze huge volumes of historical data to make predictions.Running tests, performing statistical analysis, and interpreting test results.Documenting machine learning processes.Keeping abreast of developments in machine learning.Requirements: Bachelor's degree in computer science, data science, mathematics, or a related field.Master’s degree in computational linguistics, data analytics, or similar will be advantageous.At least two years' experience as a machine learning engineer.Advanced proficiency with Python, Java, and R code writing.Extensive knowledge of ML frameworks, libraries, data structures, data modeling, and software architecture.In-depth knowledge of mathematics, statistics, and algorithms.Superb analytical and problem-solving abilities.Great communication and collaboration skills.Excellent time management and organizational abilities.Job Types: Full-time, PermanentSalary: $3,500.00-$4,500.00 per monthBenefits:Dental careExtended health careVision careSchedule:8 hour shiftDay shiftSupplemental pay types:Bonus payCommission payAbility to commute/relocate:Hamilton, ON: reliably commute or plan to relocate before starting work (required)Experience:Machine learning: 1 year (preferred)",,,2022-09-09T00:00:00,2022-10-16,FULL_TIME
[ACN] Machine Learning Intern - SynapseBio,AlleyCorp Nord,Quebec,Montreal,-1,-1,,CAD,"Opportunity

We are hiring machine learning interns to train and test models that diagnose and predict neuropsychiatric conditions using physiological data. In this role, you will be working on a team with engineers and statisticians to research solutions for healthcare diagnostics and treatment areas, starting with Alzheimer's Disease and Major Depressive Disorder, among others.

Key Responsibilities
Design, train, and implement machine learning models to classify and predict neuropsychiatric conditions;
Collaborate with our interdisciplinary team to develop, test, and rank models that will be selected for product integration;
Collaborate with leading scientific researchers on scientific publications;
Keep up to date with ML and deep learning research literature – implement novel techniques from adjacent research areas (e.g. audio and video engineering, speech recognition, eye movement), to develop the highest performing models for healthcare applications.
Qualifications
Master's or PhD student in machine learning, computer science, neuroscience, or other related fields;
Demonstrable proficiency writing code in Python, in particular with Tensorflow, Scikit-learn, PyTorch, Keras or similar (familiarity with Tensorflow is ideal, but flexibility across toolchains is strongly preferred);
Excellent presentation and communication skills – published work such as papers, code, talks are a plus.",,,2022-09-13T00:00:00,2022-10-16,OTHER
Machine Learning Operations Specialist,Stantec,Manitoba,Winnipeg,-1,-1,,CAD,"Machine Learning Operations Specialist - ( 220002SA )
Description
Grow with the best. Join a smart, creative, and inspired team that works behind the scenes to support operational excellence. As part of the Innovation Office, the Digital Technology & Innovation team is composed of digital experts who conduct research and development to keep our teams—and our client’s projects—ahead of the technological curve. They implement established technologies and find emerging solutions for all business lines (Buildings, Energy & Resources, Environmental Services, Infrastructure, and Water), bridging existing knowledge domains and facilitating the integration of powerful tools and methods. The team’s goals are to digitalize our organization, support Stantec’s digital transformation, and to increase the capacity of our designers, engineers, and scientists, providing higher-quality results and solutions to our clients.
Your Opportunity
The Innovation Office’s Digital Technology & Innovation (DTI) team has an opportunity for a Machine Learning Operations Specialist. This individual contributor position will be a member of the Data and Analytics Program Group, which leads the firm in Business Intelligence and data services by providing architectural guidance, technological vision, and solution development. Specifically, this position will use advanced analytics, data science, and machine learning to give our business and our products a competitive advantage. It includes understanding and managing the data and how it interconnects as well as architecting data for self-serve BI and BA opportunities. This position requires a person who is business savvy, experienced in data analytics, machine learning, and enjoys framing a problem, shaping & creating solutions, and helping to champion implementation. As a member of the Digital Technology & Innovation team, the Data and Analytics group also engages in research & development and provides guidance and oversight as a center of excellence for the business. This group also engages in new product research and testing and the incubation of data analytics ideas.
The ideal candidate will be a self-starter, a critical thinker, and highly interested in the application of new data analytics and machine learning technologies and methods. The candidate will become a member of the Digital Technology & Innovation group; however, they will also be accessible to Stantec’s project teams to support project work as needed.
Your Key Responsibilities
Reporting to the Data Analytics Leader, your key responsibilities will include:
Consult on machine learning solutions, give direction, and insight on machine learning initiatives and areas of focus.
Build end-to-end advanced analytics and AI/ML solutions.
Build efficient platforms for model training, evaluation, shipping, and monitoring.
Design and train ML systems and model architecture.
Train and tune advanced AI/ML models and put them in production via model pipelines, registry, packaging, deployment, and monitoring in a scalable way.
Document the work process, including experiments, parameter tuning etc.
Work with data scientists within our team, our business stakeholders, and other technical teams to deliver analytical solutions to the business.
Present periodic Tech-Talk (internal company) webinars throughout the year on the topic of machine learning and artificial intelligence.
Present to external audiences as needed.
Perform other miscellaneous tasks associated with being a member of the Digital Technology & Innovation team and those typical of a Machine Learning operations specialist.
Qualifications
Your Capabilities and Credentials
Curious, passionate about helping business lines drive their success utilizing data.
Innovative problem-solver, ability to imagine new analytical solutions to any problem.
Confident, able to challenge perceptions and biases of individuals diplomatically at every level of the organization in order to enact improvements.
Ability to communicate to both technical and non-technical people.
Ability to effectively organize, plan, prioritize, and manage time and competing priorities.
Ability to execute complex or specialized projects.
Business-oriented with a solid understanding of business requirements and vernacular.
Highly detailed when required.
Stays abreast of current and upcoming technologies and tools.
Results-focused, able to focus on results and set an example for the team.
Good understanding of end-to-end data science projects - data intuition validation, model design, implementation, validation and testing, and deployment.
Strong proficiency with R or Python.
Experience with application development practices, CI/CD pipelines and GIT.
Extensive experience with machine learning libraries (Numpy, Pandas, SciKit Learn, etc.) and any deep learning frameworks like Pytorch/Tensorflow.
Hands on expertise in developing AI & ML driven models.
Experience/knowledge in deploying AI & ML models and putting models into production.
Experience with Azure Cloud for MLOps is an asset
Education and Experience
A bachelor’s or master’s degree in business, IT, mathematics, statistics, or another relevant area of study.
Minimum 1 year of experience in the areas of machine learning, deep learning, natural language processing or data mining.
Typical office environment working with computers and remaining sedentary for long periods of time.
This description is not a comprehensive listing of activities, duties or responsibilities that may be required of the employee and other duties, responsibilities and activities may be assigned or may be changed at any time with or without notice.
Stantec is a place where the best and brightest come to build on each other’s talents, do exciting work, and make an impact on the world around us. Join us and redefine your personal best.
Primary Location : Canada-Ontario-Waterloo
Other Locations : Canada-Saskatchewan-Regina, Canada-Alberta-Calgary, Canada-Nova Scotia-Dartmouth, Canada-Manitoba-Winnipeg, Canada-British Columbia-Vancouver, Canada-Ontario-Toronto, Canada-Newfoundland and Labrador-St. John's, Canada-Alberta-Edmonton
Job : Applications Development
Organization : BC-1290 Innovation-DTI-Canada
Employee Status : Regular
Job Level : Individual Contributor
Travel : No
Schedule : Full-time
Job Posting : Aug 25, 2022, 11:37:51 AM
Req ID: 220002SA
Stantec provides equal employment opportunities to all qualified employees and applicants for future and current employment and prohibit discrimination on the grounds of race, color, religion, sex, national origin, age, marital status, genetic information, disability, protected veteran status, sexual orientation, gender identity or gender expression. We prohibit discrimination in decisions concerning recruitment, hiring, referral, promotion, compensation, fringe benefits, job training, terminations or any other condition of employment. Stantec is in compliance with local, state and federal laws and regulations and ensures equitable opportunities in all aspects of employment. EEO including Disability/Protected Veterans","Servicios de construcción, reparación y mantenimiento",,2022-08-25T00:00:00,2022-10-16,FULL_TIME
Machine Learning Engineer (All levels),Deep Genomics,Ontario,Toronto,-1,-1,,CAD,"About Us
Founded in 2015, Deep Genomics is a drug development company that aims to revolutionize medicine by leveraging expertise in artificial intelligence (AI) and genome biology. We have built the world’s first, and by far the most advanced, AI platform that is able to untangle the enormous complexity of RNA biology and find the best targets, mechanisms, and molecules.
The thesis here at Deep Genomics is that everyone, at some point in their life, will face a genetic condition, whether Mendelian or complex, and we aim to be there for them with a genetically precise therapy. We take immense pride in our team of people whose backgrounds span a diverse range of disciplines including those found in a traditional biotechnology company, as well as machine learning, laboratory automation, and software engineering.
Ideal Candidate
Our predictive systems group brings together world-leading experts in biology, genomics, medicine, and machine learning. We are working on several ambitious projects to develop pioneering AI technology for understanding complex genetic diseases and enabling the discovery of novel targets as well as therapies. We are looking for an experienced machine learning engineer to lead the design and development of new models and pipelines and the infrastructure for scaling it up to the next level.
What You’ll Be Doing:
Working with our ML scientists to develop highly scalable models and algorithms for predicting molecular phenotypes using state-of-the-art neural network methodologies.
Developing evaluation, visualization, and productivity tools for streamlining machine learning research
Adapting our algorithms and architectures to best exploit modern cloud computing environments
Working with our software engineers, biologists and geneticists to operationalize and deploy research output to match the needs of stakeholders.
What You Bring:
Solid Engineering and Computer Science fundamentals, ideally with a degree in CS, Math, or equivalent experience.
Senior candidates should have experience in architecting, developing, and deploying large software systems in a leading position
Experience in building, testing, training, and deploying production-ready ML workflows.
Experience developing machine learning algorithms or machine learning infrastructure in Python or C/C++.
Experience with frameworks like PyTorch, Caffe2, Tensorflow, Keras, JAX, Chainer, etc.
Experience in the operationalization of Machine Learning projects (MLOps) using at least one of the popular frameworks or platforms (e.g. Kubeflow, AWS Sagemaker, Google AI Platform, Azure Machine Learning).
What we offer:
Leading role in developing the future of drug development to cure genetically defined diseases.
A highly competitive salary and meaningful equity compensation.
Exceptional opportunities for learning and growth.
A bright, collegial, highly motivated team working at the intersection of the most exciting areas of science and technology.
Deep Genomics thanks all applicants, however only those selected for an interview will be contacted.
Deep Genomics welcomes and encourages applications from people with disabilities. Accommodations are available on request for candidates taking part in all aspects of the selection process.",,,2022-08-22T00:00:00,2022-10-16,FULL_TIME
Machine Learning Engineer III,ACV Auctions,British Columbia,Vancouver,-1,-1,,CAD,"ACV’s mission is to build and enable the most trusted and efficient digital marketplaces for buying and selling used vehicles with transparency and comprehensive data that was previously unimaginable. We are powered by a combination of the world’s best people and the industry’s best technology. At ACV, we are driven by an entrepreneurial spirit and rewarded with a work environment that enables each teammate to impact the company from day one. ACV’s network of brands includes ACV Auctions, ACV Transportation, MAX Digital and ACV Capital within its Marketplace Products as well as True360 and Data Services.

ACV’s Machine Learning Team is looking for a talented, experienced Machine Learning Engineer, to join our pricing domain. You will be leading the research and development of models that power the prediction of vehicle sale prices on the ACV marketplace.

Successful candidates will demonstrate excellent skill and maturity, be self-motivated as well as team-oriented, and have the ability to support the development and implementation of end-to-end ML-enabled software solutions to meet the needs of internal stakeholders. Those who will excel in this role will be those who listen with an ear to the overarching goal, not just the immediate concern that started the query. They will be able to show their recommendations are contextually grounded in an understanding of the practical problem, the data, and theory as well as what product and software solutions are feasible and desirable.

The core responsibilities of this role are:

Working with the fellow machine learning engineers to explore and refine the existing models via creative feature engineering and model tuning.
Developing ML models to detect prediction outliers, from proof of concept to Production.
Mining structured & unstructured data, and performing EDAs.
Documenting the work process, including experiments, parameter tuning etc.
Monitoring performance of models in Production.

Required Qualifications:

Graduate education in a computationally intensive domain.
0-3 years of prior relevant work or lab experience in ML/DL projects/research.
Strong sense and skills in mathematics, statistics and algorithms. Experience with regression analysis and classification analysis is essential.
Experience with EDA, including data pipeline building and data visualization.
Advanced proficiency with Python, SQL etc.
Extensive knowledge of ML frameworks and libraries. Experience on tree-based algorithms (XGBoost, CatBoost, LightGBM etc.), and Generalized linear models (GLM) are highly valued.

Preferred Qualifications:

Experience with anomaly detection, and model interpretation.
Experience with cloud services (AWS / GCP) and kubernetes, docker, CI/CD in python.
Experience with Bash Scripting

What we will offer:

Comprehensive benefits offerings for benefits eligible Teammates.
Unique culture that truly values each and every Teammate.
Career development and Future Growth Opportunities.
Learning & Development Opportunities!
We love to see our engineers grow and learn and have invested heavily in our internal Learning and Development program, which provides access to PluralSight, Frontend Masters, as well as in-person conferences.
Annual Hackathons with some amazing prizes!
Career development and future growth opportunities.

At ACV, we are committed to an inclusive culture in which every individual is welcomed and empowered to celebrate their true selves. We achieve this by fostering a work environment of acceptance and understanding that is free from discrimination. ACV is committed to being an equal opportunity employer regardless of sex, race, creed, color, religion, marital status, national origin, age, pregnancy, sexual orientation, gender, gender identity, gender expression, genetic information, disability, military status, status as a veteran, or any other protected characteristic We also consider qualified applicants regardless of criminal histories, consistent with legal requirements. If you have a disability or special need that requires reasonable accommodation, please let us know.

For information on our collection and use of your personal information, please see our Privacy Notice.",Ventas al mayoreo y al menudeo,,2022-09-07T00:00:00,2022-10-16,FULL_TIME
Senior Machine Learning Scientist,GoDaddy,,,-1,-1,,CAD,"Location

At GoDaddy the future of work looks different for each team. Some teams work in the office full-time, others have a hybrid arrangement (they work remotely some days and in the office some days) and some work entirely remotely.

This position may be a hybrid or fully remote position, as decided by your manager. If designated as hybrid, you’ll divide your time between working remotely from your home and an office location, so you should live within commuting distance. If designated as remote, you’ll be working remotely from your home and may occasionally visit a GoDaddy office to meet with your team for events or off-sites. Your hiring manager can share more about this role’s hybrid or remote designation.

This position is not eligible to be performed in Alaska, Mississippi, North Dakota, or the Virgin Islands.

Hybrid-or-Remote: This position may be a hybrid or fully remote position, as decided by your manager. If designated as hybrid, you’ll divide your time between working remotely from your home and an office location, so you should live within commuting distance. If designated as remote, you’ll be working remotely from your home and may occasionally visit a GoDaddy office to meet with your team for designation.

Join Our Team

Our team is a part of the Worldwide Engineering organization within GoDaddy, and we are looking to hire a Senior Machine Learning Scientist/Applied Researcher experienced with NLP/NLU to join our ML/AR team. Our goal is to build and grow a community of ML scientists and engineers to learn, share, and grow. We are committed to understanding all major business units, and we thrive on empowering business results by leveraging state-of-the-art ML algorithms.

This core Machine Learning/Applied Research team utilizes large-scale data to power various business areas, and a primary goal is to enhance the effectiveness of our team of customer care and sales partners with ML solutions like the self-service chatbot, a customer-centered case management system, and a configurable dynamic routing system to connect our customers with the team member who can answer their questions.

Your contributions will affect millions of customers and have a direct impact on our business results. Our team's challenges include deriving value from sparse data, understanding large scale shopping data to extract and retrieve information, and developing best practices to create the best customer experience and highest customer engagement. GoDaddy has deep and rich data sets, many still untapped, and your real passion for the cutting-edge machine learning algorithms has the power to unlock tangible business growth.

What you will get to do…

You can articulate and understand a business problem, identify challenges, formulate the ML/NLP problem and provide/prototype solutions
You will provide technical leadership, identify, and understand key business challenges and opportunities, and develop end-to-end software solutions using ML/NLP.
You will collaborate extensively with internal partners, program & product management, and engineering teams to ensure that solution meets business needs, emits valid inferences, and is functionally feasible
You will collect and process large volumes of data and build new and improved techniques and/or solutions for data collection, management, and usage
You will communicate results in a comprehensible manner to all levels of the company (field teams up to Senior Management)
You will brainstorm and share knowledge with other team members

Your experience should include…

MS in machine learning, computer science, or equivalent quantitative field with at least 2 years of industry experience, or PhD in same fieldsA background in both machine learning/NLP and software development; hands-on Deep Neural Network experience is preferredStrong algorithm design and programming skills in at least one low level language like C++/Java, and scripting languages like Python/R/ScalaExperience with distributed computing (Hadoop/Spark)Passion for solving interesting and meaningful real-world problems using principled techniques and practicesExperience working with live data (data cleaning, data visualization, and modeling)Passion for collaboration and teamworkExperience documenting, synthesizing, and communicating results

 Your experience may include…

Hands-on experience with Google Dialogflow, Live Engage, Kore.ai, or similar chatbot tools
Defining or implementing chatbot and conversation design best practices

About us... GoDaddy is empowering everyday entrepreneurs around the world by providing all of the help and tools to succeed online. GoDaddy is the place people come to name their idea, build a professional website, attract customers, sell their products and services, and manage their work. Our mission is to give our customers the tools, insights and the people to transform their ideas and personal initiative into success. To learn more about the company, visit About Us (https://aboutus.godaddy.net/about-us/overview/default.aspx.)


GoDaddy is proud to be an equal opportunity employer. We will not discriminate against any applicant or employee on the basis of age, race, color, creed, religion, sex, sexual orientation, gender, gender identity or expression, national origin, citizenship, marital status or civil partnership/union status, disability, pregnancy, genetic information or any other basis prohibited by applicable country or local laws.

If you need help completing an application for a position with GoDaddy, please reach out to our Recruiting Team at myrecruiter@godaddy.com.

GoDaddy doesn’t accept unsolicited resumes from recruiters or employment agencies.
Job ID R016523
GoDaddy's compensation is local to where you are and may vary based on an individual's qualifications at the time of the offer. The anticipated annual base salary ranges for select locations are listed below:
Seattle, New York City - $128000.00 to $160000.00
Colorado, Washington State - $113500.00 to $142000.00",Tecnologías de la información,,2022-08-18T00:00:00,2022-10-16,FULL_TIME
