Job_title,Company,State,City,Min_Salary,Max_Salary,unitText,SalaryCurrency,Job_Desc,Industry,Rating,Date_Posted,Valid_until,Job_Type
Machine Learning Engineer,KUBRA,Ontario,Midtown Toronto,-1,-1,,CAD,"Overview:

KUBRA is in growth mode and currently seeking a Machine Learning Engineer to join our Data Analytics Team!
As a Machine Learning Engineer, you will be working on designing and maintaining the Machine Learning algorithms that will be used to extract value out of our data. The best part? You will also be collaborating with BI Analysts, and Data Engineers to introduce new data on machine learning standards and best practices with KUBRA!

What you get to do every day:
Introduce machine learning standards and best practices to KUBRA.
Build scalable machine learning architecture and automate machine learning operations.
Offer data-driven insights that provide value to both internal and external customers.
Foster an environment that emphasizes trust, open communication, creative thinking, and cohesive team effort.
Build and maintain machine learning solutions in production.
The initial models may be against data in our on-premise infrastructure. As the data engineers migrate more of our data to AWS, the ML model will be against data in AWS.
What kind of person should you be?:
Excellent written and verbal communication skills and an ability to maintain a high degree of professionalism in all client communications.
Ability to influence others, build relationships, manage conflicts, and handle negotiations.
Excellent organization, time management, problem-solving, and analytical skills.
Proactive mindset and ability to work independently in a fast-paced environment focused on results.
Ability to handle pressure.
What skills do you need?:
Minimum of 2 to 3 years of experience building machine learning pipelines.
An undergraduate or masters degree in Computer Science, Statistics, Analytics, or a similar discipline
Sound knowledge of machine learning lifecycle from data gathering to model deployment.
Experience deploying machine learning models into a production environment.
Demonstrable experience with regression, clustering, and classification algorithms.
Preferable to have experience with one or more of Data tools, Databricks, Snowflake, SQL, R, Python, Spark.
Knowledge in one of AzureML or AWS Sagemaker desirable.
Experience in CI/CD and good understanding of containerization concepts.
Experience in building API’s for Model Serving is an asset.
What can you expect from us?:
Award-winning culture that fosters growth, diversity and inclusion for all
Paid day off for your birthday
Access to LinkedIn learning courses
Continued education with our education reimbursement program
Flexible schedules
Two paid days for volunteer opportunities
Well-Being Days!
KUBRA is a fast-growing company that delivers customer communications solutions to some of the largest utility, insurance, and government entities across North America. KUBRA offers billing and payments, mapping, mobile apps, proactive communications, and artificial intelligence solutions for customers. With more than 1.5 billion customer interactions annually, KUBRA services reach over 40% of households in the U.S. and Canada. KUBRA is an operating subsidiary of Hearst.
Our office is small enough to allow creative individuals to flourish, yet large enough to provide long-term stability. We place a tremendous amount of responsibility on our team members to be productive, focused and self-motivated. We offer a casual work environment, competitive compensation and a stellar benefits program.
KUBRA is an equal opportunity employer dedicated to building an inclusive and diverse workforce. We will provide accommodations during the recruitment process upon request by emailing the recruitment-team@kubra.com. Information received relating to accommodation will be addressed confidentially. We thank all applicants for their interest; however, only candidates under consideration will be contacted.",Tecnologías de la información,,2022-08-22T00:00:00,2022-10-16,FULL_TIME
Machine Learning Engineer (remote),Software International,,,-1,-1,,CAD,"Our client, is a leading, multi national AI/Data Analytics company and they are building out a new Data team for a large project with a huge insurance company. They are seeking to add a (ML) Machine Learning Engineer to the team. This could be a long term, renewable contract role.
Job Description:
Machine Learning Engineers (MLE) are technically proficient programmers who research, build, and design software to automate predictive models. An MLE builds systems that leverage large data sets to generate and develop algorithms capable of learning and eventually making predictions
Designing machine learning systems requires that the MLE assess, analyze, and organize data, execute tests and optimize the learning process to help develop high-performance machine learning models
Develop high-level solution architectures and work with big-data engineers and decision science analysts to build, test and assess models that predict and optimize business outcomes based on a client’s success criteria
Create sophisticated yet simple interpretations and communicate insights to clients that lead to quantifiable business impact
Build relationships with clients by understanding their stated, but more importantly, latent needs

Required Skills:
5-10 years of industry experience
must have valid Canadian Reliability Clearance
Strong programming skills in any one or more programming languages like Python
Experience in Process Automation, Classification, ML and NLP
Experience using python libraries for data science and machine learning such as: pandas, numpy,scikit-learn, tensor flow, etc.
Sound fundamentals of data structures, algorithms and object-oriented programming

Ability to quickly learn and communicate the latest findings in AI research
Creative thinking for leveraging machine learning to build end-to-end intelligent software systems
Experience or exposure to data science projects
Strong analytical, problem-solving skills
Hands-on experience with version control and any of the following: Bitbucket/GitHub/GitLab
Knowledge of or exposure to AWS
2+ experience creating CICD pipelines to deploy models into production
Optimizing and scaling code for pre-existing models and algorithms
Ability to translate a business motivated problem into code
Knowledge of containerization
A self starter with positive attitude
Good leadership & management skills",Tecnologías de la información,,2022-08-22T00:00:00,2022-10-16,OTHER
"Senior Machine Learning Engineer, Computer Vision (Remote)",BenchSci,Ontario,Toronto,-1,-1,,CAD,"BenchSci is a remote first organization. At this moment, we are welcoming applicants from Canada, the US and the UK for this position.
BenchSci's vision is to help scientists bring novel medicine to patients 50% faster by 2025. We empower scientists to run more successful experiments with the world's most advanced, biomedical artificial intelligence software platform.
Backed by F-Prime, Inovia, Golden Ventures, and Google's AI fund, Gradient Ventures, we provide an indispensable tool for scientists that accelerates research at 16 top 20 pharmaceutical companies and over 4,300 leading academic centers. We're a certified Great Place to Work®, and top-ranked company on Glassdoor.
We are seeking a Machine Learning Engineer - Computer Vision to join our growing ML team. You will work on complex and challenging computer vision problems that will have an impact on the 31,000+ life scientists across the world who rely on BenchSci for their research. Reporting to the Engineering Manager, ML, you'll apply your domain expertise to select, train and deploy the best-suited machine learning algorithms, collaborate and experiment with scientists, and apply state-of-the-art techniques to build solutions that will shape the future of scientific discovery. This role offers plenty of room for technical innovation and greenfield to explore and propose computer vision solutions to a complex area.
You Will:
Continuously improve the performance and scalability of ML models and pipelines that are at the core of BenchSci's products
Work on different stages of the problem from prototyping to productization
Contribute to key components across the machine learning ecosystem defining BenchSci's ML Technical Roadmap
Regularly investigate what technologies will best enable BenchSci to effectively identify experimental insights through proof-of-concepts
Work with BenchSci's Chief Science Officer and Director of ML to correctly capture the nuances of biology, effectively translating them into ML objectives
Advocate for code and engineering process improvements across your team, and help define best practices based on personal industry experience and research
Participate in sprint planning, estimations, and reviews
Work with teammates to ensure high-quality deliverables
You Have:
3+ years of experience working as a professional developer, with at least 2 years of this focused on machine learning and computer vision
A Bachelor's or Master's degree in Computer Science, Mathematics, or other closely-related disciplines
Excellent software engineering skills in Python
Comprehensive knowledge in the end-to-end machine learning lifecycle, including the nuances of the infrastructure and operations
Working experience with ML and/or Computer Vision fundamentals
Experience productionalizing ML models (this is kind of mandatory for us)
Strong experience with PyTorch, TensorFlow, Scikit-learn, and image processing libraries such as OpenCV and Scikit-image
Experience with distributed and cloud-based data processing frameworks such as Apache Spark or Apache Beam
A constant desire to grow and develop
Strong cross-team communication and collaboration skills
A team player who strives to see teammates succeed together
Nice to haves, but not mandatory qualifications:
Research publications in ML/AI-related fields
Background in Life Science (cell biology, molecular biology, genetics, immunology, microbiology)
Experience in bioinformatics
Familiarity with reference architectures on Google Cloud Platform
Familiarity with modern container orchestration systems such as Kubernetes
Benefits and Perks:
An engaging remote-first culture
A competitive compensation package that includes BenchSci equity options
Comprehensive health and dental benefits
Emphasis on mental health with $2500 CAD (or equivalent in your country’s currency) for Psychologist, Social Worker, or Psychotherapist services
Three weeks of vacation plus an additional day for every completed year
Unlimited flex time to use toward sick days, personal days, religious holidays, birthdays and appointments
Additional time-off: 2 weeks for Winter Holidays, every other Friday in July and August, your birthday, and more!
Generous parental leave benefits with a top-up plan or paid time off options
A $2000 CAD (or equivalent in your country’s currency) Annual Learning & Development budget
A $1000 CAD (or equivalent in your country’s currency) work from home allowance to make your home setup perfect for you
A lifestyle spending account for employees to receive reimbursement for eligible expenses related to wellness, lifestyle and productivity $2500 CAD (or equivalent in your country’s currency) per year
Our Culture:
At BenchSci, we’re committed to cultivating an inspiring, inclusive, and equitable work environment for high performing, ego-free, self-starting individuals with a growth mindset, who enjoy the challenge of solving hard problems. We recognize that everyone here is a person first and an employee second. We want people to feel cared for and supported to bring the best versions of themselves to work and help the company achieve its mission. We believe culture is critical to success and invest accordingly.
We live and promote our FASTT values of Focused, Advancement with Speed, Tenacity, and Transparency. We work hard to maintain an engaging, supportive environment where everyone can do their best work. To learn more, read our culture deck.
Diversity, Equity and Inclusion:
We're committed to creating an inclusive environment where people from all backgrounds can thrive. We believe that improving diversity, equity and inclusion is our collective responsibility, and this belief guides our DEI journey. To learn more, read about our DEI initiatives.
Accessibility Accommodations:
BenchSci provides accessibility accommodations during the recruitment process. Should you require any accommodation, we will work with you to meet your needs.
BenchSci is a remote first organization. At this moment, we are welcoming applicants from Canada, the US and the UK for this position.
#LI-Remote",Tecnologías de la información,,2022-08-26T00:00:00,2022-10-16,FULL_TIME
AAVAA - Machine Learning and Signal Processing Engineer,AAVAA,Quebec,Montreal,-1,-1,,CAD,"Machine Learning and Signal Processing Specialist

We are looking for a full-time Machine Learning and Signal Processing Specialist as early as September 2022. With AAVAA, you will be part of a multidisciplinary team building a unique listening device that allows everyone to hear what they want by processing their surrounding sounds based on input from their brain and biosignals. Our goal is to give people control of their auditory environment, enhance the sounds they want to hear, and suppress distracting noise. In addition to solving one of the biggest challenges of human health, you will get:

A generous salary, benefits, and vacation program
A safe, healthy, and inclusive work environment
Healthy snacks, frequent celebrations, endless tea and latte, social outings, and more!

We are looking for problem solver engineers and scientists who have a collaborative and meticulous spirit. Applicants of all levels are welcome, including Senior Leads, Engineers, and Postdoctoral Candidates residing in Canada. AAVAA is a Montreal start-up dedicated to increasing diversity in technology; therefore, candidates of all backgrounds are encouraged to apply.


Please see below for requested areas of experience.

Basic skills:

Machine learning (e.g., DNN, CNN, RNN, GAN, LSTM and SVM, KNN, Naive Bayes.)
Deep learning frameworks (e.g., PyTorch, TensorFlow, Keras, Scikit)
Advanced digital signal processing
Experience with electrophysiological data analysis (EEG, MEG, etc.)
High-level programming skills in Python, Matlab, C, C++, Java, etc.
Fourier transforms, discrete signals, and filter design
Time series data analysis
Statistical methods such as Bayesian statistics and statistical inference


Preferred skills:

Experience in biosignal analysis
Brain-computer interface and neuroscience
Feature engineering and dimensionality reduction
Knowledge of using cloud platforms
Github


Above and beyond:

7+ years in artificial intelligence and related fields
Advanced acoustics including techniques such as sound source separation, speech enhancement, noise reduction and cancellation, etc.
Experience with firmware development of ARM based 32 bit microcontrollers
Ability to lead a highly multidisciplinary team and execute goals",,,2022-08-31T00:00:00,2022-10-16,FULL_TIME
Machine Learning Engineer,Moneris Solutions,Ontario,Toronto,-1,-1,,CAD,"Who we are
Moneris was created as a joint investment between RBC and BMO Bank of Montreal (including Harris Bank) in December 2000. By maintaining the tradition of security and strength of our parent banks, today we are Canada's #1 processor, and one of North America's largest.
We are re-imagining commerce and shaping the future of FinTech. To do that, we empower our teams to redefine what's possible, enable them with the right tools and resources, and support them every step of the way.
Connect. Impact. Grow. Join one of Canada's top employers and make your mark at Moneris.
What you'll do

Applies and integrates statistical, mathematical, predictive modeling and business analysis skills to help enhance our current fraud rules while building, deploying, and maintaining advanced analytical solutions with the goal of increasing our overall fraud detection, reducing false positive alerts, and minimizing total cost of fraud
What you bring
Manipulate data to perform analysis, including querying data, defining metrics, or analyzing data to evaluate a hypothesis
Manage machine learning model life cycle through model audit, back testing, forward testing, benchmarking with the help of performance metrics
Build machine learning/deep learning models that detect risk activity
Conduct exploratory data analysis, supervised, unsupervised and semi-supervised machine learning to identify fraud trend, segment and clusters, and optimization opportunity
Researching and evaluating new model architectures which improve the accuracy of our prediction models
Collaborate with business leaders, subject matter experts, and decision makers to develop success criteria
Cooperate with cross-functional teams across the organization in finding insights and developing the right data solutions.
Collaborating with our data science team for statistical analysis on which machine learning approach to use, including the modeling of the algorithm and prototype for testing.
Must-have experience, knowledge, skills & abilities
Bachelor's degree required, Master's degree preferred in Software Engineering, Computer Science; or equivalent work experience in a Technology or business environment
Minimum of 7 years experience working in software development, design, business intelligence environments, and / or data architecture environments
Minimum of 3 years experience working in applied Machine learning or Deep learning
Full proficiency with multiple programming languages and / or database management and modelling.
Excellent verbal and written communication skills.
Highly proficient in leading large scale projects or significant project steps and communicating progress/approach with technical/non-technical peers/clients and leaders.
Proficiency in payment systems and the merchant acquiring business is an asset
What you get
The chance to be part of one of Canada’s top employers and leader in FinTech
Competitive pay and annual bonus program based on individual performance and productivity
Emphasis on Wellness - Meeting Free Fridays (MF2), company-wide holiday closure, just to name a few
RRSP matching & defined contribution pension plan
Flexible benefits package starting from day 1
Thrive in a Hybrid or Remote Model - including a tech peripheral rebate!
Extensive learning & development programs and resources - plus unlimited free access to LinkedIn Learning and Udemy courses!
Lots of opportunities to advance your career – 30% of Moneris' roles are filled internally
EAP (Employee Assistance Program), Educational Assistance and Recognition Program
Employee perk program with incredible discounts for over 2,400 vendors!
Get involved in one or many of our Moneris Committees and Employee Resource Groups - Inclusive Workplace Council (IWC), Black Employee Network, just to name a few
Who you'll work with
Our Technology team's goal is to connect ideas and technology to create solutions that shape the way people pay. Connection is in our DNA, and we are a team enabling our merchants, business partners, and each other with the tools we need to thrive. We're a team of over 400+ people, broken into six functions, who oversee all technology aspects at Moneris, including software, infrastructure engineering, cyber security, data analytics, and project management.
Learn more about how Moneris is striving to be at the forefront of Fintech!
To reduce the risk of COVID-19 transmission and to facilitate a safe return to the office for all employees, clients and vendors, Moneris has developed a vaccination standard that requires all employees and contract resources to be fully vaccinated in order to attend company premises, company events or conduct business travel on behalf of Moneris (and provide proof). Bona fide exemptions may be requested in accordance with legally protected grounds.
Note: We welcome and encourage applications from Indigenous people, people of colour, people with disabilities, people of all genders, sexual orientation and intersectional identities.",Finanzas,,2022-09-16T00:00:00,2022-10-16,FULL_TIME
Senior Machine Learning Engineer,Avidbots,Ontario,Kitchener,-1,-1,,CAD,"Now is the time to become an Avidbotter!

About Avidbots

Avidbots is a leading-edge robotics company with the vision to bring robotic solutions into everyday life to increase organizational productivity and to do that better than any other company in the world. Our ground-breaking product, the Neo 2 autonomous floor scrubbing robot, is deployed around the world and trusted by leading facilities and building service companies. Because of our continued successes, we are in major growth mode to add to our award-winning employee culture. Headquartered in Kitchener, ON, Canada, Avidbots offers comprehensive service and support to customers in 5 continents.


About the Opportunity

We are looking for a Senior Machine Learning Engineer to join our Autonomy team. The Autonomy team at Avidbots is responsible for developing production quality software that enables our robots to navigate autonomously in its environment. If you are excited about the world of autonomous robotics and have experience building industrial scale infrastructure for machine learning software, this is a unique opportunity to join a growing team in an emerging product category.


In this role, you will work closely with an experienced engineering team in bringing pioneering machine learning solutions to market for robot perception and navigation applications. You will have direct influence on the design of our end-to-end machine learning infrastructure and data pipelines. The ideal candidate is a self-starter with a proven track record in developing machine learning software in production.
This can be a hybrid opportunity!

How You Will Make a Difference:


Own deployment of machine learning functionalities into production systems.
Architect and build scalable software for effective data management, model development, performance validation and metrics monitoring.
Work closely with other functional teams, QA, Product Manager and Project Manager to integrate machine learning components into our existing robot systems.Develop systems for production machine learning model versioning and monitoring.
Drive continuous improvement to streamline model development and deployment.
Provide technical leadership and champion software development best practices.

Requirements:

B.Sc. or graduate degree in Computer Science, Engineering, Mathematics, Machine Learning, Statistics or equivalent
5+ years of experience with software development in a professional setting
3+ years of experience working with machine learning solutions in production
Proven experience building scalable infrastructure for machine learning applications
Experience with industry-standard machine learning frameworks, platforms and tools
Proficient with programming in C++ and Python
Ability to troubleshoot machine learning deployment and production issues
Driven individual, passionate about robotics, self-starter

Bonus:

Experience with cloud-based machine learning software deployment
Background in computer vision, perception, or robotics
Exposure to Robot Operating System (ROS)
Exposure to Agile project management using industry standard tools such as Jira
Working knowledge of Linux-based operating systems
Experience working with a global team


**Applicants must be currently authorized to work in Canada for any employer


 Avidbots is an equal opportunity employer committed to building a diverse workforce. As a multicultural organization, we encourage individual achievement and recognize the strength of a diverse workforce. We offer a professional working environment and culture and believe that work / life balance is critical to ensure the happiness/well-being of our people.


Upon request, Avidbots will provide reasonable accommodation for applicants with disabilities throughout the recruitment and selection process.",Manufactura,,2022-09-10T00:00:00,2022-10-16,FULL_TIME
