Job_title,Company,State,City,Min_Salary,Max_Salary,unitText,SalaryCurrency,Job_Desc,Industry,Rating,Date_Posted,Valid_until,Job_Type
"Principal Developer, Analytics Engineering",S&P Global,Ontario,Toronto,-1,-1,,CAD,"The Role : Senior Lead Developer - Analytics Engineering
The Location : Toronto, CAN, Other
GL : 12 (for internal use only)

The Team:
The team is responsible for the delivery, deployment, and further ownership of Analytics products. These products are specific, in that they are leveraging emerging tools and technologies, such as data-science-oriented languages, alternative data, and cognitive technologies. This team partners with a team of individuals who provide thought leadership and designs those products. We collaborate closely with them and build and deploy solutions following the software development lifecycle. Thereafter, the ownership and the responsibility of maintaining and enhancing the solution lies within our team.

While our workflow involves a rudimentary software development effort, an overreach into the space of data science, data mining and cognitive technologies is a prerequisite for successful engagement in our team’s workflow.
The team setting gives ample opportunities to take on complex software engineering and analytical problems. At the same time, you will be able to seek support from colleagues with a deep proficiency in the technologies leveraged. Partnering closely with other internal stakeholders, will also allow you to tap into their experience and resources.

The Impact:
In this role you will use cutting edge techniques in domain languages to handle both traditional and alternative data sets. The supported business applications include traditional credit modelling, as well as the state-of-the-art methods for alternative data mining and transformation.
We are innovating the way the essential intelligence is being collected and processed to support our clients’ decision making and risk monitoring needs. By leveraging the data science-oriented technologies, we are delivering solutions faster and at scale, while maintaining the top-notch quality standards.
You will be making meaningful contribution in building solutions delivered through the Webservices/API/Data Processing. The work you do, will provide the data and analytics required for crucial, daily decisions in the financial markets, and in corporate finance operations.

What’s in it for you:
We are a Fortune 500 company and recognized industry-leading provider of data and analytics: as such, we provide an unusually rich environment to make an impact and grow personally and professionally.
You will have an opportunity to connect with leaders across S&P Global, our clients and partners; support new product opportunities; and be part of a lean, active, and professional team.
You will be engaged in the development of the next generation of new products, while enhancing existing ones aiming at solving high-impact business problems.
This is a high visibility role, and critical to the execution of our Analytics transformation strategy.

Responsibilities:
Work as a hands-on developer to execute and deploy projects aimed at solving high-impact business problems.
Play a central role in all stages of the building, deployment, and further improvement of new products to our clients, including:
Using data science and software engineering skills to solve business problems for our end-users
Partnering with business leaders, domain experts, and end-users to gain business understanding, data understanding, and collect requirements
Data analysis and preparation
Partnering with financial engineers and model developers to understand specifications for building and deploying models/algorithms into production systems
Architect a solution that is scalable and resource efficient
Produce system documents
Improve existing code bases by using efficient, re-usable and modular coding practices (aka functional programming)

What We’re Looking For:8+ years of Software Development experience:
Strong proficiency in Python, Java
Hands on experience with the development of complex software systems, a passion for a software development cycle, talking to other SW engineers, scaling up deployment in production
Nice to have: Spark, Databricks, no-SQL data stores such as Cassandra
3+ years of exposure to quantitative, Data Science or other advanced data and predictive analytics development:
Practical experience with data mining, machine learning techniques, natural language processing, and data visualization - with an explicit aspiration to significantly enhance own skillset in those fields
Nice to know: Natural Language Processing techniques, TensorFlow or PyTorch, SpaCy for entity recognition, ImageMagick, Tesseract, Table Detection techniques
Reasonable familiarity with R to suffice the need of comprehending and transforming the code
Proven track record of strong analytical skills, learning agility, and independent thinking; Ability to make observations, form an option, and articulate to the team
Ability to proactively nurture a collaborative work environment
Ability to effectively lead and supervise junior team members
Typically requires a Bachelor/Master’s degree or equivalent experience, in Computer Science, Data Science, Computer Engineering

Preferred Skills/Experience:
An experienced software developer, with
Knowledge on AWS, Microservices, SQL
A deep knowledge of Python and Java
A passion for the software development lifecycle
Practical grasp of the data science methods and languages
An explicit ambition to expand on the data science technology exposure
A prior experience from the Economics/Financial industry is a nice to have

S&P Global delivers essential intelligence that powers decision making. We provide the world’s leading organizations with the right data, connected technologies and expertise they need to move ahead. As part of our team, you’ll help solve complex challenges that equip businesses, governments and individuals with the knowledge to adapt to a changing economic landscape.

-----------------------------------------------------------

Equal Opportunity Employer
S&P Global is an equal opportunity employer and all qualified candidates will receive consideration for employment without regard to race/ethnicity, color, religion, sex, sexual orientation, gender identity, national origin, age, disability, marital status, military veteran status, unemployment status, or any other status protected by law. Only electronic job submissions will be considered for employment.

If you need an accommodation during the application process due to a disability, please send an email to: EEO.Compliance@spglobal.com and your request will be forwarded to the appropriate person.

US Candidates Only: The EEO is the Law Poster http://www.dol.gov/ofccp/regs/compliance/posters/pdf/eeopost.pdf describes discrimination protections under federal law.

----------------------------------------------------------- IFTECH103.2 - Middle Management Tier II (EEO Job Group)

Job ID: 276534
Posted On: 2022-09-14
Location: Toronto, Ontario, Canada",Administración y consultoría,,2022-08-24T00:00:00,2022-10-16,OTHER
Lead Technical Engineer - Senior FullStack Engineer,Capgemini,Ontario,Toronto,-1,-1,,CAD,"Lead Technical Engineer - Senior FullStack Engineer068250

Capgemini is an Equal Opportunity Employer encouraging diversity in the workplace. All qualified applicants will receive consideration for employment without regard to race, national origin, gender identity/expression, age, religion, disability, sexual orientation, genetics, veteran status, marital status or any other characteristic protected by law.
This is a general description of the Duties, Responsibilities and Qualifications required for this position. Physical, mental, sensory or environmental demands may be referenced in an attempt to communicate the manner in which this position traditionally is performed. Whenever necessary to provide individuals with disabilities an equal employment opportunity, Capgemini will consider reasonable accommodations that might involve varying job requirements and/or changing the way this job is performed, provided that such accommodations do not pose an undue hardship.
Click the following link for more information on your rights as an Applicant - http://www.capgemini.com/resources/equal-employment-opportunity-is-the-law

About Capgemini

With 270,000 women and men in nearly 50 countries, Capgemini is a responsible and multicultural global leader. Its purpose: unleashing human energy through technology for an inclusive and sustainable future. As a strategic partner to companies, Capgemini has harnessed the power of technology to enable business transformation for more than 50 years. The Group addresses the entire breadth of business needs, from strategy and design to managing operations. To do this, it relies on deep industry expertise and its command of fast evolving fields such as cloud, data, artificial intelligence, connectivity, software, digital engineering and platforms. In 2020, Capgemini reported global revenues of €16 billion.

Visit us at www.capgemini.com. People matter, results count.
PURPOSE OF THE JOB:
Performs research, design, implementation and support tasks as a member of Capgemini SW development team. Works in accordance with project guidelines, quality standards and code conventions.Responsible for area/areas within the team area of responsibility (AOR). One of the current team AOR is building the platform reporting the usage of the infra resources by Machine Learning modules of another highly loaded system with 2+ billion active users.Leads complex tasks execution.
MAIN TASKS AND RESPONSIBILITIES:
Obtains tasks from the project lead or Team Lead (TL), prepares functional and design specifications, approves them with all stakeholders.Ensures that assigned area/areas are delivered within set deadlines and required quality objectives.Provides estimations, agrees task duration with the manager and contributes to project plan of assigned area.Analyzes scope of alternative solutions and makes decision about area implementation based on his/her experience and technical expertise.Leads functional and architectural design of assigned areas. Makes sure design decisions on the project meet architectural and design requirements.Addresses area-level risks, provides and implements mitigation plan.Reports about area readiness/quality, and raises red flags in crisis situations which are beyond his/her AOR.Responsible for resolving crisis situations within his/her AOR.Initiates and conducts code reviews, creates code standards, conventions and guidelines.Suggests technical and functional improvements to add value to the product.Constantly improves his/her professional level.Supervises and coaches newcomers and more junior team members.Collaborates with other teams.
REQUIRED EDUCATION AND EXPERIENCE:
Must have:
5+ years of commercial Web Full Stack development experienceStrong Javascript skills3+ years of experience with React.jsGood knowledge of GraphQLStrong OOP skills and SOLID understandingExperience building backend API (any language)Good English (oral & written) and communication skills in generalConfident client facing skills
Would be a plus:
Experience with Hack language or php

Candidates should be flexible / willing to work across this delivery landscape which includes and not limited to Agile Applications Development, Support and Deployment.

Job Developer
Schedule Full-time
Primary Location CA-ON-Toronto
Organization ERD PPL CAN",Tecnologías de la información,,2022-09-06T00:00:00,2022-10-16,FULL_TIME
Junior Algorithms Engineer,Kardium,British Columbia,Burnaby,-1,-1,,CAD,"By joining the Kardium team, you can help make a difference in the lives of millions around the world. Kardium is developing a ground breaking medical device for the percutaneous diagnosis and treatment of atrial fibrillation, a heart condition that can cause strokes, heart failure, and other heart-related complications.As our Junior Algorithms Engineer, you will join Kardium’s Cardiac Mapping team in supporting the design, development, and evaluation of algorithms to turn raw data into actionable information for physicians. You will support the development of 3-dimensional maps used by electrophysiologists during cardiac ablation procedures, using a wealth of electrical, anatomical, and spatial information as inputs. In this role you will have the opportunity to bring your creative and innovative ideas to help Kardium achieve its goal of helping improve people’s lives.What you’ll doApply scientific investigation methods to drive product innovations in mapping and navigation algorithmsImplement and evaluate algorithmic approaches to meet clinical needs related to navigation, electrophysiology, and ablationDevelop and maintain internal software tools for large multivariate data sets of electrophysiological, anatomical, spatial, and procedural dataUse data analysis and visualization to characterize existing algorithms and the data they act on to identify algorithmic improvementsSupplement algorithmic analysis with the collection of high quality and reliable bench top testing dataCommunicate experiments, analyses and results to teammates and senior leadershipWhat you bring to the teamOur Kardium team is smart, creative, and passionate about creating cutting-edge medical devices to help improve people’s lives. We work within a collaborative environment based on trust and respect. And we understand that only by working together can we solve the unsolvable. You bring to the team these characteristics, plus:A bachelor’s degree in engineering, physics, or equivalentPrior experience in research or development within a high-technology fieldPrior experience with object-oriented programming, especially for data analysis; emphasis on MATLAB, Python or Java; experience with source control is also an assetA strong motivation to produce correct, clear, and maintainable codeStrong understanding of foundational topics in applied mathematics such as calculus, linear algebra, and statisticsEffective written and verbal communication of technical subject matterIntroductory experience with advanced topics in applied mathematics are greatly desired; these topics could include signal processing, machine learning, vectors and rotation matrices, statistics, or computer vision.Why work at Kardium?We know you are looking for a meaningful career. We can offer you that, and more:Every day you know you are making a difference by helping treat a condition that debilitates millions of people worldwideA great working environment with opportunities to develop your skills and knowledge while working with cutting-edge technologyAn engaged leadership team who believes in mentoring and growing employees’ careersSupportive colleagues and plenty of fun social events to encourage employee interactionsAnd our employees think we are great too – check out Glassdoor to learn more!How to applyApply today by sending your résumé and cover letter to jobs@kardium.com, with the job title “361 Junior Algorithms Engineer” in the subject line. If you completed your undergraduate degree in the last 2 years, please also include an unofficial copy of your transcripts.Thank you in advance for your interest in working at Kardium!Job Type: Full-time",Salud,,2022-08-25T00:00:00,2022-10-16,FULL_TIME
Systems Engineer (Remote),Jolera,Ontario,Toronto,-1,-1,,CAD,"Who We Are
Jolera is one of the world's largest and most successful privately-owned global IT Security and Solutions providers. As part of the Jolera team, you will be a member of a high-performance, innovative solutions environment where the people are dedicated and focused on continuous learning and growth opportunities.

Jolera is an organization that encourages and supports ongoing training and development. We are comprised of a talented, diversified workforce that performs collectively in an entrepreneurial and flexible environment.

Who You Are
We are seeking an energetic, passionate individual with strong communication skills and ability to work collaboratively. You are a self starter who thrives in an environment of personal accountability and enjoys being part of a challenging outcome orientated culture. You want to build your career by digging in being a part of a high performance team where there is an opportunity to up your game, sharing your knowledge and working with some of the best in the business.

What You Will Do
The Systems Engineer must provide technical leadership and consulting expertise across the organization, from the point of strategic decision-making down to project planning and execution. The Systems Engineer is also responsible for presenting findings and recommendations at all levels within the company to gain commitment for high-level IT plans, as well as initiating and participating in projects to evaluate various technologies and methods for successfully implementing those plans. The incumbent will help bring companies vision to life.
Partners with the engineering, infrastructure, security, and project management teams to help implement new systems that are scalable and highly resilient.
Provides systems and services expertise and drives operational best practices.
Participates in capacity and scalability planning.
Do Research, develops, and implement new technologies and practices.
Leverages or builds appropriate technical tools to perform administration tasks, root-cause analysis, and service restoration (such as backup, restore, failover, log interpretation, and performance monitoring).
Develops and maintains positive and cooperative relationships, inside and outside of teams, interacting in a friendly, open, honest, and accepting manner.
Mentors junior systems administrators.
Support escalations from Tier 1 and Tier 2 Operational staff to troubleshoot and resolve escalated incidents and/or service requests.
Responsible for the maintenance, configuration, and manage virtual servers, and integration automation processes.
Troubleshoot hardware and software errors by running diagnostics, documenting problems and resolutions, prioritizing problems, and assessing the impact of issues
Perform or delegate regular backup operations and implement appropriate processes for data protection, disaster recovery, and failover procedures.
Responsible for disaster recovery testing and restoration of critical services during DR events.
Monitoring and managing all installed systems and infrastructure.
Design, implement, configure, and maintain various Azure SaaS Cloud Services such as Azure AD, AIP, ATP, ASR, CAS, EM+S, Teams, Intune, AAD Connect, Exchange Online, and O365.
Deploy and maintain Azure IaaS Virtual Machines and Azure Application and Networking Services to support growth into the cloud.
Optimize Azure buildouts for cost/performance (VM optimization, reserved instances, etc.).
Implementation and Delivery of Microsoft Azure projects.
Provide documentation and technical specifications on reporting for planning and implementing new or upgrades of IT infrastructure at our customers.
Establish, configure, test, and maintain operating systems, application software, and system management tools.
Perform Assessment reports recommending upgrades and changes to customer systems to ensure stability, security, and added functionality.
Ensure knowledge transfer of multiple systems and processes by properly documenting all systems, architecture, and credentials within the Jolera CS system.
Works to develop internal SOPs and Service handbooks for key systems and services.
The document, and execute multiple simultaneous high-quality projects by collaborating with all internal and external teams.
Drive R&D (Research and Development) initiatives, work with managers and teams to identify innovative technologies in line with IT strategy and deliver POC.
 Qualifications
Bachelor’s Degree, or equivalent experience.
5+ years of experience in supporting open-source infrastructure, systems administration, as well as hardware and software troubleshooting.
Familiarity with various operating systems (Linux, Windows), and databases (MySQL, Oracle).
Solid understanding of Microsoft Windows systems administration.
Experience with virtualization technologies such as VMware and HyperV;
Additional advanced certifications (i.e. Microsoft, VMWare, etc.).
Experience with DNS and DHCP technologies.
Experience with PowerShell.
Experience with system performance monitoring & fine-tuning.
Experience with backup technologies.
Experience working with SAN/NAS storage environments.
Experience in Oracle and MS SQL environments is a plus.
Keen on working with new technologies in the cloud environment with leading cloud providers such as AWS and Azure.
AWS certification is a plus.
Design / Plan and Implement changes to existing customer infrastructure.
Proven experience in project execution.
Strong analytical and problem-solving ability to effectively prioritize and execute tasks.
Good team communication skills, with technical and non-technical colleagues.
Experience writing detailed and clear procedures and documentation that is easy to follow.
Strong self-motivation and ability to work independently or in a group setting.
Strong ability to interface across the organization with other teams and managers of all levels.
Good written, oral, and interpersonal communication skills.
Highly self-motivated and directed with keen attention to detail.
High level of interest in the latest technologies.",Tecnologías de la información,,2022-09-11T00:00:00,2022-10-16,FULL_TIME
Junior to Senior Data Geoscientist,SRK Consulting,Ontario,Toronto,-1,-1,,CAD,"Our North American geology group is one of the largest within SRK, with a diverse cross-section of structural geologists, resource geologists, and geostatisticians. As a junior- to senior-level consultant within this team, your general responsibilities will include the completion of data science projects applied to mining-related geoscience. Our work incorporates data processing, data analysis and the implementation of machine learning models applied from early exploration through mining project development (including resource and engineering studies) to operational support.An important aspect of working for SRK will be the development of your consultancy. We encourage all engineers and scientists to grow their consulting skills under the broad SRK umbrella; the successful applicant will therefore be expected to establish and maintain client relationships.A postgraduate degree specializing in the application of advanced statistical analysis and/or machine learning to geoscienceMining / metals exploration experienceProfessional membership of the Association of Professional Geoscientists of Ontario (APGO) or the Professional Engineers of Ontario (PEO), or eligibility to obtain itA strong theoretical background with demonstrated competence in defining applied solutionsProficiency with a scientific coding language and with data-science and/or machine learning packagesProven ability to work independently and as part of a team to generate, implement, and complete projectsStrong written and verbal communication skillsAdditional Beneficial Experience: An undergraduate degree in geologyProficiency with GIS and/or 3D modeling softwareExperience in economic geology, structural geology, geostatistics, geochemistry and/or geophysicsExperience with modern, implicit modelling tools and/or geophysical interpretationPrior consulting experienceIn this position, you will work in multidisciplinary teams on projects around the world and may be required to travel internationally.Job Types: Full-time, Permanent",Administración y consultoría,,2022-09-15T00:00:00,2022-10-16,FULL_TIME
