Job_title,Company,State,City,Min_Salary,Max_Salary,unitText,SalaryCurrency,Job_Desc,Industry,Rating,Date_Posted,Valid_until,Job_Type
Machine Learning Engineer III,ACV Auctions,British Columbia,Vancouver,-1,-1,,CAD,"ACV’s mission is to build and enable the most trusted and efficient digital marketplaces for buying and selling used vehicles with transparency and comprehensive data that was previously unimaginable. We are powered by a combination of the world’s best people and the industry’s best technology. At ACV, we are driven by an entrepreneurial spirit and rewarded with a work environment that enables each teammate to impact the company from day one. ACV’s network of brands includes ACV Auctions, ACV Transportation, MAX Digital and ACV Capital within its Marketplace Products as well as True360 and Data Services.

ACV’s Machine Learning Team is looking for a talented, experienced Machine Learning Engineer, to join our pricing domain. You will be leading the research and development of models that power the prediction of vehicle sale prices on the ACV marketplace.

Successful candidates will demonstrate excellent skill and maturity, be self-motivated as well as team-oriented, and have the ability to support the development and implementation of end-to-end ML-enabled software solutions to meet the needs of internal stakeholders. Those who will excel in this role will be those who listen with an ear to the overarching goal, not just the immediate concern that started the query. They will be able to show their recommendations are contextually grounded in an understanding of the practical problem, the data, and theory as well as what product and software solutions are feasible and desirable.

The core responsibilities of this role are:

Working with the fellow machine learning engineers to explore and refine the existing models via creative feature engineering and model tuning.
Developing ML models to detect prediction outliers, from proof of concept to Production.
Mining structured & unstructured data, and performing EDAs.
Documenting the work process, including experiments, parameter tuning etc.
Monitoring performance of models in Production.

Required Qualifications:

Graduate education in a computationally intensive domain.
0-3 years of prior relevant work or lab experience in ML/DL projects/research.
Strong sense and skills in mathematics, statistics and algorithms. Experience with regression analysis and classification analysis is essential.
Experience with EDA, including data pipeline building and data visualization.
Advanced proficiency with Python, SQL etc.
Extensive knowledge of ML frameworks and libraries. Experience on tree-based algorithms (XGBoost, CatBoost, LightGBM etc.), and Generalized linear models (GLM) are highly valued.

Preferred Qualifications:

Experience with anomaly detection, and model interpretation.
Experience with cloud services (AWS / GCP) and kubernetes, docker, CI/CD in python.
Experience with Bash Scripting

What we will offer:

Comprehensive benefits offerings for benefits eligible Teammates.
Unique culture that truly values each and every Teammate.
Career development and Future Growth Opportunities.
Learning & Development Opportunities!
We love to see our engineers grow and learn and have invested heavily in our internal Learning and Development program, which provides access to PluralSight, Frontend Masters, as well as in-person conferences.
Annual Hackathons with some amazing prizes!
Career development and future growth opportunities.

At ACV, we are committed to an inclusive culture in which every individual is welcomed and empowered to celebrate their true selves. We achieve this by fostering a work environment of acceptance and understanding that is free from discrimination. ACV is committed to being an equal opportunity employer regardless of sex, race, creed, color, religion, marital status, national origin, age, pregnancy, sexual orientation, gender, gender identity, gender expression, genetic information, disability, military status, status as a veteran, or any other protected characteristic We also consider qualified applicants regardless of criminal histories, consistent with legal requirements. If you have a disability or special need that requires reasonable accommodation, please let us know.

For information on our collection and use of your personal information, please see our Privacy Notice.",Ventas al mayoreo y al menudeo,,2022-09-07T00:00:00,2022-10-16,FULL_TIME
Machine Learning Engineer,NTENT,Ontario,Toronto,-1,-1,,CAD,"Machine Learning Engineer
Position: Full time
Location: Toronto, Ontario (Initially Remote)
About Us:
NTENT provides a Platform-as-a-Service (PaaS), allowing industry partners to customize, localize and integrate search technologies directly into their business-to-consumer offerings. We are a unique group of brilliant minds intent on discovering, learning and building. We work in a vibrant atmosphere, with an emphasis on personal and professional development. This is an opportunity to tackle complex problems usually reserved for a handful of large companies in the search industry.
About the Opportunity:
We are looking for a talented Machine Learning Engineer to join our team and deliver machine learning-driven products. The right candidate will work on development, deployment, and lifecycle management of machine learning models for various large-scale applications (natural language understanding, web search and ranking, recommendation, personalization, dialog/conversation management).
Keywords:
Machine learning, natural language processing, learning-to-rank, online learning, deep learning, interactive machine learning, machine teaching, conversational agents, human computer interaction
Duties and Responsibilities:
Design, implement, and deploy machine learning algorithms.
Manage machine learning algorithm lifecycle.
Coordinate data collection and annotation efforts.
Work with real-time data and content coming from various data sources.
Manage machine learning data pipelines.
Design tests for machine learning algorithm effectiveness and performance monitoring.
Design tools and interfaces for interactive machine learning and teaching.
Research and development on cutting-edge machine learning technologies.

Qualifications and Skills:
Graduate degree in Computer Science with a strong background in machine learning required.
Strong problem-solving abilities, solid background in algorithms and data structures required.
Strong programming skills in Python and Scala required. Experience in other programming languages (eg. Java, R, Haskell) a plus.
Solid knowledge of machine learning tools (eg. scikit-learn, tensorflow, keras, pytorch, Spark MLlib) required.
Experience with distributed and streaming data technologies (eg. Hadoop, Spark, Kafka) required.
Experience with building and deploying API's with Docker and Kubernetes required.
Experience with natural processing tasks (eg. named entity recognition, language modeling, vector representations) required.
Experience with Elastic Search, Lucene a plus but not required.
Experience with ranking algorithms a plus but not required.
Experience with interactive machine learning (eg. active learning, reinforcement learning, machine teaching) a plus but not required.
The ideal candidate will be self-motivated, possess excellent communication skills (both oral and written) and be able to work independently. A keen interest in various aspects of natural language processing is essential in our multi-disciplinary team.
We offer a full comprehensive benefits package including medical, dental and vision. Employees receive a generous time off (PTO) plan and 13 holidays per year. We also offer 401(k) benefits, long term disability benefits and life.",Tecnologías de la información,,2022-08-31T00:00:00,2022-10-16,FULL_TIME
Machine Learning Engineer - KPMG Lighthouse,KPMG,Quebec,Montreal,-1,-1,,CAD,"Overview:

At KPMG, you’ll join a team of diverse and dedicated problem solvers, connected by a common cause: turning insight into opportunity for clients and communities around the world.
The opportunity:
Innovate. Collaborate. Shine. Lighthouse — KPMG Canada’s Center of Excellence for Data Valorization and Advanced Analytics— applies data science to solve real-word business problems, operationalize AI and optimize emerging technologies for its mission. Join a diverse team which is always curious and learning, thinking independently, working collaboratively, has a passion to solve difficult problems, and has fun doing it.
What you will do:
Collaborate with data architects and data scientists to build machine learning-based software solutions.
Prototype solutions to evaluate the impact of selected algorithms on the target problem.
Help data scientists to optimize algorithms and deploy effective solutions iteratively.
Extending prototypes into fully functional, polished solutions ready for internal and external use.
Automate training and prediction of machine learning models using platforms and frameworks.
Maintain machine learning solutions and use metrics and monitoring to perform model evaluations.
What you bring to this role:
3 to 4 years of professional experience in a related field.
Bachelor's or graduate degree in computer engineering or related disciplines.
Experience with deployment of machine learning models at scale.
Knowledge of best practices for the Software Development Life Cycle (SDLC).
Experience with data pipeline and workflow management tools such as Apache Airflow or MLFlow.
Experience with Relational and non-Relational databases (NoSQL).
Experience with object-oriented/object function scripting languages: Python, Java, Scala, etc.
Development and deployment of API at scale.
Knowledge of bash scripting and DevOps tools.
Experience with the following software and tools is a plus:
Experience with developing machine learning solutions such as natural language processing or deep learning.
Experience with container-based solutions.
Experience with Cloud environment: Microsoft Azure and Google Cloud.
Experience with big data tools: Hadoop, Spark, etc.
Experience with Data Warehousing Solutions such as Azure Synapse.
Experience with Data Bricks, Azure AutoML SDK.
Keys to your success:
KPMG individuals Deliver Impact | Seek Growth | Inspire Trust and understand that a diverse workforce enables us to deepen relationships and strengthen our business.
Providing you with the support you need to be at your best
For more information about KPMG in Canada’s Benefits and well-being, click here.
Our Values, The KPMG Way:

Integrity, we do what is right | Excellence, we never stop learning and improving | Courage, we think and act boldly | Together, we respect each other and draw strength from our differences | For Better, we do what matters
KPMG in Canada is a proud equal opportunities employer and we are committed to creating a respectful, inclusive and barrier-free workplace that allows all of our people to reach their full potential. A diverse workforce is key to our success and we believe in bringing your whole self to work. We welcome all qualified candidates to apply and hope you will choose KPMG in Canada as your employer of choice. For more information about Inclusion, Diversity & Equity in Recruitment, please click here.
For general recruitment-related inquiries, please contact the HR Delivery Centre at cafmcdnhrsthotline@kpmg.ca.
If you have a question about accessible employment at KPMG, or to begin a confidential conversation about your individual accessibility or accommodation needs through the recruitment process, we encourage you to contact us at cafmcdnhrsthotline@kpmg.ca or phone: 416-777-8002 or toll free 1-888-466-4778.",Administración y consultoría,,2022-08-26T00:00:00,2022-10-16,FULL_TIME
"Staff Data Engineer, Machine Learning Systems",Course Hero,British Columbia,Vancouver,-1,-1,,CAD,"Course Hero is scaling! We are looking for a Staff Data Engineer, ML Systems to work alongside our Machine Learning engineers to develop machine learning models and deploy them to production to enhance the Course Hero service. You will build pipelines, scale machine learning training jobs, and enhance the platform used by the Machine Learning team.

Here are some ways you'll make an impact:

Help our Machine Learning team develop, test, and deploy advanced ML models to our high traffic application.
Develop tools that make ML development more efficient, allowing ML Engineers to focus on modeling rather than technology platforms.
Collaborate across teams including Product Management, Machine Learning, Data Analytics and Engineering to plan projects that enhance the Course Hero user experience.

Requirements:

Experienced with Spark on AWS EMR and/or Databricks
Abie to optimize execution of large scale distributed data jobs.
Experienced with typical ML workflows and MLOps
Fluent in Python and SQL

Bonus Points:

Systems design and thinking
Experience with Kubernetes and Docker
Experience with Airflow
Knowledgeable on the various AWS ML services, including Sagemaker and friends.
Operational experience in areas such as permissions, secret management, observability, etc

Benefits & Perks:

Competitive salary, annual bonus, and RSUs
Medical coverage, including full dental and vision
Life and disability benefits
401(k) program (US) / retirement savings plan (Canada) with company match
One month paid sabbatical after 5 years at the company
Education reimbursement
Professional development workshops & industry conferences
Paid parental leave
Flexible work schedule
Social responsibility program (volunteer time off and donation matching)
Annual wellness stipend
Monthly tech stipend
Annual family planning stipend
Monthly snack boxes delivered to your door
Cell phone allowance
Research shows that candidates from underrepresented backgrounds often don't apply for roles if they don't meet all the criteria. We strongly encourage you to apply if you're interested: we'd love to learn how you can amplify our team with your unique experience!

#USCanada #LI-Hybrid
Equal Employment Opportunity Statement (EEO)

We are an equal opportunity employer and value diversity and inclusion within our company. We will consider all qualified applicants without regard to race, religion, color, national origin, sex, gender identity, gender expression, sexual orientation, age, marital status, veteran status, or ability status. We will ensure that individuals who are differently abled are provided reasonable accommodation to participate in the job application or interview process, to perform essential job functions, and to receive other benefits and privileges of employment as provided to other applicants or employees. Please contact us to request accommodation.


About Course Hero:

Course Hero is on a mission to help students graduate, confident and prepared. The online learning platform offers over 60 million course-specific study resources created by and for students and educators, as well as 24/7 tutor help. More than 65,000 verified college educators use Course Hero to collaborate with other faculty and share resources to hone new strategies for instruction. Everyday, students, educators and tutors help more than 20 million students make every study hour count.


We have an awesome team and a truly engaging culture. We are customer-focused, collaborative, responsible, gritty, and we love to learn. Our bold mission is to help students graduate confident and prepared!


We are not the only ones that think we're onto something big. Course Hero has been recognized as one of the 2021 Top 100 Best Places to Work in the Bay Area, Top 50 Best Paying Companies in the Bay Area, Top 100 Most Transparent Companies, and in the Top 50 Most Transformational Companies in Education Technology. Read up on some of our recent news coverage, blog, and learn more about us to see what it is like to work with our team.


Join us on our mission!",Tecnologías de la información,,2022-08-24T00:00:00,2022-10-16,OTHER
Machine Learning Scientist - Computer Vision,AbCellera,British Columbia,Vancouver,-1,-1,,CAD,"AbCellera is a young, energetic, and rapidly growing tech company with an amazing team that searches, decodes, and analyzes natural immune systems to find antibodies that its partners can develop into drugs to prevent and treat disease.

We are seeking a Machine Learning Scientist - Computer Vision to join our rapidly growing Machine Learning team. We are a group of motivated people who work in collaboration with life scientists to constantly improve our discovery pipeline. We have a multi-faceted antibody discovery and characterization pipeline that is able to rapidly discover next-generation antibody therapies. Our pipeline generates an immense amount of valuable data which can be used to further develop our pipeline through state-of-the-art machine learning techniques. Ultimately, we are all working towards a common goal which we strongly believe will make the world a better place, and bring new therapeutics to patients around the world.

How you might spend your days:

Developing computer vision models to automate and improve our drug discovery pipeline
Investigating data in creative ways to pull out exciting trends and discover useful features
Working on novel research and development projects to expand our capabilities
Optimizing machine learning and data science pipelines with a focus on scalability
Working collaboratively with life scientists, engineers, and software engineers
Shepherding machine learning projects from inception all the way through to in-house production use

We'd love to hear from you if:

Bachelor's Degree +5 years of work experience in machine learning and/or data science, or Master's Degree +2 years of work experience in machine learning and/or data science, or PhD in a relevant field
Experience developing production grade machine learning models
Experience dealing with big data
Expert in computer vision, OpenCV, tensorflow/keras/pytorch etc.
Python expertise
Strong ability to present work and communicate ideas to technical and non-technical coworkers
A strong desire to work in a collaborative, multidisciplinary environment
No previous biology experience required, but a desire to learn more about the field is!

In addition, the ideal candidate will have:

Experience in the life sciences, including imaging and bioinformatics
Experience with other components of our opinionated ML stack, including PyTorch, Jupyter, Plotly / Dash, Parquet, DVC, and Dask
Experience with our infrastructure stack, including AWS (S3, IAM, CloudWatch, Route53, RedShift), Terraform, Kubernetes, Docker, bazel

Offers & benefits:

The opportunity to work with an inspired team on challenging problems that matter
An attractive compensation package, including health and lifestyle benefits
A minimum of 3 weeks' vacation
Opportunities for personal and professional development

About AbCellera:

At AbCellera, we're solving tough problems and creating innovative solutions from the ground up - custom immunizations, microfluidics, high-throughput imaging, genomics, computation, machine learning and laboratory automation. We're revolutionizing how our scientists can explore antibodies and the scale at which they can do so. This is life-changing research and you could be a part of it.

You'll join a diverse and multi-disciplinary team of biologists, biochemists, engineers, bioinformaticians, computer scientists and physicists - all working together to bring better therapies to patients. We're a growing company with a high-throughput pipeline and the drive to be the best in the industry. This isn't just about having the best technology. We know we need a world-class team of visionaries and innovators. We look for people with drive and energy. Idealists. People we love and people we trust. This may be unconventional, but it is the key to our success. We're looking for someone like you to help us get there.

To apply:

Please send us your application through our website and refer to Job ID 20245 in your cover letter. We apologize in advance, but we receive a large volume of applications, and will only contact those who are selected for an interview.

#LI-MS",,,2022-09-16T00:00:00,2022-10-16,OTHER
Machine Learning Engineer,Parallel Domain,British Columbia,Vancouver,-1,-1,,CAD,"At Parallel Domain, we believe that autonomous systems – from self-driving cars to contactless delivery drones – have the opportunity to drastically improve the quality of life for billions of people. That is why we love what we do: enabling our customers to develop their technology safely using the Parallel Domain data generation platform. Our platform revolutionizes the way our customers generate sensor data for AI development. We're looking for people like you to join us in pushing the boundaries of artificial intelligence and synthetic data.

Parallel Domain envisions a future where every life on the planet is improved by the transition to safer and more equitable AI. To enable that future, we are on a mission to accelerate the development of machine perception with synthetic data.
We don't define ourselves by the boxes we check, we define ourselves by how we can develop and face challenges that elevate our true potential. We expect you to apply to an opportunity that aligns with your skills, professional goals and core values. Due to the high number of applicants, only those selected to move forward with an interview will be contacted.
What You'll Do:
You’ll be part of the ML research team tasked with establishing best practises on creating and using synthetic data for perception
You’ll develop perception algorithms, data pipelines, introspection tools, domain gap measures and domain adaptation approaches
You’ll summarize your findings to help guide our team as well as our customers
You’ll sync with your team on a daily basis to discuss progress, ideas and problems
You’ll work with veterans from the gaming, movie and automotive industry
What You'll Own:
Creating specific datasets for your experiments
Adapting/implementing cutting-edge models and data pipelines
Maintaining and optimizing our code base to enable fast experimentation
Writing tools to inspect and measure the impact of synthetic data on training
Summarizing and sharing your findings
Supporting our customers
Staying up to date with the latest research on synthetic data
About You:
You are eager to learn and to add value to the team
You are a team-player and understand the importance of clear communication
You thrive in ambiguous environments
You are not afraid to approach new challenges
What You Bring:
Master’s or PhD in computer science or a related field
Well-versed with developing machine learning models for computer vision tasks in either an industry or research environment
Extensive experience in python
Ability to write clean/maintainable code
Working knowledge of Pytorch or Tensorflow
You are fluent in english
Bonus Points:
Experience with developing, deploying and improving perception stacks on AVs
Experience with domain adaptation approaches or custom domain gap measures
Experience at a fast-growing, young company
Experience with workflow management systems such as Argo, Kubeflow, Airflow, Ray.io
Remote Information: This opportunity is open to candidates based out of the West Coast in the United States or Vancouver, Canada.

Why join Parallel Domain?
We are assembling a team of talented visionaries crafting a new technology that will change the world. You will be able to learn, build, and scale in a collaborative, creative culture that values every team member.
Parallel Domain celebrates diversity and is committed to creating a safe and inclusive environment for all our people. We are committed to providing employees with an environment free of discrimination, bullying and harassment. All employment decisions at Parallel Domain are based on business needs, job requirements and individual qualifications. We will maintain our commitment to and support of equal employment opportunity for all individuals without regard to race, national/ethnic origin, colour, religion, age, sex (including pregnancy), sexual orientation, gender identity/expression, marital status, family status, genetic characteristics or physical/mental disability. Our commitment extends to any other protected classes which may exist under applicable law.
We offer:Flexibility to work from our office in Yaletown, Vancouver or your home officeCompetitive compensationEmployer-paid supplemental medical, mental health, dental, and vision benefitsPaid vacation and sick time, winter shutdown, and 11 stat holidays each yearPaid parental leaveNew hire equipment + accessories budget to optimize your setup$2,000 CAD annual learning and development allowance",Tecnologías de la información,,2022-08-25T00:00:00,2022-10-16,FULL_TIME
