Job_title,Company,State,City,Min_Salary,Max_Salary,unitText,SalaryCurrency,Job_Desc,Industry,Rating,Date_Posted,Valid_until,Job_Type
Machine Learning Engineer,Granify,Alberta,Edmonton,-1,-1,,CAD,"Machine Learning Engineer
Granify is a rapidly growing technology company at the intersection of e-commerce, machine intelligence, and psychology. We’ve received investment from top investors, built a world-class team and a world-class product, and in the last year alone we generated over $650 million in incremental sales for many of the world's largest retailers!
We’re searching for an experienced Machine Learning Engineer who values mastery, authenticity, and positivity to help build and grow our product. As an engineer, your strong foundation in productionizing machine learning models will be essential in making long lasting improvements to our product. If you are a highly technical, hands-on, and mission-driven engineer, who has a passion for solving problems in the area of recommendation, search and e-commerce optimization then this is the role for you.
This is a full-time position. We are centrally located in Edmonton, but remote applications will also be considered.
RESPONSIBILITIES:

Research, design and prototype intelligent systems with the aim of enhancing online shopper experience.
Oversee research prototypes and develop them into fully-fledged AI software that are ready to be delivered to our clients.
Participate in active maintenance and code reviews in a large codebase, suggesting and implementing changes as appropriate.
Keep up-to-date with the latest papers in artificial intelligence and machine learning to propose solutions for real problems in e-commerce.
Build infrastructure to support the evolution of our shopper interaction toolset.
Mentor other engineers, participate in code reviews, and share knowledge.
Troubleshoot, test, and debug to your heart’s content.
ABOUT YOU:

At least 2 years of real-world experience implementing Machine Learning software.
Proficient in Python and/or C/C++, with an interest in learning new languages
BSc (MSc or PhD preferred) in Computer Science, Machine Learning, Artificial Intelligence, Statistics, Mathematics, Engineering, Physics, or a related discipline, with (at minimum) graduate-level courses in machine learning, or equivalent practical experience.
Strong research experience in machine learning, preferably in one or more of the following (in no particular order): reinforcement learning, natural language processing, recommendation and/or ranking systems, deep generative models, representation learning, AI interpretability, domain generalization, meta-learning, computer vision, deep neural network architectures.
Proficient in deep learning frameworks like Tensorflow, PyTorch, etc. and scientific computing packages like NumPy. Able to implement an algorithm as described in an academic paper using these frameworks in quality code.
Strong computer science background, with experience in object-oriented programming, systems design, data structures and algorithms.

Familiarity with source control (Git) and Unix systems, including shell scripting.
Good intuition for applying AI theory to make business-oriented products with minimal guidance.
Communicate to introduce honesty and clarity (avoiding buzzwords and jargon) to experts in multiple disciplines. Demonstrate a mature understanding of the current possibilities and limitations of AI research.
Curious, constantly looking for better ways to build things and excited to learn about emerging technologies.
BONUS EXPERIENCE:

Online advertising and/or marketing analytics, behavioural targeting and/or web analytics.
Working in an Agile software development environment.
Using cloud solutions, preferably AWS.
Distributed and/or parallel programming.
An active GitHub repository.
ABOUT GRANIFY:

You’ll work closely with an incredible group of the smartest, most interesting, genuinely good people around. You’ll work hard, learn quickly, and have plenty of excitement. You’ll also get a first hand view into the rapidly evolving, exciting intersection of e-commerce, machine intelligence and psychology.
With our continued growth as a company, you’ll find limitless opportunities for growth, development, and career progression.
Did you know? Granify is backed by early investors in Facebook, Uber, Twitter, Airbnb, Paypal, Pinterest, Palantir and Yelp. Wouldn’t it have been great to get in at one of those companies as they were taking off...",Tecnologías de la información,,2022-09-06T00:00:00,2022-10-16,FULL_TIME
Machine Learning Scientist - Computer Vision,AbCellera,British Columbia,Vancouver,-1,-1,,CAD,"AbCellera is a young, energetic, and rapidly growing tech company with an amazing team that searches, decodes, and analyzes natural immune systems to find antibodies that its partners can develop into drugs to prevent and treat disease.

We are seeking a Machine Learning Scientist - Computer Vision to join our rapidly growing Machine Learning team. We are a group of motivated people who work in collaboration with life scientists to constantly improve our discovery pipeline. We have a multi-faceted antibody discovery and characterization pipeline that is able to rapidly discover next-generation antibody therapies. Our pipeline generates an immense amount of valuable data which can be used to further develop our pipeline through state-of-the-art machine learning techniques. Ultimately, we are all working towards a common goal which we strongly believe will make the world a better place, and bring new therapeutics to patients around the world.

How you might spend your days:

Developing computer vision models to automate and improve our drug discovery pipeline
Investigating data in creative ways to pull out exciting trends and discover useful features
Working on novel research and development projects to expand our capabilities
Optimizing machine learning and data science pipelines with a focus on scalability
Working collaboratively with life scientists, engineers, and software engineers
Shepherding machine learning projects from inception all the way through to in-house production use

We'd love to hear from you if:

Bachelor's Degree +5 years of work experience in machine learning and/or data science, or Master's Degree +2 years of work experience in machine learning and/or data science, or PhD in a relevant field
Experience developing production grade machine learning models
Experience dealing with big data
Expert in computer vision, OpenCV, tensorflow/keras/pytorch etc.
Python expertise
Strong ability to present work and communicate ideas to technical and non-technical coworkers
A strong desire to work in a collaborative, multidisciplinary environment
No previous biology experience required, but a desire to learn more about the field is!

In addition, the ideal candidate will have:

Experience in the life sciences, including imaging and bioinformatics
Experience with other components of our opinionated ML stack, including PyTorch, Jupyter, Plotly / Dash, Parquet, DVC, and Dask
Experience with our infrastructure stack, including AWS (S3, IAM, CloudWatch, Route53, RedShift), Terraform, Kubernetes, Docker, bazel

Offers & benefits:

The opportunity to work with an inspired team on challenging problems that matter
An attractive compensation package, including health and lifestyle benefits
A minimum of 3 weeks' vacation
Opportunities for personal and professional development

About AbCellera:

At AbCellera, we're solving tough problems and creating innovative solutions from the ground up - custom immunizations, microfluidics, high-throughput imaging, genomics, computation, machine learning and laboratory automation. We're revolutionizing how our scientists can explore antibodies and the scale at which they can do so. This is life-changing research and you could be a part of it.

You'll join a diverse and multi-disciplinary team of biologists, biochemists, engineers, bioinformaticians, computer scientists and physicists - all working together to bring better therapies to patients. We're a growing company with a high-throughput pipeline and the drive to be the best in the industry. This isn't just about having the best technology. We know we need a world-class team of visionaries and innovators. We look for people with drive and energy. Idealists. People we love and people we trust. This may be unconventional, but it is the key to our success. We're looking for someone like you to help us get there.

To apply:

Please send us your application through our website and refer to Job ID 20245 in your cover letter. We apologize in advance, but we receive a large volume of applications, and will only contact those who are selected for an interview.

#LI-MS",,,2022-08-16T00:00:00,2022-10-16,OTHER
Software & Machine Learning Engineer (PEY 2023),Cerebras Systems,Ontario,Toronto,-1,-1,,CAD,"Cerebras is developing a radically new chip and system to dramatically accelerate deep learning applications. Our system runs training and inference workloads orders of magnitude faster than contemporary machines, fundamentally changing the way ML researchers work and pursue AI innovation.

We are innovating at every level of the stack – from chip, to microcode, to power delivery and cooling, to new algorithms and network architectures at the cutting edge of ML research. Our fully-integrated system delivers unprecedented performance because it is built from the ground up for the deep learning workload.

Cerebras is building a team of exceptional people to work together on big problems. Join us!
Cerebras has developed a radically new chip, system, and software stack to dramatically accelerate deep learning applications. Our system runs training and inference workloads orders of magnitude faster than contemporary machines, fundamentally changing the way ML researchers work and pursue AI innovation. Our latest system, the CS-2, has 850,000 linear algebra processors and can train brain-scale neural networks with up to 120 trillion parameters.

Cerebras Toronto

Cerebras is based in Sunnyvale, California, with its second engineering hub – the AI Centre of Excellence – located in Downtown Toronto. Toronto houses our Machine Learning and Software organization and has some of the most talented ML, optimization, and high-performance computing talent in the world. We have already built out an experienced team of over 50 engineers and computer scientists that are driving forward the next generation of our machine learning stack. Join us!

About the Role

Our products are now being used to solve some of the most pressing issues in society, including cancer research, drug development, fusion simulation, and the invention of new materials. We are looking for talented individuals to help us invent new ways of utilizing our platform for machine learning within our Machine Learning and Software organizations.

Requirements

Bachelor's degree and enrollment within the PEY program at University of Toronto
Strong Python and C++ programming skills
Strong fundamental knowledge of OOP, data structures & algorithms, computer architecture and/or machine learning

Preferred

Familiarity with TensorFlow, PyTorch or Caffe
Familiarity with GPU, CPU, or parallel architectures
Experience in vertical such as computer vision, language modeling, or speech recognition

Location

Toronto

Cerebras Systems is committed to creating an equal and diverse environment and is proud to be an equal opportunity employer. We celebrate different backgrounds, perspectives, and skills. We believe inclusive teams build better products and companies. We try every day to build a work environment that empowers people to do their best work through continuous learning, growth and support of those around them.

This website or its third-party tools process personal data. For more details, click here to review our CCPA disclosure notice.",Tecnologías de la información,,2022-09-03T00:00:00,2022-10-16,OTHER
Machine Learning Specialist (AI),RankWorks,Quebec,Pointe-Claire,-1,-1,,CAD,"RankWorks is a technology company that specializes in the development of ad tech platforms and web services. The company also offers agency level digital marketing services to the small and medium size business community.Our exceptional team consists of experts in every functional area of business and they are the key to our position as leaders in digital marketing and platform development. We strive to innovate on a daily basis to ensure we continue to grow and create new revenue opportunities and cutting edge technology.If you are passionate about taking your career to the next level, then join the RankWorks team and be a part of something big.Job Title:  Machine Learning & AI SpecialistResponsibilities:We are looking for a Machine Learning (ML) specialist to help us create artificial intelligence products.Machine Learning Specialist responsibilities include creating machine learning models and retraining systems. To do this job successfully, you need exceptional skills in statistics and programming. If you also have interest and knowledge in human behaviour analysis, we’d like to meet you.Your ultimate goal will be to shape and build efficient self-learning applications.Study and transform data science prototypes.Design machine learning systems.Research and implement appropriate ML algorithms and tools.Develop machine learning applications according to requirements.Select appropriate datasets and data representation methods.Run machine learning tests and experiments.Perform statistical analysis and fine-tuning using test results.Train and retrain systems when necessary.Extend existing ML libraries and frameworks.Keep abreast of developments in the field.Requirements:Proven experience as a Machine Learning Specialist or similar role.Understanding of data structures, data modelling and software architecture.Deep knowledge of math, probability, statistics and algorithms.Experience with sentiment and social media analysis.Interest in human behaviour analysisAbility to write robust code in Python, Java and R.Familiarity with machine learning frameworks (like Keras or PyTorch) and libraries (like scikit-learn).Excellent communication skills.Ability to work in a team.Outstanding analytical and problem-solving skills.BSc in Computer Science, Mathematics or similar field; Master’s degree is a plus.Job Types: Full-time, PermanentSalary: $49,558.00-$75,000.00 per yearBenefits:Casual dressCompany eventsDental careExtended health careLife insuranceOn-site childcareOn-site parkingSchedule:8 hour shiftApplication question(s):Must be familiar with Topic and Sentiment Analysis extractionExperience:machine learning: 2 years (preferred)advanced statistics, data mining and text mining: 2 years (preferred)",,,2022-09-15T00:00:00,2022-10-16,FULL_TIME
Machine Learning Engineer (Modeling),Afterpay,Ontario,Toronto,-1,-1,,CAD,"Company Description
It all started with an idea at Block in 2013. Initially built to take the pain out of peer-to-peer payments, Cash App has gone from a simple product with a single purpose to a dynamic app, bringing a better way to send, spend, invest, borrow and save to our millions of monthly active users. With a mission to redefine the world's relationship with money by making it more relatable, available and accessible, at Cash App you'll have the opportunity to make a real-world impact with your career.
Remote Work
Today, Cash App has thousands of employees around the world with a culture geared toward creativity, collaboration and impact. We’ve been a distributed team since day one, and continue to value working across time zones and continents both remotely and in our Cash App offices.
Our offices are great, but many of our roles can be done remotely from the countries where Block operates. We tailor our experience to champion our employees’ creativity and productivity wherever they are.
Job Description
Machine Learning is an integral part of how we design products, operate, and pursue Cash App’s mission to serve the unbanked as well as disrupt traditional financial institutions. Our massive scale and deep trove of transaction data create an endless number of opportunities to use artificial intelligence to better understand our customers and offer new products and experiences that can improve their lives. We are a highly creative group that prefers to solve problems from first principles; we move quickly, make incremental changes, and deploy to production every day.
This role is part of our Cash App's ML team and will be deeply embedded within one of our product teams - here are the workstreams we're currently hiring for:
Search & Discovery
Cash App enables millions of people and businesses to pay and get paid with ease. On our team, we build delightful experiences that help our customers find and discover people and things quickly and with trust - we aim to grow and strengthen the connections between people and businesses across the globe. Through your work, you will empower Cash App to personalize customers’ search and discovery experiences using AI/ML, to better understand our customers’ payment journeys, and help identify and execute on new opportunities for product improvement. You will employ a variety of modeling techniques on our comprehensive customer data and scale your solution to production by partnering closely with design, product, analytics, and engineering teams.
Risk
You'll build machine learning models that detect fraudulent activity in real time and help keep our customers safe and secure. You will experiment with state-of-the-art algorithms to drive down false positives, collaborate on new product features to drive fraud losses down, use any and every dataset at your disposal (including 3rd party data) to engineer new features for risk models, verify customer documents using OCR, and use biometric and device signals to detect malicious logins and account takeovers.
Customer Support Automation
Working closely with our Customer Support team, you will use our vast amounts of data to make experiences seamless for our customers and help us achieve world-class service as Cash App continues its rapid growth. You will build models that anticipate customer issues and deliver proactive in-app suggestions, use NLP to contextualize inquiries and respond instantly with relevant content, develop prioritization algorithms that improve efficiency, and apply the latest research to automate conversations with customers.
Technologies we use (and teach):
Python (NumPy, Pandas, sklearn, xgboost, TensorFlow, keras, etc.)
MySQL, Snowflake, GCP/AWS and Tableau
Java
Qualifications
You have:
5+ years experience with applied Machine Learning or Deep Learning
A graduate degree in Computer Science, AI, ML, Applied Math, Stats, Physics, or a related technical field
Worked with Product, Design, and Engineering to prioritize, scope, design, and deploy ML models
A track record of providing mentorship and technical leadership
An appreciation for the connection between the software you build and the experience it delivers to customers
Additional Information
We’re working to build a more inclusive economy where our customers have equal access to opportunity, and we strive to live by these same values in building our workplace. Block is a proud equal opportunity employer. We work hard to evaluate all employees and job applicants consistently, without regard to race, color, religion, gender, national origin, age, disability, pregnancy, gender expression or identity, sexual orientation, citizenship, or any other legally protected class.
We believe in being fair, and are committed to an inclusive interview experience, including providing reasonable accommodations to disabled applicants throughout the recruitment process. We encourage applicants to share any needed accommodations with their recruiter, who will treat these requests as confidentially as possible. Want to learn more about what we’re doing to build a workplace that is fair and square? Check out our I+D page.
Additionally, we consider qualified applicants with criminal histories for employment on our team, and always assess candidates on an individualized basis.

Block, Inc. (NYSE: SQ) is a global technology company with a focus on financial services. Made up of Square, Cash App, Spiral, TIDAL, and TBD, we build tools to help more people access the economy. Square helps sellers run and grow their businesses with its integrated ecosystem of commerce solutions, business software, and banking services. With Cash App, anyone can easily send, spend, or invest their money in stocks or Bitcoin. Spiral (formerly Square Crypto) builds and funds free, open-source Bitcoin projects. Artists use TIDAL to help them succeed as entrepreneurs and connect more deeply with fans. TBD is building an open developer platform to make it easier to access Bitcoin and other blockchain technologies without having to go through an institution.",Tecnologías de la información,,2022-09-15T00:00:00,2022-10-16,FULL_TIME
New Grad Software Engineer / Machine Learning Engineer,Aviva,Ontario,Markham,-1,-1,,CAD,"Individually we are people, but together we are Aviva. Individually these are just words, but together they are our Values – Care, Commitment, Community, and Confidence.
What you’ll doDevelop, test, and deploy codeMaintain an existing code databaseTest and debug software and hardware related issuesKeep your eye out for opportunities to improve our products
What you’ll bring
A degree in Computer Science/Engineering or related field.
1+ programming experience in Python with strong grasp of software engineering standard methodologies such as code-reusability, modularity, use of repos, etc.
1+ years of applied experience in ML, NLP, and Deep learning.
Have an understanding of SDLC, machine learning concepts, and NLP tasks such as classification, feature engineering, information extraction, structured prediction, sentiment analysis, and topic modelling.
Knowledge of packages such as Pytorch, Keras, Scikit Learn, Pandas, Tensorflow, and NLTK.
Conceptual understanding in a data-driven software engineering environment and how to leverage data to make business decisions.
A track record in building and maintaining high quality, robust and maintainable code.
Understanding of Data Warehouse concepts, ETL strategies and best practices.
An appetite for problem solving with a creative and resourceful approach to finding the right solution for the job.
Strong communication and collaboration skills
﻿What sets you apart:
You are a self-motivated and outgoing person who can work closely with business and IT stakeholders.
You understand the relationship between data and business outcomes and can focus on long term strategies for data.
Proficiency with PostgreSQL, Teradata, Hadoop and AWS is an asset.
You have experience working as part of an Agile Team.
What you’ll get
Competitive rewards package including base compensation, eligibility for annual bonus, retirement savings, share plan, health benefits, personal wellness, and volunteer opportunities.
Exceptional Career Development opportunities.
We’ll support your professional development education.
Additional Information
Aviva Canada is committed to providing accommodations for people with disabilities during all phases of the hiring process including the application process. If you require an accommodation because of a disability, we will work with you to meet your needs. Applicants need to make their needs known in advance. If you are selected for an interview and require an accommodation, you are encouraged to advise the Talent Acquisition Partner who will consult with you to determine an appropriate accommodation.
We are an equal opportunity employer and value diversity at our company. We do not discriminate on the basis of race, religion, color, national origin, gender, sexual orientation, age, marital status, veteran status, or disability status.","Energía, minería e infraestructura pública",,2022-09-07T00:00:00,2022-10-16,OTHER
