Job_title,Company,State,City,Min_Salary,Max_Salary,unitText,SalaryCurrency,Job_Desc,Industry,Rating,Date_Posted,Valid_until,Job_Type
Software Engineer - Machine Learning (Remote),Yelp,British Columbia,Vancouver,-1,-1,,CAD,"Yelp has hundreds of millions of pieces of user-contributed content, millions of users and business listings, and hundreds of thousands of advertising customers–and all of these numbers are constantly growing. Yelp’s machine learning engineers turn raw data into valuable signals by building end-to-end ML systems, from feature ETL to deploying predictive models in production, as well as by building the ML platforms that these models rely on. These systems power applications like search ranking, ads targeting, push notifications, and photo understanding. Our data teams banter about Bandits, know their way down a Gradient, and aren’t too Naïve to kick back in our office.
Yelp engineering culture is driven by our values: we’re a cooperative team that values individual authenticity and encourages creative solutions to problems. We enable all new team members to deploy working code their first week, and your impact will only grow from there with the support of your manager, mentor, and team. At the end of the day, we are all about helping our users, growing as engineers, and having fun in a collaborative environment.
We’d love to have you apply, even if you don’t feel you meet every single requirement in this posting. At Yelp, we’re looking for great people, not just those who simply check off all the boxes.
This opportunity is fully remote and does not require you to be located in any particular region. We welcome applicants from throughout Canada.
Where You Come In:
Conduct end-to-end analyses, from wrangling data via SQL or Python, to statistical modeling, to hypothesizing and presenting business ideas.
Work with large, complex datasets.
Lead the development of machine learned models for offline, batch-based data products as well as models deployed to online, real-time services.
Work in areas such as search, ads targeting, spam, and photo understanding.
Productionize and automate model pipelines within Python services.
What it Takes to Succeed:
Experience with data ETL and data analysis packages and workflows (SQL, MapReduce, Spark, etc.).
Experience with machine learning using packages such as xgboost, sklearn, TensorFlow, etc.
A love for writing beautiful and maintainable code.
The curiosity to uncover promising solutions to new problems, and the persistence to carry your ideas through to an end goal.
Comfort in using a Unix environment.
Vaccination against COVID-19 is not required for this role. We nonetheless encourage all employees to get vaccinated. Employees who are not vaccinated may not visit Yelp’s offices or participate in any in-person work activities, and are not eligible to transfer or be promoted to a role that requires vaccination.
#LI-Remote
At Yelp, we believe that diversity is an expression of all the unique characteristics that make us human: race, age, sexual orientation, gender identity, religion, disability, and education — and those are just a few. We recognize that diverse backgrounds and perspectives strengthen our teams and our product. The foundation of our diversity efforts are closely tied to our core values, which include “Playing Well With Others” and “Authenticity.”
We’re proud to be an equal opportunity employer and consider qualified applicants without regard to race, color, religion, sex, national origin, ancestry, age, genetic information, sexual orientation, gender identity, marital or family status, veteran status, medical condition, disability, or any other protected status.
We are committed to providing reasonable accommodations for individuals with disabilities in our job application process. If you need assistance or an accommodation due to a disability, you may contact us at accommodations-recruiting@yelp.com or 415-969-8488.
Note: Yelp does not accept agency resumes. Please do not forward resumes to any recruiting alias or employee. Yelp is not responsible for any fees related to unsolicited resumes.",Tecnologías de la información,,2022-09-02T00:00:00,2022-10-16,FULL_TIME
DevOpsSec Engineer,VanHack,Ontario,Toronto,-1,-1,,CAD,"Must-have skills
Devops
4 Year(s)
Aws
4 Year(s)
Language required
English
A company based in Toronto is looking for a DevOpsSec Engineer.
Role

Contribute to automation and improvements of the Cloud Infrastructure, managing virtual machines, software delivery, and health ops monitoring systems.
Participate in IT Operations, DevOps, and Security projects.
Contribute to the development of large-scale projects within an agile process, ensuring robust and lasting solutions are implemented.
Create deployment pipelines for our applications.
Proactively support the improvement of SOC2 technical and non-technical controls while ensuring their practices are in effect
Integrate and instrument Compliance and Security tools in AWS Cloud. Maintain smoothness of operations with the passion for being hands-on; scripting and automating.
Improve Configuration and Vulnerability Assessment, Patch Management, and Event monitoring/tracking systems.
Prepare documents and training materials to help both technical/non-technical audiences understand and practice the security shared responsibilities
Assist with Internal and External Audits, security, and risk assessment aspects as needed including vendor security assessment questionnaire/customer audit needs

Requirements
Experience as a DevOps Engineer or similar software engineering role.
Experienced with running and managing cloud environments and servers.
Knowledge of best practices and IT operations in an always-up, always-available service
Have a passion for continuous learning, improving, and excelling in the field of DevOps, security, and technology risk management. Always keep questioning what, why, when, where, and how to optimize systems and processes with balanced costs/benefits considered.
Good to have experience with vulnerability scanning, assessment, and patch management
Are familiar with Cloud IAM, Networking, and Application Security concepts and services
Are familiar with threat modeling and cloud and applications security based on up-to-date industry standards (CIS/OWASP)
Nice to have, previous experiences working in Startups and Fintechs


Why you?

Our 4 core principles resonate with you

Delivering on our commitments: You are results-oriented and thrive on exceeding targets
Debating then committing: You can work with cross-functional partners to evolve dynamically
Obsessing about our clients: You bring a solution mindset to work to transform clients’ lives
Leading together: You believe that none of us is smarter than all of us

Benefits?

Like-minded people working on worthy goals
Inclusive and respectful workplace
Knowledge share and mentorship
Competitive compensation package, including stock options
Leading-edge hardware and software
Employee benefits program, including health and dental insurance
Team and skill-building activities
A great creative office in the downtown Toronto core (when the world opens up)",,,2022-09-15T00:00:00,2022-10-16,OTHER
Machine Learning Operations Specialist,Stantec,Manitoba,Winnipeg,-1,-1,,CAD,"Machine Learning Operations Specialist - ( 220002SA )
Description
Grow with the best. Join a smart, creative, and inspired team that works behind the scenes to support operational excellence. As part of the Innovation Office, the Digital Technology & Innovation team is composed of digital experts who conduct research and development to keep our teams—and our client’s projects—ahead of the technological curve. They implement established technologies and find emerging solutions for all business lines (Buildings, Energy & Resources, Environmental Services, Infrastructure, and Water), bridging existing knowledge domains and facilitating the integration of powerful tools and methods. The team’s goals are to digitalize our organization, support Stantec’s digital transformation, and to increase the capacity of our designers, engineers, and scientists, providing higher-quality results and solutions to our clients.
Your Opportunity
The Innovation Office’s Digital Technology & Innovation (DTI) team has an opportunity for a Machine Learning Operations Specialist. This individual contributor position will be a member of the Data and Analytics Program Group, which leads the firm in Business Intelligence and data services by providing architectural guidance, technological vision, and solution development. Specifically, this position will use advanced analytics, data science, and machine learning to give our business and our products a competitive advantage. It includes understanding and managing the data and how it interconnects as well as architecting data for self-serve BI and BA opportunities. This position requires a person who is business savvy, experienced in data analytics, machine learning, and enjoys framing a problem, shaping & creating solutions, and helping to champion implementation. As a member of the Digital Technology & Innovation team, the Data and Analytics group also engages in research & development and provides guidance and oversight as a center of excellence for the business. This group also engages in new product research and testing and the incubation of data analytics ideas.
The ideal candidate will be a self-starter, a critical thinker, and highly interested in the application of new data analytics and machine learning technologies and methods. The candidate will become a member of the Digital Technology & Innovation group; however, they will also be accessible to Stantec’s project teams to support project work as needed.
Your Key Responsibilities
Reporting to the Data Analytics Leader, your key responsibilities will include:
Consult on machine learning solutions, give direction, and insight on machine learning initiatives and areas of focus.
Build end-to-end advanced analytics and AI/ML solutions.
Build efficient platforms for model training, evaluation, shipping, and monitoring.
Design and train ML systems and model architecture.
Train and tune advanced AI/ML models and put them in production via model pipelines, registry, packaging, deployment, and monitoring in a scalable way.
Document the work process, including experiments, parameter tuning etc.
Work with data scientists within our team, our business stakeholders, and other technical teams to deliver analytical solutions to the business.
Present periodic Tech-Talk (internal company) webinars throughout the year on the topic of machine learning and artificial intelligence.
Present to external audiences as needed.
Perform other miscellaneous tasks associated with being a member of the Digital Technology & Innovation team and those typical of a Machine Learning operations specialist.
Qualifications
Your Capabilities and Credentials
Curious, passionate about helping business lines drive their success utilizing data.
Innovative problem-solver, ability to imagine new analytical solutions to any problem.
Confident, able to challenge perceptions and biases of individuals diplomatically at every level of the organization in order to enact improvements.
Ability to communicate to both technical and non-technical people.
Ability to effectively organize, plan, prioritize, and manage time and competing priorities.
Ability to execute complex or specialized projects.
Business-oriented with a solid understanding of business requirements and vernacular.
Highly detailed when required.
Stays abreast of current and upcoming technologies and tools.
Results-focused, able to focus on results and set an example for the team.
Good understanding of end-to-end data science projects - data intuition validation, model design, implementation, validation and testing, and deployment.
Strong proficiency with R or Python.
Experience with application development practices, CI/CD pipelines and GIT.
Extensive experience with machine learning libraries (Numpy, Pandas, SciKit Learn, etc.) and any deep learning frameworks like Pytorch/Tensorflow.
Hands on expertise in developing AI & ML driven models.
Experience/knowledge in deploying AI & ML models and putting models into production.
Experience with Azure Cloud for MLOps is an asset
Education and Experience
A bachelor’s or master’s degree in business, IT, mathematics, statistics, or another relevant area of study.
Minimum 1 year of experience in the areas of machine learning, deep learning, natural language processing or data mining.
Typical office environment working with computers and remaining sedentary for long periods of time.
This description is not a comprehensive listing of activities, duties or responsibilities that may be required of the employee and other duties, responsibilities and activities may be assigned or may be changed at any time with or without notice.
Stantec is a place where the best and brightest come to build on each other’s talents, do exciting work, and make an impact on the world around us. Join us and redefine your personal best.
Primary Location : Canada-Ontario-Waterloo
Other Locations : Canada-Saskatchewan-Regina, Canada-Alberta-Calgary, Canada-Nova Scotia-Dartmouth, Canada-Manitoba-Winnipeg, Canada-British Columbia-Vancouver, Canada-Ontario-Toronto, Canada-Newfoundland and Labrador-St. John's, Canada-Alberta-Edmonton
Job : Applications Development
Organization : BC-1290 Innovation-DTI-Canada
Employee Status : Regular
Job Level : Individual Contributor
Travel : No
Schedule : Full-time
Job Posting : Aug 25, 2022, 11:37:51 AM
Req ID: 220002SA
Stantec provides equal employment opportunities to all qualified employees and applicants for future and current employment and prohibit discrimination on the grounds of race, color, religion, sex, national origin, age, marital status, genetic information, disability, protected veteran status, sexual orientation, gender identity or gender expression. We prohibit discrimination in decisions concerning recruitment, hiring, referral, promotion, compensation, fringe benefits, job training, terminations or any other condition of employment. Stantec is in compliance with local, state and federal laws and regulations and ensures equitable opportunities in all aspects of employment. EEO including Disability/Protected Veterans","Servicios de construcción, reparación y mantenimiento",,2022-08-25T00:00:00,2022-10-16,FULL_TIME
Machine Learning Engineer,Jumio,Quebec,Montreal,-1,-1,,CAD,"Description:

We are looking for a machine learning engineer. In this role, you will get to work alongside various experts in product and engineering. You will analyze datasets to discover patterns, build and test models and implement them to improve our transactional monitoring system.

Responsibilities:

Mine and analyze data from databases to create features, generate insights, drive optimization and improvement of product development.
Develop data models and algorithms to improve the current AML rule based system.
Develop processes and tools to monitor and analyze model performance and data accuracy in production.
Implement end-to-end machine learning solutions in a production environment
Keep pace with the state-of-the-art technologies in machine learning

Experience and Qualifications:

Bachelor's degree in Mathematics, Statistics, Computer Science, Engineering
3+ years of industrial experience solving analytical problems using relevant quantitative and qualitative research and analytics experience, in related business areas; or equivalent 2+years of industry experience with Master's degree
Relevant experience in fraud detection, risk calculation and entity graph.
Experience with programming languages (e.g., SQL, NoSQL, Python etc.)
Hands-on experience with machine learning frameworks such as Scikit-learn, Tensorflow and Pytorch
Strong knowledge of classical machine learning techniques (clustering, decision trees, artificial neural networks)
Basic knowledge of other machine learning areas, such as deep learning (computer vision, NLP), or reinforcement learning or graph based learning.
A strong passion for empirical research and for answering hard questions with data is required.

Great to have Experience and Qualifications:

Graduate degree in statistics, computer science, machine learning or related quantitate field.
Familiarity with SaaS development in cloud ecosystems like AWS (e.g., Sagemaker)

Key Characteristics and Attitudes:
In a recent global survey these attributes were valued by Jumios in all locations and functions - we firmly believe in hiring for attitude as well as skill.

Friendly and supportive
Adaptable and flexible
Articulate and persuasive
High IQ and EQ
Curious and coachable
Commercially Aware
Resilient and tenacious
Big picture and the detail

Jumio Values:

IDEAL: Integrity, Diversity, Empowerment, Accountability, Leading Innovation

Jumio Values:

IDEAL: Integrity, Diversity, Empowerment, Accountable, Leading Innovation
Equal Opportunities:
Jumio is a collaboration of people with different ideas, strengths, interests and cultures. We welcome applications and colleagues from all backgrounds and of all statuses.

About Jumio:

Jumio is a B2B technology company dedicated to eradicating online identity fraud, money laundering and other financial crimes to help make the internet safer. We leverage AI, biometrics, machine learning, liveness detection and automation to create solutions that are trusted by leading brands worldwide and respected by industry thought leaders.

Jumio is the leading provider of online identity verification, eKYC and AML solutions. With a global footprint, we're expanding the team to meet strong client demand across a range of industries including Financial Services, Travel, Sharing Economy, Fintech, Gaming, and others.

Applicant Data Privacy
We will only use your personal information in connection with Jumio's application, recruitment, and hiring processes, as described in Jumio's Applicant Privacy Notice. If you have any questions or comments, please send an email to privacy@jumio.com.",Tecnologías de la información,,2022-09-07T00:00:00,2022-10-16,OTHER
Application Engineer (Machine Learning),Au-Zone Technologies,Alberta,Calgary,-1,-1,,CAD,"Application Engineer (Machine Learning)Au-Zone is a leading supplier of machine learning tools and IP for embedded devices. Having just closed an investment and worldwide product licensing agreement with one of the world’s leading semiconductor companies, Au-Zone is aggressively growing our team to build on our current product innovation.The OpportunityWe build cutting-edge technical products, and we know how to have fun while doing it while still maintaining a great work-life balance. For this position, we are looking for an intermediate level application engineer to join our development team with a passion for working with customers to solve their unique embedded vision challenges using our machine learning tools, software IP and custom engineering servicesJoin a team where your creativity and dedication will be rewarded and where you will have a positive impact on the work of a large community of software developers.Description Engineering custom solutions for OEM customers.Providing customer training, demonstrations and technical assistance to technical sales.Performing front line product and application support to customers.Working with QA on software testing and verification from a customer perspective.Generating technical application notes and guides to help build the product knowledge base.Working with data scientists and software developers on the creation of demo applications to show case the product value.Participating in the continuous improvement of our support process.RequirementsExcellent Interpersonal skills, with a strong problem-solving perspective.5 yrs. of related industry experience in a development or support role.Experience with Keras and TensorFlow API’s or other ML design workflows.Positive, proactive attitude with a strong interest in learning new technologies.BS Computer Science, Computer Engineering or equivalent.AssetsExperience with Python or C programming.Experience with OpenCV.Experience with embedded hardware platforms.Personal CharacteristicsPositive, proactive problem-solving attitudeAbility to work well independently on routine assignmentsSelf motivated, entrepreneurial approach to tasks and time managementWhat We OfferMedical and dental insurance packageDisability and life insuranceShort-term and Long-Tern IncentivesFind out more about Au-Zone Technologies at www.embeddedml.comJob Type: Full-timeSalary: $57,889.78-$102,300.95 per yearBenefits:Dental careExtended health carePaid time offFlexible Language Requirement:French not requiredSchedule:Monday to FridayAbility to commute/relocate:Calgary, AB: reliably commute or plan to relocate before starting work (required)Experience:Machine learning: 5 years (preferred)",,,2022-09-07T00:00:00,2022-10-16,FULL_TIME
